,title
173,양벌리 맘스터치 치즈볼 맛있고 맘스터치 치즈볼은 안에 크림치즈가 들어서 살짝 새콤한 치즈맛이 먹어도 질리지가 않더라 네개중에 세개를 다 먹어치움. 오리지널 세트에 들어있는 후라이드치킨...
174,요즘 핫한 60계 치킨+치즈볼 먹어봤어요~ BHC 치즈볼을 먹고 전 너무 감동을 받아서 60계에도 있길래 사봤어요 사이즈는 비슷한 듯 해요 BHC 보다 치즈가 적어요... 그리고 좀 덜 부드럽네요 역시 원조보단 조금...
175,"[평택 안정점 BHC] 뿌링클 치킨, 뿌링 치즈볼, 뿌링 소떡 배달의민족! #여수언니 #여수언니정혜영 유튭 볼 때마다 왜그렇게 극찬하며 치킨 서열 1위로... 최애 #치즈볼 어딜가나 치즈사랑 #뿌링클치즈볼 맛있당! 그런데 내 최고 원탑..."
176,"안주 양 많은 부산대 술집, 맛나쌀롱:: 치즈볼 첫 영접 후후 부산대 맛나쌀롱 맛나쌀롱 메뉴(2020년 9월 기준) 리나가 주문한 음식: 맛나 계란탕(10,800원) 쫀쫀한 치즈볼(7,800원) 볶음 요리 치즈 김치볶음밥(5,800원) 눈가 촉촉..."
177,"[호디박스] 치즈볼, 호두과자 맛있네요. 이거는 치즈볼이고요. 치즈 덕분에 짭짤한 맛을 보여줘요. 위 사진상 가운데의 호두과자는 팥과 치즈가 반반 섞여 있는 호두과자입니다. 사실 호두과자는 따뜻하게 먹을..."
178,"회기/경희대 비비큐 <황금올리브 후라이드 양념 반, 치즈볼 종류별> 치즈볼 넘맛 ㅠ 괜히 밥이랑 초코랑 안 먹는게 아니죠.ㅋㅋㅋ 황금치즈볼! 안이 확실히 노랬어요. 음 치즈 맞나? 했는데 뭔가 달달하니 거친 식감이었어요. 그래도 초코볼보다는..."
179,BHC 프라이드와 뿌링클 치즈볼/ 내돈내산 추천 (나만 몰랐던 이 맛) 무조건 치즈볼은 뿌링클 팍팍!! 치즈가루 많이 뿌려달라고 주문 메시지 넣으려고 했는데 메뉴 고민하느라 시간 너무 오래 걸려서 까먹었자나요.. 제발 가루 많이 사장님....
180,멕시카나 양념치킨과 더블 치즈볼 어?맛있네? (미아점) 먹고싶었다 치즈볼 또한 너무 먹고싶어서ㅠㅠ마음먹고 시켜본 멕시카나 양념치킨과 더블치즈볼!! 와우 느껴지는 영롱쓰....치킨은 양념파라 너무너무 기대가 되는..!!...
181,"선릉 <별미곳간> 차돌즉떡에 문어 한마리 추가, 치즈볼까지 맛있게! 산드는 차돌즉떡 2인에 문어한마리를 추가하고, 치즈볼도 추가했어요! 치즈볼 너무 좋아용.. 메뉴판에 맛있게 먹는 법이 나와있어서 처음 오시는 분들도 100% 즐기실 수..."
182,"BHC 치킨 추천 , 처음 먹어본 뿌링클 콤보 - 치즈볼 세트 BHC 치킨 추천 , 처음 먹어본 뿌링클 콤보 - 치즈볼 세트 아니 치킨을 그렇게... 뿌링클 - 치즈볼인데 요번에 배달시킨 뿌링클 세트는 좀 콤보로 주문했다쥬 왜 콤보로..."
183,풀무원 치즈볼 레알 진짜 진심 대존맛 '_' 하하하 요즘 너무 배달로 치킨이랑 치즈볼을 맨날 시켜먹다보니..... 지갑이 금방... 술안주를 집에서 해먹어보자해서 #치즈볼 찾다가!! #풀무원 치즈볼 이 평이 좋은거...
184,CJ 고메 사이드바이츠 치즈볼_에어프라이어 치즈볼 고메 사이드바이츠 치즈볼 냉동보관 제품이고 겉은 바삭 속은 쫄깃 고소한 모짜렐라 치즈가 들었지! 거기에 꿀도 첨가되있다고 함ㅋㅋㅋ 사이드 메뉴로도 좋고 애들...
185,뿌링뿌링 BHC 뿌링클+치즈볼 ㅎ 굿 짠 대망의 치즈볼!! 진짜 맛있어요~ 겉은 바삭하고 오 바삭하네? 하는 순간 쫀득 달달하면서 안에 치즈 고소한 맛이 확 느껴집니다 !! 아! 이래서 유명하구나ㅋㅋㅋ...
186,"0:02 / 6:21 BJ치즈볼 데굴데굴 MBC로 굴러간날 리얼VLOG 치즈볼 데굴데굴 굴러서 보이는 라디오까지 출연!!!! 설레는 마음을 안고... 치즈볼 얘기만 나눈게 아쉽지만, 다음에 또 기회가 있다면 더 열심히 해보겠습니다..."
187,"흔한남매 요리금손 으뜸이의 시크릿레시피 깜찍 미니핫도그 ,복불복 치즈볼 복불복 치즈볼 준비물 블록형 모짜렐라치즈 찹쌀 도넛 가루 계란 한개 생수 식용유 고추냉이 블록형 모짜렐라 치즈를 적당한 크기로 자른다. 계란 1개 생수반컵 식용유..."
188,bhc 뿌링클 치킨+치즈볼(느끼up↑) 기본 치즈볼은 워낙 인기도 많고 유튜버들이나 sns에서 얘기가 많아서 굉장히 궁금했었는데 크기도 크고 무엇보다 치즈 양과 얇은 도넛 튀김 옷 바삭거리는 그 쫀듯한...
189,CJ 고메 사이드바이츠 '치즈볼' #치즈볼 이 자꾸 땡긴다. #BHC치즈볼 나름 괜찮은데 사이드만 시키자고 배달팁 내기는 약간 돈아까운 느낌이라.. 마침 엄빠랑 장보러 갔다가 #CJ 에서 나온...
190,온앤오프 이혜성 핏블리 bj치즈볼 문석기 타락헬창 출연 기대되요 현재 지금도 계속해서 운동 콘텐츠와 먹방 콘텐츠를 핏블리 유튜브 채널에서 볼 수 있는데요! 가장 유명한 먹방 영상으로는 치즈볼을 먹는 영상입니다. 빵순이X타락한...
191,"슬라이스치즈로 만드는 간단한 안주 : 치즈볼 와인, 맥주 안주로 제격인 치즈볼 완성!입니다 1. 슬라이스 치즈를 자른다. 2. 자른 치즈를 종이호일에 올린다. 3. 치즈를 전자렌지에 1분 30초간 돌린다. 4. 먹는다..."
192,일산 카페_소개울 제빵소/BHC뿌링클+치즈볼 냠냠 치킨 주문해서 냠냠:D 헤헤헤헤헤헤헤헤헤헤헤ㅔㅎ헤ㅔㅎ 치즈볼도 너무 맛있다 ㅋㅋㅋㅋㅋㅋ생각보다 맛있던 뿌링클치킨ㅋㅋㅋㅋㅋㅋ 돼지의 삶이란....휴......
193,부어치킨 크리스피도 치즈볼도 완전 취저 존맛탱 BOOR 부어치킨 크리스피 & 치즈볼 후기! 주말이라 꼭 먹어야지 하며 벼르고 있던... ㅋㅋ근데 완전 모짜렐라 같지도 않고 뭔가 크림치즈같이 달달함도 드는데 사오자마자...
194,"치킨 치즈볼 포장해와서 집에서 먹었어요~! 치즈볼이 다섯개 들어있었는데 다른 가게의 치즈볼과 다르게 기름이 좀 덜했어요. 그래서 덜 느끼했지만, 주재료가 치즈인지라 한 입먹었는데 느끼한 건 어쩔 수..."
195,bhc 뿌링클+치즈볼 맛있다. 명절엔 역시 치킨 최고 조합 아이들이 넘넘 맛나게 잘먹네요 치토스 치즈맛 같아요 캬캬 아웅 맛있어요 치즈볼에 샤워크림 퐁당 해서 을매나 맛있게요? 안에 치즈가 또 한가득 뿌링클...
196,"네고왕 : BBQ 메이플버터갈릭, 5종 치즈볼 다 먹어본 솔직 후기 행복❤ 촤르륵~ 곧 사라질 치즈볼 감상하기 황금알치즈볼 황금알치즈볼 #BBQ황금알치즈볼 치즈 한가득! 치즈 색을 보고 체다 향이 너무 강하려나, 짭조름하진 않을까..."
197,bhc 골드킹콤보 치즈볼 치밥하기에 좋은 단짠의 조화 어느 브랜드의 치즈볼을 주문해줘도 맛있게 먹는 으뜸이인데 저는 치즈가 흩어지는 느낌이라 살짝 아쉬웠답니다. 그래도 치즈볼의 반죽은 바삭하고 쫄깃쫄깃...
198,푸라닭 블랙 알리오 올리오 치킨 & 치즈볼 진 치즈 맛이 나요 BHC 치즈볼과 붙어볼 만큼 이것도 맛있더라고요 블랙 크로 칸 슈 치킨을 시켰는데 디저트를 주다니 1석2조 아닌가요 겉은 바삭한 쿠키 안에는...
199,BBQ 메이플버터갈릭치킨 + 원픽 황금올리브치킨 + 동글동글 귀여운 치즈볼 BBQ 치즈볼 같은 경우엔 치즈의 향과 짭쪼름한 정도가 마음에 든다 치즈의 느낌은 쫌 우유에 생긴 치즈처럼 불규칙한 덩어리가 느껴져서 처음 먹을때는 덜 조리된 건 줄...
200,"제천) 명품떡볶이 ★★청년다방★★::핫크림 치즈볼 떡볶이:: 핫크림 치즈볼 세트는 과일음료수와 치즈 감사와 떡볶이를 함께 먹을 수 있어요 ㅎ 음료는 자두맛, 청포도맛, 한라봉맛 세가지 중에서 한가지를 선택하는 거예요 저희는..."
201,"풀무원 모짜렐라 치즈볼 단짠풍미 좋은 고퀄간식 더했는데,, 5개 중 5개 중 풀무원 모짜렐라 치즈볼 하나가 터져서 치즈가 새더라구요ㅋㅋㅋ 예열 후 나와진 조리법 지키세요! 다른건 더 조리해야 완벽히 익었는데 이건..."
202,"아기치즈 이유식재료 , 치즈볼 만들기 (덴마크 아기치즈) productId=001249512 #아기치즈 #아기치즈추천 #이유식재료 #치즈이유식 #아기치즈볼 #치즈볼만들기 #아기치즈볼만들기 #덴마크아기치즈 #짜지않은아기치즈..."
203,"도쿄워홀D+218(한국으로 송금, 신오쿠보 y&w, 첫 효도,혤표 치즈볼) 오늘은 치즈볼 만들어 먹을거라 장터가서 장 볼거임 찹쌀 미니도나스랑 모짜렐라 겟 반값에 미친나라 그거에 적응된 나 남은 치킨 굽굽하다가 태워벌이고ㅎ 치즈볼...."
204,[치킨] 평거동 굽네치킨 _ 찹쌀 치즈볼과 함께 찹쌀 치즈볼도 함께 곁들여본다. 굽네는 항상 양이 조금 부족하게 느껴지는데... #굽네치킨 #고추바사삭 #찹쌀치즈볼 처음 먹어본 찹쌀 치즈볼은 생각보다 맛이 좋았다....
205,"버거킹 치즈볼 어플 할인, 서브웨이 샐러드 가격 (로스트치킨) 크림치즈만 들어있는 게 아니라 모짜렐라 치즈도 들어있어서 뜨거울 때 먹으면 치즈가 쭈우우욱~~~ 넘 맛있는 버거킹 치즈볼 근데 4개 정도 먹는 게 한계,,, 좀 너끼함..."
206,"자담치킨 맵슐랭, 치요링핫도그, 우유튀김, 치즈볼 가격 우유튀김, 치즈볼 후기! 통큰 우리 형부 처제가 맵슐랭 먹고파한다는 말에 자담치킨 뿌시기를 해주셨어요 맵슐랭 치킨에, 슈가치즈볼, 우유튀김, 치요링핫도그..."
207,우리집밥상)배달치킨 자담치킨 맵슐랭 양념치킨 치즈볼 후기 bhc에서 치즈볼을 시켜먹어보고 뜨악했었다 겉에 가루가 맛없고 안에 치즈는 달아서 진짜 입에 안맞았었는데 여기는 가루가 안뿌려져있는것도 있어 다음엔 그걸...
208,"[제품리뷰] CJ 고메 사이드 바이츠 치즈볼 (Feat. BHC 치즈볼과 비교) 리뷰해 볼 제품은 어제 아버지 장보는 거 따라갔다가 궁금해서 슬쩍 넣어본ㅋㅋ... 짙음 치즈가 완전 늘어나는 타입은 아님! 고메 사이드 바이츠 치즈볼 쫄깃, 떡과..."
209,"BHC 뿌링클 콤보, 치즈볼 뿌링클 콤보+치즈볼 세트 콤보는 닭 가슴살 없이 윙이랑 닭 다리만 있다. 콤보는 날개 4개 + 다리 4개 + 봉 4개! 치즈볼은 5개! 치즈볼은 왜 짝수가 아니고 홀수인지..."
210,맘스터치 치즈볼 싸이버거 가격 칼로리 나름 ㄱㅊ! 원래 치즈볼에 크림치즈 들어있는 거 별로 선호하지 않는 편인데 맘터는 맛있더라고요 겉은 바삭하고 속은 달달한 게 되게 맛있더라고요 혼자 4개 쌉가능이였어요 먹다...
211,"[소담소담♥] 강릉 배달 맛집, 두뽂스 찜닭(feat, 치즈볼) 저희는 치즈볼을 추가해서 시켰었는데 치즈볼도 진짜 맛있었습니다 ㅎㅎ 저희처럼 와인 한 잔 하신다면 치즈볼 추가도 추천드려요~ 넘나 잘어울리는 것 ! 아, 그리고..."
212,하우스원푸드 ' 델리 치즈볼 5종 ( 10개입 ) 바삭한 치즈볼 안에 부드러운 크림이 꽉꽉 ⤷ 델리피자볼 : 치즈가 꽉 찬 피자를 한입에 쏘옥 ⤷ 델리고구마볼 : 고구마무스가 달달하게 사르르 유탕기에 해...
213,20201007 푸라닭치킨(고추마요+치즈볼) 안녕. 푸라닭치킨 고추마요 + 치즈볼 그래도 푸라닭 고추마요는 사랑이야 ♥ (마산산호점 / 광안점 쵝오) 치즈볼은 진짜 처음 먹었는데 맛이 진짜 JMT 꼭 먹어봐들
214,"[신상 메뉴]안동 청년다방, 핫크림 치즈볼 떡볶이 맛봤더니... 쫀득쫀득한 치즈볼도 한 입 해줍니다 옆에 묻어 있는 치즈 보이시나요? 진짜 맛있겠죠? 치즈가 쭈욱~ 신성메뉴 먹으러 안동청년다방 갔으니 당연히 떡볶이 국물도..."
215,"[노원] 청년다방 대왕 치즈볼 로제 떡볶이 추가토핑은 안시켰으니까 다 기본으로 들어있던거겠지,, 대왕 치즈볼 반 갈라봄 안에 치즈는 아주 많이 들어있었다. 떡도 다 잘라주었다. 근데 사실 치즈볼이 넘 커서 떡..."
216,"내돈내산))bhc뿌링클+치즈볼!! 최애 치즈볼이에요~ 처음에 나왔을때는 크고 치즈도 많이들어있고 달달했는데 , 갈수록 작아지고 내용물도 적어지는것은 저만의 착각이겠죠???ㅜ엉엉 뿌링클의 8할은..."
217,CJ) 고메 사이드바이츠 치즈볼 후기(이마트 할인가) (바삭한 식감은 전혀 없었다ㅠ) 냉동 치즈볼인데다가 속에 크림치즈가 아닌 모짜치즈만 들어갔으니 당연한 결과이긴 하다. 그래도 겉에 찹쌀부분만큼은 그 어느...
218,"또래오래 외 안머거 ? 갈반핫반 후기 | 또래오래 치즈볼 | 갈반핫반 가격 18000원 치즈볼은 5000원입니다! 핫양념치킨과 간장! 그리고 조금 비싼 치즈볼 ,, 먼저 치즈볼부터 먹었는데요! 잘 늘어나는 다른 치즈볼과 비슷한 맛입니다! 근데 살짝..."
219,[서울일상] 서래마을에서 그림그리기 / 카페 아씨오/ 집콕 요리(마라탕 치즈볼) 이마트에서 마라탕 장보기를 마치고 정현이 집 에어프라이기로 치즈볼을 해먹었는데 진짜 둘조합 은근 잘어울려ㅋㅋ 마라탕 너무 좋아... 행복한 한주 보내기 끝
220,"냉동식품 ,풀무원 모짜렐라 치즈볼 후기 풀무원 모짜렐라 치즈볼 얼마 전 마트에 장 보러 갔다가 발견한 모짜렐라 치즈볼 딸이 치즈라면 넘 좋아하고 저번에 어디선가 먹었는데 맛있었던 기억 때문에 생각..."
221,"치즈볼과 함께한 문명특급 숨듣명콘서트 #한입쏙찰치즈볼 맘스터치 치즈볼이 내 맘 속 1위지만, 집에서 해먹기엔 이만한게 없다. 떡순이들이 좋아할 식감에... 에어프라이어에 돌리는게 덜 귀찮고 더 맛있다!..."
222,애슐리 치킨 콤보와 애슐리 치즈볼을 에어프라이기로 간편하게 치즈볼의 겉면은 바삭하면서 속은 쫀득하고 치즈가 잘 늘어나서 먹는재미가 쏠쏠하더라구요! 치킨 콤보는 겉은 바삭 속은 촉촉하면서 부드럽고 뼈와 살이 분리도...
223,맘스터치 치즈볼 어니언치즈감자 고구마치즈볼 싸이버거 이상으로 맘스터치 치즈볼 어니언치즈감자 고구마치즈볼 싸이버거 시켜먹은 후기 마칠게요. 오늘도 방문해주셔서 감사합니다❤
224,BHC 치즈볼 만들기 파는 치즈볼은 배달오면 속이 다 식어서 치즈 늘어나는 모습을 제대로 구경하지 못함. 그렇다고 에어프라이어에 돌리자니 겉딱속물렁.. 분명 튀김음식이지만...
225,"60계치킨 간지치킨 + 치즈볼 추천하는 메뉴 ! 잘쓰고있나 볼 수 있는데 마스크 잘쓰고있어서 좋아요 보고믿는스타일 .. ㅋ 요즘... 모짜렐라 치즈인듯? 한입 먹어보면, 사실 뭐 치즈볼이 치즈볼이겠지뭐 싶었는데..."
226,"BBQ 네고왕) 광희나는버터갈릭치킨+황올반마리+치즈볼 솔직후기! 고구마치즈볼 저는 치킨과 치즈볼을 시키면 치즈볼부터 먹습니다. 왜냐 치즈가 굳으면 앙대거든요. 고구마 향이 나기도 하고, 안에 치즈와 고구마?.. 그냥 고구마 향..."
227,BHC 뿌링클순살 + 치즈볼 속안은 촉촉 소스의 조합은 단짠 단짠 #신이나 치즈볼은 치즈의 쫄깃함 겉은 바싹 #BHC #뿌링클 순살 #치즈볼 #배달 #요기요 #정읍수성점 #치킨맛집 #갑오브갑 #민딸s2
228,"60계치킨 메뉴, 반반치킨+치즈볼 첫시식 매운거 못먹는분들에겐 딱이에요!ㅎ 저는 항상 메인보단 사이드를 더 사랑합니다ㅎ 치즈볼~ 아우 ㅎ 너무너무 맛있었어요!! 찹살이라 쫀득하고 치즈는 쭉..."
229,BHC치킨메뉴 맛초킹 치즈볼 우리 최애템이 되어버렸으! ㅎㅎ 치킨도 좋지만 콜라와 치킨무도 꼭 같이 먹어야 목넘김도 좋잖아요 ㅎㅎ 치즈볼 포장해왔더니 치즈가 약간 굳었...!! 치즈볼 전자렌지 10초 돌리니 완젼 잘...
230,치즈볼중에서 치즈볼720g.. 풀무원 모짜렐라 치즈볼 720g제품이 치즈볼중에서 제일 인기가 좋습니다. 이미 알고 계시죠? 이 제품과 관련된 오늘 쇼핑추천가능한 정보입니다!! 풀무원 모짜렐라...
231,BHC 뿌링맵소킹과 치즈볼 :: 매운 치킨 후기 통실통실한 치즈볼은 무슨맛일지 궁금! 치즈 늘어날 줄 알고 잠깐 기대했는뎈ㅋㅋ 안늘어납니다... 아주그냥 잘 뭉쳐있어요ㅠ 그래도 맛은 괜찮았어요 ㅎㅎ 좀 더...
232,Bhc치킨 일산장성킨텍스점- 뿌링클+치즈볼 추천! 먹었어요 치즈볼은 겉은 바삭하고 안에는 치즈가 늘어나는 게 따뜻할 때 먹어야 더 맛있는 거 같아요. 뿌링클은 그냥 먹어도 맛있고 소스 찍어먹으면 더 맛있어요...
233,비비큐 레드착착 리뷰(feat. 치즈볼) 치즈맛이 가득한 치즈볼 여태 먹어왔던 치즈볼과는 다른 맛이었습니다. 단맛이 적고 치즈맛이 가득해서 진짜 치즈볼 먹는 느낌? 다음에는 레드착착은...
234,순천 금당 자담치킨에서 맵슐랭과 치즈볼 도전! 치즈볼은 두가지 맛인데 하나는 설탕뿌린거 하나는 가루..?치즈가루 뿌려진거였어요. 전 치즈가루! 바로 나온 수제 무! 상큼하니 맛있더라고요^^ 그리고 배고픔을 꾹꾹...
235,"[ BHC 치킨 리뷰 ] 오늘은 뿌링클 먹는 날 with 치즈볼 ( 뿌링클 솔직후기, 뿌링클 가격, 맛, 무게, 칼로리) 소스 치즈볼도 빠질 수 없됴 이건 리뷰 서비스로 받았어요 (2개) 이러니까 내가 맨날 여기서 먹지ㅠㅠㅠ 얼마만의 치즈볼 여기만큼 치즈볼 맛있는데 없다 BHC 만세..."
236,[배달]전지현씨 BHC~(feat. 뿌링클+치즈볼) 그리고~ 치즈볼입니다!!! 생일 때 받은 카톡으로 받은 키프트폰.... 9개월만에... 음...뭔가 노랑노랑 하더라구요 TV에서 보던거랑은 조금 다르더군요 ㅎㅎ 치즈볼은 뭐...
237,[BHC치킨 추천] 뿌링클+치즈볼!!! ㅠ 손에 가루가 너무 묻어요 ㅠㅠ 맛은 있는데 좀 짭짤 ㅎㅎㅎ 저는 사실 이 치즈볼이 더 맛있었어요!!! 치즈가 아주 가득가득~~! 정말 맛있었습니다!!!
238,BHC 맛초킹 + 치즈볼 코로나배달 매콥짭잘 퇴근후 맥주한잔 ㅠㅠ 치즈볼은 진짜 따듯할때 먹어야 하는 음식같아요 ㅋㅋ 식으면 치즈가 굳고 그러니 따듯할떄 먹는 걸 강추 합니다!! BHC 맛초킹이에요!!! 중간중간에 매콤하게 고추도...
239,"Food Review ; BBQ 자메이카통다리, BBQ 치즈볼 처음 먹어본 후기 부드럽고 쫄깃한 식감은 좋은데 겉에 뭐 뿌려져 있지도 않았고 흐를것 같은 크림치즈는 사실 그리 치즈맛이 많이 나지 않는다...ㅎ 전에 다른 뿌링치즈볼이었나..."
240,[추천] 풀무원 치즈볼/먹는 방법/존맛탱 풀무원 모짜렐라 치즈볼 추천 캡쳐) 풀무원 공식 홈페이지 결론부터 말하자면 진짜... 개인적으로 치즈볼 모양도 그렇고 식감이나 맛이 육십계 치킨 치즈볼과...
241,"요즘 가장 한 디자인, 치즈볼 4등 펜던트조명 치즈볼 조명입니다! 치즈볼 시리즈는 드라마나 인테리어 잡지에서도 많이 보이는 요즘 가장 한 디자인이랍니다 =) 저희 집은 식탁 위에 치즈볼 3등 펜던트조명을..."
242,"60계치킨 고추치킨과 치즈볼, 메뉴추천 메이플 시럽과 60계 마요네즈, 그리고 봉투 속 치즈볼 60계 사이드메뉴 쫀득치즈볼 (5알) 5,000원 / 달콤한 치즈가 듬뿍 개봉 전 설레는 마음 ... 겉바속부 = 겉은 바삭..."
243,대전 마치광장 _ BHC 맛초킹 & 뿌링클 치즈볼 뿌링클 치즈볼 .. 뿌링클 좋아 치즈볼도 좋아 마지막으로 맥주 한 잔 생맥주 짠 짠 짠 맛초킹도 맛있지만 다음엔 뿌링클에 기본 치즈볼을 먹어야겠다. 내 원픽
244,"bbq 황금올리브치킨,치즈볼 사이드로 시킨 황금알치즈볼 bbq에서 시켜 먹을땐 항상 황금알치즈볼을 시켜서 먹는답니다ㅎㅎ 그리고 새로 나온 더블 치즈볼 저번엔 먹은 고구마 치즈볼도..."
245,"노브랜드 버거 치즈볼 미쳤다! +신촌점 치즈가 대박이여,,,,,,, 노브랜드 버거 치즈볼 꼭 먹어보셔요 다들,,, 진촤 맛있다고요 ㅠㅠㅠㅠㅠㅠㅠ♥ 겉은 바삭하고,, 고소한 콩가루 냄새가 확 풍기면서 치즈는..."
246,스타벅스 신메뉴 치즈볼 후기 치킨집 치즈볼 느낌은 아니다 치즈도 늘어나지 않는다 치즈빵에 더 가까운것 같다 맛없는건 아닌데 나는 쫀쫀쫜쫜 좋아하는 찹쌀할매 입맛이라 재구매 의사는 업숨...
247,에어프라이어 치즈볼 코스트코에서 치즈볼 구입 에어프라이어에 굽기만 하면 되서 간편하게 만들수 있음. 조리법은 뒷쪽에 자세히 나와있음 에어프라이어에 160도 10분 구워줌 아들이 2개...
248,가성비 갑 ! 미니스톱 치즈볼 / 편의점 치즈볼 / bhc 치즈볼 저렴이 ㅎㅎ 치즈도 낭낭하게 채워져 있었어요 개인적으로 가성비 갑이지 않나 싶네요!! 불닭같이 매콤한 거에 곁들어 먹으면 좋더라고요 치즈볼만 간단하게 먹고 싶을 때...
249,"광희나는나는메이플버터갈릭치킨/네고왕 할인/비비큐 bbq신메뉴/ +치즈볼 치킨에 치즈볼 세트까지 주문했어요!! 광희나는 갈릭치킨 14,900원 (5000원 할인⬆️) 모둠볼10개 9,000원 총 금액은 배달비까지 해서 26900원!! bbq치즈볼 모둠볼 전 사실..."
250,"[풀무원] 모짜렐라 치즈볼 치즈볼이랑은 또 다릅니다요! 그건 겉에 반질반질한 찹쌀도너츠 느낌) 암튼 껍데기 빵가루 바삭 + 반죽쫄깃 모짜렐라도 꽤 들음,,,! 빵가루 재질 모짜렐라 치즈볼..."
251,네고 왕 BBQ 메이플 갈릭치킨+치즈볼 후기 (배달비 별도) 치즈볼은 궁금해서 별도로 추가했다. 6개 6000원 10개 9000원 네고 왕 이벤트로 메이플 2개+황금올리브 반 마리+치즈볼 4개(맛 랜덤) 도 19900원에 판매...
252,처갓집 슈프림양념 + 와락간장 + 치즈볼 솔직 후기 처갓집 치즈볼 이게 딱 그 푸석푸석한 빵에 굳은 치즈 들어간 느낌 ㅋㅋㅋㅋㅋ 그런데 치즈랑 빵에서 아무맛도 안남 이게 무슨 치즈볼 ㅠㅠㅠ 그냥 밀가루 빵 같아요....
253,"명탐정 호숭씨 X-File [충무로호프] BHC 반반치킨 & 치즈볼 5리터 뿌링치즈볼 ￦6,000 충무로호프집 치킨 BHC 밑반찬 셋팅 치킨무 과자... 뿌링클치즈볼 ￦6,000 맛있는 건 어떻게? 가까이 가까이 명탐정 호숭씨 의 한 입 샷 AH..."
254,"[BBQ] [네고왕] 광희나는갈릭치킨, 황금올리브치킨, 치즈볼 먹다가 다리에 치즈 흘린 흔적까지 있네요. ㅎㅎㅎ 비비큐의 치즈볼은 살짝 매운느낌? 새콤한? 그런 맛이 있어서 신기해요. 치즈도 부드러워서 좋아요...."
255,bhc 사이드 메뉴>뿌링클 핫도그와 뿌링클 치즈볼 메인은 치킨이죠 ㅋㅋㅋㅋㅋ 우선 치즈볼 부터~ 매우 바삭 안에는 모짜 치즈가 쭉- 당연 겉에 뿌링클 가루도 매우 자극적입니다다음은 핫도그! 와..빵이 진짜...
256,bhc 뿌링클  콤보치킨/치즈볼 너 제법 맛있구나 추가 치즈볼이 탐스럽네요 한 입 앙~ 베어뭅니다 치즈가 쫀득 떡같네요 떡같으니라구 다리의 도톰한 살점 맛있네요 손잡이가 되는 그 지점도 나름 튀김껍질 뜯어먹으면...
257,"풀무원 모짜렐라 치즈볼 / 아아들간식으로!맥주안주로 딱!이네요! 소개해드릴 제품은 '풀무원 모짜렐라 치즈볼' 입니다. 100% 자연산 프로볼로네 치즈를 듬뿍 사용했기때문에 고소함과 쫄깃함이이 제대로 인 제품인데요, 보통..."
258,맘스터치 치즈볼 in 홍대 쫀득한 볼 안에 크림치즈가 들어있는데 뭔가 치즈맛 보다는 연유에 가까운 맛의 달달한 느낌. 아무래도 노브랜드치즈볼은 인절미가루가 많이 붙어있었어서 굳이 겉만...
259,"완도 맘스터치 * 완도에서 맛보는 맘스터치 싸이버거, 치즈볼 ♥ 쫀득한 찹쌀과 겉은 바삭바삭한 치즈볼. ㅠㅠ 달달한 크림치즈랑 맛 조화 너무 좋음.. 대왕 치즈볼 있음 좋겠어욬ㅋㅋㅋㅋㅋㅋㅋ 맘스터치 딥치즈버거! 딥치즈버거는..."
260,"이틀 연속 먹은 푸라닭 반반, 기름떡볶이, 치즈볼 솔직후기 이틀 연속 먹은 푸라닭 반반, 기름떡볶이, 치즈볼 솔직후기 여기 치킨은 진짜 맛있는데.. 개인적으로 사이드는 치킨 맛에 좀 못 미치는 듯. 특히 치즈볼!!! 치즈볼은 절대..."
261,잠실 노브랜드 버거 치즈볼 샐러드 와우~ 인절미 콩고물 싫어하시는 분들은 못 드시겠지만 고소하고 쫀쫀한 치즈볼 식감에 치즈도 제가 원하는 치즈여서 너무 마음에 들었어요ㅜㅜ 이번에 먹은 음식 다 별...
