,title
690,"[cuisine] 울산 북구 '제일조개구이', 울산 삼산 마라당, 달동 bhc 뿌링클&치즈볼, 맥도날드 타로파이 후기 그리구 여기 일하시는 모든 직원 분들이 친.절.하.시.다 이런 호일 그릇에 치즈랑... 시원한 생맥주에 치즈볼이 너무 먹고 싶었던.. ㅠㅠ 치즈볼 하면 뭐다? 뿌링클이다..."
691,"위례 교촌치킨에서 허니콤보,교촌 치즈볼 먹으면서 스트레스 풀고 왔어요! 치즈볼이 쫀뜩 쫀뜩하고 안에 치즈도 적당히 들어가 있고 특히 치즈볼 위에 뿌려진 짠맛의 가루가 치즈볼 하고 너무나 잘 어울 리더라고요! 가성비도 너무나 좋고!!ㅎㅎ..."
692,자담치킨 / 맵슐랭치킨 : 맛있다고 소문나서 멀리까지 가서 먹고 온 후기 +치즈볼이랑 떡볶이 후기도 있음 아름다운 푸짐샷 ^^ 요건 치즈볼 베어물었는데 치즈가 쑤욱~~~~~~늘어나서 내입에서 늘어나는 사진 찍겠다고 찰칵 ㅎㅎ 암튼 이렇게 잔뜩 기대하고 기다리고 기다렸던...
693,[네고왕 프로모션] 내돈내산 BBQ 광희나는 세트메뉴 후기 (황금올리브 반마리+치즈볼 4알+메이플 버터 갈릭치긴 2조각) 저는 메이플 치킨이 어떨지 좀 걱정되어서 황올 반반 세트로 시켰습니다 :) BBQ 앱에서 14900원에 드실 수 있어요 ㅎㅎ 치즈볼은 기본이랑 더블치즈볼?이 왔더라구요...
694,"송도 호치킨 치즈찐+치즈볼!! (가격,메뉴,할인,내부전경,주차,영업시간,내돈내산) 치즈볼 치즈 늘어나는거 보실래요? 지구 끝까지 늘어날 기세... 반정도 먹고 찍었어요. 치즈가루 수북한거 보이시나요? 메뉴 & 가격 가장 기본적으로 로스트치킨이..."
695,[치킨추천]카카오톡 선물하기로 BHC치킨 뿌링클+치즈볼 후기! 거실에서 신문깔고 먹은거라 ㅋㅋㅋ 일단 치즈볼! 5개 왔어요~~ 겉이 바삭하고 속안에 치즈 짱 많아요~ 빵도 완전 쫄깃해요! 전 2개 흡입하고 동생 줬어요 ㅋㅋ 뿌링클...
696,"D-day 64 왜 때문에 더 쪘지?/교촌치킨 치즈볼 먹어도 다이어트 할 수 있지/다이어트 도시락/발뮤다 밤굽기/내가 먹은 탄단지 먹은 양은 울팀장님 치즈볼 1개 맛만 보시고 나머지 제가 다 먹고, 치킨는 4조각 정도 먹은 것같아요. 저는 치킨을 그리 좋아하진 않아서.. 칼로리 계산은 식약처..."
697,"풀무원 모짜렐라 치즈볼 (원재료명) 곡류가공품1 - 미국산 밀가루 자연치즈 18.51% - 미국산 모짜렐라치즈 80%, 프로볼네치즈 19% 정제수 곡류가공품2 - 알레스구떼디어바게뜨믹스 대두유..."
698,에어프라이어 핫도그 간식 추천 옥두식품 핫츄 + 치즈볼 + 츄러스 리뷰 모짜렐라 치즈 핫도그 횡성한우핫도그 트위스트 핫도그 군고구마 트위스트 핫도그 체다치즈 모짜치즈볼 츄러스(츄로비) 옥두식품 핫츄 4종 + 츄러스 + 치즈볼 이렇게 총...
699,이마트 트레이더스 TRADERS 월평점 T 스탠다드 ' 더블 치즈볼 ' ' T STANDARD ' #더블치즈볼 트레이더스의 새로운 시작 T STANDARD 더블 치즈볼 40g*16입 #6980원 체다치즈와 까망베르치즈를 뿌려 풍부한 치즈맛을 낸 치즈볼 한입...
700,집밥 더바삭한 치킨&치즈볼 치킨은 봉지에 써있듯 순살 약간 부드러운 가슴살느낌 치킨먹을때 닭가슴살먹는나는 딱좋다 이랬지만 신랑은 별로안좋아할듯 치즈치즈치즈볼 요거먹으려고 뜯은거잖아...
701,진심후기#푸라닭 블랙알리오 치즈볼도 맛있는데? 왜이리길게하니 #블랙알리오 #블랙치즈볼 세트 인데 열자마자 서로 치즈볼 쟁탈을 하는바람에 사진이 저따구ㅋㅋㅋㅋㅋㅋ 박스휑ㅋㅋㅋㅋㅋ 급해급해ㅋㅋㅋㅋㅋ...
702,뿌링클 치킨 핫도그 치즈볼 소떡 먹방[쭈연커플] #뿌링클 #핫도그 #치즈볼 #소떡소떡 오랜만에 영상을 올리게... 오늘은 뿌링클 치킨 뿌링핫도그 뿌링치즈볼 뿌링소떡소떡 먹방입니다! 여러분!...
703,매주 일요일마다 타락하기로 한 bj치즈볼 18 매주 일요일마다 타락하기로 한 bj치즈볼 (0) 2020.09.18 허벌눈물 (0) 2020.... 18 매주 일요일마다 타락하기로 한 bj치즈볼 (0) 2020.09.18 허벌눈물 (0) 2020....
704,평택고덕맛집] 태평아파트 상가 치킨매니아 닭볶음탕 맛집 인정 치즈볼. 사이드메뉴인 치즈볼도 있다 치즈볼 말그대로 치즈있는 동그란모양의 사이드메뉴 내가 한입베어물고는 와 이건 사진각이다 하니까 몸소 보여주신단다...
705,"[푸라닭 치킨] 순살 블랙알리오 치킨, 블랙 치즈볼 후기 박스도 엄청 예쁘다. 맥주랑 치즈볼, 치킨의 조합은 사랑! 블랙 알리오 치킨은 조금 맵고 짭짤하긴 한데 자극적이진 않아서 좋았다. 특히 블랙치즈볼이 진~짜 맛있었다."
706,"유튜버 핏블리님 영상보고 결국 못참고 치즈볼 시켰네요 핏블리님이 치즈볼 되게 맛있게 드시는거보고 요며칠 치즈볼이 제 뇌를 지배하더라구요 결국 bhc 치즈볼에 감자튀김을 시켜 먹었습니다,,, 뿌링뿌링소스에 찍어..."
707,"코로나19로 헬스장 문닫고 타락한 헬창, 살면서 처음먹는 치즈볼...눈물의 먹방 안녕하세요 오늘은 핏블리가 아닌, 타락헬창의 시작 BJ치즈볼입니다... 하지만 치즈볼을 만난 순간 지켜온 양심은 안녕,, 모두가 이런 맛을 알고 살았다구요..?..."
708,슈프림 양념치킨.. 순살과 치즈볼 또 먹어버렸습니다 중독성 인정합니다! 쿠폰 꿀팁드려요 처음엔 치즈볼이 막 그렇게 끌리진 않았는데 이게 생각나는 맛이에요.. 안에 늘어나는 치즈 보이시죠? 약간 달콤 고소 한 치즈인듯한데 찹쌀처럼 꾸덕꾸덕한 튀김옷과...
709,"가산디지털단지역 맛집 교촌치킨 메뉴 레허반반순살, 치즈볼, 마라떡볶이 후기 (물론 저도 좋아합니당) (클릭해서보면 크게보여요) 치즈볼 메뉴사진이 없는데... 치즈볼은 퐁듀와 고르곤을 선택할 수 있습니다. 저희는 둘 중 인기많은 걸로 달라고..."
710,[교촌치킨] 코로나 왕국 라푼젤 공주의 이야기 - 레허순살반반/치즈볼 이랑 치즈볼이라구요? 일단 들어와봐요. 코로나로 지친 라푼젤을 위해 교촌... 치즈볼은 말이 필요한가. 너무 너무 맛있어서 감동의 눈물을 흘렸지... 오랜만에 이렇게...
711,"[교대역 맛집] 치즈볼, 고로케가 맛있는 집 경성꽈배기 | 치즈볼, 핫도그, 감자고로케 시식 리뷰 | 칼로리 정보 치즈볼 치즈볼도 역시나 쫀득쫀득한 식감이 맛있어요 ㅠㅠ 참살 도너츠 인데다가 안에 모짜렐라 치즈가 더해져서 쫀득함이 한 가득ㅎㅎ 핫도그도 꽤 괜찮았어요!..."
712,[원주단구동청년다방 신메뉴]:핫크림 치즈볼 떡볶이 후기 확대샷 치즈볼 맛은 크림치즈+모짜렐라 치즈가 섞여있는 맛이였습니다. 솔직히 계속 이 메뉴만 먹을 정도이다!! 이 정돈 아니지만 한번쯤은 먹어볼만한 그런 메뉴였던 것...
713,"고구마 치즈볼 고구마 치즈볼 ~ 고구마 치즈볼 ~ 재료 - 고구마 4개, 마요네즈,우유 약간,피자치즈,계란,밀가루,빵가루 1. 고구마 4개 (중간크기정도) 를 쪄줍니다. 2.찐 고구마 껍질을..."
714,[주안동맛집] 자담치킨 3반세트와 치즈볼까지. (3가지맛) 메뉴추천 내돈내산 요기요 배달 후기 요기요 리뷰 이벤트로 치즈볼을 받았어요. 치즈볼 말해뭐해 :) 자담치킨은 튀김옷이 너무 두껍지도않고 짜지도않고 굉장히 바삭 바삭 너무 맛있어요!...
715,"[서울/선릉] 1차로 모로미쿠시 선릉점에서 회, 꼬치 뿌시고, 2차로 별미곳간 떡볶이,치즈볼, 볶음밥까지!! 세 명이서 저녁 시간에 맛났는데 사시미 먹고, 꼬치 먹고, 떡볶이에 치즈볼 먹고... 대패다릿살, 다릿살, 닭껍질, 닭날개, 염통, 치즈와사비, 양송이 삼겹말이..."
716,"푸라닭 고추마요치킨 + 치즈볼 행복한 후기 뼈랑 치즈볼, 감자 이렇게 주문을 하였어요 배달시켰는데 총 가격은 25,000원 영롱한... 먹었어요 치즈볼 5개까지~ 약간 작은게 너무 귀여워요ㅋㅋㅋㅋㅋ 다른 곳에 비해..."
717,[야식추천]엽떡+bhc 뿌링클+치즈볼 엽떡꿀조합 !!! 엽떡+뿌링클+치즈볼 2. 엽떡+허니콤보+웨지감자 대표적으로 이 두가지에요!! 사실 엽떡 is 뭔들 ㅋㅋㅋㅋㅋ 야식 친구들한테 사줬더니 직장인인 본인들보다 호사스럽다고...
718,"나 치즈볼에 진심이야_버거킹 크리미 모짜볼 말랑말랑한 치킨집 치즈볼과는 다르게 단단하고 바삭한 튀김이에요. 크리미 모짜볼이라는 이름답게 치즈 필링은 크림치즈 반, 모짜렐라 반이에요. 달달한 크림치즈..."
719,주말엔 역시 bhc 뿌링클 콤보 + 뿌링치즈볼(+ 치즈볼 서비스)❣️ 엘리베이터가 고장 난 악조건을 뚫고도 영접한 뿌링클 영롱 촤란 빠질 수 없는 뿌링치즈볼 JMT 서비스로 받은 치즈볼 2알 치즈볼은 사랑입니당❤️ 황홀 뿌링뿌링소스...
720,치즈볼이라고하죠~~속살이 아주 뽀얀!! 치즈를 너무 좋아해요 먹을수록 고소하고 씹을때마다 환상적이라고 해야하는게 맞아요 BHC치킨을 주문하면서 치즈볼을 추가해서 먹어본적이 있는데요 너무...
721,"노브랜드 치즈볼(라퀴진 찰치즈볼/라퀴진 치즈볼) 에어프라이어 vs 기름에 튀기기 안에 치즈가 안녹을까 걱정이 되어서 치즈볼 포장지에 적힌 4분 30초를 준수하고자 노력했고, 치즈볼을 집게로 돌리다 보면 처음보다 말랑말랑해지는 때가 와서..."
722,"[헬스장소개]bj치즈볼, 핏블리헬스장에 가다!!!(ft.20.09.26 점심,저녁식단) 정확한 명칭은 #스텝밀머신 지금은 #유튜브 에서 너무너무 유명해지신 현.bj치즈볼 구(?)핏블리님 이 운영하고 계신 #힙업공장_부천점 으로 천국의 계단만 보고 오로지..."
723,[bhc제주이도점]_뿌링클콤보+치즈볼 bhc 뿌링클 콤보+치즈볼 안녕하세요 잇님들><>< 저는 오늘 드디어 시험이... 뿌링클 콤보는 다리+윙+봉으로 된 조합이랍니다>< 저의 최.애.조.합 이죠 치즈볼...도 시켰는데...
724,코스트코 치즈볼_에어프라이어에 겉바속촉 굽기 꺄 진짜 파는 치즈볼 같지않나용??? 아이들한테 줄때는 반으로 잘라주세요 안에 치즈가 너무 뜨거워서 데일수있어용ㅠㅠ 하지만 저는 애가 아니라서 맛있는 뜨거움을...
725,치즈볼 치즈볼 100% 자연 모짜렐라 치즈로 속이 꽉 차있습니다. 홀. 배달. 포장. 4알 : 3000원
726,"<부산 대연>대연, 경성대 맛집 ""노브랜드 버거""(NBB)//메가 바이트 버거, 인절미 치즈볼,산체스버거,치킨너겟-광고X 세트,인절미 치즈볼, NBB치킨너겟은 2개 먹고 싶은거 골고루 다 주문! 저렇게... 보이넿ㅎㅎ 치즈볼은 총 3개에 치킨너겟은 한봉지에 5개 있었다 감자튀김 양은 좀 적은듯..."
727,[펜팔 답장 해야해]절대 나를 위해 참아주는거야!|재건축 예비안전진단|BBQ치킨에 치즈볼만 먹으로 가도 되나요? BBQ 치즈볼 내가 정말 좋아한다.. 그치만 치킨이 우리에게 너무 많다.. 치즈볼에 치..는 꺼내지 못했다. BBQ에 치즈볼만 먹으러 갈 수는 없는걸까? 그럼 또 매장이용료...
728,의정부 로데오 맛집 BHC치킨 의정부로데오점 4 뿌링클 치즈볼 냠냠굿 뿌링치즈볼까지 시켰다 말고도 치즈닭똥집이나 왕새우튀김 그리고 각종 사이드 메뉴들이 있는데 배가 만땅인 상태여서 간단하게만 시키기로 했다 그리고 당연히...
729,"다이어트 쿠키, 유지어터 간식, 당뇨 간식에 좋은 오트밀쿠키, 오트밀 치즈볼 쿠키 만들기 구워졌어요~^^ㅎㅎ 치즈가 쫙 쫙 늘어나서 ㅎㅎ 남편은 치즈볼이 더 맛있다고~~ 좋아하네요~^^ 일주일에 한 번씩 이렇게 만들어 놓으면~ 한 주간 동안 간식은 신경 안..."
730,교촌반반오리지날 한마리와 치즈볼에 한잔 가산디지털단지역 치킨 맛집 교촌치킨 가산디지털단지역 치킨 맛집 교촌치킨 창측에 딱 앉으면 창밖을 훤히 바라다 볼 수... 교촌 치즈볼 (고르곤졸라) 로 주문했다. 치즈볼 안에 고르곤졸라가 가득하니 겉에...
731,요리하다 찹쌀 모짜렐라 치즈볼 넘 맛있게 먹었다 치즈도 쭉쭉 뽑아내는 요리하다 치즈볼 추천합니다! #치즈볼 #찹쌀치즈볼 #요리하다 #요리하다치즈볼 #롯데마트치즈볼 #모짜렐라볼 #에어프라이어치즈볼
732,경성대 술집 '벨지움트래블'에서 오이스터크림파스타랑 치즈볼 먹고 왔어요 경성대 맥주집 후기 실제로도 치즈볼 인기가 굉장하다고 해요 한 입 크기의 치즈볼 짭짤한 맛이 아직도 생각이 나네용 안에 꽉 차 있는 치즈! 다른 치즈볼 같은 경우에는 안에 치즈가 반...
733,또래오래 고추단짠윙봉과 치즈볼 야식은 치킨이죠^^ 또래오래 고추단짠윙봉과 치즈볼 세트 많이 맵지 않아서 좋고 짭잘하니 치즈볼과 조합도 좋고 맛납니다^^
734,"노브랜드 버거... 전 브랜드버거 먹을랍니다. 시그니쳐버거 솔직후기 (feat.인절미 치즈볼은 맛집) 배달은 되지 않더군요 저는 메가바이트버거, 시그니쳐버거 그리고 인절미치즈볼을... 패티와 치즈 그리고 양상추와 토마토가 들어있습니다. 토마토 수급이 어렵다던데..."
735,"울산 언양 술집) 백스비어 / 언양 가성비 좋은 술집 / 백종원 맥주 와인 “치즈볼 먹태 파인애플샤베트 반건조오징어” 간단하게 2차로 오면 좋을 것 같아용 먼저 다녀온 친구가 치즈볼이 맛있다길래 치즈볼, 먹태구이로 주문 기본안주 뻥튀기 언양 백스비어 모찌치즈볼 젤 먼저 나온..."
736,맘스터치 내슈빌핫치킨버거 먹었는데 싸이버거랑 치즈볼 추천하는 글(내슈빌핫치킨버거VS싸이버거) 그리고 배달비 채울라고 치즈볼도 시켰는데 젤맛있음ㅋㅋㅋㅋㅋㅋㅋㅋㅋㅋ 저안에 치즈가 크림치즈라는데 뭐랄까 따뜻한 아이스크림을 먹는맛이랄까 부드럽고...
737,"BHC 치킨메뉴 뿌링클 치킨 치즈볼 세트 가격 쁘링쁘링요거트치킨소스 먹은 리얼 후기  아는 맛이 무섭다 시즈닝 치킨 추천 바삭하고 안에 치즈가 고소하고 달달한 건 BHC 치즈볼이 1등 뿌링클 시즈닝도 골고루 많이 뿌려져 있네요 사실, 뿌링클은 이렇게 세트라고 해도 과언이 아니죠 뿌링뿌링..."
738,뿌링클 치즈볼 은 배달의 기본아닙니까 쫄깃한 치즈볼은 포기못하죠 ..!! 친구와 수다떨며 순식간.. ✨
739,충주 호암점 푸라닭 블랙 알리오 치킨이랑 치즈볼 푸라닭 치즈볼도 정말 맛잇다. 찹쌀빵에 치즈 넣은 맛! 매장이 깔끔하고 널찍했다. 내가 딱 원하던 크기. 기본세팅은 새우과자(요게 징짜 마싯는거 다들 알죠?!) 그리고...
740,[대학생 일상]내일 드디어 타투!/ 무화과/ 그릭요거트/ 프로틴바/개강/과제/치즈볼/치킨/오레오/크럼블/ 책 치즈볼에 치즈가루 뿌려먹으면 정말 맛있어요ㅎㅎ 어쩌다보니 음식 사진만 많은거 같네요. 아 그리고 드디어 내일 타투해요!! 엄마랑 같이 하러가는 첫 타투인데 빨리...
741,"20.9.15화요일) 맘스터치 사이드메뉴""치즈볼&휠렙"" 거기다 휠랩까지 시켜봤어요 ㅎㅎ 치즈볼은 치즈볼이라기보단 약간 치즈크림? 슈크림섞인 치즈크림볼 같은 느낌이에요! 처음먹었을때는 맛있었는데 4개다먹으니..."
742,21년 인생 첫 BHC 뿌링클과 치즈볼 타락헬창마냥 21년 살면서 처음 뿌링클 먹어봤다 심지어 치즈볼도 처음 먹어봤다 내 특이식성을 알게됐다 치즈볼 식은게 더 마이쪄 도리리가 생일날 준 깊티콘으로...
743,애슐리 모짜렐라 치즈볼 바삭바삭하고 안은 달콤한 치즈가 쭈욱 양념 시즈닝도 들어있는데 뿌려먹으면 맛이 두배로 풍족해진다 +)하림 모짜렐라 치즈볼 이건 딱 5개가 들어있다 할인받아...
744,"○ CJ : 고메 사이드바이츠 치즈볼 가격 : 5,990원 (아마두) 고메는 배신하지 않으니까 에프에 돌렸더니 이케 됨 맛있는데 소스나 꿀 찍먹하면 더 괜찮을듯 고메는 치즈볼 전용 소스 내라"
745,"60계치킨 간지치킨,고추치킨 치즈볼 까지~ 빠밤 맛있는 조합임 개존맛탱 원래 먹던 사진 안찍는데 이 치즈볼은 존맛이라 찍을수밖에없었다 쫀득 바삭 고소 치즈.. 아주그냥 마싯어따 #60계치킨 #간지치킨 #치즈볼"
746,"9月 3달 남은 2020 (고씨네카레, 필커피, 맥시카나 치즈볼, 가을하늘, 써브웨이, 노브랜드 역삼, 칙피스, 이오로) 맥시카나 치즈볼 (치킨은 거들뿐) 진짜 이게 찐맛인데,, 1도 유명하지 않아서 넘 슬포 이와중에 메이플 시럽 찍어먹은게 킬포 9/20 이슬이 만나서 화정천 걷걷 여기..."
747,"교촌치킨, 교촌주문앱으로 순살 메뉴 주문시 치즈볼 0원 맛 볼 수 있는 ‘교촌반반순살’, ‘교촌레허(레드허니)순살’, 깊은 불맛을... 증정메뉴인 #교촌고르곤치즈볼 은 달콤한 초코 찹쌀볼 안에 진한 고르곤졸라 치즈가 듬뿍..."
748,찹쌀미니도나스믹스로 치즈볼 만들기 / 치즈볼만들기 / 3500원으로 치즈볼 20개 / BHC치즈볼 만들기 / 뿌링소스 만들기 크림치즈양을 늘려주시고 설탕(연유)양을 줄여주세요 그럼 여러분 집에서 저렴하고 맛있게 치즈볼 만들어 즐기시고 다음 포스팅에서 만나윰 #치즈볼 #치즈볼만들기...
749,[청년다방 신메뉴] 떡볶이 맛집 청년다방의 핫크림 치즈볼 떡볶이 내돈내산 후기!! 제가 시킨 메뉴는 핫 크림 치즈 볼 떡볶이 중간 사이즈 보통맛 세트입니다!! 28500원... 치즈와 크림과 떡볶이의 조화.... 안맛있으면 안되는 조합이져!! 완전 맛있움......
750,노브랜드 리얼밀 찰 치즈볼 후기 찰 치즈볼 후기 근데 반으로 잘라보니 치즈가 안 보임 연유? 당연히 안 보임 완전 공갈빵 10개 다 잘라봤는데 전부 공갈빵임 치즈 안 보임 지금까지 구매한 노브랜드...
751,신사꽈배기 치즈볼 내가 먹어본 치즈볼 중에 최고다. 먹기 좋게 반으로 자르면 속이 꽉 차 있는 모짜렐라 치즈. 치즈가 고소하면서도 바삭하고 반죽은 꽈배기처럼 쫀득쫀득. 겉에 묻어있는...
752,치즈볼 #치즈볼 #예냥2020 안녕하세요~ 오늘은 제가좋아하는 치즈과자를 소개합니다 ~~ 저는 치즈팡팡 이라고 불러요 바삭한 과자~짭조름한 치즈 가루~ 저는 짭조름한 과자를...
753,"[내돈내산] 네고왕 2탄 bbq(비비큐) 신메뉴 광희나는 메이플버터갈릭치킨 2조각, 랜덤 치즈볼 4개, 황금 올리브 반마리 직접 시켜 먹어봤어요~! 크림치즈볼로 4개 왔더라구요ㅜㅠㅠㅜㅜㅠㅜㅠㅜ 크림치즈를 좋아하시는 분들에게는 죄송하지만 개인적으로 모짜렐라 치즈 빼고 다른 치즈 종류는 싫어하는 저는 좀..."
754,"홍대 퀸즈볼, 치즈볼 닭강정 전문점 닭먹꼬알먹꼬 새단장 :) 기존 치즈볼 전문점 퀸즈볼에서 업그레이드 된 브랜드입니다. 닭강정 (닭)도 먹꼬! 치즈볼 (알)도 먹꼬! 닭강정이 좀 더 맛있게! 다양하게 ! 전문성있게 보완되었어요 100..."
755,군산 미장동 bhc 뿌링클 치킨 +  치즈볼 : 고소한 양념치즈가루에 버물린 뿌링클치킨과  고소한 치즈볼 내돈내산 후기 같이 산 치즈볼 앙~~ 물면 찹쌀도넛안에 치즈들어있는 볼 소스콕콕 롯데리아 양념감자에 치즈맛 시즈닝의 더 진한 버전의 치즈시즈닝을 뿌린 뿌링클맛. 치즈의...
756,"[임영웅 X 청년피자] 신메뉴 ‘치즈히어로' 피자 솔직 리뷰 (feat. 치즈볼, 국내산 후라이드 닭다리, 고추마요소스) 청년피자 치즈볼 - 14개에 5,500원이라길래 얼씨구나 하고 주문했지만 치킨집 치즈볼과는 완전히 다른 느낌. - 생긴 건 롯데리아 치즈스틱과 비슷한듯하지만 맛은 그냥..."
757,"대학생 다이어트 식단일기 + 눈바디 : bhc 골드킹, 뿌링 치즈볼, 베노프 20바 카카오 * 아침 식단 - BHC 골드킹 치킨 2조각 (329kcal) - BHC 뿌링치즈볼 2개 (90kcal) 시판 치즈볼 기준 열량 새벽에 치킨 먹었습니다. 죄송합니다. 맛있었습니다. 그리고 아침에..."
758,"BHC 메뉴 추천 치즈볼, 뿌링클, 블랙올리브 아니라 치즈볼이 먼저 나왔답니다~ 저는 솔직히 BHC에서 제일 맛있는 메뉴라고 생각해요 뿌링클 치즈볼도 있고 그냥 치즈볼도 있는데 뿌링클은 치킨으로 시켰으므로..."
759,[요리하다] 찹쌀 모짜렐라 치즈볼 리뷰 치즈가 막 흐르지는 않지만 꽤 씹힙니다! 저번꺼 잘못사서 크림치즈볼이었어서 그거보단 훨씬 나있어요ㅠㅠㅠ 찹쌀치즈볼이잖아요? 찹쌀 도너츠 그 맛 납니다...
760,롯데리아 한우불고기 +치즈인더너겟(롯데리아표 치즈볼) 제일 핫하다는 한우불고기와 (롯데리아표 치즈볼?)인 치즈인더너겟을 get it!! 그러곤 집에오자마자 포장용기를 풀고 치즈인더너겟부터 앙하고 먹는데 입안이 사르르르....
761,"[임신33주]임당식단 40~42일차_불고기,김치볶음밥,미주라통밀도너츠,토마토파스타,미역국,피자,치즈볼 피자 #치즈볼 #미주라통밀도너츠 #클래식요플레 #불고기 #김치볶음밥 •공복: 85... 피자+치즈볼 109/140 못먹지만 캐나다에서 온 간식❤️ •저녁: 불고기+양배추..."
762,비비큐 자메이카 통다리/치즈볼/순살크래커/케이준감자 바삭함도 없고 목이 아릴정도로 짜기만 엄청 짜더라구요 랜덤으로 두알씩 넣어주시는 치즈볼! 지난번에 황금올리브치킨을 주문했을땐 고구마치즈볼이 와서 아주...
763,"방학 맛집 BHC 비에이치씨 뿌링클 윙 치즈볼 후기이벤트 치즈볼 뿌링클을 무슨맛으로 먹는지 모르던 때가 있었는데,, 요즘은 가장 많이 먹은 치킨인듯ㅋㅌㅌㅌ 일단 우리집은 치킨을 엄청 시켜먹는다... 올해는..."
764,음료수와 떡꼬치 치즈볼까지 아이들과 갈때는 술을 못마시니까 음료수 사주고 떡꼬치를 사줘요...호프집가면 이런 메뉴들이 있더라구요 치즈볼은 쫄깃하고 맛있답니다 군침이 돌아요!! 치즈는...
765,상봉 맛집) 경성꽈베기 치즈볼 팥도너츠 핫도그 시장꽈베기맛집 저는 오늘 엘리사 언니가 사주신 치즈볼!! 아직 블로그 시작한지 얼마 안되서 치즈가 쭈-욱 늘어나는걸 찍었어야 하는데 아쉽 ㅠㅠ 진심 치즈가 입에서 땅끝까지 쭉쭉...
766,전자렌지에서 1분 30초면 OK! 초간단 맥주안주 치즈볼 과자 만들기^^ 싶어 오늘은 전자렌지로 초간단 치즈볼 과자를 만들어보기로 했다. 치즈를 적당한 크기로 잘라서 종이호일을 깐 접시 위에 간격을 두고 펼친 후.. 전자렌지에 1분 30초...
767,BJ치즈볼 타락헬창보고 바로 사온 성산일출봉 에일맥주 (남산 제주백록담까지) 국내 수제맥주! 안녕하세요 잇님들 >< 여러분 혹시 타락헬창 치즈볼먹방 보셨나요? 아 ㅋㅋㅋ 저... ㅋㅋ 치즈볼 먹방하시는 모습에 ㅋㅋ 저도모르게 흐뭇한 미소로 쳐다보며 웃고...
768,"유튜브학과 뉴스레터 : 국내 유튜브 이슈 - 운동유튜버에서 먹방 유튜브로! '핏블리' 이제 BJ치즈볼이 되다. 하느라 '엽떡, 치즈볼, 마왕족발'까지! 가장 핫했던 음식들을 이제서야 처음... 특히 가장 인기를 끌었던 치즈볼 먹방의 인기에 힘입어 최근에는 무려 '치즈볼' 광고까지..."
769,"맘스터치 혼닭세트+치즈볼 맘터 후기 맘스터치 맘터 혼닭세트+치즈볼 후기 12,400원 맘터 혼닭세트 구성은 콜라+차파오닭강정+싸이버거 1개 9,400원 치즈볼은 3000원에 4개 개당 750원꼴♡ 싸이버거는..."
770,이번 추석 연휴에는 나홀로집에 뿌링클 + 치즈볼 + 뿌링소떡!!!!!!!!! 쌀국수도 먹음 ㅋㅋ 풍성한 한가위였당  맥도날드 상하이치킨스낵랩이랑 후렌치후라이 치즈볼도 1개 더 줌;;;;;;; 진짜 혼자 먹는데 완전 행복ㅠㅠㅠㅠㅠㅠ 진짜 혼자 계속... ㅠㅠ 소떡이랑 치즈볼 4개 정도에 치킨 몇 조각만 먹고 배불러서 치킨은 완전 거의...
771,"[부산 해운대 맛집/해리단길 맛집] 유루유루 - 오믈렛,파스타,가지튀김,돈카츠,양송이 치즈볼 양송이 치즈볼 양송이 속에 치즈를 넣고 튀긴 요리로 저는 양송이를 좋아하는 편이 아닌데도 맛있더라구요. 양송이 좋아하시는 분들에게 추천!! 특히 양송이 버섯 국물..."
