,title
187,가성비 좋은 발산역 맛집 모음 지난 연휴에는 추석을 맞이해서 가족들과 미리 알아본 발산역 맛집에서 외식을... 발산역 맛집은 모든 좌석이 아늑한 룸테이블로 되어있는데요 덕분에 코로나 걱정없이...
188,잊을수 없는 해운대 맛집 List 며칠 전 친구들과 바닷가로 놀러 갔다가 해운대 맛집에 가서 저녁도 먹고 왔어요.... 해운대 맛집이었어요. 유자폰즈 샐러드는 레몬을 올려주셔서 새큼한 맛을...
189,평창 맛집 다키닥팜 오리숯불구이 감동의 맛(내돈내산) 오늘은 알찼던 1박2일간의 평창여행을 마치고 오랜만에 다녀온 평창 맛집 다키닥팜... 평창 맛집 다키닥팜은 생오리참숯구이가 젤 유명한데 큰접시 기준 500g에 35...
190,"룸서비스301, 양재천 카페 뷰맛집 #뷰맛집 여기는 케이크도 맛있다. 모형처럼 생겼지만.. 주문하면 진짜 저렇게 생긴 케이크가 나온다는!! 치즈케이크가 먹고 싶어서 하나 주문하고... 룸서비스301의 메뉴...."
191,육즙가득한 제주 한림 맛집 최근에 놀러갔을 때 간만에 인생 흑돼지를 맛보았던 제주 한림 맛집을 발견했는데... 반찬들은 제주 한림 맛집 셀프코너를 이용하면 넉넉하게 담아올 수 있었어요. 기본...
192,찐이였던 영종도 맛집 리스트 영종도 맛집은 용유도 해변 바로 맞은편에 있어 접근성이 뛰어났는데요. 가게 앞에... 뿐만아니라 영종도 맛집은 사방이 뻥 뚫려 있는 야외포차 공간도 준비되어...
193,깔끔했던 미사 맛집 리스트 며칠 전 가족과 이야기도 나눌 겸 밥을 먹으러 미사 맛집에 방문해 봤어요.... 메뉴판 위에는 요즘 인기가 많은 미사 맛집의 만두 메뉴가 적혀 있었어요. 제 지인들도...
194,상수 맛집 서울양장에서 스테이크 먹었어요 그날 묵었던 숙소에서 가까웠던 상수 맛집 '서울양장'을 소개해볼게요. 워낙 맛집으로 소문난 곳이라 늘 웨이팅이 있다고 들어서 이날은 브레이크타임 끝나고 바로...
195,특별했던 여주 맛집 리스트 며칠 전 여주에 사는 지인을 보러 갔다가 점심 식사하러 여주 맛집을 다녀왔어요.... 매일 아침에 여주 맛집 사장님이 직접 담가 주시는 거라니 맛에 대한 기대감이...
196,"내가 뽑은 영덕 대게 맛집 베스트 대게 맛집 에 다녀왔어요. 대게를 이용한 다양한 요리를 비롯해 가격, 푸짐함까지... 소량만 먹었는데도 달큰한 맛이 진하게 풍겨서, 첫입만에 영덕 대게 맛집의 남다른..."
197,"파주 맛집  LIST :: 삼고집 (feat. 고기말이) 파주 맛집 LIST :: 삼고집 (feat. 고기말이) 안녕하세요 찌주입니다 최근 구름 없는... 전날 캠핑을 하고 , 프로방스 근처를 들렸다가 점심을 먹기로 해서 파주 맛집에..."
198,엄선해서 고른 사당역 맛집 리스트 며칠 전 친구와 저녁식사를 하기 위해 미리 검색해 두었던 사당역 맛집을 방문하게... 사당역 맛집의 내부에는 다양한 갑각류들이 채워져있는 수족관이 있었는데요....
199,기억에 남는 가로수길 맛집 리스트 가로수길 은행골 얼마 전 동생과 SNS에서 참치 초밥으로 핫한 가로수길 맛집에... 가로수길 맛집은 일요일 휴무에 매일 오전 11시부터 오후 10시 30분까지 운영한다고...
200,누구나 좋아할 잠실 맛집 다녀온지 벌써 꽤 됬지만 아직도 생각나는 #잠실맛집 진짜로 두가지 메뉴 다 맛있게... 잠실 맛집이라고 하는 이유! 장어 크기랑 비주얼만봐도 정말로 달라요 제대로 민물...
201,애정했던 안산 고잔동 맛집 리스트 최근 친구랑 동네를 거닐다가 배가 고파서 들렸던 안산 고잔동 맛집이 있어서... 그래서 더 믿음직스러웠던 안산 고잔동 맛집이었습니다. 테이블을 깡통 형식이었고...
202,"알차던 제주도 맛집 리스트 지난 여행에서 검색하고 찾은 오션뷰가 유명한 제주도 맛집을 다녀왔습니다. 듣던... 제주도 맛집에서는 플레이트매트와 팔찌, 볼펜 등 다양한 하와이 풍 소품들이..."
203,재방문각 제주 롯데호텔 맛집 리스트 얼마 전에 다녀온 여행에서는 부모님과 함께 제주 롯데호텔 맛집도... 저흰 2층으로 올라와 자리를 잡고는 제주 롯데호텔 맛집의 메뉴판부터 살피기 시작했어요....
204,"풍족했던 원주 맛집 모음 지난주 지인들과 원주로 놀러 갔다가 현지인의 추천을 받아 원주 맛집에... 저희는 고민 끝에 원주 맛집의 대표 메뉴라는 가자미세꼬시물회와 꼬막 비빔밥, 대구탕으로..."
205,우수했던 제주공항 근처 맛집 리스트 얼마전 친구들과 함께 여름휴가로 제주도에 가서 제주공항 근처 맛집을 방문하고... 시장내 위치한 제주공항 근처 맛집인만큼 화려하진 않았지만 정감가는 스타일에...
206,[꽃게찜 맛집] 목포산꽃게 꽃게를 생으로 먹을 순 없으니 자주 가던 꽃게찜 맛집을 찾아 다시 한번... 4.2 주말 저녁시간 꽃게찜 맛집에 도착하니 역시나 대기가 몇팀 앞에 있었지만 예전만큼...
207,넘사벽인 강화도 맛집 LIST 지난주 가족들과 자연적인 맛으로 유명하다는 강화도 맛집을 찾아갔어요. 가을에... 무사히 통과한 뒤에는 강화도 맛집의 홀을 둘러봤거든요. 꽤나 이른 시각에...
208,곱창떡볶이! 신사동 가로수길 맛집! 다채롭게 신박하게 먹는 곱창떡볶이세트!! ^^ 요즘은 맛집을 다녀오고 나서 2주 지나서 올리게 되요. 혹시 제가 다녀가고 문제가 될까요? 이곳도 2~3주 전에 다녀온 곳을 포스팅 하는 것이랍니다.^^ 사실 맛집들...
209,용인 수지 맛집 맛있는녀석들 엄마의밥상 미역국 맛있는 녀석들 엄마의 밥상 편에 소개됐던 용인 수지 맛집의 미역국 정찬 정성... 수지 맛집 벼르고 벼르다 올봄에 맛을 보고는 이 맛이 바로 정성이로구나 싶어 매우...
210,색다른 즐거움의 홍대 맛집 베스트 홍대 맛집을 다녀오게 되었습니다. 1. 바비레드 홍대점 주소: 서울 마포구... 또 홍대 맛집에는 다양한 어린이용 메뉴들도 많이 준비되어 있었는데요. 그래서인지...
211,자주찾는 동성로 맛집 지난 번 지인들과 대구에 놀러 갔다가 미리 점찍어둔 동성로 맛집을 찾아갔어요.... 동성로 맛집의 영업시간은 오후5시부터 새벽1시까지라서 느즈막히 방문해 야식까지...
212,목포 초밥 맛집 고래등 초밥 맛집 고래등 메뉴판이에요 저희는 고래등초밥이랑 모듬회 소로 주문했어요 친구가 연어회를 먹었는데 정말 맛있었다고 칭찬하더라구요 연어회로 먹고싶었지만...
213,"서울근교 강화 여행, 교동도 청국장 맛집 노을가든 오늘은 서울 근교 강화 교동도에 위치한 청국장 맛집 <노을가든> 을 소개해드릴까... 청국장 맛집 노을가든 을 향했습니다. 노을가든은 교동도에서도 시골의 농가들..."
214,가야공원 맛집> 냉수탕가든 오리백숙 아파도 일어날 것 같은 <가야공원 맛집 냉수탕가든의 오래백숙> 부제 : 아파도 일어날 것 같은 오리백숙... 그런데 가야공원이 바로 시내 안에 있다고 해도 과언이 아닌 바로 밑이 맛집 즐비한...
215,"양양 맛집 / 송이골 - 이제 송이철이다. 속초 여행의 끝을 알리는 양양 맛집, 송이골. 기존에도 들르고자 했으나 철도 아니거니와 가고 싶었던 곳과 열심히 혈투를 벌이다 송이가 나자빠지고 피자를..."
216,"기가막힌 강남역 맛집 리스트 지난 주말, 약속이 생겨 강남에 갔다가 친구가 맛있게 먹었다던 강남역 맛집에... 강남역 맛집 파히타는 인기 메뉴답게 푸짐한 양과 맛깔스러운 모양새로 눈길을..."
217,예술이었던 포천 이동갈비 맛집 목록 이동갈비 맛집에 다녀오게 되었는데요 그 중에 가장 강렬한 인상으로 남았던... 이동갈비 맛집의 직원분 안내로 자리를 잡고 메뉴판을 살펴보기 시작했는데요 레트로한...
218,"원조 포천 이동갈비 맛집 저번 주 친구들이랑 포천에 놀러 갔다가 유명한 포천 이동갈비 맛집에 다녀 왔다.... 손님들이 줄을 잇는 포천 이동갈비 맛집은 각종 매체에도 방영된 곳이었는데, 과연..."
219,남달랐던 경포대 맛집 리스트 얼마 전 지인들과 강릉을 방문했다가 저녁을 먹으러 경포대 맛집을 찾아갔습니다.... 창가 쪽에 자리를 잡고 바로 경포대 맛집의 메뉴판을 펼치니 다양한 세트메뉴들이...
220,진짜 괜찮은 대부도 맛집 목록 다들 면요리를 좋아해서 대부도 맛집을 검색해서 찾아갔는데 너무... 대부도 맛집은 보리밥을 공짜로 제공을 해주는걸로도 유명한데요 푸짐한 인심이 정겹더라고요...
221,"정성이 가득했던 판교 맛집 모음 어제 점심, 입맛이 없다는 친구를 데리고 숯불갈비를 전문으로 하는 판교 맛집에... 그 외에 판교 맛집에서 줄줄이 나오는 메뉴에 손이 쉴 틈이 없더라고요. 고기를..."
222,"이수역 고기집 - 가성비 좋은 삼겹살 맛집 '쟁반집8292' 다음엔 돈쟁반에 도전해볼까~ * 2020년 9월 27일 방문 이수역 고기집, 이수역 삼겹살 맛집 #쟁반집8292 이용 정보 * 위치: 서울 동작구 동작대로27다길 15(사당동 139-62)..."
223,[전북/ 남원] 든든한 산채정식 맛집 '심원첫집' 심원첫집 부모님에게도 꼭 소개해주고 싶었던 심원첫집이라 남원 여행 계획할 때부터 리스트에 넣었다 :) 30여가지의 나물과 반찬을 맛 볼 수 있는 건강한 맛집이다....
224,매력적이었던 양양 맛집 리스트 지난 주말 가족들과 대게를 먹기 위해 양양 맛집을 방문했는데요.선주 직판으로... 외관에는 양양 맛집의 방송이력도 엄청나게 걸려져 있어 제대로...
225,예술이었던 여수 맛집 예술이었던 여수 맛집 얼마 전 휴일에는 친구들과 여수의 향취를 맛보러 여수 맛집에 들러봤어요. 살이 꽉 차오른 킹크랩과 대게가 시그니처였는데 스끼다시도 수준이...
226,가성비가 좋았던 대전 맛집 리스트 지난 주 가족들과 함께 친구가 추천해 준 대전 맛집에 다녀왔다. 칼제비와 보쌈... 뿐만 아니라 대전 맛집에는 유아용 의자까지 구비되어 있었다. 아이와 함께 가족끼리...
227,자꾸 떠오르는 강남역 맛집 순위 며칠전에 친구와 매콤한 요리가 먹고 싶어서 강남역 맛집을 다녀오게 되었다... 강남역 맛집에 대한 믿음이 커지기도 했다 전체적으로 내부를 둘러보았는데 살짝...
228,흡족했던 남포동 맛집 리스트 얼마 전 부산 자갈치시장 구경길에 입소문 난 남포동 맛집을 다녀왔다. 내가... 그렇게 원하는 자리에 앉아 남포동 맛집의 메뉴판을 둘러보았다. 가짓수가 워낙 많았는데...
229,우월했던 강남역 맛집 모음 며칠 전에는 지인들과 사전에 염두해두었던 강남역 맛집을 다녀왔어요. 이색적인... 강남역 맛집은 정리 정돈도 잘 되어있어서 다들 안심하고 이용할 수가 있겠다고...
230,"추천하는 부산 기장 맛집 리스트 기장 맛집을 소개하려 합니다. (1) 해풍가마솥 주소 : 부산 기장군 기장읍 연화1길 67... 기장 맛집인데, 롯데아울렛과도 가까워 쇼핑하고 저녁에 식사하러 방문하기 좋기..."
231,명일동 맛집 명일닭발(최애 단골집) 명일동 맛집 명일닭발 간판에 35년전통이라고 되어있는데 올해로 딱 40년 됐다고 한다ㄷㄷ 여기로 할 것 같으면 늘 말하지만 내기준 닭발 맛집 1위 이자 명일동 맛집...
232,[제주도 맛집] 고등어회 맛집 _ 미영이네 식당 고등어회 맛집인 미영이네 식당에 다녀왔어요. 고등어회가 비리다며 싫어하시는... 제주 고등어회 맛집 미영이네 식당 메뉴판 only 고등어회와 고등어 구이만 팝니다....
233,"핫플 신림 맛집 : 곱창나라 핫플 신림 맛집 : 곱창나라 안녕하세요 찌주입니다 얼마 전에 친구와 함께 신림 맛집을 다녀왔다. 육즙이 풍성하기로 소문이 자자하고 , 직원분들이 친절해서 기분좋게..."
234,특색있는 구디 맛집 모음 구디 맛집이 있다하여 찾아갔어요. 신림에 20년 전통 본점을 갖고 있는 식당으로... 조리하는 공간이 그대로 보여지고 있어 위생적인 부분 또한 신뢰가는 구디 맛집이었...
235,압구정춘천막국수 - [압구정동] 오랜기간 자리를 지키는.. 집앞의 보쌈 / 족발 맛집.. 원래 그러면 안되는데.. 오랜 기간 자리를 지키고 있는 조용한 맛집.. 하지만 음식에 대한 자부심이 대단하신.. 어려운 시기지만.. 꼭 자리를 지켜주시길.. 전화번호 517-8884
236,풍미 좋던 남양주 맛집 베스트5 며칠 전에는 지인들과 다같이 SNS에서 핫한 남양주 맛집에 방문했어요. 다양한... 또 한쪽 벽에는 남양주 맛집이 여러 방송에 나왔던 모습과 유머러스한 문구가 눈에...
237,"상남동 맛집, 창원 대구뽈찜 추천,  '청담동 대구뽈찜 아구찜' 상남동 맛집 진짜 진짜 은져미 취향 조준사격한거 가툰곳 ㅋㅋㅋ 가격도 나뿌지... 상남동 맛집 맛도 양도 완벽행.....❤️ 살도 많고, 부드러우면서 쫄깃하고 맛있는데..."
238,상수역 맛집 닭갈비가 맛난 팔각도 어딜 갈까 고민하다가 숯불닭갈비로 소문난 상수역 맛집을 갔는데 맛과 분위기에... 기존에 생각하던 닭갈비집과는 사뭇 다른 분위기가 상수역 맛집의 큰 장점 중에...
239,가성비짱 영등포역 맛집 모두 모이기 쉬운 장소에 있는 영등포역 맛집에서 만나기로. 서울 한복판에 있지만... 짝꿍님이 여기 영등포역 맛집 바로 앞까지 차로 모셔다 준 올리브랑 오전 운동을...
240,"천안여행 - 소우리생고기집, 천안 소고기 맛집 [20년 9월 21일] 기대도 안 했던 천안에서 소고기 맛집을 찾았다. 난 히스토리를 좋아하는 사람이니... 나도 그거 보고 알게 된 맛집. 영업시간 및 휴일 참조. 세월의 흔적을 고스란히..."
241,애정하는 서귀포 맛집 리스트 모음 얼마 전 친구와 함께 제주도에 갔다가 서귀포 맛집에 다녀왔다. 겉바속촉의 정석을... 서귀포 맛집의 통 삼겹살이 노릇하게 익어지면 가위를 이용해 일정한 간격으로...
242,"광화문 맛집, 한우 먹방_모도우 광화문 맛집, 모도우 한우 먹방 코스요리로 한우와 생선회를 동시에~ 가을밤, 오랜만에 찾은 #광화문맛집 코로나 이전에는 미팅이며 퇴근후 지인들 만나러 종종 찼던..."
243,합정 파스타 스테이크 맛집 미티 레스토랑 와인바 파스타 맛집 미티 레스토랑 와인바. 메뉴만 잘하는게 아니라 와인까지 다양하게... 하시면 찾아가야할 맛집을 소개해 드리려고 합니다. 그럼 오늘의 합정 파스타...
244,또 갈 예정인 익산 맛집 모음 돌아오는 길에 출출해져서 검색해보니 근처에 아주 소문난 익산 맛집이 있다고... 익산 맛집에서는 후식으로 먹기 좋은 람부탄도 준비를 해주셨어요. 식사 마지막에...
245,마음 빼앗긴 강릉 맛집 모음 마음 빼앗긴 강릉 맛집 모음 안녕하소! 웅이입니당!! 며칠 전에는 강원도에 살고 있는 친척들을 만나러 갔다가 유명하다는 강릉 맛집에도 다녀 왔는데요. 산지에서 잡아...
246,전주 송천동 맛집 모임하기 좋은 리가든 #전주송천동맛집 #리가든전주송천점 안녕하세용 전북데이트입니당!... 송천동 맛집 리가든으로 향해줬습니다 흐흐 송천동 먹자골목이랑 가까워서 금방 도착한 리가든!...
247,완벽했던 제주 중문 맛집 목록모음 얼마 전 친구와 함께 제주도에 갔다가 정말 많은 제주 중문 맛집을 찾게 되었는데요... 중문 맛집의 중앙홀은 편안한 분위기를 자아내고 있어 깜짝 놀랐는데요 저는...
248,"[부산 동래 맛집]소문난 순곱이네~ 시원칼칼쓰! 맛집, 순곱이네 입니다 수안역 지하철 3번출구에서 걸어서 1분 걸리는 곳에 위치해 있구요 입지가 너무 좋아서 밥 먹으러 술마시러 들리기 정말 좋은 부산 동래 맛집..."
249,으뜸이었던 대구 맛집 모음 얼마전 친구들과 대구에 바람을 쐬러 갔다가 미리 알아봤던 대구 맛집에 식사하러... 대구 맛집은 건물내 2층에 위치하고 있었는데요. 곱창이나 대창을 전골과 구이...
250,[신대방/보라매 맛집] 서평면옥 - 2020.07.17 육계장도 먹어보고 겨울되면 만두국이나 만두전골도 먹어보려고요. #보라매맛집 #신대방맛집 #평양냉면 #평양물냉면 #소고기국밥 #얼큰달큰 #내스타일 #우리동네냉면집
251,직접 뽑아본 안산 맛집 LIST 요즘 일 때문에 안산에 갈 일이 잦은데 어제도 친구와 점심을 먹으러 안산 맛집을... 안산 맛집에 대한 좋은 인상을 받을 수 있었습니다. 외관의 규모에서 느껴진 대로...
252,모처럼 즐긴 대전 둔산동 맛집 모음들 저번 주엔 퇴근을 하고 직장 동료들과 대전 둔산동 맛집에 찾아갔어요. 두툼한... 저는 대전 둔산동 맛집의 2층 여자화장실도 이용해 보았는데요. 생각했던 이상으로...
253,끝내줬던 안면도 맛집 모음 친구들과 지난주에 안면도에 놀러갔다가 현지인의 추천을 받아 안면도 맛집에... 가족단위로도 많이 방문하는 안면도 맛집답게 한쪽에는 유아용의자도 넉넉히...
254,인상깊었던 압구정 맛집 모음 압구정 맛집을 갔는데요 신선하고 맛깔스러운 한끼라 부담도 없고 좋았던... 압구정 맛집에서 식사 전에 먼저 손부터 씻기 위해서 화장실에 들렀습니다. 보이지 않는...
255,고양 스타필드 맛집 - 스트레스 해소에 좋은 매콤 쭈꾸미 고양 스타필드 맛집 매콤한 쭈꾸미로 코로나블루 스트레스 해소할 수 있는... 스타필드 맛집 철판 쭈꾸미볶음 전문점 오늘은쭈꾸미의 외관입니다. 오픈한지 별루...
256,대만족 여수 맛집 목록 둘러보며 빼놓을 수 없는 여수 맛집도 방문하고! 여긴 현지에서 유명한... 여수 장어 맛집 힘센장어 첫번째로 찾아간 힘센장어는 거북선 승선장에서 차를 타고가면...
257,"전주 맛집, 메르밀 진미집 이제야 쓰는 전주 맛집 메르밀 진미집! 전주 여행을 정한 뒤, 맛집은 어딜갈까 찾다가 평소 메밀도 좋아하고 콩국수도 좋아해서 안먹을 수 없어서 도착하자마자 가는..."
258,꼽혔던 노량진수산시장 맛집 리스트 가족들과 함께 외식을 하기 위해 지난 주말 노량진수산시장 맛집을 방문했어요.... 참고로 노량진수산시장 맛집에서 해산물 구매시 무료 주차권도 제공되니 주차비용도...
259,자꾸 끌리는 제주 전복 맛집 전복 맛집에 들러 온갖 다양한 음식을 맛보고 왔다. 지금껏 먹어보지 못한 전복 요리의 끝판왕을 보고 왔기에 소개해 볼까 한다. 내가 찾은 제주 전복 맛집은...
260,0930 홍대/연남동 가지튀김 만두 맛집 하하(哈哈) 연남동을 거의 30분째 방황하다가 결국 '검증된 맛집'을 가는 게 가장 안전하겠다고... 명색이 만두 맛집이니까 만두도 한판 시켜야지. 군만두는 너무 튀김으로 겹치는...
261,"기깔나는 부산 기장 맛집 모음 얼마 전 동료들과 식사 약속이 생겨 부산 기장 맛집에 다녀왔는데요. 4대째... 부산 기장 맛집은 장어, 새우, 활어회, 아나고 등 다양한 해산물 요리들을 취급하고..."
262,번뜩였던 제주 중문 맛집 리스트 얼마 전 가족들이랑 제주도로 떠났다가 미리 알아둔 제주 중문 맛집을 찾았어요.... 제주 중문 맛집 내부는 모던하면서도 옛날 포차같은 아늑 인테리어가 돋보였어요....
263,[강셰프 경양식/둔촌동 맛집] 둔촌동에 있는 돈까스집인 강셰프 경양식 여기는 일종의 동네맛집같은 포지션을 가지고 있는 곳입니다. 다양한 돈까스를 먹을 수 있는 동네밥집 김치와 피클은 셀프...
264,연남동 파스타 맛집! 더다이닝랩에서 엄마와 연남동 데이트 분위기 좋다고 소문난 연트럴파크 맛집 더다이닝랩에서 맛있는 식사를 했답니다~ 연남동 파스타 맛집이라는 더다이닝랩! 연남동 데이트하기 좋은 장소로 손 꼽히는...
265,"또 가고싶은 동탄 맛집 모음 얼마 전, 식사 약속이 있어서 동탄에 갔다가 인기가 좋다는 동탄 맛집에서... 기본반찬에 콩나물에 동탄 맛집 양념소스를 쫘악 부려주니 비쥬얼이 한껏 돋아났네요...."
266,으뜸이었던 횡성 한우 맛집 모음 한우 맛집에도 식사를 하러 가봤어요. 퀄리티좋은 한우와 수준높은 음식맛을... 횡성 한우 맛집은 앉아서 식사를 할수 있는 룸도 따로 마련되어 있었는데 이곳도 상당히...
267,푸짐했던 부평 맛집 LIST 며칠전에 와이프랑 함께 인천에 볼일이 있어 들렸다가 이른 저녁을 위해 부평 맛집... 벽면의 공지글을 보니 이곳 부평 맛집은 주문진 현지 업체와 직거래로 게와 횟감을...
268,압구정 한우 맛집에서 오붓한 데이트 압구정 맛집에서 한우 오마카세 둘째 딸과 연휴 첫날에 오붓한 데이트 매우 성공적... 한우 맛집을 픽! 압구정에 도쿄등심이 두 군데가 있는데 도쿄등심 청담점은 청담...
269,내가 정한 단양 맛집 베스트 순위 단양 맛집들을 소개해볼까합니다 1. 단양 왕릉숯불갈비 식당이름은 왕릉숯불갈비... 살짝 매콤했던 더덕구이라 쓴맛이 중화가 되면서 단양 맛집에서 밥반찬으로 먹기에...
270,한눈에 반했던 서귀포 맛집 모음 얼마전 제주도 여행 중 현지인 친구가 강력 추천했던 서귀포 맛집을 방문했었어요.... 가족손님들도 많이 찾는 서귀포 맛집인 만큼 아기의자도 넉넉하게...
271,"모두가 인정한 송도 맛집 리스트 오랜만에 친구들과 기력을 보충하러 폭풍 검색을 통해 알아낸 송도 맛집... 이내 테이블에 착석을 한 저희는 송도 맛집 메뉴를 살펴본 다음, 베스트라는 소한판을..."
272,"후회 없던 신림 맛집 리스트 얼마 전에 친구들이랑 주말에 만나 저녁 식사를 하러 신림 맛집을 찾았습니다.... 신림 맛집의 영업은 오전 11시 30분부터 오후 11시까지였는데 단, 월요일은 오후 5시부터..."
273,"해리단길 맛집 : 딤타오, 미슐랭 쉐프의 딤섬 해리단길 맛집 : 딤타오, 미슐랭 쉐프의 딤섬 Dimtao- 미슐랭 스타 쉐프의 딤섬을... 지날수록 맛집이 늘어나고 있는 사랑스러운 동네 ❣️맨 처음 김나니랑 해리단길..."
274,제주공항 근처 맛집 단골이어라~ 근처 맛집 흑돼지를 맛보고 돌아왔어요. 도민들이 인정한 타이틀이 아깝지 않을... 이미 유명 흑돼지집으로 정평난 제주공항 근처 맛집 답게 흑돈은 물론 대패삼겹...
275,대만족스런 남해 맛집 목록 얼마전 부모님과 남해로 여행갔다 남해 맛집에 다녀왔어요. 현지유명한... 남해 맛집 내부는 확띄인 홀과 조용한 모임도 가질수 있는 방으로 준비되어 있었어요. 저희는...
276,잘 찾아간 부산 명지 맛집 리스트 냉큼 자리에 앉아 주문을 넣었더니 부산 명지 맛집 기본 메뉴인 샐러드 먼저... 잇달아 부산 명지 맛집의 오무라이스로 손길을 향했어요. 우선 숟가락으로 중앙을 푹...
277,곡성맛집 분위기도 맛도 찐인 곡성가든 그 부지런을 이어서 오늘은 최근에 힐링이 되었던 곡성맛집을 소개해보려구용... 야외에서 직접 구워주는 그릴 스테이크로 유명한 곡성맛집이랍니다. 캠핑 가지 않아도...
278,[고성 맛집] 백촌막국수 고성 맛집으로 예전부터 네이버 지도에 찜 해놓았던 백촌막국수에 가보기로 했다. 4.2 고성 맛집으로 유명해서 그런지 대기가 엄청나다고 한다. 그래서 우리는 아주...
279,[제주도 여행] 고기국수 맛집 _ 제주미담 고기국수 솔직후기 제주도하면 고기국수를 빼놓을 수가 없었기에 제주도 고기국수 맛집들 리스트를 미리 빼뒀는데 저희가 가려던곳이 오픈시간이 안맞아서 2번째로 빼둔 고기국수 맛집...
280,인정할만한 목동 맛집 모음 목동 맛집을 들렀어요. 맛은 당연했지만 구성과 고객 서비스가 너무 좋았던 곳이라... 목동 맛집에서 점심 식사를 할 수도 있겠다 생각되었어요. 안내받은 좌석에 앉아...
