,title
434,BHC치킨 골드킹+치즈볼 리뷰 bhc를 처음 시켜보네요.....ㅎㅎㅎ 콜라를 따로 주문 안했는데 같이 주셨어요ㅎㅎ♥ 짭쪼롬하면서 약~~~간의 매콤한 맛도 있어서 너무 맛있어요♡ 치즈볼도 너무...
435,맘스터치 쫀득쫀득 치즈볼 내 스탈 이야 바삭바삭한 치즈볼 애껴먹어야지 크림치즈가가득 한입씩 먹을때마다 감동이온다 아껴먹어야하는데 우리뚱이의 간절한 눈빛 침만 꼴깍 꼴깍중ㅋㅋ 안줄걸아니깐 그냥...
436,교촌 레드 콤보&퐁듀 치즈볼&닭갈비 볶음밥 내 돈 내산 후기 퐁듀 치즈볼이 있었는데 퐁듀가 더 끌려서 주문 첫입은 시즈닝 때문인지 살짝 짜다고 느낄 수 있다 씹으면서 안에 있는 퐁듀 치즈와 어우러 지면서 완벽한 단짠의 조화...
437,파리바게트 바삭 치즈볼 그래서인지 더 먹기가 좋았던 거 같아요. 물리지 않고 계속 먹고 싶더라구요. 치즈도 쭉쭉 잘들어나네요. 입이 심심할 때 간식으로 좋아요 파리바게트 바삭 치즈볼 !
438,비비큐 BBQ 네고왕 메이플버터갈릭 치킨 + 치즈볼 (광희나는 버터갈릭 치킨) 5천원주고 치즈볼도 추가했습니다 한입거리인데 한입에 천원 ㅠㅠ 그래도 맛있어서 봐줬습니당 ㅎㅎ 원래 치즈를 안좋아하는데 크림치즈? 처럼 부드러워서 저도...
439,"나 치즈볼에 진심이야_bbq 황금알 치즈볼, 모둠볼 일단 네고 왕 때 먹었던 황금알 치즈볼 먼저 후기 갈게요~ 생각보다 크기가 작았던 황금알 치즈볼. 치즈는 bhc와 비슷한 자글자글한 식감이었어요. 맛이 없는 건 아닌데..."
440,맛있는치킨 bhc뿌링클치킨ㆍ치즈볼 주문했어요 치즈 가득 치즈볼~~ 그냥 먹어도 맛있지만 뿌링클치킨에 뿌려진 가루 찍어서 먹으면 뿌링치즈볼이 되요^^ 치즈볼 뿌링뿌링소스에 찍어서 먹고 뿌링클치킨 가루에도...
441,"[육아/간식] 루솔 치즈볼 먹여봤는데 핵 편한 간식!! 루솔의 치즈볼인데요~ 나트륨 함량이 적어 너무 짜지도 않고 감자를 찌고 숙성한... 동그란 치즈볼이 9개 정도 들어가 있어요^^ 치즈볼을 기름 두르고 튀겨도 되고, 조금..."
442,다이어트 76일차 후포로 떠나기 도착해서  누나홀닭 후포점 치킨 골뱅이 치즈볼 냠냠 다이어트 76일차 후포로 떠나기 도착해서 누나홀닭 후포점 치킨골뱅이 치즈볼 냠냠... 촉촉한 치킨이랑 골뱅이쫄면을 시켜주고요 치뱅이 완전 올만♥️�� 치즈볼두!...
443,"스타벅스 클라우드 초코 케이크, 처갓집 슈프림양념치킨 치즈볼! 항상 시키고 나서 후회하는 이상한 사람..ㅋㅋㅋ 근데 처갓집 치즈볼은 진짜 치즈에요! 그리고 쫀!득!해요! 식감이 너무 좋습니다~ 살짝 깨찰빵느낌? 그리고 겉에..."
444,치즈볼 만들기 !!! 오뚜기 찹살 미니도나스 믹스 언젠가 bhc 치즈볼을 먹으며 나도 꼭 한번 만들어서 먹어야 겠다고 생각한적이... 얇게해서 치즈 넣어서 데굴데굴 빗어주세요~ 너무 얇게 해버리면 튀길때 터질수있어요...
445,BHC 맛초킹+치즈볼 카톡 선물하기에서 바로 사용하기 치킨이랑 치즈볼만 보고 콜라는 당연히 캔이나 500ml인 줄 알았는데ㅋㅋㅋㅋㅋ 1.25L 당황스럽네여ㅋㅋㅋㅋㅋㅋ 저희는 에피타이저로 치즈볼을 먼저 먹었어요ㅋㅋㅋ...
446,"굽네치킨 고추 바사삭, 치즈볼 솔직 후기! 달달하고 버터 맛나는 크림치즈 이더라고요 ㅎㅎ 치즈볼은 제 스타일~~ 개인적인 입맛이지만, 치킨은 기대를 하고 먹어서 그런지ㅠㅠ 몇 개 까지는 맛있었는데 계속 먹다..."
447,자담치킨 맵슐랭 치즈볼 후기 후라이드치킨 #치즈볼 까지 구매 완료//// 부끄러워 다이어트 한다고 하지말걸.. 그래도 행복한 돼지가 좋은 요즘... 찹찹 손에 뭍은 기름까지 영롱해요... 치즈볼의...
448,"미쳐버린 트레이너의 포화지방 먹방파티 (교촌 허니콤보, 치즈볼, 웨지감자, 휘핑크림) 교촌 허니콤보,치즈볼 입니다~!~! (치즈볼 먹을 때 가장 신나요 >_<) 일단 먹고 싶습니다! 먹을게요!?!? 치즈볼...♥ 일단 배고프고 그리운 마음에 선 한입 후 도움! 교촌..."
449,이마트 노브랜드 치즈볼 후기 오늘은 이마트에 치즈볼이 있다는 친구에 말을 듣고 집 앞 노브랜드에서... 않으면 치즈가 딱딱하고 차가워요❄ 치즈도 생각보다 많은 편이에요~ 구우면 색이...
450,"치즈볼/ 풀무원 모짜렐라 치즈볼! 에어프라이어에 뚝딱하면 간식으로 완전 좋아요 안에 자연산 모짜렐라 치즈가 듬뿍 들어있는데, 전에 샀던 요리하다 치즈볼보다 덜 느끼하고 기름 맛도 많이 안나서 나는 훨씬 만족스러웠다. 100% 자연산치즈인걸..."
451,후라이드치킨에 치즈볼~~ 만두튀김까지 쫄깃한 닭고기가 너무 맛있어요 군마두는 별루 안좋아하는데 모듬안주로 주문했더니 치즈볼에 만두튀김 감자튀김등 종류별로 나오더라구요 술안주를 찾는사람에게는...
452,롯데리아 밀리터리버거 : 군대리아버거/치즈볼/폴더버거 핫치킨 전 포장해서 가져갈꺼예요~ 키오스크로 이젠 익숙하게 주문하구요~ 밀리터리버거 외에도 치즈인더 치즈볼과 폴더버거 핫치킨도 같이 주문합니다. 밀리터리버거...
453,bhc 뿌링클 칼로리 치즈볼까지 냠냠:) bhc 뿌링클 칼로리 치즈볼까지 냠냠:) 여러분들!? 뿌링클 좋아하세요? 저는...별로... ㅋㅋ 울신랑은 맛잇는지 잘먹네요 역시 초딩입맛 기프티콘에 있는 치즈볼...
454,전주 효자동 피자 하프앤하프 라지 치즈볼도 맛있었어 들어있는 치즈에서 수분이 하나도 빠져나오지 않아서 식은 치즈볼 특유의 그 질척거리는 느낌이 하나도 없어요 다른곳에서 판매하는 치즈볼들은 어떤지 한번씩 사다...
455,대구 피자  유로코피자에서 칼바사세트 정원초과 피자 찹쌀 치즈볼 찐 후기 찹쌀 치즈볼이 있어 같이 주문해봤는데 여기도 치즈가 실하게 있어 만족스러웠어요 찹쌀 치즈볼과 요거트소스 최고의 궁합 치즈볼이 겉이 시즈닝 뿌리는 경우도 많은데...
456,뿌링클 콤보&치즈볼 치킨시킬 원인이 생겼다...ㅋㅋㅋㅋㅋ 치즈볼이 식으면 맛 없어지니... 치즈볼을 먼저 먹었더니 너무 느끼했다. 뿌링클 닭뼈에서도 냄새가 났다.. 좀 안 좋은 닭이라 강한...
457,노브랜드 과자 추천 :: 대용량 체다 치즈볼 후기 *내돈내산리뷰입니댱 노브랜드에서 제일 좋아하는 과자중 하나 체다 치즈볼 한통 사놓으면 집에서 넷플보면서 아구아구 먹기 딱 좋다 https://coupa.ng/bJWaq2...
458,"런데이 휴식/운동 안 함/닭가슴살 샌드위치는 맛없어/BHC 골드킹 콤보/뿌링 치즈볼/신라면 BHC 골드킹 콤보, 뿌링 치즈볼 골드킹은 처음 먹는 건데 달고 짜서 금방 물림 별로 맛이 없네 속이 느글느글해서 먹은 신라면 아 배부르다 꺼억 내일은 잘 할 수..."
459,애슐리 모짜렐라 치즈볼 간편 냉동간식 추천 전자렌지 2분컷 모짜렐라 치즈볼 안에는 치즈가 듬뿍 들어있어요. #달지않은치즈볼 개인적으로 치즈볼 안에 든 치즈가 연유치즈처럼 단맛 나는거 안좋아하는데 요건 달지않은...
460,"송도 트리플스트리트 맛집 ‘정씨함박 송도점’/돈까스,함박,고로케&치즈볼 ^^ 정씨함박 #치즈볼 은 5개 찹쌀도너츠에 치즈넣은 비주얼과 맛 겉의 빵도 쫠깃~ 안에 치즈도 쫠깃~~~ 뜨거울때 바로 먹어야 맛있답니다 푸짐한 수제 함박스테이크와..."
461,아기간식 / 치즈볼 만드는법 아기간식 치즈볼 만들기 치즈 먹기 시작한지가 몇일 안됬는데 치즈를 너무 좋아하는 우리 전복쓰❤ 입에 자꾸 쩍쩍 붙기도하고 다 먹은건지 확인하기도 힘들어서...
462,"제천 배달 맛집_bhc(뿌링클+치즈볼) #bhc, #bhc뿌링클, #뿌링클, #치즈볼 주식큰손 왕개미님이 오뚜기로 번 돈으로 치킨사주심ㅎㅎ 리뷰 안하려다가 생각보다 넘 맛있어서 리뷰ㄱ 치즈 시즈닝이 넘나 골고루..."
463,<애슐리 쉐프박스> 오 정말 기대 이상!! 시카고 피자와 치즈볼 안그래도 피자와 치즈볼 핫딜 뜨면 구매해봐야겠다고 생각하고 있었는데 마침 땋!!... 기대 이상으로 피자치즈가 듬뿍 담겨있는 것을 볼 수 있다. ㅎㅎ 상상 그 이상의...
464,"[노브랜드버거/치즈볼] 노브랜드버거 사이드메뉴 인절미 치즈볼 후기 안에 치즈는 좀 짭잘하고 밖에 인절미는 고소하고, 치즈볼 겉은 또 바삭하고 ㅠㅠ 아주 환상입니다 제발 꼭 꼭 사드십시오 !!! 저 치킨집에서 시키는 치즈볼도 그냥..."
465,파리바게뜨 치즈볼 파리바게뜨에 들렸다 맛있어 보이는 치즈볼을 사보았다... 가격은 1100원.. 흐음 좀... 했다.. 내일 또 먹어야지.. #파리바게뜨 #치즈볼 #빵 #우유 #생크림
466,[ BHC 뿌링클치킨 ] 치즈볼과 소떡은 필수 배달비는 아껴야 되잖아요.ㅋㅋㅋ 치즈볼은 따로 주문했는데 소떡은 방문포장시... BHC 치즈볼은 처음 먹어보는거라 기대만땅이네요. 치키니는 언제나 옳지만 오늘은...
467,믿고먹는 또래오래 후라이드와 치즈볼 오천원입니다 치즈볼은 어디제품이나 다 맛있는것 같아요~ 치즈양도 많고~ 한입 베어물면 꼬소한면서 담백한 맛이 입안가득 한 치즈볼입니다 염지를 잘해서 그런가...
468,"【냠냠】배떡망원점 로제떡볶이&치즈볼! 비비큐 치즈볼같을 줄 알았는데 훨씬맛있다. 약간 찹쌀떡 느낌인데 안에 치즈가 들어 있음 늘어나는 치즈는 아니고 굳어있는 치즈인데, 더 맛있음. 다음날 한강 산책..."
469,우울할 땐 치즈볼 사람들 다 (쟤 뭐야...) 이런 눈으로 쳐다보면서 지나갔다 수치플 요즘 최애 유튜버 bj치즈볼...아니 핏블리님 진짜 너무너무 귀엽다 치즈볼 한 입 할 때마다 바나나 처음...
470,우울할 땐 뿌링클을 먹어..(feat.치즈볼) (갑분 뿌링클 ㅋㅋㅋㅋ) 뿌링클 콤보에 치즈볼 추가해서 주문했는데 뿌링클은... 사실 뿌링클보다 치즈볼이 먹고싶었던건 아닐까 싶다. 쫜득쫜득 맛있구나.....
471,[배달음식] 크리스피치킨과 치즈볼 오늘은 픽업 ㅋㅋ - 식당 : 부어치킨 방화점 - 메뉴 : 크리스피치킨 + 쫀득치즈볼... 치즈볼은 기본에 충실한 쫀득하고 달달고소한 맛. 식당사장님 주방장님 배달기사님...
472,[기타 쿠캣마켓 / 모짜통통치즈볼] 에어프라이 전용 치즈볼 모짜렐라 치즈 10개 들었어요 헤헤 그냥 빨리 먹고싶어요 조리방법 에어프라이어 냉동상태의 치즈볼 에어프라이에 넣고 180도 8분 조리 합니다....
473,핏블리 힙업공장 헬스장 문석기 나이 bj치즈볼 정보 영업을 못하는 참담한 심경과 함께 그동안 먹지 않았던 치킨과 치즈볼을 핏블리 헬스장 에서 먹방 하였습니다. 이러한 영상들로 생겨난 별명은 BJ치즈볼과...
474,타락헬창 BJ치즈볼 지코바 메뉴 알아냄 타락헬창 BJ치즈볼 지코바 메뉴 알아냄 안녕하세요~ 에밀리팍이에요! 최근에... 먹방을 할때 만큼은 타락헬창 BJ치즈볼 이라는 이름으로 활동하는데요! 처음에는 짠해서...
475,"홍대 퀸즈볼 방문 솔직후기 닭강정 치즈볼 그리고 디저트 드시러 오세용 닭강정부터시작해서 치즈볼 등등 디저트 등을 판매하는데요 신기한건 디저트를... 아삭아삭했구요 치즈볼 6구 선물세트 6,000원 식감은 일단 결론 존맛탱 후아..."
476,"배달음식 : 지코바 숯불양념치킨 , 애슐리 치즈볼 , 치밥 애슐리치즈볼 처음 먹어봤는데 와 이거 뭐예요??.. 속에 치즈가 두겹이었어요 바삭한 껍질은 찹쌀도넛 느낌! 남편, 동생, 저 같이 먹었는데 첫입에 탄성질렀네요 ㅋㅋㅋㅋ..."
477,[연남동피크닉추천템 / 홍대맛집] 경의선숲길 피크닉 필수템 퀸즈볼 치즈볼 치즈볼 종류별로 1개씩에 맥앤치즈까지 땅콩달콤강정이랑 화이트어니언! 미치고 환장사는 치즈 시즈닝까지 있으니 피크닉 추천템 홍대맛집 퀸즈볼에서 꼭...
478,"[11% 할인] 더주스 (굿초이스)비스코티 강아지 비스켓 160 g, 밀크 + 치즈볼 혼합맛, 6개 밀크 + 치즈볼 혼합맛, 6개 상품에 대해서 안내해드릴게요~ 더주스 비스코티 강아지 비스켓 160 g, 밀크 + 치즈볼 혼합맛, 6개 가격은 15,900원 입니다. (가격 변동사항은..."
479,[교촌치킨] 교촌 앱으로 레허순살반반+치즈볼 증정 이벤트 배달 후기 고르곤 치즈볼 6개나 있다 하얗게 뿌려진 저 가루는 좀 짭쪼름? ㅋㅋ 치즈가 막 꽉차있지는 않은데 그래도 단짠단짠 쫀득하고 맛있다 나는 먹다가 배불러서 우선...
480,"[마포]마포 푸라닭 고추마요 블랙알리오 반반에 치즈볼! 블랙치즈볼이랑 고추마요소스. 매장에서 먹었을 때 저 초록이 소스 이름이... 큐스닭강정 치즈머스타드 맛의 매운 버전이었음 ㅋㅋㅋ 역시 확고한 나의 취향,,,, 닭다리로..."
481,"6,7,8,9 개월 아기간식 (과일 / 아보카도 / 멜론 / 치즈볼 / 티딩러스크 / 퓨레 / 당근치즈쌀국수 / 순두부계란찜 / 요플레 / 떡뻥) 떡뻥 #아기과일 #바나나 #아보카도 #멜론 #아기쌀국수 #당근치즈쌀국수 #거버퓨레 #순두부계란찜 #티딩러스크 #고구마티딩러스크 #치즈볼 #단호박치즈볼 #촉감놀이"
482,"언제 먹어도 맛있는 BHC치킨  |  뿌링클 콤보, 골드킹 순살, 치즈볼 다른 여러곳에서 먹어봤지만 가장 맛있었던 #BHC치즈볼 ❤️ 바삭 쫀득한 겉부분과 안에 들어있는 치즈까지 bhc를 뛰어넘는 곳은 아직 보지 못했다! 치즈볼도 역시..."
483,"맘스터치 신상 치즈볼 이제야 먹어보다! 나와서 뜨끈하고 맛있어요ㅠㅠㅠ 안에 치즈가 부드럽고ㅠㅠ 다먹고서 또 먹고싶어지는 맛☺️ 치즈볼은 4개 3,500원 싸이버거 5,600원 총 9,100원 bhc치즈볼은 5개에 5..."
484,굽네 치즈볼 (찹쌀치즈볼) 맛은?? 처음 깨물어 먹었을 때 굽네 치즈볼 맛은 이게 치즈야? 치즈 맞아? 했어요 뭔가가 가득 차있긴 한데.. 치즈가 저렇게 많이 들어있는데!! 누가 봐도 나 치즈야!! 하는 맛이...
485,"[태안여행] 보령 우유창고, 방포 수산시장, 꽃지 해수욕장, 방포 해수욕장, bhc뿌링클 치즈볼 치킨 세트, 폭죽 불꽃놀이 bhc 뿌링클과 치즈볼, 콜라가 같이 있는 세트를 선물로 받은 동생 덕에 이틀 연속... 근데 치즈볼 짱 맛있더라구요? 비에이치씨 뿌링클보다 치즈볼이 맛있어서 치즈볼..."
486,"20200912~20200913_일상 / 먹기만하는 주말 : 인생도넛카페, 엽기떡볶이, bhc 뿌링클, 치즈볼 시켰는데도 치즈가 엄청 많아서 놀랬잖아용 ㅎㅎ 저는 떡볶이엔 떡보다 사리를 더... ᵒ̴̶̷̥́ ·̫ ᵒ̴̶̷̣̥̀ bhc에는 뿌링클, 뿌링클엔 치즈볼, 치즈볼엔 감자튀김!!!..."
487,"굽네 고추바사삭 윙 치킨 전주 포장음식 (치즈볼, 바게트볼) 배달로 저녁 해결^^ 아이들은 맵다고 아예 쳐다도 안 봐요 ^^ 굽네치킨 사이드 메뉴 바게트볼, 치즈볼 먹음직스러운 바게트 안에 크림치즈가 잔뜩^^ 들어가 있는 바게트볼은 한 번씩 꼭 시켜..."
488,사조치즈볼/bhc치즈볼/치즈볼 사조 치즈볼!! 쿠팡에 있길래 한번 사봤어요~ 막 몇개 안남았다고 빨강불... 그랬더니 치즈가 다 터지고 난리네요~ 그치만 코팅이 잘되어있어 치즈를 깔끔하게...
489,"풀무원 모짜렐라 치즈볼 시식 후기, 칼로리 모짜렐라 치즈가 가득 들어있어서 고소하고 맛있었어요. 다른 치킨집에서 먹는 치즈볼보다 맛있으면 맛있었지 부족하지 않은 맛이었고, 무엇보다 비교적 가격이..."
490,BHC 뿌링클과 치즈볼 : 왜 애들이 환장하고 좋아할까? 진한 치즈맛~ 이거랑 마초킹 한마리에 치즈볼도 시켰어요~ 마초킹은 매콤한 고추맛이고 번갈아가며 먹으면 끝도없이 들어가요 다리랑 날개만 있는걸로 시키니...
491,17.5일차 노브랜드버거 NBB시그니처 버거; 인절미 치즈볼; 나의 찐 후기 근데 맛있긴하다 치즈볼은 진짜 생각지도 못하게 맛잇었다ㅋㅋㅋ 오...자극적이야 의외로 달고 안에 있는 치즈도 막 늘어나고... 진짜 쫀맛!! 따끈따끈해서 더...
492,"[bhc치킨 기프티콘 사용] 뿌링클, 치즈볼 칼로리 궁금하시면 컴온~ #BHC치즈볼 은 치즈가 짭쪼롬하기보다는 달달해요~ 그리고 갓 튀겨져서 겉은 바삭하니 넘나리 맛있어요! 뿌링뿌링소스 개발자 칭찬해야돼요! 어떻게 이렇게 맛있는..."
493,"맘스터치 치즈볼 : 달다,,,달아! 맘스터치 치즈볼 3500원(4개) 겉모습은 BHC치즈볼 느낌인데 안은 완전 달라요,,, 크림치즈,,? 슈크림? 느낌이여서 완전 디저트 느낌! BHC랑은 다른 느낌으로..."
494,아이러브 치즈볼/ 풀무원 모짜렐라 치즈볼 럽럽 치즈볼이 너무너무 먹고싶어서 홈플러스 냉장고 앞에서 고민하고 있었다. 도대체... '풀무원 모짜렐라 치즈볼' 와 후기도 찾아보지 않고 아 이거다. 싶었다. 홈플러스...
495,"맘스터치 치즈볼 후기 | 햄치즈휠렛버거 햄치즈휠렛버거 3,900 치즈볼 (4개) 3,500 맘스터치 가격 햄치즈휠렛버거를 오랜만에 먹게되었는데 가격이 예상보다 저렴하다는 생각이 들었어요! 치즈볼과 400원 차이가..."
496,강남역치킨 치향저격 신논현치킨 집에와도 생각나는 치즈볼 치즈볼을 각자 몇개씩 먹으려고 이렇게 욕심을 부렸단 말이냐. 근데 이것도 방금 튀겨서 그런지 치즈가 안에서 녹네 녹아.. 머스터드 소스에 찍어먹어도 맛있고 함께...
497,"굽네치킨 볼케이노 (With. 치즈볼, 삼겹살, 볶음밥) 굽네치킨 볼케이노 순살, 치즈볼 비싸도 너무 맛있는걸 어떡하죠..? 츄릅 만찐두빵 같은 치즈볼 처음에 상자를 딱 열고 주문 잘못한거 아니야?!?!? 싶었다.. 이게 무슨..."
498,"#홍대bhc#치하오#치즈볼#매장에서먹기 콤보시리즈~ 히트메뉴 그 외 사이드디쉬 창가 옆 자리가 인기석이었다 뿌링치즈볼 6,000 한 알(?)에 1,200원 짜리 ㅋㅋㅋ 너무 맛있음 치하오 21,000 완전 깐풍기맛..."
499,냉동치즈볼추천 먹거리상회의 치즈볼 입천장이 데일정도로 맛있다 치즈볼과 가장 어울리는 치즈는 아무래도 모짜렐라치즈인데요. 그런 부분들 하나하나가 먹거리상회의 냉동치즈볼추천을 하게 되는 이유입니다. 이건 한번 드셔보시면...
500,"풀무원 치즈볼 모짜렐라 맛 후기 치즈덕후인 저는 치즈볼 역시 무진장좋아해요. 치킨을 시킬때 치즈볼은 필수! 진짜 치즈볼만 오조오억개 먹을 수 있을만큼 좋아하는데요, 이번에 풀무원 모짜렐라..."
501,"네네치킨 소이 크런치 윙봉, 치즈볼 - 치밥하기 좋은 치킨 달달한 빵 같은 향기가 나요 BHC 치즈볼보다는 기름이 없는 편! 치즈 늘어나는 거 보이세요..? 근데 치즈는 잘 늘어났지만.. 개인적으론 불호.. 아! CGV 치즈볼 좋아했던..."
502,비비큐 광희나는 메이플버터갈릭치킨 - 네고왕 비비큐 메이플치킨 후기 (황금올리브 + 메이플 + 치즈볼) 위의 사진에서 볼 수 있듯이 메이플버터갈릭치킨 1마리 또는 황금올리브치킨 반마리 + 메이플버터갈릭치킨 두조각 + 치즈볼 4개 를 시킬시에만 5천원이 할인되는거였다....
503,치즈가 알차게 들어간 치즈볼~ 쫄깃한 치즈가 꽉차게 들어간 치즈볼... 아이들 간식으로도 좋지만 저도 좋아하는거라 사다놓고 집에서 자주 해먹어요 바삭바삭하게 튀기듯이 케쳡을 콕 찍어서 먹어요...
504,"치즈볼 먹고 타락한 이 시국 헬스 트레이너 그는 요즘 'BJ치즈볼', '#타락한헬스트레이너'란 이름으로 더 많이 불리는데요.... 하지만 치즈볼은 시작에 불과했다. ""저는 뿌XX 치킨을 먹었고요. 치즈볼, XX떡볶이..."
505,BHC 골드킹 콤보 + 치즈볼 기프티콘 주문 후기 (bhc 구의역점) 동글동글한 치즈볼을 한 입 앙 물면 겉은 바삭하면서도 폭신하게 씹히는 튀김 사이로 부드럽고 고소하면서 달콤한 치즈가 쮸욱~~ 입안에 달콤함과 짭쪼름함이...
506,<집에서 밥 먹기> 풀무원 모짜렐라 치즈볼 바삭바삭하게 튀긴 것처럼 나왔다. 엇! 이건 뭐지? 바삭바삭함과 치즈의 진~한 맛이 입안 가~득 느껴진다. 베리 굿!!! 다음에도 이 치즈볼 먹으면 되겠다!!!
507,[리뷰] 푸라닭 고추마요&치즈볼 치즈볼은 말해뭐해ㅠㅠ 달다구리 맛있찌 뭐!!! 이렇게 오늘도 몸무게가 늘어나지만 너무 행복캥 멋쨍이 부로콜리맨 나 오늘도 볼이 빵빵해졌어! 평점...
508,"맘스터치 전북대점 친절하고 맛있네요. 특히 싸이버거, 딥치즈버거, 치즈볼, 어니언치즈감자!! 치즈볼의 치즈는 흘러내릴 수 있으니 주의 요망!! 케이준 양념감자와 어니언 치즈감자!! 케이준 양념감자는 바삭바삭해서 좋고, 어니언 치즈감자는 치즈감자에 향긋한..."
509,자담치킨 맵슐랭치킨 + 치즈볼 + 우유튀김 근데 치즈볼 안에 치즈가 가득차서 그건 좋았다 ㅎㅎ 알찬녀석이었어 후후 bhc 치즈볼이 진짜 맛있다고 했던 것 같은데 다음번엔 뿌링클 + 치즈볼 먹어야지 그리고 그...
510,[집콕리뷰] 페리카나치킨 프라이드 + 치즈볼 + 핫도그 페리 치즈볼은 반죽이 쫀득하면서 고소한 맛이 느껴졌어요. 그리고 안에 쭈~욱 늘어나는 짭짤한 모차렐라치즈가 꽤 가득 차있더라고요. 짭짤하면서 고소하기도 하고 끝...
511,"BHC 뿌링클 콤보 + 치즈볼 + 빨간소떡 / 오랜만의 힐링..⭐ 빨간소떡과 치즈볼도 함께 주문했다 내일 양띵님 방송에서 오랜만에 화려한팀이... 한입, 치즈볼 한입 뿌링클 닭다리 + 양띵 = 미친조합 나는 닭다리를 좋아해서..."
512,"<풀무원>모짜렐라 치즈볼 먹었던 치즈가 쪽~~ 늘어나는 그런 비쥬얼의 치즈볼은 아니었지만~ 출출한 늦은오후~ 잘먹었습니다. 조리하실때, 에이프라이어 조리시 시간이랑 온도 꼭 지켜주세요!..."
513,생일 케이크 대신 요즘 유행인 '치즈볼 케이크' 인증샷 오늘은 요즘 유행하는 '치즈볼 케이크' 소식입니다. 많은 시청 부탁드립니다. 생일 케이크 대신 인기몰이 중인 누구나 좋아하는 '치즈볼' 치즈볼로 케이크를 만들어...
514,치팅데이 처갓집 순살 슈프림치킨 과 치즈볼 후기 치즈볼 먹을만했어요 !!생각보다 치즈도 맛있었구요 총평 슈프림치킨은 원래 먹어본대로 달짝찌근하고 살짝 느끼함이 추가된맛이에요 남편은 너무 새콤달콤 하다고...
515,"비비큐 황금올리브 반반 치킨 치즈볼 단골메뉴 추가요 다양한 치즈볼과 멘보샤, 새우스틱, 닭껍데기, 치즈스틱, 올치팝, 케이준감자, 소떡등 사이드메뉴도 다양하게 준비되어있어 입맛에 맞는 아이로 추가로 주문해도되요. 전..."
516,bhc 뿌링클 치킨 / 치킨 추천 / 뿌링뿌링소스 / 튀긴치킨 / 뿌링클 가격 / 치킨 기프트콘 / 애슐리 치즈볼 / 치즈볼 추천 보기만 해도 맛있겠죠 ㅎㅎ 에어프라이어에 오래 돌렸더니 흘러내리네요 ㅎㅎㅎ 엄청 뜨거웠어요^^;;;;하하하 치즈볼 내려놨더니 바로 치즈가 흘러내리더라구요 저...
517,"초간단 먹방메모 - PIZZA ALVOLO 피자 알볼로 )) 슈크림 치즈스틱 & 치즈볼 갈릭디핑 5개 실화냐...ㅋㅋㅋㅋㅋㅋㅋ 치즈볼과 슈크림 치즈스틱 짜잔!! 우리도 실물 영접!!ㅋㅋㅋ 치즈볼이 흑미맛 한 가지뿐이네ㅜㅠ 핏블리는 단호박, 흑미, 딸기 세..."
518,BBQ(비비큐) 황금올리브 + 황금알 치즈볼 (feat. 세종 나성점) 비비큐 황금올리브 + 황금알 치즈볼 네고왕 시즌 끝나고 먹고싶어서 시킨 비비큐... 치즈볼은... 나는 bhc 뿌링 치즈볼 할래...^^;; 그래도 치즈볼 also is 뭔들...
519,전주 청년다방 신메뉴 [핫크림 치즈볼 떡볶이] 안에 치즈도 그득 - 그렇습니다 볶음밥 사진은 없습니다.. ㅎㅎㅎㅎ 이제 바뀌어서 청년다방 날치알볶음밥은 셀프로 쉐킷 볶아드셔야 해요 ! ✅ 신메뉴 핫크림치즈볼...
520,"[BBQ 비비큐×네고왕] 광희나는메이플버터갈릭+황금올리브반마리+치즈볼 세트 내돈내산 그냥 치즈볼 4개로 왔다 이거 랜덤이라고 적혀있으니 뭐 할말은 없다만 그렇게 다양하게 개발해오신 볼들,, 왜 저희는 치즈볼만 주셨죠,,,?ㅠㅠ 일단..."
