,title
468,부산 기장 맛집 먹고왔지~ 제일 기억에 남는 부산 기장 맛집을 한번 소개해볼까 한다. 우리가 기장을 오게 된... 그리고 내부 한켠에는 부산 기장 맛집 답게 아기의자가 배치되어 있었다. 수가...
469,"가성비있던 일산 맛집 일산 맛집에서 식사를 하고 왔어요. 국내산 한돈을 전문으로 해서 그런지 좔좔... 일산 맛집은 소고기도 200g에 22,000원으로 가성비 좋게 판매하고 있어서 미소반판과..."
470,"통영 무전동 맛집 쌈마루, 쌈밥 맛있는집 무전동 맛집 쌈마루 입니다 무전동 세무서 옆에 있고 바로 옆집도 쌈밥집이라 쌈밥... 무전동 맛집 인정인정 T_T 가성비 오지고 맛 또한 나쁘다 느껴지지 않았어요 그집도..."
471,"이색적인 봉명동 맛집 봉명동 맛집의 갈비찜은 일반적인 조미료 양념 대신, 11가지의 천연약재가 듬뿍... 특색있는 구성과 세삼하고 친절한 맞춤서비스로 유명한 봉명동 맛집은 모든 메뉴들을..."
472,[엘리맛집] 상수 서울돼지구이 + 상수 주무대 오랜만에 등장한 #엘리맛집 #엘슐랭가이드 올리고 싶은데 아직 1번밖에 안간 곳이라_ 일단 엘리맛집으로 시작해봅니다. 급 동생이랑 에비올케가 서울에 와서 저녁...
473,제부도 맛집 / 주말 가족외식 숯향기 육회가 서비스 추석연휴 주말 가족외식하러 육회가 서비스로 나오는 제부도 맛집 숯향기에... 숯향기 / 제부도 맛집 주소 : 경기도 화성시 서신면 당성로 76-1 전화번호 : 031-355-1250
474,부산 광안리 맛집 흑돼지 제주보다 맛있어 얼마 전 부산 광안리 맛집 명승제주생고기 다녀왔습니다. 쫀득한 흑돼지 오겹살은 제주도 보다 더 맛있는 단골 부산 고기집이지요. #부산광안리맛집 #광안리맛집 지하철...
475,가든파이브 맛집 델리커리에서 점심 수요미식회 커리 맛집으로 잘 알려진 델리커리!특색있는 토핑으로 재밌고 맛있는 커리를 즐길 수 있어요. 늦은 점심에 방문했더니 한산하네요. 가든파이브 맛집...
476,제주도 서귀포 맛집일까? 다정이네 김밥 맛은? 솔직후기 했는데 검색을 해보니 다정이네 김밥도 제주도 서귀포 맛집으로 유명하더라고요..?... 역시 많은 분들이 찾는 제주도 서귀포 맛집이라고 알려져서 그런지.... 계속 통화중...
477,강력한 파주 헤이리 맛집 리스트 얼마전 파주 근처에 볼일이 생겨서 갔다가 파주 헤이리 맛집에도 들렀어요.... 앉자마자 차림표를 펼쳐봤는데 파주 헤이리 맛집의 시그니쳐인 게장 이외에도 꽃게탕...
478,"서현동 맛집 모임하기 좋은 하이드파크 다이닝 화덕에 구워 기름기는 쏙 빠져 도우는 담백한!짭짤한 프로슈토와 고소한 루꼴라의 조화는 언제나 굿이에요~ 분위기 좋은 서현동 맛집 하이드파크 다이닝,각종 모임..."
479,철산동 맛집 편리한 대게 배달까지 며칠 전 퇴근을 하고 집근처의 철산동 맛집에 가서 대게를 포장해왔어요!... 철산동 맛집의 입구 바로 옆에는 찜기가 설치되어 있더라고요 눈 앞에서 제품을 선택하고...
480,공주 맛집 곰골식당 공주서 젤 유명한 로컬 맛집은 과연?(내돈내산) 공주 맛집 중에서 제가 좋아하는 맛깔을 가려고 했는데 오늘까지 추석 연휴라서... 걸어서10초컷이였어서..ㅋㅋ 원래 어디 맛집이라고 하면 원주민은 잘 안가는거...
481,무한 감동한 주문진 맛집 모아보기 모처럼 바람 쐬러 주문진에 갔다가 싱싱한 회와 대게를 먹으러 주문진 맛집을... 산지에서 직접 싱싱한 갑각류를 받아오는 주문진 맛집이라 들어가기도 전에 신뢰감이...
482,호감가는 주문진 맛집 모음 지난 주말 가족들과 함께 바다를 보러 갔다가 대게 먹으러 강릉 맛집에 다녀왔어요.... 게다가 주문진 맛집은 그 자리에서 우리가 먹을 대게를 바로 고를 수 있게...
483,"통영 배말칼국수 통영맛집 맛보고 왔어요 통영맛집에서 소박하니 한끼 즐기기! 안녕하세요, 릴리제이입니다 이웃님들 잘... 좋아하는 포스팅, 맛집 리뷰 시작합니다 남편과 늦은 여름휴가로 남해 거제 바다 구경..."
484,압도적인 포천 이동갈비 맛집 지난주에 포천에 거래처 미팅이 있어 들린 김에 포천 이동갈비 맛집도... 포천 이동갈비 맛집은 음식의 특징 때문인지 연령대에 상관 없이 손님이 많았는데요. 띄엄띄엄...
485,위례 맛집 도담찜닭 맵지않고 달달했던 곳 새로운 거주지로 이사오고나서 여기저기 맛집을 찾아다니고 있는데 위례역 예정지... 도담 찜닭은 전국 1위맛집이라고 써있어서 눈에 확들어오더라구요! 그래서...
486,"[논현 맛집] PDR Seoul - 이러다 단골되겠네 [논현 맛집] PDR Seoul - 이러다 단골되겠네 최근 서울세관 사거리에 오픈한 내추럴 와인바 PDR Seoul을 찾았다. 근래 4~5번 방문했는데, 이제야 포스팅을..."
487,"광명 치킨 맛집 - 달봉이치킨 광명역점 (메뉴, 가격) : 세가지맛 치킨과 치즈볼! 광명 치킨 맛집 - 달봉이치킨 광명역점 (메뉴, 가격) : 세가지맛 치킨과 치즈볼! 연휴엔 역시 집에서 뒹굴뒹굴하며 치킨 배달시켜 먹는 게 제맛♡ 광명 치킨 맛집 배달..."
488,특색있는 강화도 맛집 리스트 지난 주 근교로 드라이브를 갔다가 점심식사를 위해 강화도 맛집 을 다녀왔어요.... 강화도 맛집 임을 인정할 수밖에 없었어요. 마음에 드는 자리에 앉아 메뉴판을...
489,연천 전곡 맛집 만 원의 행복 한량석쇠집 그 말을 믿고 처음 왔는데 50년도 넘은 전통이 있는 나름 연천에서는 유명한 맛집이... 오랫동안 맛이 생각나는 진짜 맛집! 우리는 파 불고기 2인분을 주문하고 가게를...
490,인상깊게 남은 안면도 맛집 모음 이곳저곳 둘러보다가 근처에서 게장을 가장 잘 한다는 안면도 맛집에서 수율... 한쪽 벽면으로는 게장 맛집으로 각종 티브이 프로에 나온 이력이 액자로 걸려 있어...
491,"[중국광저우] 중국 광저우에서 회먹기, 가성비 맛집 ‘큰손 왕포차’ / 광저우웬징루 횟집 왔다 :)) #웬징루맛집 이라고 이름 붙여도 될듯, 장소가 넓지 않고 위치도 좀 안쪽에... 빙수로,,ㅎㅎ #중국광저우 #광저우횟집 #광저우 #중국라이프 #꽝저우맛집..."
492,입맛이 살아난 제주 표선 맛집 리스트 지난번 휴가 때 제주도에 놀러 갔다가 현지인의 추천을 받아 제주 표선 맛집에... 하나하나 A급 활어들이라 날쌘 움직임을 보여주던데 제주 표선 맛집은 회 맛이 아주...
493,"여수 카페 맛집 화양면 카페나우 여수 카페 맛집 "" 화양면 "" [ 카페나우 ] 방가방가~~ 안녕하세요 여수 총각 방군이에요^^ 다들 코로나19 방역수칙 잘 지키면서 행복한 추석 명절 보내고 계시나요?^^ 한가위..."
494,망원동 맛집 유부 솔직후기 오늘은 저번부터 엄청 가보고 싶었던 망원동 맛집 유부 후기로 돌아왔다 여기로 할... 망원동 맛집 유부 메뉴판 여기 시그니처 메뉴는 한우육회 유부랑 명란로제...
495,[팔당맛집/동동국수]육칼도 맛나지만 소고기육전이 완전 좋았어요 ㅎㅎ(ft 맛있는녀석들) 여기 소고기육전 맛집 입니다. 진~~심 ㅎㅎㅎㅎ 전 처음 방문한곳이지만 옆 케블들을 서치 해 보니 비빔국수도 많이들 드시더군요 드라이브삼아 지나갈때 한번쯤 방문해...
496,믿고가는 동탄 맛집 리스트 얼마전 친구들과 동탄에서 모임이 있어서 평소에 가려고 찜해뒀던 동탄 맛집에... 검색해보니 동탄 맛집에서는 꽃삼겹이 제일 잘나간다길래 그거 먼저 주문해봤어요....
497,"창원  정우상가 맛집, 정우상가분식, '선비꼬마김밥' 정우상가 맛집 다녀와따 근데 진짜 너무 맛있어서 지난 2주동안 3번 먹고... 정우상가 맛집이래도 전혀전혀 손색없음 미친 중독성이 나를 부르네여 진짜 진짜 제발 꼭..."
498,또 가고 싶은 대구 종로 맛집 BEST3 또 가고 싶은 대구 종로 맛집 BEST3 #대구종로맛집 _ 업체명: 꺼비슈퍼 주소: 대구광역시 중구 중앙대로 79길 16 영업시간: 월~목 18:00-02:00 금~토 18:00~ 03:00 일요일 휴무...
499,제주 함덕 맛집 :: 해물라면이 맛있는 함덕해물라면 오빠네 해물라면 맛집 함덕해물라면오빠네 에 다녀왔어요 함덕 해수욕장에서 서우봉방향... 해물라면 맛집은 공간에 비해 테이블이 많지는 않았는데 오히려 저는 넓게 앉을...
500,화성 동탄 맛집 / 구성 좋은 노조미일식 동탄 맛집을 다녀왔습니다. 다양하고 질 좋은 회와 해산물이 한상 가득 차려지는데... 동탄 맛집의 큰 장점 중에 하나로 보입니다. 음식을 주문하고 나면 먼저 소스류와...
501,믿음직한 속초 대게 맛집 지난 주말 가족들과 드라이브로 강원도에 갔다가 평소 가보고싶던 속초 대게 맛집... 그리고 속초 대게 맛집의 기둥 한켠에는 빨간색 앞치마가 준비되어있었는데요....
502,빼어났던 신림 맛집 리스트 신림 맛집들이 있어서 몇군데 소개해볼까 한다 :) 1. 닭갈비 박재성의... 신림 맛집으로서의 면모를 제대로 보여주는 소개 문구가 들어가 있어서 읽어보는 재미도...
503,출중하던 안산 맛집 모아보기 안산 맛집인듯 했어요. 대부분 중년연예인이 많이 방문해서 그런지 딱... 다음은 안산 맛집에서 처음 맛보는 깻묵을 향해 젓가락질을 해봣는데요. 말캉말캉한 묵 위로...
504,모두가 만족한 안면도 자연휴양림 맛집 모음 얼마 전 가족들과 점심 식사하러 안면도 자연휴양림 맛집에 들렀어요. 살이 꽉 찬... 그 옆에는 안면도 자연휴양림 맛집 대표 메뉴인 게국지에 대한 설명도 쓰여...
505,"광화문 맛집 : 모도우(MODOWOO) 광화문 맛집 모도우(MODOWOO) 광화문 놀러간 김에 모도우에 한우를 먹으러 갔다... ㅎㅎㅎ 광화문 맛집 모도우의 메뉴판! 런치 세트에는 29,000원 짜리도 있다! 이런 건 점심..."
506,놀라웠던 대구 칠곡 맛집 모음 얼마 전 친구들이 거주하는 대구에 갔다가 다녀왔던 대구 칠곡 맛집을 소개드려요.... 착석을 해서는 대구 칠곡 맛집의 메뉴판을 살피는데 여러가지 부위와 식사류가...
507,강릉 경포대 맛집 먹고 반했던 집 경포대 맛집후기를 적고 있답니다. 역시 힐링여행에는 먹방이 빠지면 섭섭하잖아요?? >_< 그래서 강릉의 맑은 바다풍경도 구경하고요. 맛집도 열심히 검색해서 먹으러...
508,이색적이었던 홍대 맛집 리스트 모음 홍대 맛집으로 기억될만한 몇곳을 정리해 소개해보려고 합니다 처음으로 찾은... 홍대 맛집의 음식들이 차례대로 차려져 입이 떡 벌어졌는데요 시작은 맥엔치즈 버거로...
509,"역삼역 맛집 / 더뭉티기 - 떨어져 이색기야!! 지난 주 퇴근하며 찾아 간 역삼역 맛집. 지인들과 시간 약속을 잡고 찾은 곳인데, 주변에서 꽤 알려진 맛집인 듯 싶었다. 주차는 조금 어렵지만 역삼역에서 구룡터널..."
510,꼭 가봐야 할 주문진 맛집 리스트 영진 해변에서 가을 바다를 보면서 사진도 실컷 찍고나서는 주문진 맛집에서 게도... 그렇게 밖에서 한참을 또 다시 사진을 찍다가 드디어 주문진 맛집 안으로...
511,"[제주도중문맛집]천돈가-흑돼지,김치찌개,계란찜(feat한라산) 제주도중문맛집 천돈가 주소 : 제주 서귀포시 색달동 2353-1 연락처 : 064-738-7889... 제주도중문맛집 천돈가 숙소에서 걸어 1분거리 중문에 제주흑돼지 유명식당..."
512,"용호동 w스퀘어 맛집> 타블도트 맛있고 이쁜 레스토랑 <용호동 w스퀘어 맛집 타블도트의 스테이크 앤 파스타> * 용호동 w스퀘어 타블도트... w스퀘어 맛집으로 유명한 타블도트이지만, 부산에선 다소 생소한 이미지..."
513,"대전 오류동 맛집, 정가든 오랜만에 삼겹살 잔뜩 대전 오류동 맛집, 정가든에서 고기 배부르게 잔뜩 먹고온 후기! 아직 대전에 아는 곳보다는 모르는 곳이 많다보니 이곳저곳 맛집 탐방을 자주 하려고 하는 편. 대전..."
514,"동탄맛집 바다향왕코다리 동탄점! 찐맛집이에요 지난 주말 온 가족 점심을 먹으러 #동탄맛집 #바다향왕코다리 동탄점 에 다녀왔어요. 간판에도 동탄맛집 이라고 적혀있었는데요, 역시 간판에도 적어놓을 만큼 맛난..."
515,"0924 여의도IFC 근처 ktb증권 지하 맛집 완차이면가 우육탕면 맛집이 있다는 제보를 받고 본사 직원분들과 함께 다 같이 가봤다. '완차이면가'는 ktb증권 지하에도 있고, 근처 오투타워에도 있고, 농협은행 건물에도 있고....."
516,포항 북구 맛집 :: 줄서서먹는 모밀국수 맛집 반송정국시 포항에 유명한 모밀국수 맛집 반송정국시 여름이 시작되기전 다녀왔는데 이제야... 소문난 맛집 가서 맛있게 먹고 온적이 많지 않은데 여긴 진짜 맛있더라구요!...
517,[구로디지털단지/구디 맛집] 서래전 - 2020.07.07 잘 먹었습니다♡ #구로디지털단지맛집 #구로디지털맛집 #구디맛집 #서래전 #녹두빈대떡 #어리굴젓 #국물떡볶이 #짜치계 #잠시진상 #개신남주의
518,"거제맛집 해산물 삼남매전복  해물뚝배기와 전복밥 뚝배기파스타 거제맛집 해산물 삼남매전복 해물뚝배기와 전봅밥 뚝배기파스타! 다양하게... [모든이의 입맛은 주관적이니, 참고만 해주세요!!] 거제맛집 삼남매 전복 뚝배기..."
519,"석촌호수 맛집 / 신순남부뚜막매운갈비찜 - 찌개야 찜이야?! 점심 때 회사 직원들과 방문했던 어느날의 석촌호수 맛집. 석촌호수쪽 동편에서 걸어오면 보이는 먹자골목 어드메쯤에 위치해 있는데, 점심시간에 직장인들이 꽤..."
520,"어렵게 알게된 강남 맛집 모음집 강남 맛집 중에서 제가 가장 많이 방문하는 곳부터 포스팅해볼게요. 검은색에... 강남 맛집의 간판 메뉴인 편백찜이 나왔어요. 다른 수식어보다 ""근사하다""라는 말이 잘..."
521,[단대오거리 맛집] 성남 세이브존 남다른감자탕 #단대오거리맛집 #남다른감자탕 #성남세이브존 성남 세이브존 지하 2층에... 건강한 기운을 만나는 곳 단대오거리 맛집 남다른감자탕은 성남시 수정구 산성대로 337에...
522,깔끔하고 담백한  대구 다사 맛집 가족들과 함께 대구 다사 맛집 가서 고기먹고왔는데 무척 만족했습니다. 지하철로... 다사 맛집 에서만 누려볼 수 있는 여유로운 공간이 나옵니다. 좌식으로 앉아서 먹을...
523,"파주맛집 - 벙커힐. 아티장베이커스 가능한 맛집을 정말 이잡듯이 뒤졌네요 .. 저희 레이다망에 걸린 브런치 카페 벙커힐. 2층에 주차장이 있어서 1층 외관을 못 찍었는데, 세상에 어마어마합니다. 1층과..."
524,남다른 퀄리티의 경주 맛집 모음 지난번 휴가로 경주에 갔다가 점심식사를 위해 미리 알아둔 경주 맛집 에... 그리고 경주 맛집 은 룸으로 된 단체석도 따로 마련되어 있었다. 규모도 상당히 넓어...
525,[대학로맛집/금문]3대째 운영중이라는 노포 중국집.간짜가 맛난대요(ft 맛있는녀석들) 간짜장 맛집이라던데 깜빡하고 삼선짜장을 주문했.... 근데.... 아주 만족스러웠습니다. 간짜장은 얼매나 맛날지 궁금해 지는 맛 ㅎㅎㅎㅎ 면 먹고 밥까지 비벼...
526,실속있는 영덕 맛집 모음 정말 실속있는 영덕 맛집이더라구요. 괜찮은곳만 골라서 몇군데 소개해볼께요 1.... 강구항 근처에서도 꽤 가성비 좋은 영덕 맛집으로 소문이 나서 관광객들 뿐만 아니라...
527,최고였던 성산일출봉 맛집 리스트 얼마 전 친구와 함께 제주도를 갔다가 배가 고파서 성산일출봉 맛집을... 이번에는 성산일출봉 맛집의 집게발을 손에 착용하고 셀카 삼매경에 빠졌죠. 조개껍질의 발을...
528,전주삼천동맛집 너무 잘먹은 진수곱창 전주삼천동맛집 ::: 진수곱창 친구들과 함깨 하기로 했던 시간을 어디서할까... 전주삼천동맛집 처럼 정갈하길래 사진 담으면서도 뿌듯했지욤 ㅋㅋ 요즘 사진을 너무...
529,또 가고 싶은 동탄 맛집 리스트 얼마 전 친구와 함께 질 좋은 소고기로 기력보충하러 동탄 맛집을 다녀왔어요.... 안쪽에는 동탄 맛집의 셀프바가 자리 잡고 있었는데요. 각종 밑반찬과 쌈재료를...
530,"0919 종로3가/을지로 쌈밥 백반 맛집 수정식당 다오리식당에 이어 두 번째 노포 맛집 투어. 이번엔 종로3가 근처다. '수정식당'은 종로 쌈밥 맛집, 밥집 맛집 같은 키워드로 검색해서 나온 곳이다. 안 그래도..."
531,소개할만한 영종도 맛집 리스트! 영종도 맛집을 방문했어요 퀄리티 좋은 신선한 해산물은 물론 푸짐한 양에 반할... 영종도 맛집이라는게 확 느껴지더라구요 저희도 안내받은 자리에 앉아 메뉴판을 쭉...
532,맘에  쏙든 대전 유성 맛집 유성 맛집을 다녀왔어. 손수 만든 반찬부터 숯불에 구운 갈비의 퀄리티까지... 유성 맛집 사장님이 매일 무쳐주시는지 신선한 맛이 뿜어져 나와서 흡족스러웠다. 매콤한...
533,마곡나루 맛집 푸짐한 해장국과 양무침 성주옥 마곡나루 맛집 푸짐한 해장국과 양무침 성주옥 한참 비가 오락가락 하던 여름이... 해장국 찐으로 잘하던 마곡나루 맛집 소뼈해장국이랑 소고기국밥이랑 둘다 괜찮던데...
534,화려했던 합천 해인사 맛집 얼마전 정말 반가운 군대 후임들을 근처 합천해인사 맛집에서 보았습니다. 직접... 합천 해인사 맛집답게 티비에 출연하지 않았다면 이상하겠죠? 벽면에서 티비...
535,수원 광교 맛집 굴러들어온 복 명품붉은대게 복집인데 대게도 잘내는구나 염도가 높아 물을 좀 마시긴 했지만 입에 넣는 순간순간은 매우 행복했었던 기억이...ㅎ 상현역 인근 먹자거리에 위치한 수원 광교 맛집 굴러들어온 복...
536,쏠쏠했던 을왕리 맛집 리스트 5곳 얼마 전 지인들과 해변 드라이브를 나왔다가 다양한 을왕리 맛집을 다녀왔어요.... 우선 을왕리 맛집에서 직접 담근듯한 깍두기로 손이 향했어요. 양념이 자작한 편이라...
537,성남 제일의 판교 맛집 베스트 5곳 판교 맛집 소개해드려요. 저흰 판교역 2번출구에서 만나 출발했는데 도보 5분정도... 저흰 안내받은 자리에 앉아 판교 맛집의 메뉴판을 살펴보니 대표요리뿐 아니라...
538,"[해운대 맛집] 금수복국 안녕하세요 셀이에오~~ 아직 신혼여행 맛집 포스팅도 조금 남아있었네요 , 후훗... 된 맛집 오브 맛집 ! 껄껄 저는 해운대본점으로 방문했어요. 제가 묵었던 시그니엘..."
539,인천송도맛집..국제경양식..배달의민족 개시 못가고 맛집방문도 못해서 많이 아쉬웠는데 차도 수리를 했고 이것저것 살게 많아서 겸사겸사 송도에 다녀왔습니다. tv '맛대 맛'에서 소개했던 돈까스 맛집 이곳을...
540,요즘 핫하던 가로수길 맛집 리스트 얼마 전 친구와 저녁먹으러 요즘 핫플로 소문난 가로수길 맛집에 다녀왔어요.... 자리를 안내 받은 후 가로수길 맛집의 메뉴판을 천천히 살펴보았는데요. 튀김정식부터...
541,"가성비 최고 거창 피순대 맛집 단골식당 거창 피순대 맛집 단골식당 오늘은 이번 거창여행길에서 경험한, 마지막으로... 거창 피순대 맛집 단골식당... 가격 착하고 푸짐하며 맛까지 좋으니, 추천하지..."
542,너무 맛있는 전주 양념갈비 맛집 - 이버시무한리필 초대박 #전주양념갈비맛집 후기입니다. 제 회사도 이곳과 제휴를 하게 되었는데요.... 이렇게 전주 양념갈비 맛집으로 이버시 무한리필을 소개해드렸는데요. 무한리필...
543,서귀포 카페 : 크로플 맛집 올디벗구디(Oldie But Goodie) 서귀포 카페 크로플 맛집 올디벗구디 (Oldie But Goodie) 고등학교 친구들이 꼭... 크로플 맛집다워라.... 크로플 왜 이렇게 맛있나요.. 인생 첫 크로플이었는데 진짜...
544,양구맛집 양구중앙시장 옥천식당 내장탕 영업시간 : 오전 8시 30분부터 오후 2시까지 저녁장사는 안하시네요 #양구맛집 #양구옥천식당 #양구내장탕 #양구내장국밥 #양구점심 #헤이맨 #헤이맨의맛있는여행
545,여운이 깊었던 서귀포 맛집 LIST 여운이 깊었던 서귀포 맛집 LIST 지난 주에는 제주도에 살고 있는 지인들을 만나러 갔다가 다양한 서귀포 맛집에도 다녀왔는데요. 그 중에서도 우수한 품질의 흑돼지와...
546,파주 헤이리 맛집 힐링했다! 예전에 친구들이랑 파주로 바람쐬러 갔다가 파주 헤이리 맛집 다녀왔었는데요.... 헤이리 맛집은 셀프바가 마련되어 있어서 필요한 반찬들을 충분히 즐길 수 있었어요....
547,"럭셔리했던 파주 맛집 모음 지난 주말, 엄마가 단골로 간다는 파주 맛집에 다녀 왔습니다. 바비큐를 즐길 수... 이렇게 파주 맛집은 골고루 먹을 것들이 많았어요. 무엇보다 만인의 애피타이저라고..."
548,반하고 온 포천 맛집 순위 저번 주에는 부모님을 모시고 현지에 거주하는 친구가 추천해준 포천 맛집에... 백운계곡에서 차로 15분 잠얼마 지나지 않아 포천 맛집의 곁들임 한 상을...
549,"또가고픈 오이도 맛집 #오이도맛집 #오이도횟집 번호 : 031-499-9793 주소 : 경기도 시흥시 오이도로 127 오이도횟집 지난 달에는 가족들과 겨우 시간을 맞춰, 바다도 보고 오이도 맛집에도..."
550,분위기 대박 당산역 맛집 LIST 당산역 맛집이었어요. 도란도란 술 마시기에도 너무 좋고 데이트 코스로도... 당산역 맛집의 테이블의 규모는 각 자리마다 달랐어요. 다소 넓은 쪽에는 누가 이미 예약을...
551,손꼽히는 대천 맛집 모음 며칠 전 친구네 커플이랑 함께 나와 식사를 하기 위해 대천 맛집을 찾아갔다.... 빈틈없이 꽉 찬 양도 양이지만 대천 맛집의 다양한 종류가 있다는 것에 놀랐다. 그렇게...
552,박수가 절로 나오는 부천역 맛집 리스트! 부천역 맛집으로 저만의 존맛탱구리 단골집이에요. 주로 이렇게 깜깜할 때 찾곤... 부천역 맛집은 언제 가도 서비스가 좋아요. 앉으니깐 바로 물과 함께 메뉴판을...
553,곡성 맛집 곡성가든 또 생각나는 스테이크 진짜진짜 오랜만에 광주를 벗어나 스테이크 먹으러 곡성 맛집 곡성가든... 남아서 #곡성맛집 #곡성가든 여기저기 구경 해봤어요. 뭐시고긴디ㅋㅋㅋㅋ 고기 손질...
554,[대림/구로구청 맛집] 라꾸긴 - 2020.07.08 비싼돈주고 망한적이있어서 그랬나 더더더더 맛있게 잘 먹었던거 같아요. #대림맛집 #구로구청맛집 #라꾸긴 #갑오징어회 #아오리이까 #금태구이 #병어 #우니진미
555,뛰어난 협재해수욕장 맛집 베스트 뛰어난 협재해수욕장 맛집 베스트 지난 3박4일 제주여행 중 제대로 된 한끼를 먹기 위해 심사숙고해서 찾은 협재해수욕장 맛집에도 방문했는데요. 푸짐한 구성과 퀄리티...
556,중독이었던 제주도 맛집 리스트 제주도 맛집부터 디저트 맛난 장소를 소개해봅니다. 이번에 방문한 제주도 어가는... 주차장을 통해 제주도 맛집의 내부로 들어가면 엘리베이터가 맞이해주었는데요....
557,부족함 없던 인천 송도 맛집 지난 주말에는 지인과 모임을 위해 송도에 갔다가 이 근처에서 핫하다는 송도 맛집... 더불어서 금액대가 비싸지가 않다 보니 저는 송도 맛집에서 대게와 랍스터가...
558,인정할만한 성산일출봉 맛집 모음 숙소 사장님이 추천해 준 성산일출봉 맛집이 있어서 식사하러 가봤어요. 갈치회와... 성산일출봉 맛집답게 해가 뜨고 있는 멋진 사진도 붙어 있었구요. 한쪽에는 판매...
559,수원 광교 맛집 통통조개구이 오랫만에 즐기는 별미 조개구이 수원 광교 맛집. 상현역 수원 지방 경찰청과 수원 지방 법원 인근에 위치한 통통조개구이. 광교에서 색다른 별미를 찾는다거나 조개구이집을 찾을때 염두해두면...
