,title
745,"울산 맛집 : 정씨함박 울산남구점 울산 맛집 : 정씨함박 울산남구점 강쌤이랑 두번이나 갔던 정씨네함박. 점심으로... ◕ ∀ ◕｡) 급 찾은 맛집인데 꽤 만족했던 정씨함박 , 울산 맛집들아 기다려 내가..."
746,"다낭 치킨 맛집 ""본촌"" 말만해도 그 느낌 휴가스럽습니다~ 다낭치킨 맛집답게 배달도 가능합니다! 배달도 되고런치프로모션시기에 따라서 프로모션도 진행중입니다. 프로모션은 늘..."
747,묵동 맛집 도심속에서 진정한 캠핑을~!! 그런데 문득 떠오른 묵동 맛집 '캠프앤그릴'!! 꽤나 도심속에서 캠핑 분위기를... 더더욱 안심하고 갔던 묵동 맛집 캠프앤그릴~^^ 문을열고 입성하니.. 여전히 널직한...
748,정감가는 포천 이동갈비 맛집 순위 이동갈비 맛집 에서 식사부터 해결했는데요. 지친 몸과 마음을 달래줄만큼... 특히 공기 좋은 야외테이블은 포천 이동갈비 맛집의 명당석 이였거든요~ 실외라서...
749,확실했던 가로수길 맛집 리스트 가로수길 맛집에 찾아갔어요. 산뜻한 분위기에서 맛과 품질이 보장된 이탈리아... 가로수길 맛집이였어요. 또한 타원형 창문을 통해 자연채광이 그대로 비춰지면서...
750,일품이었던 제주 중문 맛집 지난번에 제주도에 갔을 때 방문했던 제주 중문 맛집이 아직도 기억에 남네요.... 제주 중문 맛집은 냉동갈치가 아닌 백퍼센트 제주산 생갈치만을 사용한다고 하는데...
751,"합정역 맛집 행진 급냉삼겹살 후기! (feat,수요미식회) 오늘은 얼마전에 엄청 맛나게 먹고온 합정역 수요미식회 맛집으로 유명한 행진... 합정역 맛집의 고기들이 나왔다 이 날 급냉삼겹살 처음 먹어보는거였는데 약간..."
752,연경지구맛집 : 인사동막창을 집에서 배달로 편안하게 인사동막창 : 연경지구맛집 막창이 너무 먹고 싶은데 코로나19도 그렇고 아이들과 함께 막창집에 가서 막창 구워먹는건 힘들었는데 연경지구맛집 막창 맛있기로 소문난...
753,대전 오류동 맛집 소담회 횟집 오류동 맛집 다녀왔어요.대전 오류동 횟집 소담회 입니다~ 1층엔 다찌 자리와... 오류동 맛집 잘 찾아왔다 싶었죠!! 메뉴판 보세요~대전 오류동 맛집 소담회는숙성회와...
754,일품이었던 미사강변 맛집 육미애 일품이었던 미사강변 맛집 육미애 지난 주말에 미사역 근처에서 가족 외식을... 한쪽에 미사강변 맛집 숙성고가 있었어요. 선별한 고기를 160시간 이상 웻 에이징...
755,특색있던 제주 애월 맛집 리스트 공유 제주 애월 그때그집 얼마 전 친구들과 함께 다녀온 제주 애월 맛집을 정리해 보려고... 제주 흑돼지 맛집 주문을 마치고 얼마 지나지 않아 테이블 위로 잔뜩 펼쳐진...
756,만족스러웠던 제주공항근처 맛집 모음 제주공항근처 맛집에도 방문할 수 있었어요. 퀄리티 높은 갈치요리와 함께... 제주공항근처 맛집이었답니다. 한쪽 벽면에는 막걸리를 종류별로 팔고 있는걸 봤는데...
757,손꼽히는 인계동 맛집 모음 얼마전 동호회 모임이 있었는데 점심식사를 위해 인계동 맛집을 찾아갔어요.... 알고보니 인계동 맛집에서 식사류를 주문하면 즉시 취사를 해서 손님상으로...
758,"화원배달음식 맛집 윤옥연할매떡볶이, 스시향, 행복한마라탕마라식당, 뭄뭄 + 에그드랍, 카페식스, 로지트, 청솔로9 화원맛집 / 화원배달맛집 윤옥연할매떡볶이, 스시향, 행복한마라탕 마라식당, 뭄뭄 에그드랍, 카페식스, 로지트, 청솔로9 안녕하세요 쩡입니다- 사진은 자꾸 모이고..."
759,마음대로 정한 송도 맛집 이번에 가족 외식이 있어서 미리 알아본 송도 맛집을 찾아 갔어요. 예약 후... 송도 맛집이었습니다. 자리를 잡고 주문을 마치자 에피타이저 메뉴부터 나왔는데요. 식전에...
760,경복궁역 맛집 스위스 셰프의 뢰스티 가스트로통 맛있는녀석들 라스위스 맛집 롤란드 히니 셰프의 뢰스티 요리를 맛볼 수 있는 가스트로통 (&라스위스) written by gene_k 서울 도심의 한복판에서 스위스의 분위기를 느낄 수 있는 경복궁역 맛집...
761,흡족했던 미사 맛집  List 지난 주에 지인들과 점심 약속이 있어 SNS에서 핫한 미사 맛집에 방문하게... 그 위에는 드라이플라워로 꾸며 놓아서 한층 더 무드 있는 미사 맛집이 되었답니다. 저희는...
762,"울산 달동 맛집 달구소에서 소고기 즐기기 ** 울산 달동 맛집 달구소 ** 주소 : 울산 남구 신정로 18번길 8 매장전화 : 052-266-3504... 달동 맛집 달구소 메뉴 및 가격 ** 소고기 모듬 삼합 세트(갈비살, 살치살, 차돌박이..."
763,포천 맛집 특별하게! 포천 맛집에 다녀왔어요. 사회적거리두기가 격상된 요즘이라서 점심에 잠깐 만나... 건물 밖에서 알 수 있다싶이 매장이 무척이나 넓고 쾌적한 포천 맛집이었어요....
764,홍성 남당항 맛집 대하 택배 주문해서 먹어요 홍성 남당항 맛집 만중이네회수산 맨날 엄마가 해주신 음식만 먹다가 내가 대하를... 크~ㅋㅋㅋ 다시 봐도 오지네ㅋㅋ #홍성남당항맛집 #홍성남당항대하택배 머리...
765,"[중구/ 신당동/ 약수역] 퓨전 국수, 누들 맛집 '치면식당' 특히 면 종류 사랑하시는 엄마는 친구 모임 여기로 와야겠다고 하시더라. 히히.. 내가 안내한 맛집을 좋아해 주셔서 감개무량했다."
766,제주흑돼지 / 도민맛집 웃뜨르 우리돼지 한 번 잡솨봐연! 추석특집으로다가 정말로 나만 알고 싶던 도민맛집을 오늘 처음으로... 도민맛집 웃뜨르 우리돼지 한 번 잡솨봐연! 빤빰 고고.jpg 작년 봄에도 방문했던 웃뜨르...
767,"완벽했던 속초 현지인 맛집 리스트 지난 주말엔 가족들과 강원도에 계신 할아버지를 뵈러갔다가, 속초 현지인 맛집에... 유명한 프로그램인 MBC 오늘 저녁에도 소개된 적 있는 속초 현지인 맛집이라니, 이..."
768,강릉 맛집 동화가든 원조 짬순 내돈내산 솔직 후기!(대기꿀팁) 강릉 맛집 검색했을때 가장 최상단에 뜨는 강릉 동화가든 이에요 ㅎㅎㅎ 사실 저도 맛집블로거인지라 하도 블로그 광고를 잘 안믿어서 여길 가야되나 말아야되나...
769,대박이었던 영통 맛집 리스트 영통 맛집에 예약하고 다녀왔답니다. 티철판요리라는 상호였고 아주대병원 근처에... 영통 맛집은 셰프님의 퍼포먼스와 불 쇼 등을 바로 눈앞에서 볼 수 있어 인상적인...
770,꼭 가봐야하는 강남역 맛집 며칠 전 친구들과 점심을 먹기 위해 강남역 맛집을 방문했어요. 특색있는 분위기로... 게다가 강남역 맛집은 건물에 엘리베이터가 설치되어 있어 6층까지 편안하게...
771,제주어느뒷골목 레알카레맛집 ‘커리하우스’ 제주맛집 ‘커리하우스’ 서귀포에 카레전문점으로는... 커리하우스 : 064.733.9215 #신슐랭 #제주도맛집...
772,엄선한 평택 맛집 리스트 지난 주말에는 친구들이 살고 있는 평택에 갔다가 다양한 평택 맛집에도... 평택 맛집은 한쪽에 룸도 구비되어 있었지요 단독적인 공간에서 프라이빗한 식사를 할 수...
773,매일 가고 싶은 군산 수송동 맛집 경성일번가 #군산수송동맛집 #경성일번가수송점 안녕하세용 전북데이트입니다! 고기는 언제... 수송동 맛집! 먹고싶은거 맘껏 고르라고 하셨지만 삼겹살이면 충분하기 때문에 바로...
774,특색있는 금촌 맛집 리스트 지난 주 친구들과 파주 롯데아울렛으로 쇼핑하러 갔다가 근처 금촌 맛집도 들렀어.... 이윽고 둘러본 금촌 맛집 홀의 모습은 통창으로 햇빛이 들어와 한층 밝은 분위기가...
775,박수 나오는 잠실 맛집 리스트 잠실역에 일이 있어서 갔다가 잠실 맛집을 찾아다녔어요. 어디가 맛있나~ 친구랑... 누가 잠실 맛집 아니랄까봐 입구에 보니 이런 표창장도 보이더라고요. 이런 걸...
776,퀄리티 좋았던 남해 멸치쌈밥 맛집 모음 지난 주 친구들과 남해로 놀러 갔다가 현지인의 추천을 받아 남해 멸치쌈밥 맛집... 내부를 조금 더 둘러보다 푸르른 산이 한눈에 들어오는 남해 멸치쌈밥 맛집 의...
777,용인 돼지갈비 맛집 맛있는 마늘갈비 다온생갈비 용인 돼지갈비 맛집 맛난 마늘갈비 다온생갈비 경기도 반대편 사는 주민으로써... 있는 맛집이 좀 더 한산하고 안전하게 다가오는것 같아요. 마늘갈비라는 신세계를 맛본...
778,부산 남천동 맛집 맥주랑 찰떡 스프카레 스스키노 부산 남천동 맛집 맥주랑 찰떡 스프카레 스스키노 - 날씨 좋았던 주말 요즘은... 부산 남천동 맛집 스스키노 이미 소문나서 오픈 시간 딱 맞춰가도 나보다 먼저 온...
779,환호했던 서귀포 맛집 지난번 친구들이랑 제주도로 놀러갔다가 전 부터 가보고 싶었던 서귀포 맛집에... ▲밑반찬 조금 있으니 서귀포 맛집의 직원분이 다가와서 세팅을 해주셨다. 드레싱이...
780,백퍼 만족 제주 월정리 맛집 친한 지인들과 함께 다녀온 제주 월정리 맛집 소개합니다. 마실 겸 해안길을... 건물 앞쪽으로 제주 월정리 맛집 주차장이 널직하게 마련되어 있어서 차를 가지고...
781,집에서 끓이는 맛집 알탕 내장탕 ly/2EHr8SV 9월이 시작되자마자 검색해보고 기다렸던 완도맛집 ㅎㅎ 알탕이랑... ly/3ci29SD 완도맛집 재입점하셔서 구매했어요. 고구마줄기랑 전두부 추가하고...
782,부정 할 수 없는 일산 맛집 LIST 얼마 전에는 오랜만에 외식도 할 겸 전부터 가보고 싶었던 일산 맛집에 다녀왔다.... 일산 맛집이었다. 우리는 가장 인기가 좋다는 백제원 양념 갈비 정식 2인으로 주문을...
783,"팡팡 터지는 광주 소곱창 맛집 황소알곱창 팡팡 터지는 광주 소곱창 맛집 황소알곱창 한번 꽂히면 일주일에 두번은 기본... 소곱창 맛집 연예인들도 다녀가고, 방송에서도 빈번하게 출연한 수완지구 황소알곱창에..."
784,"카페상상거제도 카페와 거제도 맛집 추천,  카페 상상과  빅버거 :) 거제도 카페와 거제도 맛집 추천 카페 상상과 빅버거 :) 거제도 여행을 준비하면서... com/accentv/222102588397 거제도 상상속의 집 건물 안에 거제도 맛집 빅버거와 오션뷰..."
785,"명동역 맛집| 사시미코스는 일식성진 명동역 맛집, 일식성진 명동역 맛집 일식성진은 4호선 명동역 10번 출구에서 도보로 3분 거리에 위치해있어 대중교통을 이용해 방문하기에는 상당히 접근성이 좋은데다가..."
786,생각나는 제주 산방산 맛집 BEST5 최근 친구들과 여행 중 제주 산방산 맛집에서 식사를 했었는데요. 선도 높은... 보자마자 술이 빠질 수 없겠다 싶어 소주도 곧장 오더를 넣게 된 제주 산방산 맛집입니다....
787,힐링되는 대전 맛집 리스트 오랜만에 친구네 놀러가서 한우의 퀄리티가 높다는 대전 맛집들을 찾아가... 대전 맛집은 정육식당 스타일로 고기 진열대가 있었어요. 여기서 판매중인 한우의 정확한...
788,대전맛집 파돈까스 최고로 잘하는 대대손손 대손관 리뷰 ㅋㅋㅋㅋㅋ 오늘은 제목처럼 대전맛집 파돈까스 잘하는 식당 대대손손 대손관... 대전 맛집 대손관 맛: 96 파가 수북하게 쌓여있는 비쥬얼 만큼 소스도 고기도 맛이좋아요...
789,[북아현동/추계예대]달곰삼삼 - 돈까스 맛집 인증 게다가 가격도 합리적인 수준이니 돈카츠 맛집으로 꼽을 밖에. <내부> 내부는 한산하다. 내가 저녁시간 전에 가서 그런 것 같기도 하고 코로나 영향도 있을 것 같고...
790,"생각나는 영종도 맛집 리스트 그중 저렴한 가격에 싱싱한 음식을 맛볼 수 있는 영종도 맛집 찾아서 다녀왔는데... 그리고 영종도 맛집은 특이하게 컨디션 이벤트가 진행 중이었어요. 테라, 후레쉬..."
791,입맛 사로잡은 노원 맛집 모음 저번에 서울사는 친구랑 만나 점심식사를 할 겸 노원 맛집에 들러봤습니다. 현지... 노원 맛집 입구로 들어서니 소독정책 메세지가 붙어있는걸 볼 수 있었어요....
792,한화쏘라노 맛집 델피노 cc 에서도 인기! 한화쏘라노 맛집 친구들과 1박2일 여정을 마치고 서울 오기전 늦은 점심으로 먹고 왔어요. 델피노 cc 에서도 식사하기 좋은 맛집 이어서 인기가 좋다고해요. 안녕하세요...
793,"대박이였던 영덕 대게 맛집 리스트 지난 주, 지인들과 함께 영덕 대게를 먹기 위해 나들이겸 영덕 대게 맛집을... ▲대게 고르기 또한 영덕 대게 맛집은 먹을 대게를 직접 고르는 시스템이라 독특했다...."
794,또 가고싶은 춘천 닭갈비 맛집 모음 손님들이 편하게 쉬어갈 수 있게 넉넉하게 마련해놓은 춘천 닭갈비 맛집은 남다른... 벽 쪽에는 춘천 닭갈비 맛집의 인기를 증명하는 연예인들의 사인이 잔뜩 붙어...
795,"거제 맛집 :: 즉석떢볶이 맛집 문어랑 떡볶이 맛집 문어랑의 메뉴 입니다 :) 저희는 문어랑 떡볶이 ₩21,000 문어밥 ₩7,000... 거제 숨은 즉석 떡볶이 맛집 문어랑 떡볶이 좋아하는 분들은 꼭 드셔보세요"
796,인정했던 성산일출봉 맛집 전부터 가보고 싶었던 성산일출봉 맛집에 방문했는데 전문점이라는 타이틀에... 한쪽에 세워진 유아용 의자는 성산일출봉 맛집에서 미리 준비해놓은 것 같았다....
797,거제도 맛집 모음집 알려드릴게요! 3박4일 동안 구경하며 들렸던 거제도 맛집 중에 갑각류 셋트 메뉴가... 거제도 맛집에 들어서면 세련된 느낌의 내부홀이 먼저 눈에 들어왔어요. 반듯하게 놓여진 쇼파로...
798,성수맛집 오팔_대창덮밥 와아.. 성수동 골목골목에 핫한 맛집이 진짜 많이 생기고 있습니다 집근처에 맛집이 많아서 행복 :) 성수 오팔은 지인이 알아내곤 가보고 싶다고 근처 사는 절 꾀어내어...
799,계속 생각나는 포천이동갈비맛집 포천이동갈비맛집을 다녀왔어요 35년 전통의 깊은 손맛을 자랑하는 곳인만큼... 1등 맛집이라고 하니 과연 그 맛이 어떨지 굉장히 기대되더라고요 벽면 한쪽에는...
800,성북구카페 북서울꿈의숲 커피와 빵집 맛집 뮈에 예전 북서울꿈의숲 데이트를 가기 위해 성북구카페를 알아보다 알게된 빵집 맛집... 빵집 맛집 뮈에로 향했다. 북서울꿈의숲과 가까운곳에 위치해 동네주민 뿐만 아니라...
801,":: 몸이 정화됐던 송도 맛집 환절기에 떨어진 기력을 충전하고자 보양식의 신흥 강자라는 송도 맛집에... 자리에 앉기 전 셀프코너도 살짝 봤는데, 나란히 자리한 두 가지 김치통 뒤에 송도 맛집..."
802,"안산소고기맛집 <<아리화>> 부모님 모시고 가기 좋은곳! 안산소고기맛집 <<아리화>> 부모님 모시고 가기 좋은곳! 엄마 생신때 모시고 갔던 안산 소고기 맛집 아리화 :-) 고기도 맛있고, 분위기도 좋아서 리뷰해볼까해요..."
803,소문낼만한 팔당 맛집 리스트 며칠 전 지인들과 다같이 콩음식 전문점으로 유명한 하남 맛집에 방문했어요.... 팔당팔화 수변공원 근처 맛집 곧바로 주차를 마치고 나면 근처에 있던 복돼지 조형물을...
804,제주 구좌 맛집 :: 현지인 추천 흑돼지 맛집 명리동식당 흑돼지 맛집 명리동식당에 다녀왔어요 명리동식당은 제주에만 지점이 3군데나 있는 흑돼지 맛집으로 유명한 곳이구요 저는 구좌직영점으로 다녀왔어요 현지인 추천...
805,행복했던 노원역 맛집 모음 노원으로 지난주에 친구들을 만나러 갔다가 점심식사를 위해 노원역 맛집에... 노원역 맛집의 내부로 들어서자 탁 트인 널직한 홀에 답답한 마음이 뻥 뚫리는 기분이...
806,[목동역/신정동 맛집] 다불러소갈비 - 2020.07.01 #목동맛집 #목동역맛집 #신정동맛집 #다불러소갈비 #소갈비맛집 #생갈비 #이동양념갈비 #목동소갈비 #소갈비된장전골 #물쫄면 #포스팅쓰다셀프염장
807,"[청담동 맛집] 청담동 스테이크, 볼트스테이크하우스 벌써 5번째 방문하는 청담동 맛집 볼트스테이크하우스. 여기는 이미 수요미식회, 맛있는 녀석들에서도 소개된 스테이크 맛집이기도 하다. 이 곳은 브런치 플레이트나..."
808,분당 수내역 맛집 모밀국수 교자만두 맛있는 그집 분당 수내역 맛집 모밀국수 최강 달인 그집에서 일본식 판모밀과 교자만두 written by gene_k 메밀소바 소스로 특허를 받은 메밀국수를 선보이고 있는 분당 수내역 맛집...
809,"소문낼만한 동탄 맛집 동탄 맛집에서 냉면을 먹고 왔어요. 지인 추천으로 가봤는데 갈비찜에 쓰였던... 냉면류의 가격은 9,000원, 갈비탕은 11,000원인 걸 보니 동탄 맛집은 전반적으로 가격대가..."
810,순대 한접시 공짜 거창 현지인 맛집 신미국밥 피순대국밥 거창 현지인 맛집 신미국밥 피순대국밥 오늘은 가성비가 아주 뛰어난 맛집 한곳 소개할까 합니다. 경남 거창군 거창시장 인근에 위치한 신미국밥... 6천원짜리...
811,가 본 속초 중앙시장 맛집 모아모아 중앙시장 맛집 리스트 정리하다 보니 이런 먹방을 선보였던 순간들이 그리워 다시... 중앙시장 맛집 찾아갔더니 사람들이 넘나 많아 좀 여유롭게 앉아 먹고 싶은...
812,"내돈내산 영등포 맛집 리스트! 아이를 낳은 뒤로는 외식은 개뿔 집에서 밥챙겨먹기도 힘든 요즘, 전국 방방곳곳 다니던 맛집투어하던 시절이 까마득해요. 오늘은 정말 오랜만에 맛집 포스팅을..."
813,신라호텔 더라이브러리 피자와 팟타이 맛집! 가 #팟타이 맛집이라고.. 그래서 주문하면서 직원분께 여쭤보니 유머러스하신... 팟타이 맛집이 맞더라구요. 늘 신라호텔의 더라이브러리에서는 빙수나...
814,"[이수 맛집] 원조 부안집 요즘 맛집 포스팅이 조금 소홀했죠 ? (사실 다른 포스팅도 조금 소홀했움.ㅋㅋㅋ)... 이수맛집 원조부안집의 메뉴에요. 고기는 5종류가 준비되어있고 , 쫄면 / 막국수..."
815,압도적인 해운대 맛집 리스트 지난번 친구와 함께 현지인이 강추했던 해운대 맛집을 다녀왔어요~ 프리미엄... 자리에 앉아 가장 인기 좋다는 해운대 맛집 특모듬을 주문해봤어요. 100%제주산 고기가...
816,[고속터미널 맛집 털기]:베이크 치즈타르트 최고! 고속터미널 맛집 1위ㅠㅠ 베이크 타르트는 워낙 유명해서 꼭 먹어보고 싶었는데 이... 고속터미널 맛집으로 추천하는 바입니다 집 오자마자 넘 먹고싶었던...
817,가로수길 크로플 맛집이지만 난 별로였던 새들러하우스 (돈아까운 4만원 ㅜ) ㅋ 그냥 내 블로그에 포스팅하고 잊으련다 #새들러하우스비추 #새들러하우스크로플 #가로수길새들러하우스 #가로수길크로플맛집 #크로플맛집 #새들러하우스솔직후기
818,"부산정관맛집 / 정관막국수 맛집 :: 강원도막국수, 수육과 메밀전병도 함께 즐겨요 :) 대표하는 맛집 중 손님 만족도에서 가장 높은 맛집으로 소개 되었다고해요 이미 정관신도시에는 소문난 막국수&칼국수 맛집이라 기장아울렛이나 추모공원 갔다가..."
819,수지구청역 맛집 김밥 속이 꽉 차있네~ 김밥 맛집 수지구청역 쉐프의숯불김밥 속이 꽉 차있는 식감 좋은 김밥 맛집 written by gene_k 블친분의 포스팅에 여러 번 등장하기에 오래전부터 궁금했던 김밥 맛집이...
820,내가 뽑은 오이도 맛집 모음 지난전에는 가까운데 바람 쐬러 갔다가 점심식사를 하려고 추천받은 오이도 맛집... 조금 기다리니 기본 스끼다시들부터 시작해서 오이도 맛집의 메인 메뉴들까지...
821,손 큰 사장님 덕분에 늘 감동하는 안산 순대국 맛집 안산 순대국 봉궁순대국 경기 안산시 상록구 사사안골길 2-2(사사동 239-20) 전화 031-439-0005 매일 09:00 - 22:00 #안산맛집 #안산순대국맛집 #안산순대국 #봉궁순대국...
822,내가 고른 강화도 맛집 리스트5 내가 고른 강화도 맛집 리스트5 엊그제 가족들과 전부터 가보고 싶었던 강화도 맛집에서 여러 가지 음식을 먹고 왔어요. 주문과 동시에 갓 지어낸 돌솥밥은 물론 수제...
823,가성비 돋보인 속초 대게 맛집 리스트5 지난 주에는 가족들과 속초에 갔다가 미리 알아둔 속초 대게 맛집도 다녀왔는데요.... 속초 대게 맛집의 내부는 전체적으로 밝고 환한데다가 테이블 수도 많아서...
824,기억에 남는 건대 맛집 모음 지난 주말 건대로 쇼핑을 하러 갔다가 점심식사를 위해 건대 맛집 에 찾아갔다.... 입간판 구경을 마치고 건대 맛집 의 내부로 들어서자 탁 트인 넓은 홀에 마음이 뻥...
825,"직접고른 대포항 맛집 리스트 지난 주말, 친구들과 속초에 갔을때 후기가 좋은 대포항 맛집에서 식사를 하기로... 대포항 맛집은 주문이 들어오면 바로 잡아서 손질하고 찜기에 넣고 쪄주시는..."
826,장점가득한 통영 맛집 모음전 지난 주 친구들과 통영에 드라이브 갔을 때 미리 검색해뒀던 통영 맛집들을... 여러 방송매체에서 청결한 통영 맛집으로 소개되었다는 내용이 적혀 있어 한결 안심이...
827,청담동 평양냉면 맛집 맛있는 어복쟁반과 불고기 피양옥(6) #청담동맛집 #청담동술집 #청담동평양냉면맛집 #강남평양냉면 #청담평양냉면 #강남이북음식 #청담이북음식 #피양옥 피양옥 완전 맛있는 이북음식맛집 이번...
828,"삼각지 맛집 - 한우 육사시미 & 구이 '칠프로칠백식당' 삼각지 맛집 '칠프로칠백식당'을 찾아가봤다. 삼각지역 3번 출구 인근, 가격도... 삼각지 맛집. 오픈 시간인 5시에 딱 맞춰서 갔는데, 이미 세 테이블에 손님이 있었다...."
829,성수 맛집 점심 중국집 낙원관 오픈-!!! 성수 맛집 점심 낙원관!!! 성수동 카페거리 근처 소바식덩 토라식당있는 그... ㅎㅎㅎ #성수맛집 #성수점심 성수 카페거리 근처 성수 점심 맛집 - 토라식당 - 소바식당...
830,[구서동 맛집] 구서 칼국수 -반전이 있었던 식사 [구서동 맛집] 구서 칼국수 -반전이 있었던 식사 2년 전쯤 어떤 식당을 가려다 이 칼국수집을 발견하였다. 한눈에 매력이 느껴졌다. 그러나 가야 될 식당이 있으므로...
831,공주 으뜸맛집 시장정육점식당 육회비빔밥 최고~ 으뜸 맛집임을 인정하고 왔던 날입니다. 2013년부터 지금까지 한 번도 빠지지 않고 꾸준하게 으뜸맛집 선정된 것만 봐도 어떤 식당인지 알 수 있겠지요. 매주 일요일은...
832,영덕 물회 맛집_동해안횟집 영덕 물회 맛집_동해안횟집 여름이 끝나는건 좋지만 물회 계절이 끝나가는게... 영덕 여행 중 방문했던 곳으로 영덕 맛집으로도 꽤나 유명한 곳 답게 사람이 엄청 많았던...
833,"압구정로데오맛집 더미트바 분위기술집 추천 앤의 일상블로그, 앤입니다~ 저의 단골집인 압구정로데오맛집♥ <The Meat Bar> 쿨... 요즘 핫한 압구정로데오맛집은 더미트바♥ 오픈 시간에 맞춰가서 사람이 없는 줄..."
834,뛰어났던 제주 중문 흑돼지 맛집 최근 친구들과 삼삼오오 모여 제주 중문 흑돼지 맛집을 찾았습니다. 오랜 시간... 찾아보니 연예인분들도 많이 찾는 제주 중문 흑돼지 맛집이었습니다. 유명인들의...
835,"강릉 주문진 대게 맛집 게네집, 가성비 좋게 먹은 후기 대게 맛집 후기를 남겨볼게요. 남자친구가 나름 열심히 검색을해서 발견한 강릉 현지인 추천 맛집이라고 하네요 ㅋㅋ 제 돈주고 직접 사 먹은 후기이니까 믿고 후기..."
836,맛있는녀석들 고성맛집 동해반점 중화비빔밥 & 중화비빔면 고성 동해반점 맛있는녀석들 고성맛집 요즘 티비를 보다보면 맛있는녀석들... 같아요 #고성맛집 #고성동해반점 #맛있는녀석들고성맛집 #고성중화비빔밥 #중화비빔면...
837,[사하/한식] 아빠 최애 사하맛집 해닮코다리 이것이 사하맛집 해닮코다리의 소자! 맛선생이 서울에서 좋아하는 코다리와는 완전... 여튼 사하맛집 우리아빠 찐사랑집 해닮코다리 다른 분들도 부산 사하 코다리 맛집...
