,title
0,"60계치킨 메뉴 짜파치킨+치즈볼 처음이자 마지막 쫀득 치즈볼 5개 5,000원 배달팁 1,000원으로 총 24,900원을 결제했고 저는 별내점을... 후기를 볼 수 있었는데요 다른 분들이 60계치킨 짜파치킨을 드신걸 보다보니 반반..."
1,"비비큐 네고왕) 광희나는 메이플버터갈릭치킨, 황금올리브, 치즈볼, 닭껍질튀김 JMT 솔직후기 기본 치즈볼은 크림치즈 맛도, 모짜렐라 맛도 다 별로 안 나서 느끼함만 있는 약간은 맹맹한 느낌의 치즈볼이었어요(나머지가 짜서 더 맹맹하게 느꼈을 수도 있어여!)..."
2,에어프라이어 냉동치킨 애슐리 치킨 스윗 콤보&치즈볼 후기 모짜렐라치즈볼도 금방 만들어서 따끈따끈 쪼옥 늘어나는 치즈가 매력적이었는데요. 겉은 바삭하고 속은 쫀득쫀득해서 씹을 때마다 행복감이 가득이었고 사이즈도...
3,bhc치킨 메뉴 뿌링클 치즈볼 다 조앙 늘어나는건 볼 수 없었지만 그래도 마시써요ㅠㅠ 안에 메이플시럽이 들어가서 단짠스럽기까지 하고요 ㅋㅋ 겉은 완~전 바삭함 ㅋㅋㅋ 그 다음은 치즈스틱이에요 이건...
4,아이 간식 하기 좋은 핫도그 치즈볼 츄러스까지! 안에 치즈가 쏙쏙 두 가지 맛을 맛볼 수 있으니 고소한 맛도 특별해지는 것 같아요. 이번에 츄러스와 모짜 치즈볼도 함께 맛보게 되었는데요. 츄러스는 원래 좋아하는...
5,"핫도그와 츄러스, 치즈볼 아이간식으로 핫츄! 식감의 치즈볼을 만날 수 있답니다. 달콤하면서 담백하고 쭉쭉 늘어나는 치즈 때문에 재미나게 먹을 수 있는 아이간식이에요. 이렇게 치즈가 쭉쭉 늘어나는데 싫어할..."
6,이마트 트레이더스 순살치킨 & 크림 치즈볼 구입 솔직후기. 크림치즈볼입니다. 겉면은 바삭하고 안쪽은 쫄깃한 찹쌀로 되어 있어 약간 깨찰빵 같은 느낌의 식감이였습니다. 가운데 들어있는 것은 처음에 치즈인줄 알았는데...
7,"간식으로 준비한 핫도그, 치즈볼, 츄러스 또 생각나! 에어프라이어 요리 : 옥두식품 체다치즈 핫도그, 모짜치즈볼, 츄러스(츄로비) = 핫츄 핫도그 ) 옥두식품 왠지 이름이 정겹지 않나요~~^^ 핫도그 전문 기업으로 옛날 핫도그부터 프리미엄 핫도그까지..."
8,치킨콤보 애슐리 치즈볼과 간장치킨 강추 (홈스토랑 오픈함) 치즈가 장난아니죠? ㅋㅋ 깜놀함 ! 치즈볼답게 쭈욱 늘어나는데 완전 대박쓰!! 시즈닝 가루 뿌려서먹으니까 더 마시씀!!! 이맛에 사람들이 먹는건가봐요 ㅋㅋ 그리고...
9,[마켓컬리] 내돈내산 추천템. 다이어트 식단/요리 기록. 치즈볼. 콩국수. 유튜브에서 핏블리 치즈볼 먹방 보다가 ㅋㅋㅋㅋ 충동적으로 애슐리 모짜렐라 치즈볼을 구매했다. 총 10개 들었다. 뉴욕치즈맛 시즈닝까지 포함. 에어프라이어와...
10,"7살 아들 식판식,유아 간식   - 아이스크림 사랑, 치킨,치즈볼,토마토스파게티, 토마토연어스테이크, 냉소바,카레 등등.. 7살 아들 식판식,유아 간식 - 아이스크림 사랑, 치킨,치즈볼,토마토스파게티... 닭고기 #끼리마카롤 #끼리크림치즈마카롱 수박식빵과 함께 오늘의 아침으로 먹었어요..."
11,"안성 푸라닭 블랙알리오와 고추마요 보틀 /치즈볼 후기 ㅋㅋ 포장주문해오고 치킨먹는동안 굳어진 치즈볼은 전자레인지에 10~15초정도 돌려주면 안에 치즈가 녹아서 맛있게 먹을 수 있어요. 겉이 검은색인데, 뭐가들어간지는..."
12,프라닭 고추 마요와 블랙 치즈볼 치킨덕후의 솔직후기 블랙 치즈볼을 주문해놓고 기다립니다. 배달은 50분정도 걸린듯해요 금액은... 체다치즈와 모짜렐라 치즈가 들어 있습니다~비주얼 때문인지 찹쌀도넛먹는...
13,쿠캣 인기 메뉴 다 먹어봄!! 치즈볼/순살 찜닭/감자탕 볶음밥/오징어 젓갈/띵커바디 도시락 있는 치즈볼 중에 괜찮은 아이가 없어서 걱정 반 기대반으로 일단 시켜보았답니다! 후기 : 정말 기대 이상!!! 겉은 바삭하고 속은 찹쌀 도넛 + 치즈 같은 느낌이에요...
14,남산타워에서 놀아보자! 라이언 치즈볼 어드벤처 방문 남산타워 안에 라이언 치즈볼 어드벤처가 있다고 해서 구경갔습니다. VR체험을 할 수 있는 곳입니다. 라이언 치즈볼 어드벤처 입구 두둥! 입구에서부터 느껴지는...
15,"냉동치킨 추천, 에어프라이어 조리 애슐리 치킨 스윗 콤보 & 치즈볼 그리고 치즈볼도 에어프라이어에 다 돌려 주었는데 봉지 안에 치즈맛 시즈닝가루가 있어요... 근데 울 지겸이는 치즈가루 안 좋아해서 다 뿌려주지는 않았구요..."
16,"에어프라이어 냉동치킨 : 애슐리치킨 스윗콤보 & 치즈볼 먹는동안에 치즈볼을 후다닥 돌려봤어요. 이것도 치킨과 마찬가지로 15분을 돌려서 구워줍니다. 그동안 사이드로 주문하던 그 맛 똑같았고, 치즈 시즈닝이 함께 들어..."
17,"던킨 해피오더,캡슐커피,프레즐,치즈볼,핫도그 이번엔 캡슐 1줄과 핫도그.치즈볼 치즈핫도그1500원 소시지핫도그1500원 치즈볼3300 조합해서 소시지5개+치즈볼1개 10800원ㅡ>5800원 캡슐1팩+소시지5개 10900ㅡ>5900원..."
18,"노브랜드버거메뉴 종류와 인절미 치즈볼 사이드메뉴 중에서도 인절미 치즈볼이 많은 분이 궁금해하는데요, 다른 곳에서도 많이 찾아볼 수 있는 치즈볼에 인절미 가루를 묻혀 고소하면서도 치즈의 맛을 느낄 수..."
19,[리뷰] BHC 뿌링클 치즈볼 세트 뿌링가루가 뿌려진 메뉴들이 점점 늘고 있는데 그 중에서도 꼭 맛봐야 하는 치즈볼입니다! 생각보다 옛날 도넛츠 속에 치즈가 들어간 단순한 메뉴이지만 아주 맛있는...
20,[간편식/간식]파리바게트 바삭 치즈볼 뭔가 치즈가 덜 녹은채로 조리되는 경우가 많아서 불신... 걍 예열은 풀로해서 뜨끈뜨끈하게 해서 넣는게 제일 안전한듯해서 예열 빠방하게 하고 치즈볼을 돌렸다....
21,양남자부엌 아기 간식 고구마 치즈볼 #수제간식 #아기간식 #간단간식 #육아대디 #아빠육아 #육아 #고구마 #치즈볼 #고구마치즈볼 #단호박치즈볼 #수제간식 #아기치즈 #에어프라이 #전자렌지 #간식만들기 안녕하세요...
22,카카오톡 선물하기 : BHC 뿌링클치킨+뿌링소떡+치즈볼(모바일쿠폰 사용하기) 아니 소떡소떡 개발하신분 진짜 너무 기발하시잖아요 ㅎㅎ 역시 BHC 치즈볼이 제일 맛있어요! 치즈도 꽉차있고 아쉬웠던건 시간이 좀 지나고 와서 치즈볼이 다 식어서...
23,"[BBQ치킨 : 메이플버터갈릭 치킨, 황금올리브 치킨, 치즈볼] - 네고왕 할인, 10월 8일까지 어서들 시켜드시게~ 메이플 세트는 메이플버터갈릭 치킨 2조각 황금올리브 치킨 반 마리 치즈볼 4개... 지점마다 다른가 보다 치즈볼 4개 (랜덤) BBQ치킨에서는 총 5종의 치즈볼을..."
24,네네치킨 메뉴 추천 파닭 맛있지! 사이드메뉴는 치즈볼 ♥ 단짠의 조화가 있는 치즈볼이라 이건 따뜻할 때 먹는걸 추천드려볼게요 치즈가 말랑할때 쏙 먹으면 진짜 맛있어요!!! 한 입 먹어보면 진짜 고소한 치즈가 넉넉히...
25,"[내돈내산] BBQ 광희나는 갈릭치킨(메이플버터갈릭치킨) / BBQ 모듬볼(치즈볼) 리뷰 더블치즈볼도 크림치즈가 섞여있기때문에 하위권. 그렇지만 크림치즈볼보다는... 광희나는 갈릭치킨은 마늘빵 맛 치킨을 한 번 경험해 볼 만 하지만, 두 번은 안..."
26,"부어치킨 크리스피와 치즈볼, 연휴에는 치콜?? 저는 치즈를 좋아하긴 하는데 치즈볼에 크림치즈 들어있는 건 좋아하지 않아요. 크림치즈는 빵에 발라먹는 걸로 족한 사람;; 이런 튀김음식에는 주욱~~ 늘어나는 고소한..."
27,"에어프라이어 간식 핫도그,츄러스,치즈볼까지 옥두식품으로 pick!! 대박~~~ 게다가 안에 머금고 있는 치즈는 정말 부드럽네요. 치즈볼이 크기도 작은 게 아니라서 몇 개 먹었는데도 배가 부른 느낌이에요. 츄러스(츄로비) 옥두식품..."
28,맘스터치 메뉴•커플강정콤보에  내슈빌 핫치킨버거(치즈볼 존맛탱) 콤보는 싸이버거 2 버거 변경 안돼요 닭강정 치즈볼4개 콜라2 세트 진짜 괜찮죱... 맛이였던 치즈볼 학자들이 만들어냈다는 비에찌 치즈볼은 영원한 탑클레스 이지만...
29,기프티콘으로 받은 bhc치킨 뿌링클+치즈볼 치즈가 식기 전에 치즈볼부터 념념 뿌링클 요번에 두번째 먹어보는건데 일반적으로 아는 양념치킨도 후라이드도 아닌것이 뭔가 가루묻혀놓은 과자마냥 쟙죠롬하고...
30,애슐리 오리지널 통살 치킨 & 모짜렐라 치즈볼 후기 모짜렐라 치즈볼을 산 가장 큰 이유가 바로 치즈 시즈닝이 들어있다는 것이었어요! 한 봉지에 치즈볼 10알이 들어있었어요. 치즈볼을 겹치지 않게 에어프라이어에...
31,BBQ 치킨은 비비큐 황금올리브랑 치즈볼이 짱인듯 네고왕 이벤트를 볼 때만 해도 심드렁 했었는데 막상 그게 끝나고 보니 또... 지극히 주관적인 견해이나 황금알치즈볼은 꾸덕한 노란색 치즈맛이 느껴지는데 이게...
32,60계 치킨 먹고오다 고추치킨 / 간지치킨 / 치즈볼 뇸뇸 (60계 치킨 당진 기지시점) 메이플 시럽까지 나와서 고소하고 달콤하게 치즈볼을 즐겼습니당 ㅎㅎ 치즈 이즈 낭낭해욤 ! ㅋㅋㅋ 근데 두개 이상은 못먹어! 넘 느끼해 개인적으로 치즈볼은 BHC가 더...
33,"아이간식으로 좋은 치즈볼, 치즈칩 만들기 그 때는 치즈칩이라고 했는데 어느 순간부터 나는 치즈볼이라는 이름으로 이 간식을 부르고 있어 #치즈볼 인지 #치즈칩 인지 정식명칭은 모르겠지만.. 하여간 만들기도..."
34,"부곡동치킨 바른치킨 월피부곡점에서 대새레드치킨 그리고 고구마 치즈볼 고구마 치즈볼 달콤한 고구마 무스와 슈레드 치즈의 조합이라고 기제되어있던데, 엄청 말랑폭신하고 맛있어요 사실 집에 오는 과정에서 살짜쿵 식긴했는데 그럼에도..."
35,"치킨추천 ""애슐리 치킨 스윗 콤보 & 모짜렐라 치즈볼"" 솔직후기 거기에 모짜렐라 뉴욕 치즈맛 시즈닝이 들어 있는 치즈볼까지~ 집에서 완전 제대로 즐길 수 있겠더라구요. 퍽퍽살이 없어요. 봉 그리고 윙으로만 조합이 되어 있구요...."
36,"도시락|백미찰밥,굴전,꼬치전,콘샐러드,햄치즈큐브,치즈볼,낙지젓갈오이무침,된장찌개 백미찰밥, 치어 후리카케(しらすふりかけ), 꼬치전, 낙지젓갈 오이무침, 콘샐러드, 굴전, 치즈볼튀김, 햄치즈 큐브 짜지 않은 비빔낙지젓갈+오이 슝슝 썰어 넣고..."
37,"푸라닭 메뉴추천 블랙알리오&치즈볼 주문[기프티콘 사용방법] \4,900 치즈볼 원래 좋아라 하는데 푸라닭의 블랙치즈볼은 정말 찐맛 이였다. 체다와 모짜렐라 치즈가 듬뿍 들어간 푸라닭 사이드메뉴 블랙치즈볼 역시 단연코..."
38,네고왕 즐기기 BBQX네고왕 황금올리브치킨+치즈볼 7천원 할인 개꿀 #치즈볼 사진만 봐도 군침이 엄청 도네요 #황금올리브치킨 #닭다리 두가지 소스를 다 찍어먹어봤습니다 둘다 맛있더라구요 육즙이 터져나오는 그 느낌 ...크하...
39,200919토.~200921월 시골집에와서 (가지무침.노각무침.짬뽕.팥빙수.파김치.치즈볼.만두.단감.부추전.전갱이구이.삼겹살묵은지제육볶음.호박잎.콩나물무침.) 노각무침 #치즈볼 #만두 #씻은묵은지 #묵은지삼겹살 # 내가 다먹음. 큰엄마가 만든피김치.맛있다.역시 젓갈이 맛있어야함. 가지나물 노각무침. 치즈볼.찰치즈볼인데...
40,냉동치킨 추천! 윙&봉 꿀조합 애슐리 치킨 스윗 콤보+모짜렐라 치즈볼 요즘 치킨배달 시킬때 치즈볼도 필수로 시키는데 여태 먹었던 치즈볼보다 치즈가 아쥬 꽉차있고! 바로 조리해서 뜨끈하게 먹으니 더 꿀맛! 거기에 치즈맛 시즈닝으로...
41,"광명 소하동 인생닭강정, 치즈볼 같습니다 치즈가루에 치즈볼 전체에 뿌려져 있어서 치즈향이 싸악 올라오네요! 겉이 바삭바삭한 찹쌀 도너츠같은 치즈볼입니다~ 100% 자연산 모짜렐라 치즈가 들어있다고..."
42,BHC 골드킹 콤보 후기 단짠단짠 간장치킨 강추(with 치즈볼) 달콤바삭 치즈볼도 잊지마세욥 치즈 보이나여 겉에 빵도 쫄깃하고 안에 치즈가 대박입니다 통통한 닭다리 정말 최애의 치킨이 매주 매주 변하고 있는 요즘 간장치킨은...
43,냉동치킨 :: 애슐리 치킨 스윗 콤보 치즈볼 모짜렐라 치즈 듬뿍~ 치즈볼의 고소한 맛과 체다맛시즈닝으로 약간 짭조름한 맛이 더해져 더욱 맛있게 즐길 수 있습니다 :) 치킨콤보 애슐리 치킨스윗콤보와...
44,"[일산/경기도]살 찌는 소리 여기까지 들리네여..(T_T)(2020.10.04)(BBQ 네고왕 메이플버터갈릭+황금올리브반마리+치즈볼/이마트 닭발+연어/한라토닉/맥주 홈파티) 메이플버터갈릭치킨 2조각+황금올리브치킨 반마리+치즈볼 4개(랜덤) 14,900원... 비비큐치즈볼 #이마트 #무뼈닭발 #연어 #한라토닉 #어쩌라거 #제주펠롱에일 #대한IPA..."
45,또래오래 추천메뉴 갈반핫반 그리고 치즈볼 그리고 삼공주가 너~무 좋아해서 안시키면 서운한 치즈가 듬뿍 들어 있는 치즈볼이에요! 하나의 크기가 이정도인데요 저는 반을 잘라서 속에 든 풍부한 치즈를 쭉 늘려...
46,"네고왕 비비큐 BBQ 바삭한 치킨 치즈볼 조합 굳 이거 보내줘서 이후에 주문했을때 고구마, 치즈, 초코 세트로 주문했다는... 치즈볼 진심 최고에여 ㅠㅠ 저는 충주 교현스타점에서 포장해왔어요. 크으으으... 진심 최공..."
47,"냉동치킨 추천 꿀간장소스에 버무린 애슐리 치킨 스윗 콤보와 치즈볼로 홈스토랑 완성! 애슐리 모짜렐라 치즈볼에는 뉴욕 치즈맛 시즈닝이! 함께 들어있어서, 냉동식품을 조리한 거라고는 믿기지 않을 만큼, 보다 완성도 높은 요리와 플레이팅을 완성할 수..."
48,또래오래 시그니처 메뉴 갈반핫반 치즈볼 세트로 먹어요 동글동글 치즈볼은 사이드 중 최애메뉴! 특히 매콤한 치킨을 주문할땐 단짝처럼 잘 어울려요. 담백하고 고소한 모짜렐라 치즈가 쏙! 쫀득하게 늘어나서 식감도 참...
49,"광명 치킨 맛집 - 달봉이치킨 광명역점 (메뉴, 가격) : 세가지맛 치킨과 치즈볼! 조화롭다 *.* ㅋㅋ 그리고 하나더치즈볼(5000원) ""이게 더 잘 팔리면 오또카지?"" 아니 달봉이치킨 말투가 왜케 기엽찌?!ㅋㅋㅋㅋㅋ 크- 쫄깃쫄깃한 도우 안에 치즈 가득!!..."
50,누들떡볶이 샌디밥 떡볶이 치즈볼 새우볼 함께 즐겨요 누들떡볶이 샌디밥 떡볶이 치즈볼 새우볼 함께 즐겨요 요새 집에서 밥차려먹을... 별미인 치즈새우볼이에요 떡볶이 먹을때 튀김이 빠지면 섭하잖아요 ~ 각 1인분씩...
51,"BBQ 비비큐 레드착착과 황금올리브 블랙페퍼 치킨을 반반세트로 먹어보았다 (핫킹세트, BBQ 치즈볼) 같이 배달온 치즈볼 앞에 쉐킷쉐킷을 써놓은 이유는 양념감자마냥 뭔가 부워서... ㅎㅎㅎ나도 못먹을뻔 치즈볼 5개가 들어있다. 평범한 치즈볼 같았는데, 내 취향은..."
52,"60계 치킨, 간지치킨 & 치즈볼, 맛깔나게 먹어 봅니다. 60계 치킨 야탑점, 오늘 치킨 맛이 쵝오!! ♥ 60계 치킨, 간지치킨 & 치즈볼, 맛깔나게 먹어 봅니다. 60계 치킨 야탑점, 오늘 치킨... 쫀득치즈볼 ▲ 그래 얼른 포장을 열고 먹을 준비를 합니다. 언제나 같은 60계 치킨..."
53,핏블리 헬스장 나이 키 문석기 타락헬창 치즈볼 움짤 위치 주소 먹방 폴댄스 트레이너 유튜버 근황 치즈볼을 먹고 감격하는 영상이 유명세를 타며 'BJ치즈볼'이라는 별명을 얻었고 이후 먹방 영상에는 타락헬창으로 카테고리를 붙이고 있다 . ⭐️ 핏블리...
54,"BBQ 비비큐 황금올리브 반반, 자메이카 통다리,치즈볼 모둠 비비큐 볼 모둠이렇게 세가지 시켰어요! 근데 또 오늘 글 쓰다가 안건데 저기... 헿 영롱한 비비큐 치킨 영상입니닷 ㅎㅎㅎ BBQ 비비큐 치즈 볼 모둠 비비큐 볼은 치즈랑..."
55,"네고왕 비비큐, 광희나는 메이플 버터갈릭+황금올리브치킨+치즈볼  주문 후기  tip !! 비비큐 신메뉴인, 광희나는 메이플버터갈릭치킨 2조각도 맛 볼 수 있고... 왜 치즈만 주냐긔요 그래도 치즈볼은 진짜 비비큐 맛있어욬 까슬, 달콤, 짭쫄, 고소..."
56,"쏘이마루 #비건푸드- 콩고기,치즈볼,커틀렛 (가족건강센터) 육류가 안들어간 식물성 식품인데 너무 맛있다 케찹에 찍어먹으니 꿀맛 남편이 감자를 좋아해서 감자 치즈볼도 먹어봄 (독일산 모짜렐라치즈+국산감자) 감자치즈볼은..."
57,[BBQ] 네고왕 메이플 2개 +황금올리브+치즈볼 4개 왜냐면 bhc는 약간 짭짤한 맛도 가미되어 있는데 (치즈가 좀 짭짤한 편) bbq는 너무 달다. 연유치즈볼 느낌 단거 좋아하시는 분들은 bbq 치즈볼 더 좋아할 듯! 그리고...
58,또래오래 매운맛 좋아한다면 단짠윙봉 치즈볼이죠! 특히 저는 깊고 진한 치즈의 맛이 일품인 또래오래 치즈볼 부터 손이 가더라고요! 그리고 치킨과 찰떡인 무가 들어 있어요^^ 아이들이 사이드메뉴 후렌치후라이와...
59,[주말]야식:)bhc 뿌링클 콤보+치즈볼 역시 최고닭!! 뭘 사도 다 먹는 거ㄷㄷㄷ #확찐자 주말 야식으로 주문한 bhc 뿌링클과 치즈볼이에요~ #bhc #bhc뿌링클 #bhc콤보 #bhc치즈볼 배달 음식 주문하기 전에 늘 하는 대화 배는...
60,네고왕 광희 X BBQ 황금올리브 치킨 + 치즈볼 뒤늦은 후기! 가까워서 다행..ㅋㅋㅋㅋ 픽업 후 오픈한 황금올리브치킨+치즈볼. 치즈볼 1개만 넣어주는줄 알았는데 되게 큰 치즈볼 2개가 들어가있었다 ㅋㅋㅋ 약간 닭의 알 느낌...
61,맘스터치는 치즈볼입니다.. 치즈볼이에요!! / 맘스터치 메뉴 추천 바삭크림치즈볼 바!삭!크림!치즈!볼!! 열개 시켜서 이것만 먹고싶다. 커피 대신 치즈볼 아 물론 최근에 이런 뉴스가 떴다. 선택은 직접 하시는걸로. 맛있는거 개발해놓고...
62,"bhc 뿌링클 치킨 치즈볼 뿌링뿌링소스 맛있다 치즈뿌린 치킨팝이랑 시즈닝 진짜 비슷하네 하지만 과자랑 치킨이랑은 천지차이,, 뿌링클 단짝 치즈볼 bhc는 사이드가 굉장히 많아서 사이드만 사먹는 사람들도..."
63,"핏블리 문석기 헬스장 위치 bj치즈볼 올해 나이는? 그는 ""제가 먹어보겠습니다""라고 말하며 코로나19로 헬스장이 닫아, 치즈볼 타락먹방으로 bj치즈볼로 엄청난 인기를 끌고 있습니다. 이혜성은 핏블리에게 빵을 권했고..."
64,자담치킨 메뉴 후라이드 윙봉&치즈볼 찰떡궁합 치즈볼도 같이 주문했어요 자담치킨은 콜라가 아니라 사이다를 보내주시네요 ㅋㅋ... 윙봉이랑 치즈볼이에요 딱 봐도 되게 바삭바삭해 보이죠? 자담 순살치킨은 국내산...
65,골드킹 콤보_with 치즈볼/bhc치킨 왔어요 제 치킨 치즈볼5개 5천원 한개에 천원 치즈진짜맛있다 또먹고싶다 진짜 치즈볼 한 30개는 그냥 때려넣을듯 이게 골드킹이구나 간장맛이에요 근데 맛있네여?...
66,애슐리 치즈볼 에어프라이어 제가 구매한 애슐리 모짜렐라 치즈볼은 총 300g으로 10개의 치즈볼이 들어있는데요. 뉴욕치즈맛 시즈닝도 들어있습니다. 시즈닝은 체디치즈와 파마산치즈...
67,BHC 치킨 뿌링클 치즈볼 콜라 셋트 BHC치킨 뿌링클+치즈볼+콜라 셋트에요. 덕분에 잘 먹게 된 치킨입니다. 오랜만에... 치즈가루가 왠지 살짝 거슬리는.. 뭔가 아이들 취향의 맛 같은 느낌. 그래도 잘 먹긴...
68,풀무원 모짜렐라 치즈볼 에어프라이어 간식 세상 간단한 에어프라이어 간식 ♡ 막 구워진 치즈볼은 안쪽 치즈가 매우 뜨겁기 때문에 특히나 아이들 간식으로 주실 때는 잘 식혀서 주셔야 해요. 반으로 잘라보면...
69,푸라닭 블랙알리오 (치즈볼은 꼭 시키세요) 푸라닭 내돈내산 리뷰 블랙알리오&치즈볼 ㅋㅋㅋㅋ진짜 푸라닭 퀄리티 무엇 이건... 블랙치즈볼 !!! 갠적으로 치킨보다 이 치즈볼 때문에 자주 시켜먹을듯해요...ㅋㅋ...
70,한신포차 치즈볼 나도 먹어봄 언넝 벌어서 효도해야지 하는 요즘 이번에 한신포차 닭발 치즈볼도 있다해 먹어봄 한신포차 치즈볼 #한신포차닭발 #한신포차치즈볼 한상 세상 푸짐 ㅎ빵은 언니가 따로...
71,치즈볼에 푹 빠진 코덕의 일상 (발표) 저 치즈볼 처음 먹어봤거든요. 네고왕에서 광희씨가 맛있게 먹어서 궁금하긴 했는데 우와!!! 이건 진짜 내서타일 쫀득쫀득 저 BBQ치킨 별로 안좋아하는데 치즈볼 때문에...
72,"푸라닭 치킨 블랙마요+사이드(치즈볼,블랙치즈케이크, 블랙크로칸슈) 냠냠 치즈볼은 맛있었답니다. 약간은 느끼한 느낌도 들지만 사람들이 추천하는 이유가 있는 맛이랍니다. 블랙 치즈케이크와 크로칸슈.... 음..... 돈 아까워요. 치즈케이크는..."
73,"자담치킨 맵슐랭순살 & 후라이드 순살 & 슈가 치즈볼 감튀만 먹고 남겼다 ㅋㅋㅋㅋ 매운 맛을 중화시킬 치즈볼 난 치즈 싫어해서 안먹었는데, 찹쌀 도너츠 같았다고 했다 쏘쏘인듯? #내돈내산"
74,[서울 동대문구] 장안동 교촌치킨 배달 : 레허순살 반반+치즈볼 고르곤 치즈볼은 음.. 고르곤 치즈가 들어갔다더니 확실히 치즈 맛이 좀 달랐다 단짠단짠보단 좀 더 치즈에서 약간의 꿀맛이 나는 그런...엄....애매한 맛... BHC는 딱 입에...
75,풀무원 모짜렐라 치즈볼 아이들이 좋아하는 간식 풀무원 모짜렐라 치즈볼 안녕하세요^^ 치킨 시켜 먹을때 항상 꼭!! 주문 하는 치즈볼 ㅎㅎ 저희 딸아이가 정말 좋아하는데요 치즈볼 주문 하면 5개가 오는데 그럼 그...
76,"파리바게뜨 치즈볼 맛있어!!ㅎ 파리바게뜨 치즈볼!!ㅎㅎ 그리고 같이 사온 치즈빵, 정확한 이름은 모르겠네요!! 이런 자극적인 빵이 더 맛있는 ㅋㅋㅋㅋ 고기 좋아하는 한국인!!ㅋㅋ 이런 얇으리 한..."
77,갓뚜기/찹쌀미니도나스/치즈볼로는 별로../갓성비 같아서 치즈랑 안어울림 결론: 치즈볼이랑 싱크률 0% 레귤러가 훨 맛남 조리법 따라서 반죽하고 너무너무 쉬움 튀기다보면 조그맣던 반죽이 엄청나게 커진다 ㅋㅋ 6배는...
78,"애슐리 모짜렐라 치즈볼 후기 가끔 치즈 듬뿍 들어있는 #치즈볼 먹고 싶을 때가 있어서요 고럴때 간식으로... 안에 치즈는 좀 넉넉히 들었으면 좋겠는데, 아무래도 볼 사이즈가 작다보니 .. 그렇게 막..."
79,"60계치킨 울산강동점 - 짜파치킨 치즈볼 후기 맘스터치의 치즈볼과 사뭇 달랐다. 타 제품보다 훨씬 찹쌀도너츠에 가깝다. 외피는 매우 쫄깃한 재질이고, 내부는 크림치즈에 비해 모짜렐라 치즈의 비율이 좀 높은 듯..."
80,"지옥에서 온 것 같은 비주얼의 60계치킨 짜파치킨(feat.치즈볼, 간지치킨) 요즘 BJ치즈볼님 덕에 전성기(?)를 맞이한 치즈볼 그리고 60계 치킨의 간판이자 스테디셀러 간지치킨. 저는 간지치킨이 훨 맛있어요. 왜인지 모르겠는데ㅡ같이 온 삶은..."
81,애슐리 치즈볼~~ 치즈볼 10개하고 뉴욕치즈맛 시즈닝 10g이 같이 들어 있었어요. 기름에 튀기려다 귀찮아서 5개는 기름 바르고 5개는 그냥 구워봤어요. 배송 받은 후 설명서대로 180도...
82,"에어프라이어 냉동치킨, 애슐리 치킨 스윗 콤보& 모짜렐라 치즈볼 치즈볼 위에 치즈 시즈닝 가루를 솔솔 뿌려서 먹어주었어요 반으로 갈라보니 치즈 늘어나는거 보이시죠!! 치즈가 굳을 수 있으니 일단 치즈볼부터 먹어보겠습니다ㅋ..."
83,덕천맛집:덕천동 청년다방 핫크림 치즈볼 떡볶이 가위로 십자모양을 내어 주면 안에 가득찬 치즈가 까꿍하고 나옵니다 닭튀김도 들어 있어서 치즈볼에 들어있는 치즈에 찍어서 먹었는데 매콤 고소한게 너무 맛있네요...
84,"자담치킨, 맵슐랭 후라이드 & 슈가 치즈볼 치킨 살을 뻑뻑살두 지짜 부드럽구 맛있긴했다 ~ 슈가 치즈볼 , 기본 치즈볼 위에 설탕 솔솔 ~ 치즈볼두 연유 찍먹이가 더 맛있는 둣 ! 나쁘진 않았지만 비교군들..."
