,title
0,압도적인 강화도 맛집 리스트 지난번 가족들과 나들이를 떠났다가 미리 알아둔 강화도 맛집을 방문했어요... 강화도 맛집만의 비결도 읽어볼 수 있었어요 일반 인공사료가 아닌 새우나 치어등을...
1,"후회 없는 제주 연동 맛집 연동 맛집을 다녀왔어요. 가격대에 비해서 퀄리티가 상당했던 곳이라 소개해... 제주 연동 맛집은 다른 소고기집과 다르게 소금뿐만 아니라 또띠아, 창란젓 크림치즈..."
2,제주도 애월 맛집 다다의 작은 공간 #노키즈존 제주도 애월 맛집 다다의 작은 공간 #노키즈존 유럽 아닙니다! 제주도 맞습니다! 제주도 애월 맛집 다다의 작은 공간에 다녀왔어요 이름처럼 작지만 매력이 뿜뿜하는...
3,취향 저격한 산방산 맛집 산방산 맛집도 다녀왔어요. 간만에 제대로 힐링을 하면서 퀄리티가 좋았던... 내부 모습은 엄청 깨끗했던 산방산 맛집이었는데요. 주방 쪽에는청정 지역의 농장에서...
4,감탄했던 일산 맛집 며칠 전 친구들과 점심 약속이 있어 가성비 좋다는 일산 맛집을 찾아갔어요... 일산 맛집은 반찬의 가짓수도 다양한데다가 전부 신선하고 깨끗하게 관리하고 계셔서 맘...
5,"부담없는 신림 맛집 리스트 얼마 전, 지인과 함께 저녁식사를 하러 신림 맛집에 방문했습니다. 퀄리티 뛰어난... 신림 맛집에선 듬뿍 내어주셔서 고마웠어요~ 특유의 마늘향이 진하게 난다는 점도..."
6,부산 연산동 맛집 부채살 스테이크! 이번 주말에는 남자친구와 둘이서 부산 연산동 맛집에서 데이트를 했어요.... 남자친구와 다녀온 부산 연산동 맛집은 그린애플이라는 곳인데요. 철판요리가 아주 유명한...
7,가성비 좋은 송도 맛집 리스트 이번 명절에 가족들과 킹크랩을 먹기 위해 송도 맛집을 방문했어요. 킹크랩... 실내 한쪽에는 송도 맛집 수조가 길쭉하게 나열되어 있었어요. 자세히 살펴보니 녹조가...
8,다들 만족했던 여수 맛집 LIST 여수 맛집에 방문하고 왔습니다 :D 하모샤브샤브와 활어회 덕에 맛은 물론이오... 흔치 않은 매실장아찌는 여수 맛집의 엄청난 메리트였어요. 말캉하면서도 무르지는...
9,"무한으로 즐기는 속초 대게 맛집 리스트 얼마 전 휴일을 맞아 가족들과 강원도 여행 갔다가 식사하러 속초 대게 맛집에... 보는 앞에서 게를 찌고 손질해주니까, 신뢰감도 높아지는 속초 대게 맛집이었죠...."
10,풍성했던 대부도 맛집 리스트 지난 주 근교로 드라이브를 갔다가 점심식사를 위해 미리 알아둔 대부도 맛집 에... 가족 단위로도 많이 방문하는 대부도 맛집 답게 한쪽에는 유아용의자도 넉넉히...
11,월등했던 경주 맛집 LIST 얼마 전 친구들이랑 떠난 여행에서 기억에 남았던 경주 맛집에 다녀왔어요. 정갈한... 유난히 손이 많이 가는 한식을 경주 맛집에서는 가성비 훌륭한 가격에 제공된다고...
12,믿음직스러운 포천이동갈비맛집 지난 번 언니와 몸보신하자며 미리 찜해뒀던 포천이동갈비맛집을 다녀왔었어요ㅎ... 전국 맛집 탑1위로 당당하게 선정됐다고 하니 맛에 대한 호기심이 한껏 상승했어요...
13,완벽했던 남포동 맛집 모음 남포동 맛집을 찾아갔어요. 20년 호텔 경력이 있는 셰프님이 조리해 주는 곳으로... 이어서 애피타이저와 남포동 맛집의 기본 반찬들이 테이블 위에 깔끔하게...
14,인상적이었던 제주 한림 맛집 모음 맛집도 다녀왔는데요. 퀄리티 좋은 재료를 사용하고 젊은 부부 사장님이 반갑게 맞이해주셔서 기분좋게 식사하고 온 곳이라 소개해드립니다. 1. 협재 근처 흑돼지 맛집...
15,고터 초밥 맛집 / 회전초밥 스시마이우 고터 초밥 맛집 / 회전초밥 스시마이우 어릴 때 안먹었던 음식들이 나이가 들면서... 고터 초밥 맛집 스시마이우 본점 작은 가게이지만 사람들로 꽉 차있고 자리가 없을...
16,끌리는 춘천 닭갈비 맛집 모음 닭갈비 맛집을 찾아갔는데 퀄리티도 좋으면서 분위기도 괜찮아서 만족스러웠던... 닭갈비 맛집의 양파소스도 입에 잘 맞았어요~ 부어 먹는 소스는 위생적으로 매일...
17,대표적인 강릉 맛집 리스트 강릉 맛집 신대게나라 저희가 다녀온 신대게나라는 영진해변에서 차를 타고... 강릉 맛집은 선주가 직접 운영하는 곳이라 살수율 넘치는 대게를 팔고 있어 제대로...
18,으뜸이었던 함덕해수욕장 맛집 모음 함덕해수욕장 맛집에 다녀왔어요. 신선한 해산물의 맛을 제대로 볼 수 있으면서도... 자리에 앉아 함덕해수욕장 맛집의 메뉴판을 살펴보고는 다양하게 맛보기 위해 문어...
19,대구 삼덕동 맛집 한식과 양식의 퓨전 비스트로 이곳이 대구 삼덕동 맛집으로 이미 알만한 사람들은 아는 곳이라고 하더라고요.... 대구 삼덕동 맛집은 한식을 베이스로 한 양식 퓨전요리라고 생각하시면 편할 것...
20,믿고 먹는 포천이동갈비맛집 리스트 간만에 고기 생각이 나서 친구와 수제갈비로 유명한 포천이동갈비맛집을... 그 옆에는 포천이동갈비맛집이 사용하는 극세석쇠의 장점에 대한 설명문도 붙어있는...
21,모두에게 딱이던 강릉 맛집 BEST 지난번에 동해로 놀러 갔을 때 마음에 쏙 드는 강릉 맛집을 발견해 다녀왔어요 :D... 강릉 맛집이었어요. 매장 한쪽에는 셀프바가 마련되어 있기도 했는데요. 이곳에서...
22,원조 강릉 맛집 모음 얼마 전 강원도 여행 중에 20년 전통의 수제 생갈비를 맛볼 수 있는 강릉 맛집엘... 강릉 맛집 이었습니다. 주차는 갓길이나 인근 공터를 이용 할 수 있었어요. 영업시간은...
23,30년 전통의 신도림 맛집 얼마 전 회사 동료들과 저녁을 먹기 위해 미리 검색해 두었던 신도림 맛집에... 30년 전통의 신도림 맛집답게 여러 연예인들이 방문한 것을 알 수 있었습니다. 본격적으로...
24,기억에 남는 동탄 맛집 모음 지난 번 지인들과 동탄으로 놀러 갔다가 미리 알아두었던 동탄 맛집에 찾아갔어요... 동탄 맛집 의 후한 인심도 엿볼 수 있었지요 마음에 드는 자리에 앉아 벽에 걸린...
25,감탄의 연속 양산 맛집 리스트 양산 맛집도 들르고 왔습니다. 엄청난 비주얼과 구성에 잘 찾아갔구나 싶은... 먼저 갖가지 반찬과 함께 양산 맛집 기본 서비스인 시락국이 나왔어요. 시락국은 시래기...
26,다들 가봐야하는 강릉 맛집 목록 소개 얼마 전 친구들이랑 강원도로 일 보러 떠났다가 도민이 알려 준 강릉 맛집에... 특히 강릉 맛집에서는 금어기를 제외하고는 홍게를 무한으로 즐길 수 있다고 하더라고요....
27,행주산성 맛집 원조국수집 행주산성 맛집 원조국수집 추석 연휴가 끝나기가 무섭게 가을을 제대로 느끼게... 행주산성 맛집 원조국수집 이랍니다. 자전거 라인딩 하시는 분들 모르는 분 없다 할...
28,비주얼 끝판 부산 기장 맛집 리스트 기장 맛집 해담이라는 곳에 다녀 왔어요~ 1. 해담 주소 : 부산광역시 기장군 기장읍... 기장 맛집은 오션뷰가 좋기로 유명하기 때문에 저희는 바다가 보이는 곳에 자리를...
29,염창동 맛집 :: 곱도리탕 배달 되는 곱창이랑 쭈꾸미랑 ♪ 염창동 맛집 발견하고 바로 주문했다. 옛적에 소금 창고였기에 이름지어진... 소소자매도 좋아해서 일부러 염창동 맛집 사이드메뉴 에서 추가주문 한것인데~ 녀석들이...
30,색달랐던 춘천 닭갈비 맛집 리스트 닭갈비 맛집 샘밭 저희가 찿은 샘밭숯불닭갈비는 청평사 인근에 위치한 곳으로... 닭갈비 맛집은 이미 입소문이 난 곳이라 식사를 하고 있는 손님들을 볼 수 있었는데요...
31,"동래역 맛집 푸짐한 연어샐러드 동래역 맛집 가련한부엌 동래점. 친구와 함께 갔는데 새콤달콤 맛난 수제 과일 막걸리에 반하고, 푸짐하고 맛있는 연어샐러드에 두번 반했던 맛집이었네요. 가격도 딱..."
32,제대로 숙성된 서귀포 흑돼지 맛집 흑돼지 맛집에 다녀왔어요. 고소하고 담백한 숙성된 고기만을 사용하고 텃밭에서... 그리고 서귀포 흑돼지 맛집에서는 sns에 태그를 걸고 상호와 함께 올리면 음료수...
33,마음에 들었던 여수 맛집 리스트 얼마 전 바다 구경하러 여수로 떠났다가 싱싱한 간장게장이 먹고 싶어 여수 맛집을... 특별히 여수 맛집에서 평일에만 나오는 누룽지 한 사발도 누릴 수 있어 큰...
34,깊이가 달랐던 남양주 맛집 베스트5 얼마 전 놀라 나왔다가 남양주 맛집 몇 군데를 탐방했는데요. 그 중에서 가장 실속... 화초와 화분 아래 실제 살아있는 잉어 두 마리가 헤엄쳐 남양주 맛집의 실내...
35,꼭 가봐야 할 김포 맛집 제주도 여행이 매우 가고 싶은 요즘 흑돼지가 맛있다고 소문난 김포 맛집 후기예요... 김포 맛집이에요 제주 흑돼지 집에 왔으니 메인 메뉴로 오겹살을 1인분과 여기 오면...
36,효섬마을 초가집. 제주절물휴양림 맛집. 제주여행 제주절물휴양림에서 5분`10분 정도 거리에 있는 맛집... 저도 검색해서 찾은 곳이라.. 후기는 좋던데.. 맛은 솔직히 so so!!.... 일단 먹어보는 걸로..... 아점겸.... 들어간...
37,수준이 남다른 창원 맛집 리스트 지난 휴일 가족들과 점심을 먹으러 창원 맛집에 다녀왔어요. 친구들 사이에서... 창원 맛집에 입구로 들어가니 깔끔하게 정리된 메뉴판이 보였어요. 그중에서 주력...
38,정성이 느껴진 속초 대게 맛집 리스트 저번주에 친구들과 함께 신선한 대게요리로 유명하다는 속초 대게 맛집을 향해... 속초 대게 맛집 내부는 전체적으로 새하얀 인테리어라 쾌적한 편이었어요. 특히 넓고...
39,"특출났던 영덕대게맛집 순위 지난 주말에는 가족과 함께 떠난 여행 중 우연히 알게 된 영덕대게맛집에... "" 다채로운 해산물 한상 "" 원하는 자리에 착석 후, 영덕대게맛집의 메인인 대게 2마리와..."
40,후회 없는 성산일출봉 맛집 소개 오랜만에 친구들과 제주도로 놀러 갔다가 요즘 SNS에서 핫하다는 성산일출봉 맛집... 성산일출봉 맛집 영업시간 먼저 마주쳤어요~ 오전 10시부터 밤 12시까지 넉넉하게...
41,고기리막국수 - 질리지 않는 들기름막국수 찐맛집 고기리막국수 자꾸 먹어도 질리지 않는 들기름막국수 찐맛집 by. Liz 또몽이... [ 이전 방문기 ] 무조건 줄서서 먹어야 하는 워낙 웨이팅 심한 맛집이라 이 시국에 선뜻...
42,"김포고기맛집 :: 한우 살살녹는 소짝 ☆ 김포고기맛집 이었고, 요즘 꼬기 맛에 제대로 심취한 딸래미도 대찬성했다.... 김포고기맛집 이라는 칭찬을 아끼지 않으며~ ^^ 이번엔 소 갈비뼈 사이의 살코기를 분리한..."
43,달서구 용산동 맛집 촉촉하고 부드러운 돼지구이 이번 주말에는 오랜만에 동네 친구들과 달서구 용산동 맛집 상구네 돼지구이에서... 친구들과 방문한 달서구 용인동 맛집은 들어가는 입구에서부터 알록달록하게도...
44,또 가고 싶은 수원 맛집 LIST 수원 맛집 게판 저희가 다녀온 수원 게판은 화성행궁에서 차를 타고 5분만에... 수원 맛집은 가성비가 정말 갑이었어요 주문을 마치고 안으로 갔더니 따뜻한 원목...
45,석촌역 맛집 - 자가제면 우동과 돈카츠가 맛있는 곳 석촌역 맛집 새로 오픈한 우동전문점 자가제면 우동과 돈카츠가 맛있는 마초야... 석촌역 맛집 자가제면 우동과 돈카츠가 맛있는 마초야 송파점이 오픈을 했답니다. 이...
46,놀라웠던 경주 맛집 리스트 얼마 전 친구들과 함께 드라이브 갔다가 미리 알아두었던 경주 맛집에... 자리에 앉아 잠시 기다리니 경주 맛집에서 주문했던 요리들이 테이블 위로 하나둘씩 차려지기...
47,역대급 퀄리티 영종도 맛집 인근에 조개구이로 유명한 영종도 맛집을 방문했는데 싱싱함이 으뜸이었던 곳이라... 영종도 맛집은 포장마차 감성의 정감 가는 분위기였어요. 안쪽까지 길게 뻗은...
48,강릉 장칼국수 골목 맛집 칠천원의 행복 점심을 먹은 지 3시간 밖에 안 됐지만 그냥 이대로 가기가 아쉬워 강릉 장칼국수 맛집 중에 찐 맛집으로 추정되는 곳을 찾아 다녀왔습니다. 강릉시 금학동에 골목에 있는...
49,기억에 남는 울산 맛집 리스트 울산 맛집 중에서도 괜찮은 곳이라고 추천받은 삼산정에 갔었어요. 삼산정... 울산 맛집에서 저희가 고른 메뉴는 한우 스페셜 모둠이었어요. 옆으로 나온 반찬도...
50,"[강릉여행] 줄서지않으면 먹을 수 없는  강릉대표맛집, 짬뽕순두부 원조- 동화가든 본점 강릉에 꼭 가봐야 할 맛집들이 몇군데 있는데 그중 하나인 곳. 초당순두부라는... 유명맛집인데다 기다리기까지 했으니 여긴 맛없으면 안되는 집인거다. 순두부와..."
51,쿠나 @ 성수동 맛집 성수동에 파스타 맛집이 생겼다는 제보를 접하고 어느날 다녀왔어요 예약을 꼭... 은근 맛집이 많이 생기더라는 (지하에 르프리크도 공사중이었어요) BNHR카페...
52,남달랐던 제주 중문 맛집 리스트 중문 맛집을 소개하도록 할게요~ 1. 제주 중문 큰갯물횟집 주소 : 제주 서귀포시... 중문 맛집 모듬 튀김도 맛깔스럽게 준비되었어요~ 깨끗한 기름에 튀겨내어 예쁜...
53,월등했던 제주 애월 맛집 리스트 며칠 전 친구와 함께 흑돼지를 먹으러 제주 애월 맛집에 찾아갔어요. sns에서 아주... 구경을 마치고 제주 애월 맛집의 차림표를 읽어봤어요. 흑돼지 김치찌개나...
54,고양 스타필드 맛집 / 소갈비찜 한양산장 고양 스타필드 맛집 / 소갈비찜 한양산장 결혼하고 나서 처음으로 신혼집을... 고양 스타필드 맛집 한양산장 차자로 가도 좋다. 주차장이 정말 크게 되어있어서...
55,교동 맛집 한국인 입맛에 딱이야 친구가 그렇게 적극적으로 추천해 준 곳은 처음이라 얼마나 맛있는 맛집인지... 이곳은 외관은 카페나 일식집처럼 보이지만 교동 맛집은 퓨전 요리를 판매하는 곳으로...
56,후기남기고 싶은 안면도 맛집 모음 지난 주말에는 바람도 쐴 겸 안면도에 놀러갔다가 소문난 안면도 맛집에 찾아갔다.... 특히 안면도 맛집은 도에서 지정한 모범음식점이었는데 인정받은 곳인 만큼...
57,[서초장어타운(서초동)] 교대역 인근 국내산 민물장어 참 숯불 소금구이 맛집 2007년에 개업한 곳으로 강남에서 남서울민물장어와 함께 민물장어 구이 맛집으로... ☎ 02-521-6934 서울 서초구 서초동 1571-30(반포대로28길 77) ABRAXAS 맛집 평가 - 맛...
58,가볼만한 제주 남원 맛집 서귀포 남원 의귀리 갈비시대 원래는 갈비가 맛있는 제주 남원 맛집으로 알려져... 맛보기 전이긴 하지만 이정도면 제주 남원 맛집이라 입소문날 만하구나 싶은 생각이...
59,내가 픽했던 경주 맛집 모음집 저희가 다녀온 경주 맛집 입니다 :D 이 곳은 맛깔난 한식은 물론 다채로운 쌈채소도... 규모가 굉장히 큰 곳이라 단체로 방문해도 문제 없을 듯 했고 경주 맛집은 모든...
60,풍성했던 하남 맛집 리스트 지난 주말에 친구들이랑 모임이 있어서 하남 맛집을 찾아가 보았는데요. 좋은... 그리고 하남 맛집은 기본으로 잡곡밥이 준비된다는 게 특이했는데요. 흰쌀밥으로도...
61,뛰어났던 곤지암 맛집 얼마 전에는 광주에 일이 있어서 들렀다가 현지인들은 모두 안다는 곤지암 맛집을... 곤지암 맛집 엿도 입이 심심할 때 먹으면 딱 좋았어요. 먹을수록 달콤하고 고소함이...
62,이태원 맛집 베트남 음식점 랑만 이태원 맛집을 한 곳 보여드리려고 합니다. 이태원 베트남 퀴논 거리입니다.... 이태원 퀴논길 안에 숨어있는 이태원 맛집 랑만 네이버 지도를 보고 찾아가서 보니까...
63,송정 해수욕장 맛집 육즙최고 핫도그 테이크아웃으로 진짜 제대로 즐긴 송정 해수욕장 맛집 청춘아 달리 송정점. 송정... 고급스러운 재료를 사용하기 때문에 더욱 만족할 수 있었던 핫도그 맛집이었네요....
64,"들안길 맛집 분짜와 국물 깊은 쌀국수 에머이 수성구에 맛집이 많지만 역시 들안길 맛집이 제일 맛있고 가성비도 좋은 것 같았네요. 쌀국수, 분짜, 똠찌엔 어느 하나 빼놓지 않고 너무 맛있었어요. 다음에도 베트남..."
65,대구 달서구 맛집 전문적이어서 좋아 동생이 추천해 주는 대구 달서구 맛집은 이미 검증되어 있는 맛집이 틀림없기 때문에 걱정 없이 방문할 수 있어서 너무 좋아요. 저희가 점심을 먹으러 간 곳은...
66,호감이었던 포천 이동갈비 맛집 5곳 얼마 전에 남편과 포천에 바람쐬러 갔다가 포천 이동갈비 맛집도 다녀왔는데요.... 설렘을 안고 들어간 포천 이동갈비 맛집의 내부는 조금 특별한 구조였어요. 홀 중앙에...
67,"서울 핫플 익선동 맛집 카페 한가해서 좋았던 곳 익선동 한옥거리 골목을 따라 요즘 유행하는 레트로, 빈티지 느낌 가득한 맛집, 카페가 모여있죠. SNS에서 유행하는 익선동 맛집, 익선동 카페 (온천집, 청수당, 송암여관)..."
68,만점 주고 싶은 잠실 맛집 잠실 맛집을 찾아갔어요. 질 좋은 민물장어와 1++등급 한우를 동시에 먹을 수 있는... 잠실 맛집은 믿고 먹을 수 있더라고요. 그 옆에는 당일 손질된 일등급 장어들이...
69,일년내내 맛있다는 동막 해수욕장 맛집 해수욕장 맛집으로 검색했어요 밥 먹고 카페도 가야 하니까~ 일년내내 칼국수 맛있는 집 동막 해수욕장 맛집으로 검색하면 꼭 보이는 일년내내 사실 해물칼국수는 파는...
70,대구신천시장맛집.....가을은 고기에 집중하기 좋은 날씨.....돗소리 신천점 #대구신천시장맛집 중에도 다양한 업종들이 즐비하지만 그중에 유난히 돼지고기를... 양배추맛집이라고 소문나게 만든 장본인 양배추재래기 쓱 쓱 비벼서 고소한...
71,[대구육개장맛집]이젠 육개장하면 대구에서 이집만 남았네 ---옛집식당 #대구육개장맛집 육개장 많은 설들이 있기는 하나 현재까지도 대구 경북권에서 제일 먼저 만들어져 퍼졌다고 보는게 일반적이죠... 대구탕이라고도 불렸다는 사실을...
72,문래역 맛집 / 양대창 초대창 문래역 맛집 / 양대창 초대창 양대창은 참으로 맛이 좋은 음식이다. 가격이 비싸서... 뮨래역 맛집 초대창 문래역에서 멀지 않은곳에 위치하고 있다. 문래역 5번출구로...
73,"수원 장칼국수 맛집 강릉장칼국수 수원 남수동 강릉장칼국수 수원시 팔달구 수원천로 314(남수동 72-1) 전화 031-241-7959 영업 11:00-20:00 휴무일 2,4주차 월요일 #수원맛집 #수원칼국수맛집 #수원장칼국수..."
74,동네 맛집 살리기 프로젝트 105 [대조동/남도술상] 남도의 해물안주가 가득한 손맛 좋은 여주인이 운영하는 선술집 오늘 포스트는 동네 맛집 살리기 프로젝트로 얼마전에 소개한 녹번동의 제주도... 동네 맛집 살리기 프로젝트로 소개를 합니다. 이 집은 실내포차 컨셉으로 전라도 여수...
75,고터 맛집 / 목살 온유월식당 고터 맛집 / 목살 온유월식당 고기는 언제 먹어도 맛있다. 맛있는 고기를 먹을려고... 고터 맛집 온유월식당 고속터미널역에서 정말 가깝다 8-1번 출구로 나와서...
76,윤이네식당 대구교동맛집 #대구교동맛집 대구 교동에 위치한 요즘 뜨고 있는 맛집 핫플 식당중 하나인 윤이네식당 처음 오픈 했을때는 참 많이 어설퍼 보였는데 이제 어느 정도 궤도에 올라서니...
77,"성수 샌드위치 맛집 미아논나 Mia Nonnaa 성수 샌드위치 맛집 미아논나 Mia Nonna 미아논나 서울특별시 성동구 연무장5길9-16... 여기 주변 많이 지나다녔었는데, 이날 제대로 이곳 저곳 #성수맛집 다시..."
78,"[2015 Spain] 스페인 산세바스티안 맛집 - Bar Sport 제대로 된 핀초를 맛보려면 꼭 가볼만한 완소 산세바스티안 맛집이다. Address: Fermin Calbeton, 10, 20003 San Sebastian - Donostia, Spain Phone: +34 943 42 68 88 ABRAXAS 맛집 평가..."
79,모루 대구삼덕동맛집 #대구삼덕동맛집 카레를 전문으로 하는 식당들은 많이 있는데 제 스타일의 카레를 내는곳은 그렇게 흔하지 않더라구요 일본 카레의 진하면서 착감기는 스타일의 카레...
80,[2017 France] 프랑스 부르고뉴 본(Beaune) 맛집 - Patisserie Fabien Berteau 디저트 맛집이다. 오너 파티셰인 Fabien Berteau는 프랑스 파리의 라뒤레... 프랑스 부르고뉴를 여행하는 분들은 꼭 가봐야 할 본 디저트 맛집이다....
81,"신논현고깃집, 신논현삼겹살 -  근고기 맛집 '육덕식당' 신논현역 3번 출구 인근, 추억 돋는 제주식 근고기 맛집 입구의 간판이 복고풍... 비주얼만 봐도 신논현삼겹살 맛집이다. 가운데 고기는 부드러운 목살, 오른쪽은..."
82,삼각지 맛집 춘지본가는 이제 해물 오마카세 맛집이에요 삼각지 맛집들이 있는 곳이라 정말 주당 및 직장인들의 퇴근길을 절로 멈추게 하는... 그런데 자원과 원대구탕 사이에 제철 해산물 요리로 사랑받던 삼각지 맛집...
83,숙대 맛집 /  황지살 상록수 숙대 맛집 / 황지살 상록수 숙대쪽에서 오래 살았지만 그쪽의 있는 음식점들은... 숙대 맛집 상록수 숙대입구역 10번출구로 나와서 지하차도쪽으로 간 후 신호등을...
84,"[청담 맛집] 생일파티룸이 있는 곳, 데일리청담 청담맛집 데일리청담은 디브릿지 클럽이었던걸로 기억한다. 이번에 카페&다이닝... 청담 맛집 데일리청담은 3층에 위치하고 있어서 엘리베이터를 타고 올라가면 된다...."
85,아이뽀유 @ 가로수길 맛집 재방문 할 듯 루프탑도 분위기 좋아요~ 아이뽀유 @ 가로수길 맛집 주소 서울시 강남구 도산대로 153 전화번호 02-517-4656 영업시간 07:30 ~ 22:00 주차 기계식(만차시 주차불가)
86,대구짬뽕맛집 수봉반점 #대구짬뽕맛집 명절을 쇠고 나서는 느끼리한 음식을 먹고 알콜에 찌들어 지낸 속을... 짬뽕 맛집으로 손꼽아 보라고 한다면 당연히 제가 첫손 꼽는곳 이기도 하고 이제는...
87,대구 본리 맛집 한우라서 더 고소해 본리 맛집인 양곱화 본동점을 방문했답니다 도착했을 때 간판이 커서 찾기... 본리 맛집답게 가게 바로 앞에 주차장도 있고 주차요원도 계시더라고요 저도 다음엔 차를...
88,대학로 피자 맛집 핏제리아오 대학로에 위치한 유명 피자 맛집을 찾았습니다. 피자 장인 이진형 셰프가 총괄하는... 여기 대학로 피자 맛집 핏제리아오는 마치 이탈리아 어디메에 와 있는 듯한 느낌이...
89,대구 칠성동맛집 . 대구중국집맛집  ..........기본에 충실한 볶음밥........경승원 요즘은 맛집정보수집 하는데 있어서 다양한 경로가 존재하는것 같습니다 예전에 sns상으로 정보취합 하려면 네이버블로그가 전부이거나 다음에 맛집카페정도 였는데...
90,월드국수 대구 종로맛집 #월드국수 대구 종로 맛집들은 예전에는 나이드신 분들이 많이 다니시는 식당들이 많았지만 이제는 젊은 친구들이 많이 찾는 거리가 되다 보니 젊은 아이들 입맛에 맞는...
91,백석 맛집 분위기 좋은 야외 테라스 더코너비스트로 실내보다는 야외에서 활동하는 게 몸도 마음도 편한 요즘이라 유독 맛집 알아볼 때도 야외 있는 곳으로 찾아보게 되더라고요 더코너비스트로 백석 맛집으로 이날 점심은...
92,교동시장맛집.........대를 이어온 .....교동시장 서울순대 어제 교동할매빈대떡집에 이어 2탄으로 교동시장맛집은 연달아 포스팅합니다.... 오래된 맛집 예전에는 할머니가 직접 가게에 나오셔서 운영하셨는데 이제는 연세가...
93,문래동 맛집 새로운 치맥의 강자 문래동 맛집 새로운 치맥의 강자 얼맥당 문래점이 오픈을 했답니다 진짜... 문래동 맛집 새로운 치맥의 강자의 숨은메뉴인데요 개인적으로 저는 얼맥에 저 청양고추 크림...
