,date,title
526,2020년 10월 11일,오늘은 점심과 저녁 하루종일 닭류 섭취  점심 또 다시 내찜닭먹으러 고고 뷰 나름 갠찮은 창가에 앉아서 밖에 보면서 식사  저녁 치킨집에서 치맥 꿀파티 with 감튀 and 치즈볼   일요일 닭고기 닭음식 닭고기스타그램 맛스타그램 일상스타그램 먹스타그램맛있다 맛있다그램 닭파티 하루종일닭만먹음 배불르다 배불르다그램 소통 소통해요 맞팔환영 인친환영 내가찜한닭 썬더치킨 점심과저녁감튀 치즈볼
527,2020년 10월 11일,다들 피자시켜머궈  피자알볼로 피자 로제파스타 치즈볼 pizza pasta cheezeball 저녁 존맛 foodie
528,2020년 10월 11일, 고수를 넣은 마라탕 홍어와 동급인걸로
529,2020년 10월 11일,로제찜닭 넘 맛있어요 진짜  치즈볼 은 좀 별로 튀김치즈떡같은느낌 로제찜닭 찜닭 납작당면 당면사리 고구마 로제 먹스타그램 맛스타그램 두찜 좋테 소통해요 eat 매워 foodfoodstagramchicken rosé
530,2020년 9월 30일,노브랜드 치즈볼 jmt
531,2020년 10월 11일,EVENT  맛있는 감의 계절 가을이 왔어요  요리조리 떨어지는 감을 받고 있는 도도 과연 도도가 바구니에 받은 감은 몇 개 일까요 댓글로 도도가 받은 감의 개수를 맞혀주세요  참여 방법 리딩게이트 공식인스타 팔로우 도도가 받은 감의 수를 댓글로 달아주시면 참여 완료  참여 기간 105 월  1025 일  당첨자 발표 1027 화  선물 3명 맛초킹한마리치즈볼콜라125L 7명 스타벅스 카페라떼 Tall  리딩게이트 퀴즈이벤트 인스타그램이벤트 영어도서관 초등맘 초등영어 영어공부 이북 eBook 10월이벤트 EVENT QUIZ 아들스타그램 딸스타그램 스타벅스 맛초킹 치즈볼 이벤트경품
532,2020년 10월 11일,또먹분식 떡볶이 후라이드떡볶이소스에콕 치즈볼 먹팔 소니의식사공간
533,2020년 10월 11일,치킨 먹을때 치즈볼 굳이 안 시켰는데 친구가 깜짝 선물로 우리집으로 배달시켜 줬을때 먹고 반해서 내가 시켜먹을때도 꼭 시키게 됨텅빈 지갑만 아니면 매일 먹었을듯  혼밥 치즈볼 뿌링치즈볼 BHC 먹스타그램
534,2020년 10월 11일,막둥이 자전거 배우기 오늘은 치느님과   이렇게 저녘이 되가는구나 ㆍ ㆍ 일상 소통 오늘 일요일 주일 코로나 꺼져 집콕 지겨워 우울 가족 놀이터 출동 삼남매 삼남매네 우리집 막둥이 오구오구 잘한다 오후 마무리 뿌링클 치파오 치킨 치즈볼 옴뇸뇸 맛있다 jmt 소확행 
535,2020년 10월 11일,네고왕 보고 바로 시킴 기대 이상으로 맛있네요   광희나는메이플버터갈릭치킨 bbq 네고왕 치즈볼 황올반  할인 끝나기 전에 많이 시켜 먹었어야 했는데 아숩 
536,2020년 10월 11일,코로나를 뚫고 꽃구경감 이러면 안되는거아는데나도 너무나가고싶어서 마스크쓰고 간식먹을때만 잠시마스크뺌 잘먹는 아들들 사진협조 절대안해주는 아들둘 너희나중에 이쁜사진없다고 머라하기만해라  그래도 뛰고 놀앗더니 피곤햇는지 지금 자는중 올라가면 깰까바 주차장서 버티는중 단감테마공원이쁜내아가들명랑핫도그치즈볼
537,2020년 10월 11일,운동하는 아들 골고루먹이기 어렵다 좋아하는것만 먹으면 채소는 안먹으니 중간중간 색다르게 해먹이기  스테이크샐러드 까르보떡복이와치킨 치즈볼 아침부터치즈돈까스에볶음밥 축구맘 많이먹고쑥쑥크자
538,2020년 10월 11일,협찬 그래도진짜리뷰 가치식탁 치즈스틱 자세한건네이버검색 치즈가 그득그득 진짜 치즈 많이든거 인정 패스트푸드점에 치즈스틱 드시러 가는 아드님이 빛의 속도로 다 드심 눈은 부어도 잘 먹어요 이틀전 사진지금은 붓기 많이 빠졌어요 치즈볼 냉동식품 냉동간식 간식 리얼치즈스틱 리얼크림치즈볼 치즈 08L 아이간식
539,2020년 10월 11일,오뚜기찹쌀미니도나스 믹스사랑 치즈볼  기름진건 항상 맛있음  딱 두개 치즈볼로  흔들리는 이 때문에 치즈볼 먹다가 피본 딸  4살도 춤추게 만드는 믹스 도넛  싸고 간단하고 맛있고 간식으로 딱 좋아
540,2020년 10월 11일,커플강정콤보 싸이버거 강정 치즈볼 맘스터치 일상스타그램 럽스타그램 데일리그램저녁메뉴 지름신강림 맛스타그램  이마트 문 닫은 줄 모르고 나갔다가 칼국수도 주차 불가 결국 석계역
541,2020년 10월 11일,피자헛 불고기피자 치즈볼
542,2020년 10월 11일,_ 휴일의 마지막도 치킨선생 과 함께라서 햄볶해오 출출하고 나른한 오후 버튼 몇번으로 집앞까지 배달되는 행복이예오 지금 치킨선생신길점 인스타 프로필에서 전화하기 버튼을 이용해 전화주문 해보세오 사진속 제품은 크리스피치킨과 치즈볼 입니다 _ _  배달의민족 과 요기요에서 치킨선생신길점을 검색하세요  미리 전화주문 주시면 시간 맞춰 준비해드립니다  배달주문보다 매장주문시 조금 더 저렴한 가격에 맛 보실 수 있어요
543,2020년 10월 11일,시흥맛집 은행동 홍춘천치즈닭갈비 치즈볼 새우튀김 냠냠
544,2020년 10월 11일,간만에 옛날 튀긴 빵들이 땡겨서 배달 시킨 명품찹쌀꽈배기앤찹쌀핫도그 의 찹쌀꽈배기  찹쌀팥도너츠 찹쌀도너츠  고구마치즈볼  찹쌀치즈볼  그리고 서비스로 받은 치즈감자핫도그 까지  전반적으로 빵피 자체가 쫄깃하고 고소하며 치즈볼류나 핫도그 같은 경우는 바삭하기까지 해서 역시 맛없없  찹쌀도너츠 같은 경우에는 안에 완두 앙금이 쬐금 들어있어 이거 완전 내 취향  팥도너츠 에 들어있는 팥은 아주 달달하고 곳곳에 팥알갱이도 살아있었다  치즈볼 에 들어간 치즈가 늘어나는 모짜렐라 치즈에다 부드러워서 더더욱 존맛탱  특히 고구마를 좋아해서 고구마치즈볼을 제일 기대 했는데 역시는 역시 고구마 앙금과 치즈가 들어가니 짱짱 맛있었다  서비스로 받은 치즈감자핫도그는 겉에 감자가 완전 짭조름하고 바삭하며 치즈는 치즈볼에 들어가는 똑같은 모짜렐라 치즈라 궁합이 아주 잘 맞았다
545,2020년 10월 11일,양파 치즈볼 튀김모여라
546,2020년 10월 11일,또박 꽈베기 도너츠  날이 너무좋은데 피곤모드라서 기냥 간단히 동네산책하고 돌아오는길           쩡이_냠냠 먹방 먹스타그램 먹스타맞팔 먹방스타그램 가족스타그램 살찐다그램 반사 밥상 스벅 주말스타그램 주말일상 먹거리 다이어트 홈쿡 푸드스타일링 푸드그램 맛스타그램꿀맛 존맛탱 jmt 옛날도너츠 치즈볼 도너츠맛집 꽈베기도넛 폴란드그릇 포토메리온
547,2020년 10월 11일,코로나이후첫영화관람담보큰호두과자같은치즈볼다신안먹는걸로카라멜팝콘등촌하루빨리마스크벗고다니고싶다
548,2020년 10월 11일,죽어도 여한이 없습니다 뿌링클콤보  치즈볼   가격은 23000원으로 저렴하진 않지만 최고의 행복감을 느낄 수 있는  진짜 가능만하면 매일 먹고싶다           음식 먹스타그램 맛집 먹스타 먹방 맛스타그램 음식스타그램 소통 일상 맛있다그램 먹부림 요리 맛있다 존맛 푸드스타그램 먹방스타그램 음식 일상소통 인스타푸드 맛집스타그램 먹스타맞팔 먹팔 치킨 BHC 행복 JMT 갓성비
549,2020년 10월 11일,요즘 폭풍흡입 39년만에 처음 먹어본 어향동고 감동 눈물이 또르륵 맛 영광굴비 치즈볼 아웃백 너무 오랜만이야 역쉬 신천떡볶이 최애 라구파스타 립아이스테이크 인생 육개장 맛집 찾음 배민맛집
550,2020년 10월 11일,지브로와 한성 마트 독점 특가 상품 한성마트 네이버 장보기 단독 SET 상품 출시  모짜렐라 치즈볼  치즈스틱  치즈까스 3종 세트 겉은 바삭 속은 쫀득 진정한 모짜렐라 맛을 느껴보세요  믿을 만한 한성 식품 HACCP 인증은 기본 제품입니다 아이들 간식 어른들 술안주 어디든 즐겨 보세요   전상품 특가 쿠폰으로 가격비교 최저가 인증  한성 마트 전상품 한번에 묶음 배송으로 슬기롭게 장보세요   상단의 프로필 링크 누루시면 구매하실수 있습니다   gbrowa_com 친구 추가좋아요 해주세요  모짜렐라 피자치즈 모짜렐라치즈 눈꽃치즈 모짜렐라치즈볼 치즈볼 치즈스틱 업소용치즈볼 에어프라이어치즈볼 찹쌀치즈볼 대왕치즈스틱 치즈볼과자 업소용식자재도매 냉동치즈볼 치즈볼도매 크림치즈볼 에어프라이어음식 대용량치즈볼 냉동치즈스틱 치즈볼추천 풀무원치즈볼 풀무원크림치즈볼 더블치즈볼 교촌치즈볼 BBQ치즈볼 코스트코치즈볼 지브로와 한성마트 에어프라이어치즈스틱 에어프라이어간식
551,2020년 10월 11일,서울에서 놀러온 이모야들이랑 2박3일 함께 마지막날 아침은 이모들이 떠후아빠식먹고싶다고 요청해서 급하게 고기사와서 한상 차려먹기 고기사러 쿨쿨자는 오빠빼고 다 같이 나가서 모닝커피떠후는주스 사고 고기사고 오는길에 우리동네 분식맛집가서 물떡에 떡볶이튀김사서 손에 한 가득들고 집으로 혼자나갓다왓으면 20분이면 충분한데 다섯이 움직이니 1시간20분걸림그래도 재밌으니 시간 가는줄 모르고 다녀옴 2박3일동안 먹은 우리가 먹은 사진도 함께 마지막사진은 못먹는 치킨보고 애가탄 이월이사진     2박3일 부산에 먹으러온 이모야들 떠후아빠식 소원성취 붕붕카타고 장보기 산책하기 차돌박이찜 소불고기 공심채볶음 모닝글로리볶음 이애영분식 물떡사랑 떠후그램 은바다횟집 전어모듬회 오마카세 BHC 뿌링클 치즈볼 삼다진족 온족발 스타벅스 블랙글레이즈드라떼 JMT
552,2020년 10월 11일,  bbqchickeninsta kwangheeworld bbqchicken 비비큐 네고왕   광희나는메이플버터갈릭치킨 황금올리브치킨 반마리 치즈볼 랜덤4개 세트 정가 199 네고할인쿠폰 50149 배달비별도   네고왕에서 비비큐 광고 모델된 황광희님 또 네고 하러감 촬영중 역댁급 웃긴 엘베 장면도 나오고  신메뉴 정가가 220 인데 199로 조정네고도 하고 일주일간10021008 신메뉴 50 할인 네고까지 해주심 크으 이름도 광희이름이 들어가곸  리뷰들 보니 물린다는 얘기들이 많아서 황금올리브 반마리 메이플치킨 2조각 세트로 시켰다 움지금 생각해봐도 현명한 주문이였음 메이플은 소스는 맛있는데 부위가 그닥 그리고 두조각이 최대인듯 물려 개인적으로 나는 역시 황금올리브가 최고인듯     비비큐치킨 비비큐치즈볼 메이플버터갈릭치킨 황광희 네고왕황광희 네고왕bbq 네고왕이벤트 맛스타그램 먹스타그램 먹스타맞팔 내돈내산 후기 리뷰 맛집 치킨 chicken 소통 좋아요 좋아요반사 맛집리뷰 치느님 맛집스타그램 
553,2020년 10월 11일,오늘의 메뉴 에프로 굽굽한 치킨이랑 치즈볼 그리고 샐러드 분명히 풀을 가득 담았는데 치킨 굽는 사이 드레싱에 숨이 죽어버림  그리고 치즈볼은 3개가 딱 맞는 것 같다  4개부터는 도저히 턱도 아프고 부담스러워서 못 먹음 이래서 욕심을 줄여야 하는데  플레이팅도 사진도 엉망이지만 그래도 접시 접시 챙겨 담고 찍은 사진을 보면 나를 위해서 예의는 차렸구나 싶어 뿌듯해지는 마음  근데 사랑한테 사진 찍는 법을 좀 배워야 할까  점심메뉴 치킨 바삭바삭 치킨맛집 에어프라이어요리 치즈볼 치즈볼맛집 쫀득쫀득 샐러드 샐러드맛집 아삭아삭 먹스타그램 먹방 집밥스타그램 좋반 맞팔 소통
554,2020년 10월 11일,아예태사자 인더 하우스 태사자 박준석님 제 오래된 단골고객님이신데요 사실은 아내분이 매니아셔서 유튭방송에 우리꺼 제품가지고 나가서 보여주게됐다고 연락주셔서 뭔가하고 찾아봤더니 와우 시너지제품도 매니아지만 다양한 영양제를 챙겨드시니 이리도 방부제미모이신가봅니다아내분 덕이쥬 앞으로도 쭉쭉쭉 시너지와 함께 더 건강하고 멋져지시길  그나저나 트레이가 좀 탐나네요
555,2020년 10월 11일,너무 진지하게 봤자나
556,2020년 10월 11일,연휴가 끝나가서 슬프니까 또 당섭취 흑당 밀크티와 모찌볼을 연유에 푹 담가 먹어줍니다  홈카페 홈카페놀이 homecafe 밀크티 흑당밀크티 흑당라떼 모찌볼 치즈볼 파리바게트 파리바게트모찌볼 간식 간식스타그램 디저트 디저트그램 빵순이
557,2020년 10월 11일,어제 먹은 장어 내가 장어를 이렇게 잘먹게 될줄이야 
558,2020년 10월 9일,처음으로 만들어본 치즈볼 다음엔 더 얇게 만들어봐야겠다 애들이 넘 맛나게 먹음    음식 음식스타그램 음식스타그램 음식그램 홈쿡 홈쿡 홈푸드 홈쿡스타그램 간식 간식추천 간식스타그램 쿡스타그램 요리 요리스타그램 맛스타그램 먹스타그램 푸드스타그램 치즈볼 치즈볼 치즈볼맛집
559,2020년 10월 9일,협찬 그래도진짜리뷰 가치식탁 치즈스틱 자세한건네이버검색  고급진 맛의 치즈스틱  치즈볼 이었어요 근데 저는 개인적으로 느끼한 음식을 잘 못 먹고 좋아하지도 않아서 크림치즈볼은 너무 느끼하게 느껴졌어요 참고로 까르보나라나 빠네도 느끼해서 잘 못 먹는 뇨자에요  크림치즈가 정말 듬뿍 들어있어서 치즈나 느끼한 음식 좋아하는 분들은 만족스러우실 것 같아요  치즈볼 냉동식품 냉동간식 간식 리얼치즈스틱 리얼크림치즈볼 치즈 08L
560,2020년 10월 11일,프로틴 프로틴음료 단백질 단백질음료 바쁠때 보충제 로 활용 제일 좋은건 식품으로 섭취하는 것 셀렉스스포츠 셀렉스 셀렉스프로틴 코스트코 내돈내산 운동하는교사 운동하는직장인 운동하는여자 헬린이 일요일오후 에는 광희나는메이플버터갈릭치킨 치즈볼 조합으로 타락 헬린이 헬스타그램
561,2020년 10월 11일, 주말 낮맥한잔 연휴라 좋았는데 시간이 이렇게또   홈카페과일우리집먹스타그램온더테이블육아소통아들맘주방홈쿡인스타푸드맞팔야경선팔데일리점심인친소통맘스타그램요리인스타푸드육아맘치맥집스타그램육아소통오오티디치킨dailybhc치즈볼오후꿀주말일요일
562,2020년 10월 11일, 비쥬얼 무엇 오지게먹계 멤버 집 앞에 새로생긴 피자집 아기자기한 외관에 내부도 아담함 하지만 피자비쥬얼은 그렇지 못함 반반피자로 고구마랑 페풔로니 선택 귀엽지만 속은 알찬 치즈볼까지 피자 도우 얇고 토핑이 너무나 알찼음내입속으로 마구들어감 개마싯어 담에는 엄마랑 와서 다른 메뉴피자 먹어볼거야 재방문할거야
563,2020년 10월 11일,치킨 보내주신 분 사랑합니다   우리집식탁 bhc골드킹콤보 단짠단단짠 치즈볼 엄마표비빔국수 집술 낮술 술스타그램 짠스타그램
564,2020년 10월 11일,혼자서아점먹기순살양념치킨리뷰이벤트로받은치즈볼욕심부려봄반도못먹음배터짐
565,2020년 10월 11일,BBQ 신상 광희나는 메이플 버터갈릭 드세요 두번드세요  혹시나 입에 안맞을까봐 2조각짜리 시켰는데 후회했다니까요  메이플평소에 좋아하는데 메이플맛은 잘 모르겠고 버터향 가득한 마늘빵맛 암튼  치즈볼은 랜덤으로 온다더니 고구마2개 크림치즈2개왔어요  초코러버로서 쇼콜라가오길 기대했는데 그래도 맛있었어요  친구네집이라 정직하게 치킨사진만  이번에 전주가서 맛있는거 원없이 먹고왔네요  큰일나따 이제  광희나는메이플버터갈릭치킨 bbq 신상치킨 치즈볼 고구마치즈볼 크림치즈볼 광희만세
566,2020년 10월 11일,마늘 치킨 괜찮았음 치즈볼도 맛있었음 60계치킨 마늘치킨 떡볶이 치즈볼 마이쩡 마이쩡그램 먹스타그램 인스타푸드 푸드스타그램 음식스타그램 음식 음식사진 존맛탱 food foodstagram foodphoto instagram instarfood
567,2020년 10월 11일,협찬 그래도진짜리뷰 가치식탁 치즈스틱 자세한건네이버검색 치즈스틱을 너무 좋아해서 예전에 쿠팡에서 구매하려고 찾던 중 봤던 제품인데 가격은 저렴했으나 양이 적어서 구매 안했던 젷품인데 공팔에서 진행하길래 구매했다 치즈스틱 너무 맛있다 그냥 말이 필요 없었어요 치즈볼은 크림치즈라 꾸덕하면서 달달했다 치즈볼보단 난 치즈스틱 쭉쭉 늘어나고 기름에 튀기기 싫어서 오븐에 구웠는데 진짜 쭉쭉 늘어나네요 넘 맛나서추석때 쇼핑몰에서 주문하려다가 배송땜에 못하구 담에 주문하려구요 치즈볼 냉동식품 냉동간식 간식 리얼치즈스틱 리얼크림치즈볼 치즈 08L 오븐치즈스틱
568,2020년 10월 11일,치맥 부셨다
569,2020년 10월 11일,로고 색상이 변경되었습니다 배민에서 주문하실때 참고해주세요  숯불고추장바베큐 치즈새우촌닭 숯불간장바베큐 숯불소금구이 치즈볼 소떡소떡 포테이토치즈볼 무봤나촌닭 안성점 안성시 안성 배달의민족 백성3길30 백성초등학교 무촌 안성맛집 존맛 존맛탱 안성맞집추천 안성맛집 닭스타그램 낮술안주 치밥 비벼먹는치킨
570,2020년 10월 11일, 역시님나맛난거해쥰다구신이난칭구헼 홈요리 백종원크림새우 새우어묵바 소시지떡꼬치 멘보샤 치즈볼
571,2020년 10월 11일,요즘 먹고싶었던 달다구리로 대환장파티 웁스 풀무원 치즈볼 빽다방 연유라떼 칙촉이퐁당위즐 냠
572,2020년 10월 11일,치즈볼
573,2020년 10월 11일,광희나는메이플버터길릭치킨 네고왕 재밌게 보는데 여태까진 다 주문실패하고 마지막 날 막차탔던 치킨 주문 포장해가는데 차 안에 메이플 시럽냄새 장난 아님 와플 핫케이크를 먹고 싶게 만드는 냄새 뭔가 마늘빵을 먹는거 같은 느낌적인 느낌도 들지만 크기가 작은것만 빼면 맛있었음  황금올리브치킨도 맛있고 메이플버터갈릭치킨도 맛있고 치즈볼도 종류별로 있어서 좋고 구성도 괜찮은데 메이플버터갈릭 2조각 황금올리브 4조각 치즈볼 4개를 정가주고 사먹는건 조금 생각해볼 듯  bbq 네고왕 광희 광희나는메이플버터갈릭치킨 광희나는갈릭치킨 황금올리브치킨 치즈볼 크기가아쉽
574,2020년 10월 11일,맛초킹치즈볼
575,2020년 10월 11일,家のこ近所さんに 韓国式チキン のお店出来てた 配達してもらえる幸せ 早速頼むよねぇ    青年チキン　青年チキンカフェ　チキン　ハニーハターチキン チースホール キムチ　おまけ付き　大根かない  旨し　飯テロ　テフ活　リヒ決定 ubereats 住処ハレハレ 한국식치킨　치킨 허니버터치킨　치즈볼　치킨무가없어요　치킨무주세요 치킨무 うるさい 맛집　도쿄 히가시무라야마 구메가와역
576,2020년 10월 11일,20201010 ㆍ 취킨퐈티 3일내내 치킨만먹었다 근데신기만건 물리지가않네 ㆍ 럽스타그램 민소그램 치킨 웨지감자 치즈볼 잘먹겠습니다 저녁스타그램 야식 선팔 좋아요
577,2020년 10월 11일,협찬 그래도진짜리뷰 가치식탁 치즈스틱 자세한건네이버검색  가치식탁 리얼치즈스틱 리얼크림치즈볼  햄버거나 치킨 먹을때 함께 먹으면 더 맛난 치즈스틱 치즈볼  하지만 사이드로 따로 시키면 비싸다  그래서 이렇게 가치식탁에서 나온 치즈들을 냉동으로 집에 놔두면 든든  그리고 맛도 대애애애박  빵가루로 만들어 더욱 고소 바삭하고 모짜렐라 치즈와 리얼크림치즈로 하나하나 한입 베어 먹을때마다 감탄이  치즈스틱은 롯x꺼와 견주어도 손색없고 크림치즈볼은 조그만한게 손은 꽉차고 넘 부드럽고 크림치즈 풍미가 가득했다  치즈스틱은 1봉에 12개 크림치즈는 17개 넘 많아서 친정 가족들 5명이랑 이틀을 나눠먹었다  오늘은 떡볶이랑 같이 먹었는데 매콤한 떡볶이랑 고소달콤한 치즈랑 찰떡궁합  이건 가격도 저렴해서 재구매각100 아기들 간식으로도 어른들 안주로도 1000  세상에 똑같은 치즈스틱과 치즈볼은 없는거 같다  간만에 아주 만족한 제품이였다  치즈볼 냉동식품 냉동간식 간식 리얼치즈스틱 리얼크림치즈볼 치즈 08L 아기간식 안주
