,date,title
871,2020년 10월 9일,돈까스회관 육즙 이빠이  서비스 팍팍 드려요 멘치볼 치즈볼 HandMade 신림 봉천 제일시장 청룡시장 돈까스 서비스는내맘대로 메뉴개발 신메뉴 돈짱 돈까스짱 돈까스짱가
872,2020년 10월 9일,메이플버터갈릭치킨 soo_먹스타그램
873,2020년 10월 9일,푸라닭 고추마요 기름떡볶이 치즈볼 각 10점 2점 3점씩 드릴게요 만점은 10점 만점에 10점 입니다
874,2020년 10월 9일,    불금이니께 애덜은 뿌링클이랑 치즈볼 집남자랑 나는 스팸두부김치     불금 뿌링클 치즈볼 스팸두부김치 쏘맥 야식 야식스타그램
875,2020년 10월 9일, 최근에 치킨 2번 시켜먹었는데 그게 다 자담치킨 이라는거 그만큼 나를 유혹하는 요녀석  동생한테도 맛보여주고 싶어서 제주에서도 시켜봐따 소스를 많이 주셔서 완전 푹푹 찍어먹음 순살이고 조각이 작다 순살은 닭다리살이라 부드러움 근데 뭔가 양이 적은 거 같음  맛은 정말 마약이다 많이 안 매워보이는데 진짜 계속 씁씁거림 진짜 신기하게 끝맛이 매움 근데 앞에 달달한 감칠맛이 있어서 계속 들어간다 요즘 신상치킨 중 진짜 1위  배불러서 좀 남겼는데 몇분 후에 다시 주워먹는 나를 발견함 식어도 맛있다는거  엄청 바삭한 지점도 있다는데 아직 바삭함은 느껴보지 못했다 그래도 양념이 맛있어서 좋음  치즈볼 도 서비스로 주셔서 먹어봤눈데 치즈볼은 단맛 없는 담백한 맛임 안 드셔본 분들 꼭 한번은 먹어보세요    야식야식추천치맥치킨추천 맵슐랭치킨치킨치킨스타그램불금배고파먹스타그램맛스타그램치킨먹방치킨맛집치킨배달추천술스타그램안주스타그램chicken
876,2020년 10월 9일,오빠 채고 뿌링클맛초킹치즈볼 박성경 만만세
877,2020년 10월 9일,우리 모두가 좋아하는 치킨  60계치킨       먹스타그램 먹기먹방 먹스타맞팔 먹스타 먹방 먹방투어 먹팔야식치킨음식치킨맛집60계치킨 치즈볼맛있다행복다이어트한글날
878,2020년 10월 9일,109 서문시장 수건구매 바글바글 모던하우스 커튼 bhc 양녕치킨 치즈볼 식탁 베란다타일 조립 럽스타그램 윤서커플
879,2020년 10월 9일,엄마랑 하루종일 데이트   메가커피 버거킹 핫아메리카노 아이스아메리카노 할라피뇨불고기 공지천 상상마당 bhc 뿌링클 치즈볼 고마워잘먹었어 피자스쿨 치즈피자 핫치킨피자 한글날
880,2020년 10월 9일,수고했어오늘도 폭풍같은 하루의 마무의리는 치맥 칭구가 맛있다며 보내준 프라닭 블랙알리오 생맥주 치즈볼 ㆍ ㆍ  첫예약 10시30분부터 가능해요  마지막예약 7 8시까지 가능합니다  공휴일 일요일도 정상오픈해요 ㆍ ㆍ ㆍ ㆍ 아트 예약하시는 팁 저희샵 8090이상이 아트시술입니다 600여가지의 다양한 아트가 준비되어있어요 예약시 미리 아트예약으로 말씀해주세요 아트 종류나 좋아하시는 취향이 다양하다보니 하고싶은 아트 찾아오시면 선택이 더쉬워요 인스타나 블로그 보시다 찜콕해오셔도 좋아요 아트는 전화상담 받지 않아요 오셔서 시술전 상담후 가격안내해드려요 저녁예약은 빨리 마감되니 미리 연락주세요 소중한 예약시간 꼭지켜주세요 오늘도 행복하세요 꼭이요 ㆍ ㆍ ㆍ ㆍ 예약시 지켜주세요  동시시술 최대 45명까지 예약됩니다 토탈뷰티샵으로 분야별 선생님들이 계세요 당일예약 가능하고 샘들이 많아 예약이 수월해요 티켓팅 해놓고 받고싶을때 못받는거 no no 공휴일 일요일 정상오픈 주중 20시까지예약가능 노쇼 당일취소  예약시 신중히 부탁드려요 다른분들 못받고 비워둔 소중한시간 지켜주세요 노쇼하고 안오시면 샵에 큰피해라는거 알아주세요 노쇼하시는분들 부득히 노쇼비 받고 있어요 최고의 재료와 퀄리티를 보답해드리겠습니다 디엠 다렉 카톡 시술중에 확인이 어려워요 죄송하지만 전화예약만 가능해요  전화문의주세요 02 22992269 ㆍ ㆍ ㆍ ㆍ ㆍ 라뜰리에 토탈뷰티샵 10년이상의 두원장님이 든든히 지키는 라뜰리에 45명의 분야별선생님들로 예약이 수월해요 아트별로 전문선생님이 계시는 고퀄리티샵입니다 룸ㆍ베드ㆍ샤워실이 완비되어있는 토탈뷰티 한자리에서 여러시술 편히 받아보실수있어요 요기조기 방황하시고 유랑생활하셨던 고객님들 한자리에서 뷰티의 모든걸 편안히 즐겨보세요 분위기 넘나 좋은 울샵으로 힐링하러오세욤  ㆍ ㆍ ㆍ 시술종류 옥수동 리버젠상가1층에 위치한 토탈뷰티샵입니다 네일아트패디큐어웨딩네일핸드페인팅 전문 페이스왁싱윤곽관리바디왁싱브라질리언남자왁싱 속눈썹연장속눈썹볼륨펌브로우리프트펌러시안3d속눈썹제거 내성발톱교정관리물어뜯는 손ㆍ발톱교정케어무좀발톱 Lcn레진젤 드릴 각질관리아기발로 리커버리각질관리 ㆍ ㆍ ㆍ ㆍ ㆍ 금요일 저녁 불금 공휴일 먹방 맛있다 가을 좋아요 압구정 한남동 맛스타 옥수동맛집 소통 좋반 옥수동 압구정 한남동 약수동 데일리 insta beauty 맞팔 nails daily
881,2020년 10월 9일,똥집튀김갓모어치킨치즈볼먹방먹스타그램
882,NaN,NaN
883,2020년 10월 9일,낮술과 데이트하기 딱 좋은 와인바를 소개합니다 문래동에 있는 포도술 은 창작촌 아주작은 골목 안에 위치해 있는 와인바 입니다 특히 요즘같이 날씨 좋을때 가면 창작촌 특유의 분위기와 맑은 하늘이 어우러져 와인맛이 두배로 맛있어지는 매직을 경험 하실 수 있을거에요 오늘 마신 레드와인은 사실 풀바디감을 예상하며 시켰는데 끝에 올라오는 텁텁한 맛이 좀 아쉬웠어요 그렇지만 시킨 안주랑 먹으니 어우러지는 듯 그 뒷맛을 보안해주는거 같아서 좋았어요 치즈 크래커에는 꿀에 트러플을 가미한 디핑소스가 나왔는데 생각보다 트러플 향이 강하더라구요 그런데 또 꿀과 함께 먹으니 치즈 풍미도 더 살아나고 맛도 훨씬 고소하게 살려줘서 굉장히 만족하면서 먹었어요 친구분들과 가볍게 와인을 즐기시거나 연인과 데이트 하는 곳으로 추천드립다 podosool 와인 치즈크래커 소세지 치즈볼 tt_gaga
884,2020년 10월 9일,진짜 마시따 뿌링뿌링 뿌링클
885,2020년 10월 9일,친정갔는데 엄빠는 모임이라며 나가버리시고 오빠네랑 동네에 있는 Crispy201 다녀옴 다트던졌는데 538점 나옴 생맥한잔 꽁짜  Crispy201 치킨 국물떡볶이 치즈볼 제주맛집 금능맛집 동네맛집 다트잘하면생맥한잔은꽁짜 다트에소질있는듯
886,2020년 10월 9일,Repost toreore_official        또래오래와 함께하는 오늘의 사이드메뉴는  쫄깃쫄깃 떡 덕후들 모여 소떡소떡 매콤한 불닭이 잔뜩 불닭볼 칼칼한 국물이 일품 국물떡볶이 고소한 치즈가 쭈욱 리얼치즈볼  내 최애는 치떡조합 ____ 너도 하나 골라봐  참여방법 내 최애 사이드메뉴 댓글 남기기 경품  추첨을 통해 또래오래 E쿠폰 3명 옥스포드블록3명 증정 페이스북과 동시 진행 이벤트 기간  1012 월 당첨자 발표  1111 수  또래오래 인스타그램 팔로우까지 하면 당첨 확률 UP  10월 이벤트 알아보기 10월 31일까지 요기요에서 치킨불닭볼세트 3천 원 할인 요기요에서 치킨치즈볼세트 3천 원 할인 배달의 민족 매주 수요일 3천 원 할인  10월 7일  10월 13일까지 단짠윙봉치즈볼 세트 7000원 할인  고추단짠윙봉 단짠윙봉 콘듀치킨 갈반핫반 오곡후라이드 치즈볼 리얼치즈볼 불닭볼 소떡소떡 국물떡볶이 요기요 배달의민족 농협 신상치킨 치킨추천 치킨맛집 또래오래 목우촌 할인 프로모션 배달음식 야식 치킨스타그램 배달의민족 요기요 10월 10월할인
887,2020년 10월 9일,정읍은 쌍화탕이 유명하지요    정읍 사는 울 혜영쌤 추천으로 간 곳인데 너무 맛있게 잘 먹었어요 haeum_piano 소개 감사해용   저는 요런 거 진짜 좋아하거든요 십전대보탕이나 쌍화탕이나 대추차나 요런 거       어르신 취향    다육이를 킵핑해서 기르신다는 엄마를 따라 다육이 세상으로 그른데 5분 둘러 보니 졸리다      다육이는 나랑 쫌 안 맞나      생긴 지 얼마 안된 꽈배기집 청춘당 웨이팅만 20분 소님도 많고 어마어마한데 개인적인 입맛으로는 그냥 쏘쏘       여울음악미술학원 차마루 정읍 쌍화탕 쌍화차 대추차 다육이 뚱뚱이다육이 청춘당 꽈배기 핫도그 치즈볼
888,2020년 10월 9일,찹쌀대왕 원곡점 OPEN   커피꽈배기 맥주핫도그 찹쌀대왕   국내산 신선한 재료로 100수제로 만들어 맛있는 음식과 영양간식을 제공하고 있습니다 위  치  단원구 원곡동 8258번지 영업시간 09302130 단체주문 031495510   원곡동 원곡동맛집 원곡동맛집추천 대왕핫도그 명품찹쌀꽈배기 명품 찹쌀꽈배기 콩고물꽈배기 꽈배기 찹쌀카스테라꽈배기 카스테라꽈배기 설탕꽈배기 찹쌀감자야채고로케 치즈볼 찹쌀견과류도너츠 모짜렐라치즈 핫도그 통모짜핫도그 반반핫도그 고구마도너츠 고구마 설탕 도넛 도너츠 고로케 깨끗한기름 수제음식 신선한재료 배달의민족 요기요
889,2020년 10월 9일,내게닭을보내온당신께감사하며 첫양념치킨군말없이흡입하였소 비비큐는후라이드양념둘다매워서 모유는한타임걍유축해서버리는걸로    불금 힐링푸드 갑분닭 비비큐 반반세트 치즈볼 고마워  
890,2020년 10월 9일, 오리고기 볶음밥과 계란 스크램블을 준비해놓고동생이 먹자고 졸랐던 김치치즈탕수육을 시켰다 이미 어디서 먹을지도 정해놨더라  그래 치즈가 이정도는 올라가있어야지 양도 적당히 많고 맛있기도했다김치가 조금더 많았으면 좋겠어서 담번에는 김치를 추가할 생각  서비스로 주신 치즈볼이랑 떡도 맛있었다서비스인데도 넉넉하게 주셔서 완전 좋았음_최근에먹었던 마슬랜이랑 가격도 별로 차이 안나는디 양도 많고 훨씬 맛있었음 그리고 역시 김피탕은 계란이랑 밥이랑 먹는게 짱임    리얼안심찹쌀탕수육 구리김피탕 리얼안심탕수육 안심탕수육 김치치즈탕수육 김치탕 김피탕 치즈볼 볶음밥 오리고기볶음밥 배달음식 구리배달맛집 배달음식 찹쌀탕수육 김치치즈 탕수육 치탕 먹스타그램 맛스타그램 먹방일기 집밥그램
891,2020년 8월 25일,협찬 리얼치즈스틱  리얼크림치즈볼 냉동실에 꼭 있어줘야 하는 친구들    에어프라이어에 8분 돌리고 떡볶이까지 준비하면 그냥 환상의 조합 역시 뭘 먹든 제대로 먹어야 해    치즈 쭈욱 늘어나는 거 너무 좋고 크림치즈 들어있어서 더 맛있고 오늘 하루도 배부르게 잘 먹었다
892,2020년 10월 9일, 이제서야 먹는 치킨 치킨 먹고싶을때까지 기다리다가 드디어 존맛탱 선물해준 pig___let 에게 감사 치킨 치킨스타그램 먹스타 먹스타그램 먹팔 웅디먹스타 bhc치킨 bhc bhc치즈볼 치즈볼 후라이드치킨 치킨추천 치킨맛집 치즈볼맛집 기프티콘 맞팔 선팔
893,2020년 10월 9일,출출해윤 자담치킨 치즈볼 크기는작지만맛있당
894,2020년 10월 9일,운동전후론 체온유지하면서 조금이라도 안전하게 감기라도 걸림 안좋잖아  근데 집에가니 이리또 이건아니잖아 근데 왜케 맛나 오늘은 탄단지 다들 즐금  가을성큼 가을성큼 가을운동복 운동복추천 추운날운동 건강챙기기 감기조심 경성도너츠 치즈볼 꽈배기 맞좋 맞팔 선팔 likeforlikes followforfollowback follow 좋반테러 좋반 팔로우 좋아요
895,2020년 10월 9일, 집콕 한글날 원래도 어디 안나가는 가족이라 사람 많고 차 막히는 연휴엔 더 집 점심은 윤이가 픽한 바지락칼국수 저녁은 남편이 선물받은 기프티콘으로 치킨 오늘 점심 저녁 다 배달 좋구만 점심 먹고 후식은 내가 좋아하는 희한한군고구마 반개 글고 이건 며칠전에 먹은건데 앙꼬바 흑미흑임자 이거 넘 맛남 크기가 좀만 더 컸으면 좋겠는데    한글날 애들이지은 삼행시 집콕 연휴엔 먹고자고먹고 배달음식 아리수칼국수 바지락칼국수 김치만두 bhc 뿌링클 맛초킹 치즈볼 희한한군고구마 앙꼬바흑미흑임자
896,2020년 10월 9일,요즘 이래저래 바쁘고 멘탈 탈탈이라 인스타 글도 못올리고 너무 힘빠져서 치킨시켰당 뿌링클 존맛탱
897,2020년 10월 9일,이틀 동안 달달치사량 초과    배스킨라빈스 배스킨라빈스초코케이크 배스킨라빈스엄마는외계인 베스킨라빈스 아이스크림 미찐감자 바닐라아이스크림 라면 치즈라면 크림진짬뽕 죠리퐁아이스크림 후리이드치킨 bhc 맛초킹 콤보세트 치즈볼 먹스타그램 냠냠 냠냠 배불러 yummy imfull       
898,2020년 10월 9일,야식메뉴 치킨 치즈볼 닭다리1씩잡고 기름범벅 가루범벅 재잘재잘 근데귀여워 마냥이쁜내새끼들 
899,2020년 10월 9일,Eroom의 24번째 게시물 유튜브 채널 네고왕광희 에서 네고된 BBQ 의 메이플버터갈릭치킨 이올시당 달달한 치킨에 짝꿍은 불닭볶음면 매콤한 불닭볶음면 을 먹고 달달한 치킨 메이플버터갈릭치킨 을 먹으면 매운맛 중화 가능 메이플버터갈릭치킨 은 마늘빵 소스를 치킨에 찍어 먹는 듯한 느낌이었는데 치킨이 쪼꼬미  내 스탈은 아니었 혹시 몰라서 선택할 때 반반으로 황금올리브치즈볼 했는데 현명했던 선택쓰  맛집 맛집스타그램 먹스타 먹방스타그램 먹스타그램 음식 음식스타그램 선팔먹팔소통맞팔 네고왕광희BBQ메이플버터갈릭불닭볶음면황금올리브치즈볼
900,2020년 10월 9일,투다리 치즈볼 만두 은행 왠일로 2차
901,2020년 10월 9일,풀영상은 유튜브에 있습니다 ASMRMellawnie ASMR eatingsounds eatingshow mukbang firenoodles spicynoodles samyangnoodles cheeseball crispysounds 먹방 리얼사운드 치즈볼 불닭볶음면 食べる音 咀嚼音 チーズボール プルダックポックンミョン
902,2020년 10월 9일,타락한 헬창  프로필 끝나고 벌크업 중 이틀밖에 안 됐지만 회개주말 갑시다읏 
903,2020년 10월 9일,Repost toreore_official        또래오래와 함께하는 오늘의 사이드메뉴는  쫄깃쫄깃 떡 덕후들 모여 소떡소떡 매콤한 불닭이 잔뜩 불닭볼 칼칼한 국물이 일품 국물떡볶이 고소한 치즈가 쭈욱 리얼치즈볼  내 최애는 치떡조합 ____ 너도 하나 골라봐  참여방법 내 최애 사이드메뉴 댓글 남기기 경품  추첨을 통해 또래오래 E쿠폰 3명 옥스포드블록3명 증정 페이스북과 동시 진행 이벤트 기간  1012 월 당첨자 발표  1111 수  또래오래 인스타그램 팔로우까지 하면 당첨 확률 UP  10월 이벤트 알아보기 10월 31일까지 요기요에서 치킨불닭볼세트 3천 원 할인 요기요에서 치킨치즈볼세트 3천 원 할인 배달의 민족 매주 수요일 3천 원 할인  10월 7일  10월 13일까지 단짠윙봉치즈볼 세트 7000원 할인  고추단짠윙봉 단짠윙봉 콘듀치킨 갈반핫반 오곡후라이드 치즈볼 리얼치즈볼 불닭볼 소떡소떡 국물떡볶이 요기요 배달의민족 농협 신상치킨 치킨추천 치킨맛집 또래오래 목우촌 할인 프로모션 배달음식 야식 치킨스타그램 배달의민족 요기요 10월 10월할인
904,2020년 10월 9일,오랜만에 뿌링클    창원우리집bhc뿌링클치즈볼맛스타그램 먹스타그램먹짤foodstagram팔로우좋아요밍또먹밍또어디가밍슐랭
905,2020년 10월 9일,오랜만에 뿌링클 치즈볼 짭쪼롬해서 아주 콜라가 물처럼 맥히는구나   일상치킨뿌링클뿌링클치즈볼뿌링클치킨치킨먹벙먹스타그램먹방치즈볼오빠랑저녁밥꿀꿀
906,2020년 10월 9일,치킨은 익산BHC동부오거리점      익산 전주 군산 전북대 객사 객리단길 bhc치킨 bhc 동부오거리점 치킨 주문많이해쥬세요 뿌링클 치즈볼 맛초킹 레드킹 핫후라이드 골드킹 선팔 맞팔 선팔하면맞팔 좋튀 좋아요 좋아요반사 좋아요테러 dm
907,2020년 10월 9일, 밀단 챌린지 중이였는데  평상시에 시켜 먹지도 않는 피자를 다 먹었어요  거기에다 맥주까지  밀가루 먹지말자고 하니 피자가 당길 줄이야    진짜 잘 먹은듯  야식타임
908,2020년 10월 9일, 한글날 공휴일 출근 그리고 퇴근   아드님은 오늘도 내일도 약속있으시고 나는 퇴근해서 뒹굴거리다가 출출해서 냉동실에서 숙면중이 치킨이랑 치즈볼꺼내서 에어프라이어 힘을 빌려서 매운간장치킨 만들고 따끈한 치즈볼 or 까망베르치즈 담아서 혼자 한잔하도록 하겠습니다   혼술 일상 집콕 혼자놀기
909,2020년 10월 9일,유자 오픈 축하축하 대박나자   치킨 제주 삼도동 제주맛집 오픈 축하해 떡볶이 치즈볼 존맛탱
910,2020년 10월 9일,오늘 내 최애 misodogi 나 호강시켜줌 머리도 갬겨주고 맬려주고 너무 좋앙 아주 상쾌해  뀨우 맘스터치 근손실 햄버거 세트에 치즈볼 매우 환상적  오늘도 타락한 헬린이를 용서하소서 아멘    입원3일차 충대병원 병문안 핵존맛 맘스터치 치즈볼 머리감은날 상쾌한공기 음좋아 타락한헬린이 헬스 운동하는여자 헬창이되고싶은헬린이 헬린이 헬창 염증과싸우는중 이기자 빨리나아서 헬스클럽 운동 갈꺼야
911,2020년 10월 9일, ㆍ ㆍ 20201008 목요일 저녁메뉴 ㆍ ㆍ ㆍ ㆍ ㆍ ㆍ ㆍ 치킨먹으러 발걸음 옮긴 맘스터치 후레이크갈릭치킨 싸이버거 바삭크림치즈볼 햄버거를 몇개월만에 보는건지 봉인해제 한듯 순식간에 흡수시켰다  치즈볼 와우 처음 먹어봄 입을 데었지만 이런 맛이었다니 완전맛있어  이제야 맛보다니 먹는동안 복덩이 태동도 활발하고 신기하다  23주임산부 임산부저녁식사 임산부먹방 임산부힐링타임 친구랑수다삼매경 친구딸램이랑 셀카놀이 임산부일상기록
912,2020년 10월 9일,bhc bhc치킨   bhc뿌링클 bhc치즈볼  다들 뿌링클 한번씩 먹어봤지요 이건 무슨일이 있어도 한번은 먹어야해요 왜냐면 너무 맛있기 때문이죠  거기에 치즈볼은 또 얼마나 맛있게요  허허 치킨 먹은지 얼마나 됬다고 또 치킨을 먹는지 워낙 많은 종류를 가지고 계신 치느님 이번 생에 맛을 다 볼 수 있을까요
913,2020년 10월 9일,협찬 떡볶이치즈볼 덕후 주목 대왕치즈볼이 들어간 존맛탱 신상떡볶이 리뷰해봄   오늘의 냠수증 주인공은 청년다방 신메뉴 핫크림치즈볼떡볶이 이야   떡볶이 강자 청년다방이 야심차게 내놓은 핫크림치즈볼떡볶이는 먹방 유튜버 떡볶퀸 이랑 콜라보해서 나온 야심찬 신메뉴야 비주얼에 놀래고 맛에도 놀래는 이 메뉴는 대왕 치즈볼 과 크림소스가 들어간 매콤달콤 떡볶이 가 만나 너무 맛있는 역대급 존맛탱 메뉴임   대왕치즈볼을 가르면 쫀득하고 달달한 모짜렐라치즈 주르륵 흘러 치킨집 치즈볼보다 못할거라는 생각은  달달하고 쫀득한게 떡볶이 소스와 함께 먹으니까 너무 맛있느는거 있지 심지어 오래 담궈도 소스맛이 진하게 촤르르 잘베어 더 맛있더라  먹는걸 멈출수 없을 정도로 토핑도 두둑하니 한끼 안먹어도 될정도야 기다란 밀떡볶이를 가위로 찹찹잘라서 먹는 재미도 있으니 일석이조랄까   가장 추천하고 싶은건 후식 볶음밥 국물을 조금 남겨서 밥이랑 볶아먹으면 로제리조또 완성 아삭한 김치랑 날치알과 함께 먹으니까 그냥 볶음밥보다 훨씬 맛있었어 꼭 볶음밥 추가해서 먹어보는걸 추천  떡볶이스타그램 떡볶이추천 청년다방추천 치즈볼추천 치즈떡볶이 먹스타그램 푸드스타그램 맛스타그램 먹팔 맞팔 먹스타
914,2020년 10월 9일,비비큐 황금올리브닭다리 치즈볼 치즐링 허니갈릭스 dessert39
915,2020년 10월 9일,드디어 먹어보는군 0  bbq 광희나는메이플버터갈릭치킨 치즈볼 비싸 배달료개비싸 그래도 광희땜에먹는다 네고왕 개꿀잼
916,2020년 10월 9일,오늘 저녁은 피자 잇님들도 맛있는 저녁 식사하세요 불금 저녁메뉴 피자 치즈볼 완전좋아 졸맛탱
