,date,title
256,2020년 10월 13일, 바른치킨 수원만석점  그래용 저 수원왓어요  수원 친구집에서 하룻밤 자면서 우리인친님 가게에 가서 치킨한마리 시켜왓어용  인절미치킨 첨 먹어보는데 인절미가루 퐉퐉 뿌려진게 딱 제 스타일이네요  김말이튀김에 떡볶이까지  오늘 야식도 과식 근데 저 치킨 중간중간에 잇는 고구마큐브와 인절미치즈떡인가요 이게 진짜 매력포인트  너무 잘먹엇슴돠 사장님  수원님들 sujeong6854 치킨 많이 시켜드세욤 내일 그동안 등산버킷리스트 엿던 산을 등산해야하니 저는 이만 사라질게염     내일등산갑니다 어디가게유   바른치킨 바른치킨수원만석점 바른치킨 수원바른치킨 수원치킨 수원치킨맛집 치킨맛집 치킨추천 치킨 인절미치킨 인절미 치즈볼 김말이튀김 떡볶이 치즈떡볶이 수원맛집 맛집 맛스타 맛스타그램 야식 야식스타그램 야식추천 야식메뉴 야식타임 수원 내돈내산후기 내돈내산 낼등산피드에서만나요
257,2020년 10월 12일,요즘 핫한 치킨 먹어봤습니다 맵슐랭치킨  처음엔 친동생이 알려줘서 알게된 치킨이였어요 자담치킨처음 들어보는데 했는데 피드와 인스타 검색해보니 떠오르는 치킨이더라구요 일단 딱 첫입 먹었을때 그냥 처음 먹어보는맛이였어요 같이 먹은 친구는 맵다고 했는데 제 입맛엔 맵다 보다는 뒤에 살짝 알싸한맛 나는정도 저 하얗게 보이는게 특제마요소스라는데 뭔가 달달한 맛도 나니 맛있었어요 치요링치즈볼은 뿌링클 가루 뿌린 느낌인데 JMT  자담치킨 맵슐랭치킨_19000 치요링 치즈볼_4000  맛스타 먹스타그램 맛스타그램 치킨스타그램 배달음식추천 자담치킨 치즈볼 치요링치즈볼
258,2020년 10월 12일,얘 때문에 배탈남 치즈볼 비에이치씨 치즈 먹스타그램 맛스타그램 맛집 먹방 fwf food followforfollowback likeforlikes like4likes
259,2020년 10월 12일,첫줄안녕 청년다방 에서 요즘 핫하게 홍보하고있는 핫크림치즈볼떡볶이 뿌시고왔습니다  가게명 청년다방 군포산본점 위치 경기 군포시 산본로343번길 23 메뉴 핫크림치즈볼세트대 31500 다모아 튀김 9500  맥주 5개  비주얼은 매우 훌륭합니다  느끼한 걸 싫어하시는 분이나 많이 매운걸 즐기시는 분이면 추천하지않습니다  2명의 차돌파들은 차돌이 낫다고 주장 호불호가 있을듯하고 맵기는 순한맛과 매운 맛 두가지만 선택할수있는데 매운맛이 맵찔이인 저한테 크게 맵지않았습니다  다들 월요일 잘 보내셨나요 피드는 여기까지 쓰고 자러갑니다
260,2020년 10월 12일,   월화수목금금금   매일매일 매매리부트  매일매일리부트  지금이순간을사는것  일요일도퐈이아 건강공부중 공주클럽 폭풍수다 고속충전중 떡볶이그램 납작만두 튀오뎅 튀만두 치즈볼 대구스터디 감사한인연  감사한시간  간절함
261,2020년 10월 12일,육십계 치즈볼 맛스타그램 먹스타그램 맛집
262,2020년 10월 12일,6동 투다리를 좋아하는게 후라이가 기본안주야 이거만해도 한병 순삭이야          안양 안양6동 투다리팸 투다리 김치우동 계란후라이 닭껍질꼬치 돼지껍데기 치즈볼 은 bhc 양배추사라다 일상 퇴근
263,2020년 10월 12일,아직도  CU갔다가 왔는데 아직 치즈볼이 안 나와서 돈 준비하고 방송얘기하면서 기다리고있습니돠 아직도 안나왔다 치즈볼 BHC 돈준비완료 소현이가_찍어준거
264,2020년 10월 12일,광희나는메이플버터갈릭치킨 bbq 치즈볼 존맛
265,2020년 10월 12일,BHC  오늘은 노랑색편 먹방촬영날이여서 콜팝이랑치즈볼 사러왔지요 BHC 치즈볼 뿌링콜팝 먹스타그램 촬영날 사러옴 학교마친뒤
266,2020년 10월 12일,푸라닭냄새에 미쳐  치킨 푸라닭 블랙알리오 명랑핫도그 치맥치즈볼 야식 맛스타그램
267,2020년 10월 12일,할매랑 데이트    청년다방 청년다방떡볶이 치즈볼 차돌떡볶이 청년다방차돌박이떡볶이 감자튀김 jmtgr 존맛 food 먹스타그램 떡볶이
268,2020년 10월 12일,태안여행 마지막 3박 4일 순삭 조식은 삼겹살 스팸고추장찌개 후식은 과일에 미니퍼스트 1리터커피 텐트접고 아쉬워서 컵라면까지 천리포해수욕장 꽃사과 천혜향 스팸고추장찌개 까르보나라떡볶이 치즈볼 길바닥라면
269,2020년 10월 12일,올만에 햄버거쓰 맘스터치 딥치즈버거 치즈볼 불고기버거 저녁 먹스타 맛스타그램 먹부림 월요일
270,2020년 10월 12일, 야식은 치킨이G  여러분 오랜만이여요 사실 제가 정말 제 인생 마지막 다이어트로 생각하고 열심히 식단이랑 운동을 하고 있는데 인스타 들어오면 다들 음식 사진을 너무 잘찍으셔서 참을 수가 없더라구여 그래서 많이 못들어왔었는데 얼마전에 알바생회식을 해서 치킨을 먹으러 가게 되었답미당에휴 다이어트 망했네요 근데 진짜 오랜만에 먹으니까 너무너무 맛있어서 여기다 올리고 싶었어요  썬더치킨 제가 대전에 있을 때 정말 자주가던 치킨집인데 공주와서도 있어서 먹었는데 여기가 더 맛있는 것 같아요 어니언 순살치킨과 간장순살치킨 감자튀김 모듬소세지 스윗치즈볼까지 진짜 다 먹고온 것 같은데 진짜 다 짱맛  여기 그리고 셀프바에 감자칩있는데 그게 진짜 별미입니다 진짜 최고입니다 꼭 드셔보세요  또 먹고싶어지니까 이만 사라지겠습니다 뿅  썬더치킨 짱맛 jmt 간장치킨 순살치킨 어니언치킨 감자튀김 소세지 치즈볼 미쳤다 야식 야식스타그램 야식추천 맛집 맛스타그램 맛집추천 먹스타그램 먹스타맞팔 먹방 먹스타 공주맛집 공주 대전 fff followforfollowback following food korea photo chicken
271,2020년 10월 12일,맘스터치 치즈볼
272,2020년 10월 12일,오늘은이거야이거 맛스타그램 먹스타그램 야식스타그램 치즈볼 치즈볼만들기 유튜브 슬기로운제빵생활 업로드완료 구독좋아요댓글 홈베이킹 쉬운베이킹
273,2020년 10월 12일,협찬 그래도진짜리뷰 가치식탁 치즈스틱 자세한건네이버검색 치즈스틱은 적당히 짭쪼롬하고 치즈볼은 달콤해서 좋았습니다 간단하게 구워먹기 편해서 간식으로 잘 먹었어요 치즈볼 냉동식품 냉동간식 간식 리얼치즈스틱 리얼크림치즈볼 치즈 08L
274,2020년 10월 12일,회사 냐냐들 방울 없는 치즈볼 이제 그냥 냥파티다 지옥의 치즈볼 너낌적인너낌
275,2020년 10월 12일,뿌링클 너무 좋아     뿌링클콜팝치즈볼bhc존맛탱존맛탱구리먹스타그램음식음식스타그램쿡쿡스타그램푸드푸드스타그램푸드코드먹는게행복이지뭐소확행맞팔선팔좋아요좋아요반사첫줄반사댓글댓글환영친구모으기집콕여전히먹방중
276,2020년 10월 12일,YoutubeGONGSAM TABLE 이공삼  새우 크림 치즈 퐁듀와 피자 떡볶이 허니버터 핫 칠리 맛 치즈볼 양념치킨 명랑 핫도그 먹방  eatingshow eating asmr mukbang asmreatingsounds asmreating eatingasmr asmrsound mukbangshow mukbangkorean 리얼사운드 먹방 먹스타그램 맛스타그램 야식스타그램 야식 맛집 맛집 핫도그 치즈볼 피자 떡볶이 새우 치즈퐁듀 크림파스타 양념치킨 치킨 핫도그 명랑 corndog pizza
277,2020년 10월 12일,다이어트1일차부터 줫망 스멜다이어트치킨 맥주 치즈볼 경아두마리치킨 맛있음 다이어트는내일부터 좋반 맞팔 인친
278,2020년 10월 12일,노랑통닭 후라이드치킨 깐풍치킨 양념치킨 한마리더시켰는디사진이없네 효또치 치즈볼 먹스타그램
279,2020년 10월 12일,뉴욕버거춘천점 출출할때 아이들 간식으로 때론 커피와 함께 어른들의 요깃거리가 되는 이아이는 프라이팩 입니다용  어니언링 새우볼 치즈볼 감자가 섞여있어 간단히 즐길수 있답니다     뉴욕버거 감자튀김 간식 간식스타그램 프라이팩 치즈볼 간식맛집 어니언링 맛있다그램
280,2020년 10월 12일,경성꽈배기 진짜맛있어요   살빼야하는데 이틀째 시켜먹는중   가을은 천고마비의계절  그렇게 살쪄가는중  경성꽈배기찹쌀도너츠핫도그팥빵치즈볼배터짐쫀득쫀득아메리카노간식타임쿠팡이츠배달최고
281,2020년 10월 12일,메이플 버터갈릭 다들 시켜드세요 대신 2조각이 최선입니다 치즈볼도 맛있어요  내일부터는 리얼로다가 운동 빡세게 2주간 쉬었으니 다시한번 근육통이란 친구를 다시 만나보자 안산 부곡동 퇴근후 직장인 직장인스타그램 비비큐 BBQ 메이플버터갈릭 2조각이한계 치즈볼 먹방 내일부터다이어트 운동가즈아 불태우자 지방과의전쟁 지방과이별 먹스타그램 맛스타그램 선팔 맞팔 소통 환영 좋아요 좋아요반사
282,2020년 10월 12일,B B Q   치킨야식맛스타그램먹스타그램푸드스타그램먹방먹스타맛집탐방아점간식맛있다그램foodstagram일상소통데일리인친맞팔좋아요ootd치킨맛집비비큐치즈볼
283,2020년 10월 12일,트레이더스 흑임자치즈볼 순살치킨 치즈볼이 진짜 쫀득쫀득하고 흑임자맛이 엄청남
284,2020년 10월 12일,  네고왕 댁대리 하나씩 노나먹기 국룰 말모말모 말해뭐해   비비큐치킨 네고왕황광희 이벤트또해주세요 황금올리브치킨 bbq치킨 황금알치즈볼 치즈볼존맛탱 치킨야식먹방 먹스타그램맛스타그램 일상 chicken bbq negotiation dinner food daily
285,2020년 10월 12일,루피 추천 후라이드치킨  후라이드 치킨 주로 어디꺼 드세욥 루피는 네네치킨 이 어제 생각나서 시켜봤어욥 후라이드 를 시켰는데 너무 바삭해 치즈볼 은 치즈가 완전 가득 있었어욥 양념치킨 은 양념이 너무 맛있어서 단짠단짠 하면서 계속 흡입 했다는 저녁 이나 야식 으로 다들 치킨 드셔보세욥  맛집 치킨추천 배달 배달음식 배달의민족 추천 먹팔 먹스타그램 맛스타그램 먹스타 선팔하면맞팔 맞팔 댓글 좋아요 일상 일상스타그램
286,2020년 10월 12일,mellawnie_asmr is eating cheese balls corndogs honeycomb smores dip  marshmallow cookie   im stressing out so much about my exam resultsi honestly just feel like randomly tearing up every single timethankfully asmr has been helpful  honeycomb rawhoney honeycombasmr asmr honeyeater stickysounds rawhoneycomb bhc cheeseball corndog cheesesauce cheesepull cheesyfood koreanasmr koreanmukbang smores mukbangfood dessertasmr marshmallowfluff 치즈볼 스모어 roastedmarshmallows 마시멜로우 toastedmarshmallow mukbangeating 아이스크림 icecreambar magnumicecream crunchysounds crunchyasmr
287,2020년 10월 12일,사이드까지 완벽한 떡볶이집 추천 협찬  한글날에 집에서 쉬면서 소크라테스떡볶이 먹었어요 치킨집은 오후에 문 여는데 떡볶이 집은 일찍 문열어서 너무 좋음 아점 으로 먹기 딱 좋아요  그리고 요즘 떡볶이에 핫도그 같이 먹는게 유행인데 여기는 따로 시킬 필요없이 세트로 시킬 수 있어서 좋더라구요 핫도그는 분리현상 때문에 원래 커팅이 어려우니 참고하세요  전 2단계감성맛에 떡80 어묵20로 먹었는데 어묵 좋아하시는 분들은  어묵80 떡 20로 바꿔서 드시면 돼요 2단계는 맵찔이도 먹기에 딱 괜찮았어요  사이드도 다 먹어봤는데 제 개인적인 입맛 기준에는 튀김푸딩계란찜주먹밥 순으로 추천드려요 튀김이 하나도 안 눅눅하고 바삭바삭해서 핵맛탱  사진에 보이는 구성대로 드시려면 45명이서 먹어도 충분히 배부를 것 같아요 저는 둘이서 점심 저녁 두끼 먹었는데도 많이 남았네요    떡볶이먹방 떡볶이맛집 떡볶이덕후 떡볶이체인점 떡볶이배달 배달맛집 떡볶이핫도그 분식스타그램 분식맛집 치즈볼 떡볶이그램 먹스타맞팔
288,2020년 10월 12일, 오늘은 붕어빵에 치즈볼 간식  치즈볼 존맛탱
289,2020년 10월 12일,교촌허니콤보   간만에먹으니맛나네 이집이잘튀긴건가   고르곤치즈볼 치즈볼에뿌려진 저것이 좀 별로   간만에 맥주랑   맥주안주 치킨 교촌치킨 허니콤보 치즈볼 야식 야식스타그램 안주스타그램 맥주스타그램 소주 막걸리 소통 일상 선팔 맞팔
290,2020년 10월 12일,두찜 로제찜닭 치즈볼  자취방에 혼자라서 시켜먹을까 말까 엄청 고민했지만 나눠먹으려고 그냥 시켜버렸다  이제 배달음식 당분간 금지야  치즈볼 3개에 카스라이트 쪼매난 캔까지 맛저했어용 꽤 많이 남았는데 내일은 남긴 로찜 마저 먹구 내일모레는 남은 양념에 밥 비벼서 두끼씩 해결해야지  그나저나 빨리 종강하고싶다 지금 다가오는 시험이 중간이 아니라 기말이었으면 대학가면 누가 논다고 구라쳤냐 고딩때보다 더 힘들다 
291,2020년 10월 12일,추욱 처지는 헬욜 당떨어진다 헬요일 너모 피곤쓰 힘들  먹스타 먹스타그램 bbq 황금올리브치킨 bbq모듬볼 모듬볼 쇼콜라볼 더블치즈볼 고구마치즈볼 치즈볼 네네치킨 후라이드 스위트치즈볼 연유볼 네네스위틱 수제미니핫도그 미니핫도그 돼지코생곱창갈비 양념막창 막창 주먹밥 계란탕
292,2020년 10월 12일,치킨 마늘치킨 순살 치즈볼 치킨은살안쪄 치즈볼살안쪄 꿀떡 다이어트 맛집 먹방 먹스타 맛스타그램 먹스타그램 먹스타 맛집 맛집추천 맛있게먹으면0칼로리 
293,2020년 10월 12일,요즘 잘먹는 치즈볼 발레 끝나고 먹으니 더 맛나네 롱치즈스틱 보담 더 달콤한맛  7세딸 청말띠딸 딸스타그램 치즈볼 버거킹치즈볼 하원후일상
294,2020년 10월 12일,광고  퇴사를 축하해주신 BBQ감사합니다 제 소원은 평생 놀고먹는 돈많은 백수되기 입니다 요즘 핫한 치즈볼케이크로 자축했습니다 귀여운데 맛있기까지한 치즈볼 칭찬해 쌩얼에 잠옷은 무시바람  bbqchickeninsta 케이크 생일케이크 치즈볼 비비큐치즈볼케이크 BBQ치즈볼케이크 치즈볼케이크 비비큐치즈볼 BBQ치즈볼
295,2020년 10월 12일,역시 뿌링클은 날 실망시키지 않아 반마리에 치즈볼까지 혼자서 야무지게 잘 먹었당 치킨 뿌링클 치즈볼 bhc치킨
296,2020년 10월 12일,  20201012  휴일의 마지막은 치맥  맵찔이는 맵소사 소스 주의     치맥 카스 bhc 뿌링맵소킹 치즈볼
297,2020년 10월 12일,감자의꿈 편스토랑 편의점신상 치즈볼 편스토랑보고 먹고싶어삼  그냥먹으니 치즈가 부족한거같아 강제 치즈투척  맛나게 먹겠습니다 
298,2020년 10월 12일, 뿌링클은 오랜만에 먹어야 맛있는겨
299,2020년 10월 12일,        애월맛집 중문맛집 고기먹자 먹는재미 수성못맛집 사천탕수육 치즈볼 대구맛집 기네스 빵쟁이 집밥 울산맛집 강남반영구 반영구 눈썹문신
300,2020년 10월 12일,시너지디톡스를 하면 신기한 일 투성이  피곤함이 사라지고 낮잠도 안자니 시간활용에 좋고 커피도 안땡겨요  라는 고객님   직접 겪으면서도 계속 신기방기   인체의 신비 디톡스는 과학    문의는 카톡으로 bigsmile012 상담신청은 sha_ssam 프로필링크 클릭
301,2020년 10월 12일,  포도쨈 만들다가 급 푸라닭 밥이랑 멱국이랑 같이 냠냠 하투하투 고추마요 첨 먹어보는데 맛있네 와사비마요진짜 소스가 걸죽 진한게 괜찮아 양식요리 먹는 느낌 좀 느글느글 하다 싶으면 멱국에 김치하나 올려서 좀 먹고     차밍푸드 치킨 푸라닭 푸라닭치킨 고추마요치킨 치킨맛집 치킨추천 푸라닭문현점 서면점 오늘 쉬는날인가 블랙치즈볼 치즈볼 미역국 생일상 셀프생일상 야식 야식추천 집밥 홈쿡 홈파티 까르보나라치킨 와사비치킨 서면맛집 전포동맛집 문현동맛집 chicken foodstagram foodporn kfood koreanfood instafood
302,2020년 10월 12일,멕시카나 ෆ 불닭치킨 ෆ 더블치즈볼  매운 치킨 땡길 때 먹는 불닭치킨 생각보다 덜 맵지만 먹다보면 매워서 치킨무랑 치즈볼로 중화해주고 양념도 맛있어서 치밥으로 먹어도 꿀맛
303,2020년 10월 12일,좋은 사람들과의 식사 준비는 즐거워  정신없지만 생각한 대로 착착한 완수 근데 플레이팅 피자 찌그러진 거 모냐 파슬리가루 왜 빼먹냐 당근 꽃 배열 마지막에 망가짐 
304,2020년 10월 12일,돼지파티 족발 치킨 비빔국수 치즈볼 샐러드 요즘 매일매일 돼지파티 중이라 피드를 못올려용  전 이렇게 모든음식 모라놓고 한입씩 번갈아가며 먹는걸 좋아한답니당  ᴗ 
305,2020년 10월 12일,Todays dinner 뿌링클 또링클 치즈볼       선팔맞팔 맞팔 팔로우 먹팔 좋반테러 음식 음식스타그램 먹스타그램 좋반 좋아요반사 좋아요테러 일상 today menu
306,2020년 10월 12일,순대볶음에 와인이 은근 꿀조합이랍니다 럭셔리 그릇들에 순대볶음이라니 언발란스하지만 임페리얼포슬린에 안 어울리는 음식은 없죠 스토리에서 미리 보여드렸던 추가된 구성인 그릇3개 모두 사용해봤오요  러시아황실 도자기 임페리얼포슬린 코발트넷에 쯔비벨 보르도 블루 보르도 레드도 있오요 이 조합이 딱 부부의세계 한소희 아빠 회장님댁 그릇세팅이었죠 쯔비벨보르도 수입물량 얼마나 기다렸는지 몰라요 이번주 목요일에 한정수량으로 만날게요  임페리얼포슬린 쯔비벨 2단트레이 이번주 목요일 공구오픈
307,2020년 10월 12일,매번 감사합니다 이런 과분한 챙겨주심과 배려도 얼마 남지 않았네요  치즈볼 치킨 피자
308,2020년 10월 12일,택배보내고 너무 허기저서 먹은 분짜와 반미  강동에 손꼽는 맛집 반미의 빵이 진짜 예술임  겉바속촉의 대표 대체 빠리바게트는 이런 빵 왜 못만듬  그냥 바게트가 아님 베트남식으로 직접 굽는거 같은데 암튼 최고의 맛  up_n_down84
309,2020년 10월 12일,운동끝나고 치즈볼을 먹을까 말까   그놈의맘스터치치즈볼
310,2020년 10월 12일,청년다방_압구정  요즘 진짜 치즈볼이 대세죠 쫌 늦었지만 드뎌 영접한 청년다방 신메뉴  다들 극찬하셔서 기대 진짜 많이했는데 기대이상으로 진짜 대존맛이였습니다ˊᗨˋ  위에 치즈볼이 진짜 흉내만 낸 치즈볼이 아니라 진짜 맛있는 크림치즈 그득그득 넣은 쫜득한 놈이었어요 치킨이랑 떡볶이 국물 조합도 너무했구다 맛있어서 울면서 먹었어요 버터갈릭포테이토는 진짜 말모말모  다들 신메뉴 먹으러 꼭 가보세요 제발요  _ 홈뇸뇸지_압구정
311,2020년 10월 12일,16세 맞냐고  말걸면 무서워서 쫄릴듯  shs_84
312,2020년 10월 12일,33개월 루유아식  우리밀 치즈볼 귤 브로콜리버섯리조또
313,2020년 10월 12일,맘스터치 맘스터치치즈볼 바삭크림치즈볼 3500 4개  겉 바삭  쫀득 찹쌀  연유슈크림크림치즈 충격적일정도로 맛있었음 이제껏 맘터 치즈볼 안먹고 뭘먹고 산걸까 속의 크림이 치즈맛이 많이 나지 않아서 부담스럽지 않다 모짜렐라 아님 달달한맛 앞으로 치팅때 맘터 치즈볼 먹는다  치즈볼 맘터 맘터치즈볼 레전드 크림치즈볼
314,2020년 10월 12일,우기asmr 우기_asmr 네네치킨 네네치킨청양마요 감자튀김 치즈볼 네네치킨먹방 먹방 asmr asmreating eatingsounds eatingshow realsound mukbang 맞팔 선팔 likeforlikes flowers
