,date,title
0,2020년 10월 12일,광고공구예고  안녕하세요 뚜뚜네간식 뚜맘입니다  오래 기다려주신 오크리스피 최저가공구  드뎌 데려왔어욜 꺄아아아  이번에는 신제품 쫀쫀초코볼에  선착순 100명 오도닭 증정 이벤트  까지  취향껏 고를수 있는 알찬 구성  뚜뚜네서만 가능하다는 거 아시죠  공구 때 마다 넘치는 물량 때문에  공구기간을 길게는 못 잡아요  이번에는 꼭 놓치지마세요  어린이어른이 간식으로 쵝오오오  내일 오후 3시 알람설정 필뚜    뚜아뚜지 오크리스피 에어프라이어간식 멘보샤코코넛쉬림프 오도닭치즈볼초코볼 쫀쫀치즈볼쫀쫀초코볼 아이간식간식야식안주 최저가공구
1,2020년 9월 24일,오백예순두 번째 호기심까까  노브랜드버거 인절미치즈볼3알2900원   리뷰요청지에서 눈길을 사로잡은 한 알바분의 열띤 영업   노브랜드버거 버거 맛없어서 평소에 잘 안가는데  사이드라서 방문해봤어요   인절미 치즈볼이라니 이름부터 걍 침 주루룩   딴딴하게 잘 튀겨진 치즈볼 한 입 베어물어보니 허우허   진짜미쳤구만 너무 맛있습니다 내취향이야   겉은 콩고물설탕  꼬소롬 달콤달콤 속은 모짜렐라치즈  짭쫍짭쫍 고소 약간 치즈볼 꼬북칩 인절미ver    추천해주신 알바분 진자내가 가만안둬   여태 먹어본 치즈볼중 최고였던 호까 취향 신상이었습니닷   노브랜드버거노브랜드신세계치즈볼인절미치즈볼인절미할미입맛할매입맛치즈스타그램신상리뷰호기심까까_별5점호기심까까_노브랜드버거맛스타그램먹스타그램호기심까까
2,2020년 10월 13일,교촌치킨 사이드 신메뉴 3종   치킨만 먹기 허전할 때 추가해서 먹으면 꿀맛이겠됴    꽈배기는 굉장히 쫄깃하고 시즈닝이 들어가 있어서 진짜 맛있었구   칩카사바는 일반 감자칩에 비해 더 바삭하고 담백해서 맛도링   글구 갠적으로 젤 맛있었던 통통치킨카츠   쓰면서도 또 먹고 싶은  제대로 겉바속촉이라 식감이 너무 좋았어요  동봉된 교촌 소스 2종 골고루 찍어 먹으니 넘 행복했어요 히히  내 위 왜 작아   광고 지만 정말 맛있었던 사이드 신메뉴들   교촌 교촌치킨 사이드메뉴 사이드메뉴맛집
3,2020년 10월 3일,BHC 핫 뿌링클 콤보    asmr asmreating asmrfood mukbang mukbangasmr mukbangkorea eatingsounds eatingasmr eatingshow instafood foodoftheday 먹방 유튜버 유튜브 뿌링클 뿌링클콤보 치즈볼 소떡소떡
4,2020년 10월 8일, 맵소사 여러분 이렇게 예쁜 케이크 보셨나요 자기들도 사느라 바쁠텐데 참 우리 딸이랑 아들이 배씨치킨 오픈 100일이라고 먹음직스러운 맵소킹 닭다리 와 치즈볼을 올린 케이크를 준비했다네요  이렇게 응원해주는 가족이 있으니 앞으로도 제대로 된 치킨길을 위해 열심히 으쌰으쌰 해야겠죠  어느새 100일이 된 배씨치킨 여러분의 응원도 듣고 싶습니다 댓글로 배씨치킨에 들려주고픈 응원 메세지를 남겨주세요  감사한 마음과 함께 작은 선물도 보내 드릴게요  이벤트 기간  108목1021수 당첨자 발표  1026월 경품  골드킹 한마리  치즈볼  콜라 125L  배씨치킨 수건 20명  배씨치킨 팔로우는 필수   배씨치킨 bhc 오픈100일 100일잔치 이벤트 축100일기념 맵소킹 치즈볼 치킨스타그램 맛스타그램
5,2020년 10월 6일,신전 떡볶이 닭껍질 튀김 고구마치즈볼 김말이 고추튀김  오랜만에 신전 고구마 치즈볼이 너무 먹고싶어서 시켜먹었는데 요즘에는 사이드 메뉴가 너무 잘 되있어서 너무 좋네요  먹스타그램 먹스타맞팔 먹스타 맛스타그램 맛스타 푸드스타그램 푸드 foodstagram food 떡볶이 떡볶이스타그램 떡볶이맛집 신전떡볶이 신전튀김 치즈볼 닭껍질튀김
6,2020년 10월 13일,노랑통닭 심색치킨 골라 먹는재미가 있죠 내가 먹고싶은맛 다 먹을수있어서 좋아요  그래도 노랑통닭은 후라이드치킨이 진리 치즈볼은 더 진리  노랑통닭 치즈볼
7,2020년 10월 6일, 일주일에 떡볶이 최소3번 먹는 떡볶이덕후로서 이 집 진짜 찐으로 잘함 크림소스  짱맛탱 요즘 대란이라는 치즈볼떡볶이 저는 크림떡볶이로 업글해서 만들어먹었어용  밀키트라 들어있는 재료 걍 때려넣고 바글바글 쫄여주면 10분컷 끝입니둥 그리구 에푸에 돌린 튀김이랑 튀김도 천연떡볶이에서 구매가능 치즈볼은 쿠캣치즈볼  여기 크림소스가 진짜 개찐해서 한입먹고 컥 이거 소주안주야했다는요 꼬숩꾸덕하고 짭조롬한데 치즈볼 올려주니깐 단짠짠 진짜 꼭 먹어봐용 짱맛탱 글구 파스타면도 있어서 탄수화물덕후는 대대만족 크림떡볶이는 cy_tteokbokki   송키야매요리 천연떡볶이 떡볶이 떡볶이맛집 떡볶이택배 밀키트
8,2020년 10월 12일,오늘의 야식은 치킨 이에용  치킨매니아에서 메뉴를 야심차게 준비했어요  싹쓰리치킨세트에용 양념되있는건 처갓집 슈프림치킨 후라이드는 비비큐 황금올리브 떡볶이는 신전떡볶이  싹쓰리 세트20900  진짜로 셋다 맛이 비슷한거같아요 떡볶이는 진짜 비슷하게 만들었어용 후추향 저는 갠적으로 후라이드가 젤 맛났어용 헤헤 가격대비 양도 많구 맛도 좋구 일단 구성이  치킨매니아 싹쓰리치킨 황금올리브치킨 슈프림양념치킨 신전떡볶이 알볼로피자 치즈볼
9,2020년 10월 14일,오늘은 간식 만드는 날   약속없는 날   고구마티딩러스크 고구마분유빵 치즈볼 나란뇨자 양조절이뭔가요 하아 러스크먹방 뒷처리는엄마몫 힘들다힘들어
10,2020년 10월 14일,나는 그냥 다 먹을거야 뿌링클 치즈볼 다섯개 다 내거일줄 알았는데 아빠가 하나 먹네 그래 하나 정도는
11,2020년 10월 14일, 노랑고래계양코아루점 2번째 신메뉴 출시    체다치즈와 모짜렐라의 만남   치즈덕후들을 위한 치즈볼이 출시되었습니다 어서 빨리 치즈를 사랑하시는 지인분들께 알려주세용  찹쌀꽈배기 핫도그 도너츠 꽈배기맛집 핫도그맛집 인천 인천맛집 계양구 계양구맛집 임학역 임학역맛집 계산역 계산역맛집 작전역 임학동맛집 계산동맛집 맛스타그램 먹스타그램 계양구청맛집 치즈볼 치즈도너츠맛집 팥도너츠맛집 팥도너츠
12,2020년 10월 14일,협찬 그래도진짜리뷰 가치식탁 치즈스틱 자세한건네이버검색 가치식탁 리얼치즈스틱 리얼크림치볼 SET  치즈스틱은 적당하게 짭쪼름하며 쭈욱 늘어나는 리얼치즈가 대박인데 사진으로 표현을 못해서 아쉬움  치즈가 고급치즈인게 먹어보면 바로 느껴짐 치즈볼도 같은 치즈일 줄 알았는데 한 입 먹어보고 입 안 가득 달콤한 크림치즈에 기분이 너무 좋아졌음 나는 라볶이와 함께 먹었는데 매콤한 음식과도 찰떡궁합 한 팩 당 양도 넉넉하게 들어있어서 강추 치즈볼 냉동식품 냉동간식 간식 리얼치즈스틱 리얼크림치즈볼 치즈 08L
13,2020년 10월 14일,협찬 그래도진짜리뷰 가치식탁 치즈스틱 자세한건네이버검색 치즈스틱은 흔히알던 짭쪼롬한 치즈여서 떡볶이랑 잘어울리고 크림치즈볼은 에어프라이어로 돌리니까 안에속이 잘 튀어나오긴하지만 달달해서 맛있었다 양도 적당하고 12번 먹기 적당한양 치즈볼 냉동식품 냉동간식 간식 리얼치즈스틱 리얼크림치즈볼 치즈 08L
14,2020년 10월 14일,협찬 그래도진짜리뷰 가치식탁 치즈스틱 자세한건네이버검색 느무 맛잇어용짭쪼롬하면서 치즈스틱의 쫀쫀함까지치즈스틱 좋아하는 전 대만족 재주문각입니다 치즈볼 냉동식품 냉동간식 간식 리얼치즈스틱 리얼크림치즈볼 치즈 08L
15,2020년 10월 14일, 찌이이이즈볼  저의 소원이 있다면 세상모든 종류의 치즈볼을 한 곳에 모아두고 질릴 때까지 먹어보는거예요 치즈볼은 역시 BHC인가요 또 어디가 맛있나요            서울 뚝섬 뚝섬한강공원 나들이 피크닉 치즈볼 간식 맛스타그램 먹스타그램 데일리 오오티디 민낯 후리스 플리스 좋반 좋아요반사 소통 팔로우 협찬 cheeseball selfie fff
16,2020년 10월 14일,뿌링뿌링
17,2020년 10월 14일,뿌링뿌링
18,2020년 10월 14일,마늘빵맛인데 치즈볼 존맛 근데 세조각쯤 느끼해서 좀 물림  광희나는메이플버터갈릭치킨 메이플버터갈릭치킨 비비큐 bbq 비비큐신메뉴 치킨 마늘빵치킨 야식 치즈볼 모듬치즈볼 비비큐치즈볼 존맛
19,2020년 10월 14일,201014 램잇_점심  하루 두 끼 클린식  한 끼 더티식을 반복하는 요즘 어제 저녁도 뿌링클  치즈볼 뿌링핫도그로 1인 1닭하고 후식으로 스키니피그 파인트 사이즈 반 통 먹음 근데 막 배터질 정도는 아니고 적당히 배불러서 스스로도 경악했다 바프준비하면서 위 줄어든줄 알았는데 전혀 아니구낭 그래도 정신을 완전히 놓지는 않고 두 끼 클린식단 패턴을 가져간다는데에서 위안을 삼아봅니다 하핫 오늘까지만이라는 생각 버리고 내일도 먹을 수 있다고 생각하면서 폭주하지 않기 먹을 때 행복하게 먹고 죄책감에 초절식하지 않기 램아 제발
20,2020년 10월 14일,치즈볼 cheese 아이가릿 부산맛집 광안리맛집 부산여행 beer burger table koreanstyle 혼밥 대구맛집 restaurante 맛스타그램 먹스타그램 먹방 일상 선팔 맞팔 좋반 맞반 likeforlike koreanfood comida 선팔하면맞팔 diario daily foodie foodstagram korea koreanfood
21,2020년 10월 14일,협찬 그래도진짜리뷰 가치식탁 치즈스틱 자세한건네이버검색 조금 녹아서 도착하기는 했지만 바로 냉동실에 넣을 수 있어서 괜찮았어요 양도 넉넉하고 패키지가 깔끔해서 아주 마음에 들었어요 아이들이랑도 같이 먹을 수 있어서 좋았답니당 맛있고 고소해요 치즈볼 냉동식품 냉동간식 간식 리얼치즈스틱 리얼크림치즈볼 치즈 08L
22,2020년 10월 14일,맘스터치 치즈볼  친구들이 치즈볼을 왜 먹어보라고 하는지 이제 좀 알겠음 진짜로 처음에는 이게 무슨맛이지 싶었는데 얼마 전부터 자꾸 먹고싶어서 먹었당 싸이버거세트랑 같이시켰는데 싸이버거는 이미 다 먹었구 음그래서 칼로리가이걸로 1일1식 한걸로
23,2020년 10월 14일,바쁘네 바빠 딸랑구랑 병원갔다가 잉크충전 맡겨놓구 올만에청년다방 차돌박이떡볶이 치즈볼 올만에 먹으니 맛있는떡볶이 이제 다음은 잉크충전한거 가지고 다이소 로 고고씽  딸랑구랑데이트 병원갔다가 청년다방떡볶이 다이소 출발 담엔더맛난거사줄께
24,2020년 10월 14일,멕시카나치킨 무거점 0522779261  매일  오전10시  새벽 02시 50분 까지  무거동삼호동굴화리 배달비 없음  울산 남구 전지역중구전지역 울주군 청량읍범서읍 반천반연과기대 배달가능 원거리는 추가배달비 있습니다  제일 중요한 신선 냉장 닭 유통기한 꼼꼼하게 체크하고  가게안 매장과 주방을  늘  깨끗하게  정리정돈  청결소독  청소를 철저히 하고 있습니다  본사 레시피와 위생방침을  준수해서  손님께  건강하고  맛있는  치킨 요리로  보답할수 있도록  최선을 다하겠습니다  항상 좋은 재료로 정직하게 만들겠습니다  전화로 포장주문시 닭만 가져가면 마리당 5천원 할인  콜라 소스무우는 별도 구매 가능 생맥주1000cc 5000원 콜라대1500원 무500원 양념소스500원  전화로  배달 주문시 1마리당 1개 선택가능 콜라125 로 변경 멕시감자튀김 미니치즈돈까스1개 수작미니핫도그1개 영탁 스마트폰거치대 폰그립 1개  멕시카나치킨무거점  땡초치킨  불닭치킨  멕시카나 울산맛집 콜이오배달대행  까르보불닭치킨 뿌리고치킨 치킨  무거동치킨 후라이드치킨  울산대맛집 마늘치킨  파닭  뿌리고매콤달콤  치토스치킨 반반치킨  강정치킨 치즈볼 맥시듀오 투마리치킨 순살치킨 무거동맛집 포장할인5천원
25,2020년 10월 14일,나같이 성분에 예민한 사람들은 식품첨가물이 없어 안심하고 먹을수있어 좋은데다 세상에나 옴총나게 맛있어버려요 치즈가 그냥 치즈가 아니에요 비싼치즈맛 뙇 알잖아요 비싼치즈맛 그 맛 살짝 태워먹었지만 맛은 진짜 찐이에요 두봉지 한번에 뚝딱 흡입 해버렸어요 아이간식으로도 어른들 안주로도 진짜 최고네요   가치식탁 리얼치즈스틱 리얼크림치즈볼 치즈스틱 치즈볼 냉동식품 냉동간식 간식 08L
26,2020년 10월 14일,치즈볼소시지볼 빅푸드 마켓에서 진행한 JMT이벤트에 당첨되어서 먹게된 치즈볼이랑 소시지볼 치즈볼은 치킨먹을 때에만 시키는 거라고 생각했는데 이렇게 간편하게 먹을 수 있다뉫기분 좋아  간편 전자레인지에 3분 에어프라이기에 10분 번거로운 조리과정이 필요없어서 간식으로 먹기 딱이다 꽉 차있는 재료 보통 핫도그를 시키면 저렴한 소세지를 사용해서 맛이 떨어지는 경우가 많은데 소시지볼의 소시지가 탱탱한 비엔나로 가득 차있어서 너무 맛있었다 치즈볼 역시 빵안에 치즈가 가득하다 모짜렐라체다고다덴마크치즈를 한 입에 먹을 수 있어서 더 진한 맛이 난다 튀기지 않고 구워서 담백  간편하게 먹을 간식을 원한다면 추천 건강하게 먹을 간식을 원한다면 추천 그냥 맛있는게 먹고 싶으면 추천
27,2020년 10월 14일,가마치통닭치즈볼  가마치에 치즈볼이 있따 치즈볼이 급 먹고싶었는데 치킨 시키기엔 배불러서 가마치에서 치즈볼 포장 따뜻 바삭한 치즈볼 안에 모짜렐라치즈 쮸우욱 늘어나는게 걍 천국이잔하여 꼬북칩이랑 같이 맥주 한캔 순삭 햄보케
28,2020년 10월 14일,치즈볼 시나몬롤 홈베이킹 망했어 
29,2020년 10월 14일,교촌치킨 치즈볼     고르곤졸라치즈볼 55  살살치킨 160  굉장히 기대하고 시킨 치즈볼 안좋아하는사람이 없잖아요 그런데교촌은 으어 맛없어요 딱 꼬깔콘 맛이나고 치즈는거의없고 달지도 짜지도않은 과자먹는맛 이걸 오천원 넘게주고먹느니 과자사먹읍시다  살살치킨이야 저희집 최애라 매일먹어서 코맨트할게없지만 교촌 치즈볼은 피하는걸로  맛스타그램 푸드스타그램 맛집추천 서울여행 술스타그램 쿡스타그램 맛집탐방 foodporn foodie instafood 먹방스타그램 맛뉴픽 koreafood 맛집 먹스타 먹팔 foodstagram chicken 치느님 치킨스타그램 좋아요반사 mukbang 첫줄 먹스타맞팔 서울맛집
30,2020년 10월 14일,버거 내취향아님  모짜렐라치즈돈까스 뇸뇸뇸 마이쪙 탄탄면 맛있네 치즈볼 세개는 우리 1호 배 속으로
31,2020년 10월 14일,버거스타그램 수제버거맛집버거앤프라이즈 수제버거 수제버거맛집추천 배달맛집 배달가능 배달 용인맛집추천 롯데몰수지 존맛탱 jmt모짜스틱 치즈볼
32,2020년 10월 14일,투파인드피터범계평촌안양맛집치즈볼
33,2020년 10월 14일,어제 먹었슴 뿌링클 존맛탱 뿌링클 뿌링클콤보 치즈볼 뿌링클소스
34,2020년 10월 14일,협찬 그래도진짜리뷰 가치식탁 치즈스틱 자세한건네이버검색 간단하게 야식이나 간식으로 먹고싶을때 바로 간편하게 에프에 돌려먹음 되니까 완전 편하고 맛있어서 쟁여두는 리얼치즈스틱 리얼크림치즈볼 치즈가 쭈우우우욱 늘어나는 치즈스틱 뜨거울때 바로 먹으니 아주 끝내주는구만 리얼크림치즈볼은 달달하니 아이들 간식으로도 좋을듯 치즈가 가득가득 단짠 조합으로 맥주안주로도 훌륭해 치즈볼 냉동식품 냉동간식 간식 리얼치즈스틱 리얼크림치즈볼 치즈 08L 먹팔 먹스타그램 치즈덕후 먹스타 간식스타그램 맞팔 소통 좋아요반사 첫줄반사
35,NaN,NaN
36,NaN,NaN
37,NaN,NaN
38,2020년 10월 14일,협찬 그래도진짜리뷰 가치식탁 치즈스틱 자세한건네이버검색  치즈가 가득들어서 맛잇당 대용량팩도 나오면 사먹을듯  치즈볼 냉동식품 냉동간식 간식 리얼치즈스틱 리얼크림치즈볼 치즈 08L 치즈스틱 간식
39,2020년 10월 14일,협찬 그래도진짜리뷰 가치식탁 치즈스틱 자세한건네이버검색 크림치즈 대박 너무 맛있고 치즈스틱에 치즈도 완전 굿굿 치즈량 엄청 많아서 쭈욱 늘어남 치즈볼 냉동식품 냉동간식 간식 리얼치즈스틱 리얼크림치즈볼 치즈 08L 내돈내산 체험구매 후기
40,2020년 10월 14일,바삭바삭 단짠단짠  기분 좋은 식감에 프로틴 치즈볼 21g의 단백질 보충하면서 치즈볼의 짭짭한 맛까지 그대로 담아낸 진짜 치즈볼  단백질 과자 같지 않고 그냥 치즈 과자같은 자꾸만 손이가는 그 치즈볼  치즈과자 체다치즈 고단백 단백질과자 신제품 프로틴유신제품 신제품출시  repost kki_912  박민 쥐띠 돌림자 쓰는 분들은 뭘만들어도 신박한거같다 한분은 짐웨어로 한분은 먹는걸로 서민들 잔고털이중  그만큼 가성비가심비맛멋 다잡은듯 프로틴치즈볼 이거 그냥들이붓고싶다 아껴먹을려고했는데 세봉지째 협찬아님 믿고드셔보세요 개맛있음 리얼치즈볼 대박인건 단백질21g들어가있음 소름   프로틴유 프로틴치즈볼 치즈볼 단백질간식
41,2020년 10월 14일,모짜치즈볼 신제품 소예푸드 엣홈 학교급식 급식메뉴추천 급식업체 급식홍보 급식메뉴 급식스타그램 영양사 영양사스타그램 급식 영양사선생님 치즈볼 치즈가득  요녀석은요 소예푸드 신제품 이에요  자연치즈가 무려 319 나 들어있는 녀석인데요 타사 제품보다 치즈가 많이 들어서 좋다고 선생님들이 좋아 하시더라구요  선생님  치즈가 많으면 아이들이 좋아 하는거 다 아시죠 또 치즈 함량이 많으면 많을수록 가격이 비싼데 요녁은 치즈가 많은데도 가격이 저렴하다고 좋아하시더라구요  또 그뿐만이 아니에요 유탕시 터지지않아 치즈가 흘러나오지 않는게 요녀석에 가장큰 장점 이랍니다 치즈볼은 유탕시 잘 터지거든요 그래서 터지지 않도록 단점을 보완 했어요 그게 기술력 이래요  맛은 말씀 안드려도 다 아시죠 달콤함과 끝까지 고소함두배 요녀석은 식어도 맛있더라구요
42,2020년 10월 14일,노브랜드버거 nbb nobrandburger 부산 아들성화에 take out 시그니처버거 코울슬로치킨버거 치즈볼 어니언링 치킨너겟 맛보려고 사이드메뉴 종류별로 음시그니처버거는 괜찮고 치킨버거는 상하이가 낫다 개취 어니언링은 눅눅하고 치즈볼은 음 여튼한번먹어볼만은 함
43,2020년 10월 14일,퇴근 후 치맥    퇴근후치맥 bhc치킨 치즈볼 뿌링클 맥주 종이의집
44,2020년 10월 14일,_   다시 어린이집에 가기 시작하니 다시 시작한 아침밥전쟁    박태원밥상 엄마는커피
45,2020년 10월 14일,협찬 그래도진짜리뷰 가치식탁 치즈스틱 자세한건네이버검색 치즈가 쭈우으욱늘어나고 맛있음 조리도 간편해서 편하게 섭취 가능 치즈볼 냉동식품 냉동간식 간식 리얼치즈스틱 리얼크림치즈볼 치즈 08L 먹스타그램
46,2020년 10월 14일, 치즈볼을 이렇게 만들다니 _ 너무너무 맛있잖아  나도 만들어 보고 싶지만  베이킹엔 똥손인지라 사먹을게요   치즈볼 맛있다 수제치즈볼 나는사먹어야지 베이킹은어려워 감성사진 음식사진 배경천필수
47,2020년 10월 14일,Repost toreore_official with repostsaveapp   띵동 띵동 선물이 도착했습니다  또래오래가 새로운 옷을 입었어요  설레는 마음과 행복을 듬뿍 담은 여행가방처럼 맛있는 치킨을 담아 찾아 갈게요  ____ 새로 바뀐 또래오래 넘 귀엽지 않아 ๑ᴗ๑  참여방법 친구 태그 후 또래오래 소식 알리기 경품  추첨을 통해 또래오래 E쿠폰 3명 옥스포드블록3명 증정 페이스북과 동시 진행 이벤트 기간  1019 월 당첨자 발표  1111 수  또래오래 인스타그램 팔로우까지 하면 당첨 확률 UP  10월 이벤트 알아보기 10월 31일까지 요기요에서 치킨불닭볼세트 3천 원 할인 요기요에서 치킨치즈볼세트 3천 원 할인 배달의 민족 매주 수요일 3천 원 할인  고추단짠윙봉 단짠윙봉 콘듀치킨 갈반핫반 오곡후라이드 치즈볼 리얼치즈볼 불닭볼 소떡소떡 국물떡볶이 요기요 배달의민족 농협 신상치킨 치킨추천 치킨맛집 또래오래 목우촌 할인 프로모션 배달음식 야식 치킨스타그램 배달의민족 요기요 10월 10월할인
48,2020년 10월 14일,뿌링클 모음집 사실 이거 말고 더 있는데  사진을 안 찍음  뿌링클 치즈볼 먹고싶다 06 학교 가는날
49,2020년 10월 14일,이런 케이크가 인싸라매 оо    광주 상무지구 구시청 치즈볼케이크 bhc 치즈볼 96 25 일상 데일리 daily 좋아요 좋아요반사 좋반 팔로우 팔로잉 맞팔 선팔 fff ootd 오오티디 흔녀 instadaily instalike 셀스타그램 얼스타그램 셀카 셀피 selfie selca
50,2020년 10월 14일,뿌뿌뿌  개인전에서 WIN name S
51,2020년 10월 14일,협찬 치즈스틱 넘 좋아하는 울 남매 좋은 재료로 만든 리얼 치즈스틱으로 간식 준비해줬어요 바삭한 튀김옷안에 치즈가 듬뿍듬뿍 진짜 고소하더라구요  제 간식은 크림치즈볼 한입에 속 들어가는 볼 안에 부드러운 크림 치즈가  에어프라이어에 간편하게 먹을수 있는 간편 간식 리얼 치즈스틱리얼 크림치즈볼 아쉽기 전에 얼른 냉동실에 쟁여놔야긋네요     치즈볼 냉동식품 냉동간식 간식 리얼치즈스틱 리얼크림치즈볼 치즈 08L
52,2020년 10월 14일,협찬 그래도진짜리뷰 가치식탁 치즈스틱 자세한건네이버검색 베프 언니 강력 추천으로 알게된 치즈스틱 치즈볼  후라이팬에 기름 두르고 보기좋게 노릇노릇하게 구워내면 끝  치즈스틱도 맛있지만 치즈볼이 달달하니 취향저격 간식이나 맥주 안주로 먹기 좋아요   치즈볼 냉동식품 냉동간식 간식 리얼치즈스틱 리얼크림치즈볼 치즈 08L 맥주안주
