,date,버거킹
0,2020-10-18,토마토 버거킹 가출 이유 안녕 초이 삼촌 햄버거 시나 저번 내내 고기 버거 래서 간만 햄버거 더니 토마토 토마토 버거킹 트러플 머쉬룸 와퍼 가격 내용 버거 인분 재료 트러플 소스 버섯 양파 패티 양상추 줄평 감칠맛 최고 나나 트러플 머쉬룸 감칠맛 아주 패티 조화 버거킹 최애 버거 야채 상승 토마토 신선 하나요 버거 브랜드 기존 버거 차신 버거킹 버거 만족 예정 연하 자주 토마토 버거킹 와퍼 불맛 고기 버거 어도 한번 감칠맛 매력 트러플 머쉬룸 와퍼 초이스 버거 버거킹 버거킹 와퍼 버거킹 햄버거 맛집 햄버거 배달의민족 머쉬룸 와퍼 트러플 소스 트러플 버거 와퍼 버거킹 치즈볼 치즈볼 감자 튀김 맛집 맛집 버거 스타
1,2020-10-18,토마토 버거킹 가출 이유 안녕 초이 삼촌 햄버거 시나 저번 내내 고기 버거 래서 간만 햄버거 더니 토마토 토마토 버거킹 트러플 머쉬룸 와퍼 가격 내용 버거 인분 재료 트러플 소스 버섯 양파 패티 양상추 줄평 감칠맛 최고 나나 트러플 머쉬룸 감칠맛 아주 패티 조화 버거킹 최애 버거 야채 상승 토마토 신선 하나요 버거 브랜드 기존 버거 차신 버거킹 버거 만족 예정 연하 자주 토마토 버거킹 와퍼 불맛 고기 버거 어도 한번 감칠맛 매력 트러플 머쉬룸 와퍼 초이스 버거 버거킹 버거킹 와퍼 버거킹 햄버거 맛집 햄버거 배달의민족 머쉬룸 와퍼 트러플 소스 트러플 버거 와퍼 버거킹 치즈볼 치즈볼 감자 튀김 맛집 맛집 버거 스타
2,2020-10-18,토마토 버거킹 가출 이유 안녕 초이 삼촌 햄버거 시나 저번 내내 고기 버거 래서 간만 햄버거 더니 토마토 토마토 버거킹 트러플 머쉬룸 와퍼 가격 내용 버거 인분 재료 트러플 소스 버섯 양파 패티 양상추 줄평 감칠맛 최고 나나 트러플 머쉬룸 감칠맛 아주 패티 조화 버거킹 최애 버거 야채 상승 토마토 신선 하나요 버거 브랜드 기존 버거 차신 버거킹 버거 만족 예정 연하 자주 토마토 버거킹 와퍼 불맛 고기 버거 어도 한번 감칠맛 매력 트러플 머쉬룸 와퍼 초이스 버거 버거킹 버거킹 와퍼 버거킹 햄버거 맛집 햄버거 배달의민족 머쉬룸 와퍼 트러플 소스 트러플 버거 와퍼 버거킹 치즈볼 치즈볼 감자 튀김 맛집 맛집 버거 스타
3,2020-10-18,토마토 버거킹 가출 이유 안녕 초이 삼촌 햄버거 시나 저번 내내 고기 버거 래서 간만 햄버거 더니 토마토 토마토 버거킹 트러플 머쉬룸 와퍼 가격 내용 버거 인분 재료 트러플 소스 버섯 양파 패티 양상추 줄평 감칠맛 최고 나나 트러플 머쉬룸 감칠맛 아주 패티 조화 버거킹 최애 버거 야채 상승 토마토 신선 하나요 버거 브랜드 기존 버거 차신 버거킹 버거 만족 예정 연하 자주 토마토 버거킹 와퍼 불맛 고기 버거 어도 한번 감칠맛 매력 트러플 머쉬룸 와퍼 초이스 버거 버거킹 버거킹 와퍼 버거킹 햄버거 맛집 햄버거 배달의민족 머쉬룸 와퍼 트러플 소스 트러플 버거 와퍼 버거킹 치즈볼 치즈볼 감자 튀김 맛집 맛집 버거 스타
4,2020-10-18,토마토 버거킹 가출 이유 안녕 초이 삼촌 햄버거 시나 저번 내내 고기 버거 래서 간만 햄버거 더니 토마토 토마토 버거킹 트러플 머쉬룸 와퍼 가격 내용 버거 인분 재료 트러플 소스 버섯 양파 패티 양상추 줄평 감칠맛 최고 나나 트러플 머쉬룸 감칠맛 아주 패티 조화 버거킹 최애 버거 야채 상승 토마토 신선 하나요 버거 브랜드 기존 버거 차신 버거킹 버거 만족 예정 연하 자주 토마토 버거킹 와퍼 불맛 고기 버거 어도 한번 감칠맛 매력 트러플 머쉬룸 와퍼 초이스 버거 버거킹 버거킹 와퍼 버거킹 햄버거 맛집 햄버거 배달의민족 머쉬룸 와퍼 트러플 소스 트러플 버거 와퍼 버거킹 치즈볼 치즈볼 감자 튀김 맛집 맛집 버거 스타
5,2020-10-18,토마토 버거킹 가출 이유 안녕 초이 삼촌 햄버거 시나 저번 내내 고기 버거 래서 간만 햄버거 더니 토마토 토마토 버거킹 트러플 머쉬룸 와퍼 가격 내용 버거 인분 재료 트러플 소스 버섯 양파 패티 양상추 줄평 감칠맛 최고 나나 트러플 머쉬룸 감칠맛 아주 패티 조화 버거킹 최애 버거 야채 상승 토마토 신선 하나요 버거 브랜드 기존 버거 차신 버거킹 버거 만족 예정 연하 자주 토마토 버거킹 와퍼 불맛 고기 버거 어도 한번 감칠맛 매력 트러플 머쉬룸 와퍼 초이스 버거 버거킹 버거킹 와퍼 버거킹 햄버거 맛집 햄버거 배달의민족 머쉬룸 와퍼 트러플 소스 트러플 버거 와퍼 버거킹 치즈볼 치즈볼 감자 튀김 맛집 맛집 버거 스타
6,2020-10-18,토마토 버거킹 가출 이유 안녕 초이 삼촌 햄버거 시나 저번 내내 고기 버거 래서 간만 햄버거 더니 토마토 토마토 버거킹 트러플 머쉬룸 와퍼 가격 내용 버거 인분 재료 트러플 소스 버섯 양파 패티 양상추 줄평 감칠맛 최고 나나 트러플 머쉬룸 감칠맛 아주 패티 조화 버거킹 최애 버거 야채 상승 토마토 신선 하나요 버거 브랜드 기존 버거 차신 버거킹 버거 만족 예정 연하 자주 토마토 버거킹 와퍼 불맛 고기 버거 어도 한번 감칠맛 매력 트러플 머쉬룸 와퍼 초이스 버거 버거킹 버거킹 와퍼 버거킹 햄버거 맛집 햄버거 배달의민족 머쉬룸 와퍼 트러플 소스 트러플 버거 와퍼 버거킹 치즈볼 치즈볼 감자 튀김 맛집 맛집 버거 스타
7,2020-10-18,토마토 버거킹 가출 이유 안녕 초이 삼촌 햄버거 시나 저번 내내 고기 버거 래서 간만 햄버거 더니 토마토 토마토 버거킹 트러플 머쉬룸 와퍼 가격 내용 버거 인분 재료 트러플 소스 버섯 양파 패티 양상추 줄평 감칠맛 최고 나나 트러플 머쉬룸 감칠맛 아주 패티 조화 버거킹 최애 버거 야채 상승 토마토 신선 하나요 버거 브랜드 기존 버거 차신 버거킹 버거 만족 예정 연하 자주 토마토 버거킹 와퍼 불맛 고기 버거 어도 한번 감칠맛 매력 트러플 머쉬룸 와퍼 초이스 버거 버거킹 버거킹 와퍼 버거킹 햄버거 맛집 햄버거 배달의민족 머쉬룸 와퍼 트러플 소스 트러플 버거 와퍼 버거킹 치즈볼 치즈볼 감자 튀김 맛집 맛집 버거 스타
8,2020-10-18,토마토 버거킹 가출 이유 안녕 초이 삼촌 햄버거 시나 저번 내내 고기 버거 래서 간만 햄버거 더니 토마토 토마토 버거킹 트러플 머쉬룸 와퍼 가격 내용 버거 인분 재료 트러플 소스 버섯 양파 패티 양상추 줄평 감칠맛 최고 나나 트러플 머쉬룸 감칠맛 아주 패티 조화 버거킹 최애 버거 야채 상승 토마토 신선 하나요 버거 브랜드 기존 버거 차신 버거킹 버거 만족 예정 연하 자주 토마토 버거킹 와퍼 불맛 고기 버거 어도 한번 감칠맛 매력 트러플 머쉬룸 와퍼 초이스 버거 버거킹 버거킹 와퍼 버거킹 햄버거 맛집 햄버거 배달의민족 머쉬룸 와퍼 트러플 소스 트러플 버거 와퍼 버거킹 치즈볼 치즈볼 감자 튀김 맛집 맛집 버거 스타
9,2020-10-18,버거킹 햄버거 맛집 버거킹 맛집 치즈볼 치킨 감자 튀김 치즈스틱 기네스 버거 더블 불고기 버거 불고기 퍼통 새우 와퍼 맛집
10,2020-10-18,버거킹 햄버거 맛집 버거킹 맛집 치즈볼 치킨 감자 튀김 치즈스틱 기네스 버거 더블 불고기 버거 불고기 퍼통 새우 와퍼 맛집
11,2020-10-17,unpredictability edition cheeseballs cm mm 초등학교 롯데리아 치즈스틱 청소년기 칠리 치즈 프라이 대학교 나쵸 치즈 직장 닐때 버거킹 오오오 치즈스틱 요즘 치즈볼 머릿속 사이즈 자개 송석 빈티 지브라 시타 왁스 온통 지니 을축 적하 핸드 메이드 시타 자개 송석원 목걸 이원석 팔찌 이어링 팔찌 코디 샌드위치 블링
12,2020-10-17,am pm pm feat feat boy pm 식단 일지 아침 쭈꾸미 만두 감자 팽이버섯 달걀 점심 버거킹 와퍼 반개 치즈볼 저녁 채소 볶음 양파 자색 양파 연근 팽이버섯 브로콜리 가슴 두부 샐러드 방울토마토 무화과 병아리 고구마 반개 호박고구마 반개 마켓 쭈꾸미 만두 쭈꾸미 해산물 쫄깃하 쭈꾸미 식감 예술 아마 지금 중인 버거킹 다가 치즈볼 구매 가격 뭔가 크기 예전 학교 분식집 콜팝 크기 여운 함정 어보 모짜렐라 치즈 피자 갈릭 디핑 소스 짭쪼롬 구리 옴청 바삭 바삭 바사 튀김 요리 저녁 김치볶음밥 된장찌개 된장국 비주 고구마 호박고구마 그득 고구마 종류 별로 비교 려고 스팀 찜질 호박고구마 확실 노오 고구마 껍질 보라색 왼쪽 호박고구마 오른쪽 고구마 인적 고구마 밀도 식감 운동 일지 걷기 계단 저녁 다가 시작 전신 하체 분안 뒤쪽 복부
13,2020-10-17,am pm pm feat feat boy pm 식단 일지 아침 쭈꾸미 만두 감자 팽이버섯 달걀 점심 버거킹 와퍼 반개 치즈볼 저녁 채소 볶음 양파 자색 양파 연근 팽이버섯 브로콜리 가슴 두부 샐러드 방울토마토 무화과 병아리 고구마 반개 호박고구마 반개 마켓 쭈꾸미 만두 쭈꾸미 해산물 쫄깃하 쭈꾸미 식감 예술 아마 지금 중인 버거킹 다가 치즈볼 구매 가격 뭔가 크기 예전 학교 분식집 콜팝 크기 여운 함정 어보 모짜렐라 치즈 피자 갈릭 디핑 소스 짭쪼롬 구리 옴청 바삭 바삭 바사 튀김 요리 저녁 김치볶음밥 된장찌개 된장국 비주 고구마 호박고구마 그득 고구마 종류 별로 비교 려고 스팀 찜질 호박고구마 확실 노오 고구마 껍질 보라색 왼쪽 호박고구마 오른쪽 고구마 인적 고구마 밀도 식감 운동 일지 걷기 계단 저녁 다가 시작 전신 하체 분안 뒤쪽 복부
14,2020-10-16,버거킹 사이드 남매 천원 행복 치즈스틱 진리 버거킹 웅상 간식 맛집 웅상 맛집 치즈스틱 치즈볼 어니언 후렌치후 라이 아이스크림 햄버거 햄버거 먹음 사이드 만원
15,2020-10-16,버거킹 사이드 남매 천원 행복 치즈스틱 진리 버거킹 웅상 간식 맛집 웅상 맛집 치즈스틱 치즈볼 어니언 후렌치후 라이 아이스크림 햄버거 햄버거 먹음 사이드 만원
16,2020-10-15,밀밀 밀밀 저녁 버거킹 콰트로 치즈 트러플 머쉬룸 와퍼 감자 튀김 케첩 치즈볼 제로 콜라 저녁 엄마 햄버거 엄마 햄버거 마침 우리동네 버거킹 버거 버거 고기 패티 미지 근했음 래서 콰트로 치즈버거 치즈 녹지 라이스 치즈 모양 그대로 배달 매장 짜증 엄마 지도 기분 쁘다 지점 가야 묵음
17,2020-10-15,밀밀 밀밀 저녁 버거킹 콰트로 치즈 트러플 머쉬룸 와퍼 감자 튀김 케첩 치즈볼 제로 콜라 저녁 엄마 햄버거 엄마 햄버거 마침 우리동네 버거킹 버거 버거 고기 패티 미지 근했음 래서 콰트로 치즈버거 치즈 녹지 라이스 치즈 모양 그대로 배달 매장 짜증 엄마 지도 기분 쁘다 지점 가야 묵음
18,2020-10-15,pairing drinks 음주 일기 사일 모든 저녁 버거킹 치즈볼 도전 너겟 샐러드 칭다오 드래프트 시원 줄평 부러 캔맥 버거킹 사이드 사서 만족도 주가 주정뱅이 적절 균형
19,2020-10-15,pairing drinks 음주 일기 사일 모든 저녁 버거킹 치즈볼 도전 너겟 샐러드 칭다오 드래프트 시원 줄평 부러 캔맥 버거킹 사이드 사서 만족도 주가 주정뱅이 적절 균형
20,2020-10-12,요즘 치즈볼 발레 치즈스틱 청말띠 스타 치즈볼 버거킹 치즈볼 원후
21,2020-10-10,jmt jmtgr 한번 대충 지난주 소한 부림 양심 연휴 이후 허리 파서 이정 연어초밥 광어 초밥 유부초밥 모듬 유부초밥 교촌치킨 치킨 피자 떡볶이 모듬 튀김 버거킹 햄버거 너겟 치즈스틱 만두 찐빵 노랑 통닭 치즈볼 양념통닭 배달 만세 맛스타그램 다그 아가리 어터 다음주 다이어트
22,2020-10-09,bhc 엄마 하루 종일 데이트 커피 버거킹 아메리카노 아이스 아메리카노 라피 불고기 공지천 상상마당 뿌링클 치즈볼 고마 피자스쿨 치즈 피자 치킨 피자 한글날
23,2020-10-09,sns 꿀맛 스타벅스 가격 헤이즐넛 오트 쇼콜라 애플 쿠키 크림 프라푸치노 치즈 가성 요즘 스타벅스 기프티콘 스타벅스 간만 평소 자리 사람 이제 거리 두기 자리 자체 요즘 치즈 신상 음료 공략 헤이즐넛 오트 쇼콜라 사진 이미지 초코 러버 취향 저격 었다 허쉬 애플 쿠키 크림 프라푸치노 시럽 스탈 쿠키 토핑 쿠앤 쇼콜라 치즈볼 보신 기대 었다 양은 개정 가운데 치즈 모짜렐라 나진 번은 을지 가격 만족도 스벅 가격 장점 엔돌핀 직빵 치즈 간식 대용 소식 단점 치즈볼 가격 버거킹 코로나 자리 매우 협소 에어컨 스타벅스 치즈볼 치즈 꿀볼 음식 카페
24,2020-10-08,am bhc 기상 학생증 발급 남양주 대중교통 이용 훈망탱 보기 하루 금방 가면 카공 이틀 나름 기분 뿌듯뿌듯 훈이패 시브 열심 시험 공부 하자 홍대 냉면 담보 보물 청라 버거킹 공차 훈이 녹차 딸기 우리은행 진접 학생증 신규 발급 한촌 설렁탕 양털 자켓 아마 스빈 카페라떼 요거트 딸기스무디 블루 버드스 디카 시험 공부 과제 홀릭 치킨 뿌링클 치즈볼 치즈스틱 지쿠 이양 실물
25,2020-10-07,동춘동 햄버거 버거킹 프렌치프라이 크리미 그냥 있쟈나 오늘이 버거킹 처럼 통통 아해 아주 크리미 아쥬 최고 치즈볼 워낙 아해 버거킹 크리미 치즈 촉촉 크리미 치즈 알짝 던데 그게 쵝오 아주 살짝 달달 무조 어플 쿠폰 사용 크리미 어플 쿠폰 사용
26,2020-10-07,동춘동 햄버거 버거킹 프렌치프라이 크리미 그냥 있쟈나 오늘이 버거킹 처럼 통통 아해 아주 크리미 아쥬 최고 치즈볼 워낙 아해 버거킹 크리미 치즈 촉촉 크리미 치즈 알짝 던데 그게 쵝오 아주 살짝 달달 무조 어플 쿠폰 사용 크리미 어플 쿠폰 사용
27,2020-10-07,동춘동 햄버거 버거킹 프렌치프라이 크리미 그냥 있쟈나 오늘이 버거킹 처럼 통통 아해 아주 크리미 아쥬 최고 치즈볼 워낙 아해 버거킹 크리미 치즈 촉촉 크리미 치즈 알짝 던데 그게 쵝오 아주 살짝 달달 무조 어플 쿠폰 사용 크리미 어플 쿠폰 사용
28,2020-10-05,배부 행복 뚱땡이 그냥 뿌링클 허니콤 보바 치킨 한신 통닭 황금올리브 치즈볼 롯데리아 맘스터치 버거킹 맥도날드 도미노피자 초밥 소주 엽떡 곱창 막창삽겹살 족발 보쌈 델리 닭꼬치 핫도그
29,2020-10-03,브랜드 보이 브랜드 버거 포장 이정 온건 호기심 그니 버거 세트 사고 치즈볼 치즈볼 인절미 치즈볼 어니언 도넛 래서 뭔가 어니언 진양 버거킹 양파 치즈볼 개수 사이즈 작고 치즈 천원 성비 여러 돈까스 정식 나오니 가성 려면 버거 세트
30,2020-10-03,월말 추석 겹살 고기 버거킹 치킨 감자 튀김 떡볶이 치즈볼 치킨 잡채 집밥 행복 돼지
31,2020-10-02,instafood 버거킹 햄버거 안나 서모 하루 배달 와퍼 치즈볼
32,2020-09-28,jmt bhc bhc bhc momstouchlove 여러 맘스터치 사진 대박 햄버거 햄버거 맛집 맘스터치 롯데리아 맥도날드 버거킹 최고 맘스터치 음식 이지 맘스터치 고고싱 었다 맘스터치 고루 고루 최고 싸이버 맘터 감자 튀김 지면 래서 싸이버 거세 치즈볼 덕후 아주 아주 덕후 사이드 메뉴인 바삭 크림 치즈볼 지나 수가 싸이버 사람 정도 싸이버 싸이 넓적다리 그대로 싸이버 매콤 다리 살로 패티 라서 야들야들 화이트 갈릭 소스 조합 최고다 최고 야채 피클 양파 양상추 표현 필요 그냥 최애 버거 케이준 양념감자 맘터 감자 튀김 싸이버 유명 케이준 스타일 감자 튀김 고요 그냥 어도 케찹 어도 맘터 운하 바삭 크림 치즈볼 다라 표현 불가능 치즈볼 덕후 라서 매일 매일 가능 입맛 기준 치즈 차이 바삭 수준 바삭 쫄깃 고소 제대로 크림 치즈 워낙 아해 모짜렐라 사르르 순식간 최애 치즈볼 무조건 치즈볼 때문 맘스터치 자주 제발 세상 모든 사람 맘터 치즈볼 치즈볼 거울 어도 바삭 쫀득 도전 해주 싸이버 세트 바삭 크림 치즈볼
33,2020-09-28,구미 버거킹 기네스 머쉬룸 와퍼 기네스 와퍼 치즈볼 치킨너겟 감자 튀김 햄버거 데마 일차 집콕 쿨쿨
34,2020-09-22,nbb why pay more its good enough 햄버거 사랑 브랜드 브랜드 버거 보셧 한번 어보 두번째 사실 성비 은지 브랜드 버거 서울 강남구 테헤란로 산체스 세트 인절미 치즈볼 치킨너겟 확실 세트 제일 미트 마니아 세트 버거킹 비교 확실 저렴 가격 맥도날드 비교 크게 차이 브랜드 세트 원정 요기 포인트 크기 버거킹 와퍼주니어 사이즈 패티 앞서 충분 배부 기입 브랜드 금액 맥도날드 빅맥 이나 슈비 버거 사실 말햇 브랜드 이유 닭다리 모양 치킨너겟 닭다리 모양 사랑 치킨너겟 브랜드 위너 인절미 치즈볼 뿌링클 치즈볼 이후 가장 치즈볼 었습니 냄새 사이드 맛집 냄새 포장 경우 로봇 킬포 영상
35,2020-09-22,nbb why pay more its good enough 햄버거 사랑 브랜드 브랜드 버거 보셧 한번 어보 두번째 사실 성비 은지 브랜드 버거 서울 강남구 테헤란로 산체스 세트 인절미 치즈볼 치킨너겟 확실 세트 제일 미트 마니아 세트 버거킹 비교 확실 저렴 가격 맥도날드 비교 크게 차이 브랜드 세트 원정 요기 포인트 크기 버거킹 와퍼주니어 사이즈 패티 앞서 충분 배부 기입 브랜드 금액 맥도날드 빅맥 이나 슈비 버거 사실 말햇 브랜드 이유 닭다리 모양 치킨너겟 닭다리 모양 사랑 치킨너겟 브랜드 위너 인절미 치즈볼 뿌링클 치즈볼 이후 가장 치즈볼 었습니 냄새 사이드 맛집 냄새 포장 경우 로봇 킬포 영상
36,2020-09-22,bbq 복자 비비큐 황금올리브 치킨 치즈볼 버거킹 콰트로 치즈
37,2020-09-22,오랜만 버거킹 배달 버거 햄버거 버거킹 기네스 와퍼 맥주 스타 치즈볼 테라
38,2020-09-22,오랜만 버거킹 배달 버거 햄버거 버거킹 기네스 와퍼 맥주 스타 치즈볼 테라
39,2020-09-14,돼지 일요일 돼지 주먹 족보 세트 술판 버거킹 치킨너겟 치즈스틱 치즈볼
40,2020-09-12,기네스 와퍼 버거킹 주말 햄버거 버거 특별 안나 수록 달달 체적 훈연 바베큐 소스 케찹 맥날 버거 버거킹 퍽퍽 패티 기진 요건 소스 마지막 크리미 버섯 어간 기네스 맥주 영상 마지막 버거킹 기네스 와퍼 세트 크리미 가격 대비 아쉽슴
41,2020-09-12,기네스 와퍼 버거킹 주말 햄버거 버거 특별 안나 수록 달달 체적 훈연 바베큐 소스 케찹 맥날 버거 버거킹 퍽퍽 패티 기진 요건 소스 마지막 크리미 버섯 어간 기네스 맥주 영상 마지막 버거킹 기네스 와퍼 세트 크리미 가격 대비 아쉽슴
42,2020-09-12,기네스 와퍼 버거킹 주말 햄버거 버거 특별 안나 수록 달달 체적 훈연 바베큐 소스 케찹 맥날 버거 버거킹 퍽퍽 패티 기진 요건 소스 마지막 크리미 버섯 어간 기네스 맥주 영상 마지막 버거킹 기네스 와퍼 세트 크리미 가격 대비 아쉽슴
43,2020-09-11,신전 떡볶이 맥도날드 버거킹 신전 떡볶이 맥도날드 버거킹 떡볶이 어묵 튀김 지후 라이 감자 소스 칠리 치즈볼 크림 치즈볼 샐러드
44,2020-09-11,신전 떡볶이 맥도날드 버거킹 신전 떡볶이 맥도날드 버거킹 떡볶이 어묵 튀김 지후 라이 감자 소스 칠리 치즈볼 크림 치즈볼 샐러드
45,2020-09-10,햄버거 파티 우회 햄버거 회식 여서 삼삼오오 의논 는걸 버거킹 신상 홍삼 에이지 엑스 분위기 행복 햄버거 버거킹 회식 치즈볼 알로 유니 김해 유니 유니 김해 중앙대 리점
46,2020-09-10,햄버거 파티 우회 햄버거 회식 여서 삼삼오오 의논 는걸 버거킹 신상 홍삼 에이지 엑스 분위기 행복 햄버거 버거킹 회식 치즈볼 알로 유니 김해 유니 유니 김해 중앙대 리점
47,2020-09-10,점심 버거킹 간만 치즈볼 입안 살살
48,2020-09-09,두부 강정 만들기 전분 가루 기름 듯이 엄마 간장 양념 느무 엄마 해주 기기 콩나물국 더니 엄마 뚝배기 콩나물국 해주 셨는데 칼칼 하니 시원 이건 최고 고구마 돈까스 치즈볼 이건 기면 김치 돼지고기 김치 가루 계란후라이 쓱쓱 천국 소리 절로 유부초밥 김치찌개 날치 알쌈 삼겹살 깻잎 열무김치 명란젓 양념 게장 진수 성찬 날치 알쌈 고기 히힛 먹방 요정 요섹녀 신부 수업 요리 설거지 두부 조림 강정 유부초밥 버거킹 바나나 맛점 콩나물국 엄마 손맛 김치 돈까스 치즈볼 맛저 먹스타그램 먹방 요정 부림
49,2020-09-06,요즘 꼬셔 햄버거 합의 냉동 레토르트 용가리 치킨 버거킹 감자 튀김 방울토마토 치즈볼 쁘니 호호 미요
50,2020-08-28,kg kg egcg 식사량 조절 체중 다이어트 다이어트 기록 다이어트 다이어트식단 다이어트 일기 체중 변화 체중감량 체중 기록 트레이닝 다이어트 쉐이크 체중 조절 조제 식품 트리 디데이 배달의민족 마트 냉동식품 새싹 보리 체중감량 보조 폴리코사놀 파리 포산 마늘 추출 가슴 모디 쿠스 쇼트브레드 플레인 버거킹 스윗 치킨 명랑 핫도그 치즈볼
51,2020-08-27,맘스터치 햄버거 음으로 맘스터치 싸이버 거세 싸이버 롯데리아 맥도날드 버거킹 햄버거 전혀 치즈 하늘 치즈 감자 양념감자 맘스터치 싸이버 치즈볼 치즈 감자 엔별 때문
52,2020-08-26,bhc burgerking jmt mukstagram mukbang pizza burger bhc homeparty 치킨 피자 햄버거
53,2020-08-26,living bhd 메인 사이드 메인 문하 짝꿍 존재 꿀팁 공유 팔로우 메인 사이드 버거킹 너겟킹 아웃백 부시맨 부레 노랑 통닭 눈꽃 치즈떡볶이 치즈볼 서브웨이 쿠키
54,2020-08-26,구들 쪕쪕 바압 환영 팔로우 선댓 환영 가요 하트 팔로우 팔로워 리기 팔로워 리기 팔로우 환영 사진 사진 스타 팔로우 팔로우 환영 치즈볼 치킨 버거킹 너겟 팔로우 팔로우 리기 먹스타그램 스타 스타
55,2020-08-25,instagram instadaily instalike 최햄몇 계획 라면 이따 소리 안함 저녁 햄버거 버거킹 콰트로 치즈 치즈 와퍼 새우 와퍼 너겟킹 치즈볼 프렌치 라이 코울 슬로 수원
56,2020-08-24,bbq bbq kfc 치즈볼 네고왕 치즈볼 때문 아무 치킨 이나 네고왕 닥분 천원 할인 금액 저렴 먹엇습니 번은 할인 쿠폰 때문 비비큐 어플 통해 거지 난이도 최적화 요기 요로 황금올리브 치킨 이나 크기 크리스 비슷 케이에프씨 이후 치킨 나이트 치킨 종류 케이에프씨 들엇어용 비비큐 삼성 점포 상태 회전 재료 관리 지점 차이 치킨 케이에프씨 치킨 나이트 교하면 케이에프씨 위생 측면 아보 배달 점포 포장 수령 이미지 마지막 치즈볼 확실 치즈볼 때문 치킨 얘기 절로 상태 때문 굳이 지점 케이에프씨 치킨 나이트 버거킹 치즈볼 조합 장하 근처 동네 비비큐 네고왕 쿠폰 비비큐 치킨 세용 배달 배달 천원 방문 포장 비용 때문 동네 근처 라면 방문 포장 치킨 세용 방문 포장 배달 배달 음식 치킨 느님
57,2020-08-23,대전 버거킹 칠리 크랩 버거 치즈볼 치킨너겟 감자 튀김 맛스타그램 먹스타그램 스타
58,2020-08-22,bhc 요즘 햄버거 맘스터치 사이드 최고 치즈볼 흡사 배달 배달 음식 배달의민족 배달 음식 배달 맛집 햄버거 햄버거 맛집 사이드 치즈볼 고구마 치즈볼 샐러드 감자 튀김 스타일 기분 기분 전환 소한 행복 확행 맘스터치 버거킹 롯데리아 맥도날드 수제 버거 사랑 혼밥 혼밥 성공 그래도좋아
59,2020-08-18,essential tip by easy repost app bhc cheese 저장 브랜드 치즈볼 모음 본사 치즈볼 맛스타그램 치킨 맘스터치 신전 떡볶이 페리 카나 버거킹 필수 정보 꿀팁 명랑 핫도그 치킨 푸라닭 찹쌀 도너츠 치즈 치즈 요리 고구마 치즈볼 쫀득 치즈볼
60,2020-08-15,aka chocolate sundae food daily foodie 버거킹 치즈스틱 크림 치즈볼 크림 치즈볼 치즈볼 치즈스틱 간식 야식 어니언 양념감자 감자 튀김 초코 선데 마무리 피카츄 음식 먹스타그램 맛스타그램 맛집 먹방 데일 음식 스타 푸드 스타
