,date,버거킹
61,2020-08-15,bbq bhc bbq id food 황금올리브 치킨 치즈볼 광희 덕분 치킨 치즈볼 오랜만 옛날 바삭 바삭 정도 지점 마다 치즈볼 저가 치즈볼 버거킹 치즈볼 맘스터치 치즈볼 가장 저렴 었으 통해 경우 한해 황금 올리브 치킨 천원 할인 천원 제공 치즈볼 제공 이벤트 실시 치맥 치킨 맛집 맛집 탐방 먹방 스타 스타 먹스타그램 먹방 스타 팔해 존맛 마산 맛집 마산 창원 부산 환영 음식 음식 스타 솔직 후기
62,2020-08-14,버거킹 스윗 치킨 버거 버거킹 버거 기대 익숙 기억 사랑 치즈볼 기억 존맛 크기 개도 가능 쉐이킹 프라이 매콤 치즈 갈릭 가루 듬뿍 버거킹 버거킹 버거킹 먹스타그램 스타 스타 먹방 먹방 스타 햄버거 햄버거 맛집 맛집 스타 맛집 탐방 팔로우 팔로우 환영 팔로우
63,2020-08-14,버거킹 스윗 치킨 버거 버거킹 버거 기대 익숙 기억 사랑 치즈볼 기억 존맛 크기 개도 가능 쉐이킹 프라이 매콤 치즈 갈릭 가루 듬뿍 버거킹 버거킹 버거킹 먹스타그램 스타 스타 먹방 먹방 스타 햄버거 햄버거 맛집 맛집 스타 맛집 탐방 팔로우 팔로우 환영 팔로우
64,2020-08-14,버거킹 스윗 치킨 버거 버거킹 버거 기대 익숙 기억 사랑 치즈볼 기억 존맛 크기 개도 가능 쉐이킹 프라이 매콤 치즈 갈릭 가루 듬뿍 버거킹 버거킹 버거킹 먹스타그램 스타 스타 먹방 먹방 스타 햄버거 햄버거 맛집 맛집 스타 맛집 탐방 팔로우 팔로우 환영 팔로우
65,2020-08-14,버거킹 스윗 치킨 버거 버거킹 버거 기대 익숙 기억 사랑 치즈볼 기억 존맛 크기 개도 가능 쉐이킹 프라이 매콤 치즈 갈릭 가루 듬뿍 버거킹 버거킹 버거킹 먹스타그램 스타 스타 먹방 먹방 스타 햄버거 햄버거 맛집 맛집 스타 맛집 탐방 팔로우 팔로우 환영 팔로우
66,2020-08-14,버거킹 스윗 치킨 버거 버거킹 버거 기대 익숙 기억 사랑 치즈볼 기억 존맛 크기 개도 가능 쉐이킹 프라이 매콤 치즈 갈릭 가루 듬뿍 버거킹 버거킹 버거킹 먹스타그램 스타 스타 먹방 먹방 스타 햄버거 햄버거 맛집 맛집 스타 맛집 탐방 팔로우 팔로우 환영 팔로우
67,2020-08-14,버거킹 치즈볼 패스트푸드 데리 요즘 아들 고하 햄버거 아들 데리 서로 라다 게라 버거킹 더위 피해 아들 최애 음식 불고기 거거 미닛메이드 오렌지 외식 치즈볼 주부 스타 스타 해빙 여름
68,2020-08-14,버거킹 치즈볼 패스트푸드 데리 요즘 아들 고하 햄버거 아들 데리 서로 라다 게라 버거킹 더위 피해 아들 최애 음식 불고기 거거 미닛메이드 오렌지 외식 치즈볼 주부 스타 스타 해빙 여름
69,2020-08-07,버거킹 햄버거 후렌치후 라이 콜라 너겟 치즈볼 지지
70,2020-08-07,bhc cheese 저장 브랜드 치즈볼 모음 본사 치즈볼 맛스타그램 치킨 맘스터치 신전 떡볶이 페리 카나 버거킹 필수 정보 꿀팁 명랑 핫도그 치킨 푸라닭 찹쌀 도너츠 치즈 치즈 요리 고구마 치즈볼 쫀득 치즈볼
71,2020-08-06,햄버거 주니어 사이드 여러 가지 뷔페 버거킹
72,2020-08-03,짬뽕 볶음밥 버거킹 금욜 저녁 도저히 쪼꼬 야채 먹이 려고 대파 불맛 요리 호들갑 새우 하트 양으로 도하 애정 표현 공적 치자 토욜 냉동 냉장고 투리 냉털보 한참 숟가락 자꾸 젓가락 개임 젓가락 빙구 웃음 초딩 마지막 별로 안고 프다 쥬니어 사이드 라지 치즈볼 주말 스타 집밥 스타 집콕 요리 스타 푸드 스타 맛스타 스타 스타 커플스 스타 초딩 스타 데이트 짬뽕 요즘 최애 냉털 볶음밥 채소 말라가 버거킹 콰트로 치즈 치즈볼 시체놀이 넷플릭스
73,2020-08-03,짬뽕 볶음밥 버거킹 금욜 저녁 도저히 쪼꼬 야채 먹이 려고 대파 불맛 요리 호들갑 새우 하트 양으로 도하 애정 표현 공적 치자 토욜 냉동 냉장고 투리 냉털보 한참 숟가락 자꾸 젓가락 개임 젓가락 빙구 웃음 초딩 마지막 별로 안고 프다 쥬니어 사이드 라지 치즈볼 주말 스타 집밥 스타 집콕 요리 스타 푸드 스타 맛스타 스타 스타 커플스 스타 초딩 스타 데이트 짬뽕 요즘 최애 냉털 볶음밥 채소 말라가 버거킹 콰트로 치즈 치즈볼 시체놀이 넷플릭스
74,2020-08-03,버거 사이드 홀릭 버거킹 버거킹 패스트푸드 먹스타그램 맛스타그램 주말 데이트 치즈 주니어 할인 행사 치킨너겟 치즈 프라이 치즈볼 소스 지게 사이드 홀릭맛나 돼지
75,2020-08-03,버거 사이드 홀릭 버거킹 버거킹 패스트푸드 먹스타그램 맛스타그램 주말 데이트 치즈 주니어 할인 행사 치킨너겟 치즈 프라이 치즈볼 소스 지게 사이드 홀릭맛나 돼지
76,2020-08-02,by 치즈볼 디아블로 소스 메인 디아블로 소스 버거킹
77,2020-07-30,분명 전화 통화 최애 소주 안주 치즈 어간 음식 치즈볼 사람 치즈볼 소주 뚜껑 사람 치즈볼 소주 버거킹 치즈볼 치킨너겟 치즈 엔소 분명 나름 다이어트 아들 워킹맘
78,2020-07-22,repost hayul 사진 감사 미소 장착 다리 면차롱 제주 여행 일차 물놀이 위해 아침 협재 어제 날씨 물놀이 아빠 하율 멀리 어가 태율 파도 어가 하율 파도 물이 요하 파도 해파리 부녀 중간 협재 하루 종일 결정 파라솔 려고 김밥 전복죽 정도 해수욕장 치킨 라면 블로그 블로그 이유 구나 파라솔 안부 만원 그냥 식당가 제대로 저녁 면차롱 서비스 제주 여행 아기 제주 가족 여행 협재해수욕장 치킨 치즈볼 핵존맛 떡볶이 김밥 충무김밥 오뎅 은하 전복죽 전복 수제 햄버거 버거 버거킹 와퍼 면차롱 짜장면 짬뽕 감귤 탕수육
79,2020-07-17,버거킹 사이드 잔치 치즈스틱 어니언 치즈볼 콜라 치즈스틱
80,2020-07-16,instainstagraminstafood foodfoodlikefoodgood orakaihotel burgerking dailydailygram 호캉스 호캉스 막밤 오징어 다가 배민 문하 여서 오징어 햄버거 치즈볼 치킨너겟 감자 튀김 클리어 가기 러더 이따 새벽 수영장 녀석 일찍 일어나서 갈수 녀석 항상 부모 엄마 아빠 조만간 호캉스 호캉스 하자 구나 인천 인천 논현동 목요일 라카 이송 파크 호텔 오라 카이 호텔 호텔 맛집 맛집 마지막 야식 오징어 버거킹 햄버거 치즈볼 감자 튀김 치킨너겟 먹방
81,2020-07-16,instainstagraminstafood foodfoodlikefoodgood orakaihotel burgerking dailydailygram 호캉스 호캉스 막밤 오징어 다가 배민 문하 여서 오징어 햄버거 치즈볼 치킨너겟 감자 튀김 클리어 가기 러더 이따 새벽 수영장 녀석 일찍 일어나서 갈수 녀석 항상 부모 엄마 아빠 조만간 호캉스 호캉스 하자 구나 인천 인천 논현동 목요일 라카 이송 파크 호텔 오라 카이 호텔 호텔 맛집 맛집 마지막 야식 오징어 버거킹 햄버거 치즈볼 감자 튀김 치킨너겟 먹방
82,2020-07-15,제주 여행 일차 물놀이 위해 아침 협재 어제 날씨 물놀이 아빠 하율 멀리 어가 태율 파도 어가 하율 파도 물이 요하 파도 해파리 부녀 중간 협재 하루 종일 결정 파라솔 려고 김밥 전복죽 정도 해수욕장 치킨 라면 블로그 블로그 이유 구나 파라솔 안부 만원 그냥 식당가 제대로 저녁 면차롱 서비스 제주 여행 아기 제주 가족 여행 협재해수욕장 치킨 치즈볼 핵존맛 떡볶이 김밥 충무김밥 오뎅 은하 전복죽 전복 수제 햄버거 버거 버거킹 와퍼 면차롱 짜장면 짬뽕 감귤 탕수육
83,2020-07-15,오랜만 외출 버거킹 병원 복권 사고 버거킹 치즈볼 아이스크림 버거킹 치즈볼 아이스크림 먹스타그램
84,2020-07-15,오랜만 외출 버거킹 병원 복권 사고 버거킹 치즈볼 아이스크림 버거킹 치즈볼 아이스크림 먹스타그램
85,2020-07-15,오랜만 외출 버거킹 병원 복권 사고 버거킹 치즈볼 아이스크림 버거킹 치즈볼 아이스크림 먹스타그램
86,2020-07-14,버거킹 햄버거 칠리 크랩 새우 대게 새우 버거 트러플 감자 튀김 치즈볼 햄버거 세트 라지 세트 햄버거 맥도날드 맛스타그램 행복 스타 화이팅
87,2020-07-13,버거킹 먹스타그램 치즈볼
88,2020-07-12,covid burgerking ig bliss daily instadaily happy life blessing in disguise 점심 버거킹 와퍼 마스크 익숙 해지 버거킹 불고기 와퍼 치즈볼 주말 점심 하루 소한 직장 인스타그램 가족 스타 아빠스 맛집 먹스타그램 학행 지금 행복 나중 행복
89,2020-07-12,covid burgerking ig bliss daily instadaily happy life blessing in disguise 점심 버거킹 와퍼 마스크 익숙 해지 버거킹 불고기 와퍼 치즈볼 주말 점심 하루 소한 직장 인스타그램 가족 스타 아빠스 맛집 먹스타그램 학행 지금 행복 나중 행복
90,2020-07-12,covid burgerking ig bliss daily instadaily happy life blessing in disguise 점심 버거킹 와퍼 마스크 익숙 해지 버거킹 불고기 와퍼 치즈볼 주말 점심 하루 소한 직장 인스타그램 가족 스타 아빠스 맛집 먹스타그램 학행 지금 행복 나중 행복
91,2020-07-04,버거킹 대게 와퍼 햄버거 맛집 패티 먹방 맛집 햄버거 와퍼 늗곳 대게 다이어트 운동 감자 튀김 치즈볼 와퍼 버거킹 요즘 마요네즈 듬뿍 어간 햄버거 좋댴
92,2020-07-04,버거킹 대게 와퍼 햄버거 맛집 패티 먹방 맛집 햄버거 와퍼 늗곳 대게 다이어트 운동 감자 튀김 치즈볼 와퍼 버거킹 요즘 마요네즈 듬뿍 어간 햄버거 좋댴
93,2020-07-04,점심 햄버거 버거킹 꿀맛 치즈볼 치즈스틱 치킨너겟 치즈 더쿠 치즈 덕후
94,2020-06-21,인스타 바삭 바삭 치킨 버거킹 야식 치맥 바삭 치즈볼 버거킹 먹스타그램
95,2020-06-21,인스타 바삭 바삭 치킨 버거킹 야식 치맥 바삭 치즈볼 버거킹 먹스타그램
96,2020-06-21,버거킹 치즈볼
97,2020-06-19,버거킹 초점 사진 원래 버거킹 햄버거 베이컨 치즈 치즈볼 꿀맛 하루 점심 금요일 일상사진 초점 은사 아들 엄마 초딩 중딩 스타 아들
98,2020-06-19,버거킹 초점 사진 원래 버거킹 햄버거 베이컨 치즈 치즈볼 꿀맛 하루 점심 금요일 일상사진 초점 은사 아들 엄마 초딩 중딩 스타 아들
99,2020-06-19,기름 밤새 작업 한숨 자고 남편 버거킹 증산 버거킹 후렌치 프라이 너겟킹 치즈볼 콜라
100,2020-06-19,기름 밤새 작업 한숨 자고 남편 버거킹 증산 버거킹 후렌치 프라이 너겟킹 치즈볼 콜라
101,2020-06-18,ootd daily 버거킹 오픈 만원 이상구 텀블러 증정 행사 일전 햄버거 타령 쮸닐 때문 줄섬 버거 텀블러 오자 마자 오지 햄버거 먹방 토마토 햄거거 롯데리아 버거킹 버거킹 계점 햄버거 덕화 버거 와퍼 대게 와퍼 치즈볼 치즈스틱 먹스타그램 맛스타그램 먹방 시흥 맛집 웃핏 오오 티디 일리 데일
102,2020-06-18,ootd daily 버거킹 오픈 만원 이상구 텀블러 증정 행사 일전 햄버거 타령 쮸닐 때문 줄섬 버거 텀블러 오자 마자 오지 햄버거 먹방 토마토 햄거거 롯데리아 버거킹 버거킹 계점 햄버거 덕화 버거 와퍼 대게 와퍼 치즈볼 치즈스틱 먹스타그램 맛스타그램 먹방 시흥 맛집 웃핏 오오 티디 일리 데일
103,2020-06-18,ootd daily 버거킹 오픈 만원 이상구 텀블러 증정 행사 일전 햄버거 타령 쮸닐 때문 줄섬 버거 텀블러 오자 마자 오지 햄버거 먹방 토마토 햄거거 롯데리아 버거킹 버거킹 계점 햄버거 덕화 버거 와퍼 대게 와퍼 치즈볼 치즈스틱 먹스타그램 맛스타그램 먹방 시흥 맛집 웃핏 오오 티디 일리 데일
104,2020-01-28,예전 치즈볼 버거킹 치즈볼 비교 불가 로나 인절미 초코파이 페레레님 조언 견과류 토핑
105,2020-01-18,오픈 분도 착햇 근처 버거킹 어가 치즈스틱 치즈볼 나왓네 애기 처음 치즈스틱 영접 계속 달라
106,2020-02-06,bhc 치즈스틱 마켓 구입 동글동글 치즈볼 마니커 제품 치즈볼 버거킹 치즈볼
107,2020-04-01,올반 치즈볼 치즈볼 뱀파이어 치킨 세트 버거킹 몬스터 세트 듀얼 와츄원 올반 치즈볼 원가 치즈볼 원가 뱀파이어 치킨 세트
108,2020-03-21,버거킹 치즈볼 인생 경험 존나 버거킹 어보
109,2020-03-21,버거킹 치즈볼 인생 경험 존나 버거킹 어보
110,2020-03-18,곰방 어제 마침 요기 버거킹 할인 햄버거 음료 치즈볼 방어 다운 세용 내일 딸램 생일
111,2020-04-26,comebekoji 새봄 치즈볼 대대 저녁 돌나물 잔뜩 카레 보리 비빔밥 소스 버거킹 패티 아이디어 뱅크 새봄 치즈
112,2020-05-15,기요 맘스터치 치킨 처넌 할인 배달 천원 최종 천원 할인 스타일 버거킹 치즈볼 다도 세트
113,2020-05-20,저녁 버거킹 딜리 치즈볼 크기 매우 탄산수 병뚜껑 치즈볼
114,2020-08-01,버거킹 치즈볼 쿠폰 길레 크기 손가락 크기 버거 치킨 버거 주니어 와퍼 가지
115,2020-09-01,버거킹 치즈볼 탕수육 달래 첫날 배달 일요일 짜파게티 여주 치즈스틱 탕수육 대신 치킨너겟 더니 신랑
116,2020-08-24,어제 저녁 버거킹 치즈볼 에프 어물 다가 치즈 팔목 지면 화상 래서 휴지
117,2020-09-22,버거킹 빨래 이마트 시화 인근 위치 버거킹 칠리 게라 지세 치즈 크리미 치즈볼 어니언 디아블로 소스 치즈
118,2020-09-22,버거킹 빨래 이마트 시화 인근 위치 버거킹 칠리 게라 지세 치즈 크리미 치즈볼 어니언 디아블로 소스 치즈
119,2020-10-09,산책 강변 갈랬는데 신랑 버거킹 자고 둘찌 윰차끌 아이스크림 사이 첫째 햄버거 햄버거 사고 치즈볼
120,2020-01-14,kfc 크림 치즈 징거버거 후기 버거킹 치즈볼 처럼 치즈 쭉쭉 거나 스타일 뭔가 하니 타르트 질감 단맛 고요 치즈 단점
121,2020-02-14,get 버거킹 치즈볼 진날 버거킹 치즈볼 치즈볼 사실 처음 크기 치즈볼 반도 모야 아닛
122,2020-02-14,get 버거킹 치즈볼 진날 버거킹 치즈볼 치즈볼 사실 처음 크기 치즈볼 반도 모야 아닛
123,2020-02-25,가운데 치즈 인지 아주 지니어스 치즈 열심 다가 버거킹 치즈볼 존맛 어보 어보 셨으
124,2020-02-11,치즈볼 지고 두번째 버거킹 치즈볼 처갓집 치킨 사이드
125,2020-03-07,버거킹 크리미 치즈볼 드디어 치즈볼 가나 치즈 덕후 콰트로 치즈버거 어도 버거킹 최애 오랜만
126,2020-03-07,버거킹 크리미 치즈볼 드디어 치즈볼 가나 치즈 덕후 콰트로 치즈버거 어도 버거킹 최애 오랜만
127,2020-03-05,자취 냉동식품 간단 리하 사이드바 치즈볼 크리미 한치 버거킹 치즈볼 치즈 서도 치즈볼
128,2020-03-05,경산 맛집 친절 점수 트리플 치즈볼 호식 이두 치킨 영대 버거킹 치즈볼 크림 치즈 피자 치킨 때문 종종 포장 방문 드디어 치킨 서도 크림 치즈 어간 치즈볼
129,2020-03-23,버거킹 크리미 치즈볼 경산 삼풍 족발 맛집 원조 장충 족발 경산 치킨 맛집 지코 사동 버거킹 양파링 치즈볼 치즈볼 깜짝 음청 햄버거 묵고 노래 노래 도부 씐나씐
130,2020-03-23,버거킹 크리미 치즈볼 경산 삼풍 족발 맛집 원조 장충 족발 경산 치킨 맛집 지코 사동 버거킹 양파링 치즈볼 치즈볼 깜짝 음청 햄버거 묵고 노래 노래 도부 씐나씐
131,2020-03-23,통닭 후라이드 간장 미니 치즈볼 미니 치즈볼 이름 듯이 미니 사이즈 치즈 크림 치즈 야말로 버거킹 치즈볼
132,2020-04-03,bhc 치즈볼 모짜렐라 돈카츠 후기 사진 치즈볼 치즈 한쪽 기대 치즈볼 버거킹 치즈볼
133,2020-04-24,cm 맘스터치 사이드 바삭 크림 치즈볼 후기 바삭 크림 치즈볼 지름 내외 형태 버거킹 크리미 롯데리아 치즈 정도 아담 크기 달리
134,2020-04-18,버거킹 치즈볼 코코넛 림프 콰트로 치즈 와퍼버거 버거킹 콰트로 치즈 버거 와퍼버거 코코넛 림프 쫀득 크리미 치즈볼 콰트로 치즈 버거 치즈
135,2020-04-18,버거킹 치즈볼 코코넛 림프 콰트로 치즈 와퍼버거 버거킹 콰트로 치즈 버거 와퍼버거 코코넛 림프 쫀득 크리미 치즈볼 콰트로 치즈 버거 치즈
136,2020-04-23,먹방 자의 살기 감성 커피 달구 커피 달구 라테 카페 아인 슈페너 뿌링 치즈볼 치즈볼 맛초킹 시킴 그동안 볼일 버거킹 아기 상어
137,2020-04-17,fs bhc 경주 버거킹 버거킹 경주 터미널 통모 와퍼 불고기 와퍼 꿀맛 치즈볼 달리 크림 치즈 존맛 한번 사서 보시 이건 불고기 와퍼 이건 불고기 주니어 확실 크기 차이 어마 어마 이건
138,2020-04-17,fs bhc 경주 버거킹 버거킹 경주 터미널 통모 와퍼 불고기 와퍼 꿀맛 치즈볼 달리 크림 치즈 존맛 한번 사서 보시 이건 불고기 와퍼 이건 불고기 주니어 확실 크기 차이 어마 어마 이건
139,2020-05-04,공릉 고로케 치즈볼 맛집 도로시 명품 꽈배기 치즈볼 마약 옥수수 고로케 치즈볼 이건 그대로 치즈 어진 치즈볼 간단 포스팅 서로 이웃 환영 맘스터치 치즈볼 버거킹
140,2020-05-25,맘스터치 바삭 크림 치즈볼 후기 인지 버거킹 치즈볼 후기 인지 버거킹 치즈볼 크림 치즈 버거킹 치즈볼 다그 래서 치즈볼 맘스터치 치즈볼
141,2020-05-25,맘스터치 바삭 크림 치즈볼 후기 인지 버거킹 치즈볼 후기 인지 버거킹 치즈볼 크림 치즈 버거킹 치즈볼 다그 래서 치즈볼 맘스터치 치즈볼
142,2020-05-25,맘스터치 바삭 크림 치즈볼 후기 인지 버거킹 치즈볼 후기 인지 버거킹 치즈볼 크림 치즈 버거킹 치즈볼 다그 래서 치즈볼 맘스터치 치즈볼
143,2020-05-17,feat 버거킹 콰트로 치즈 치즈스틱 치즈볼 직장인 야근 식사 이건 버거킹 치즈볼 버거 버거킹 치즈스틱 케첩 셋팅
144,2020-05-17,feat 버거킹 콰트로 치즈 치즈스틱 치즈볼 직장인 야근 식사 이건 버거킹 치즈볼 버거 버거킹 치즈스틱 케첩 셋팅
145,2020-05-17,feat 버거킹 콰트로 치즈 치즈스틱 치즈볼 직장인 야근 식사 이건 버거킹 치즈볼 버거 버거킹 치즈스틱 케첩 셋팅
146,2020-05-22,버거킹 크리미 치즈볼 치즈 쭈욱 재미 겉쪽 치즈 크림 크림 적당 달달
147,2020-05-19,bhc 치즈 모짜렐라 치즈 쭉쭉 엄마 치즈볼 아함 요즘 워낙 치즈볼 유명 치킨 버거킹 이나
148,2020-06-11,쌀국수 갈비탕 옥상 광합성 핫도그 치즈볼 한바탕 난리 홍대 체육관 추적 추적 버거킹 치즈볼 달달 치즈 롯데리아 치즈스틱 고소 치즈볼 출근 장님
149,2020-06-15,로그 생일케이크 다이어트식단 부침개 명량 핫도그 치즈볼 엽떡 뚜레주르 마카롱 단호박 그슬럿 버거킹 이응 수제 도넛 버터 킹콩 빵공 장오 두산 막국수 바베큐 장터 원조 국수 치즈볼 살짝 찹쌀 도너츠 눠낌이랄까 불닭 소스 살짝 매콤 저번 엽떡 소세지 치즈 핫도그
150,2020-06-12,버거킹 크리미 후기 버거킹 치즈볼 치즈 크림 치즈 짠맛 달달 치즈볼 호불호 갈리 맛이죵 드립
151,2020-06-12,버거킹 크리미 후기 버거킹 치즈볼 치즈 크림 치즈 짠맛 달달 치즈볼 호불호 갈리 맛이죵 드립
152,2020-06-29,구례 수제비 이조 갈비 버거킹 치즈볼 곡성 다리 곡성 캠핑장 수제비 토지면 제비집 돌솥비빔밥 유명 여수 로스 티아 수제 햄버거 피곤 래서 갈비 이조 왕족 갈비
153,2020-06-17,버거킹 콰트로 치즈버거 려면 제대로 치즈 치즈 위해 치즈볼 버거킹 배열 잘못 패티 기분
154,2020-06-17,버거킹 콰트로 치즈버거 려면 제대로 치즈 치즈 위해 치즈볼 버거킹 배열 잘못 패티 기분
155,2020-07-28,am 아침 점심 요약 애슐리 롤링 치즈볼 버거킹 군자 능동 애슐리 롤링 치즈볼 치즈 마법 소스 에어프라이어
156,2020-07-12,버거킹 몬스터 세트 치즈볼 요기 치즈볼 아해 버거킹 치즈볼 기대 이하 몬스터 패티 장난 닙니 지네 광고 진입 참고 해주 몬스터
157,2020-07-12,버거킹 몬스터 세트 치즈볼 요기 치즈볼 아해 버거킹 치즈볼 기대 이하 몬스터 패티 장난 닙니 지네 광고 진입 참고 해주 몬스터
158,2020-07-25,햄바 버거킹 치즈볼 버거 사이드 사랑 치즈볼 맛있따잉 치즈버거 심플 된거 주니어 와퍼 자식
159,2020-07-07,치즈볼 덕후 어보 천하 프랜차이즈 베스트 치즈볼 모음 치즈볼 덕후 어보 천하 프랜차이즈 베스트 치즈볼 모음 명랑 핫도그 쫀달 치즈볼 버거킹 크리미 비비큐 황금알 치즈볼 신전 고구마 치즈볼
160,2020-07-21,버거킹 치즈볼 버거킹 치즈볼 가격 저렴 자주 치즈 크림 치즈 달달 크기
161,2020-07-21,버거킹 치즈볼 버거킹 치즈볼 가격 저렴 자주 치즈 크림 치즈 달달 크기
162,2020-07-17,bhc 치즈볼 래서 쫀득 크리미 치즈 라서 버거킹 사이
163,2020-07-05,버거킹 치즈볼 처음 무게 마다 신기 천장 퇴근 어가 채소
164,2020-08-29,쫀달 치즈볼 명랑 핫도그 치즈볼 도전 치즈 버거킹 신전 떡볶이 치즈볼 때문 낱개 치즈볼
165,2020-09-01,치즈볼 꿀맛 버거킹 치즈볼 맘스터치 치즈볼 요사 집앞 경성 핫도그 치즈볼 고요 치즈볼
166,2020-08-23,배곧 맛집 정왕동 맛집 배곧 버거킹 배곧아브뉴 프랑 행사 새우 와퍼 치즈볼 후기 크림 치즈볼 크림 치즈 거임 존맛 새우 와퍼
167,2020-08-03,kfc kfc 순희 빈대떡 고기 완자 치킨 치즈볼 맥주 머무 이제 칠만 직접 재배 고추 치킨 노랑 치킨 배달 치즈볼 버거킹 나은 맥주
168,2020-08-18,애슐리 치즈볼 간단 요리 간식 롯데리아 버거킹 치즈스틱 몹시 애슐리 치즈볼 쿠팡 파트너 활동 일정 수수료 제공
169,2020-08-09,버거킹 트러플 머쉬룸 와퍼 치즈볼 치킨 너겟 버거 놈임 다가 크리미 바삭 바삭 보드 러운 크림 치즈 어가 모짜렐라 치즈 크림 치즈 순삭
170,2020-09-16,bhc 자취 끼니 맘스터치 치즈볼 알룰 로스 양념치킨 보기 치즈 크림 강하 인적 치즈볼 치즈볼 브랜드 라퀴진 치즈볼 버거킹 치즈볼 맘스터치
171,2020-10-13,치즈볼 적당 버거킹 치즈볼 는걸 모양 신기 호떡 토스트 글씨체 정자 쓰기
172,2020-10-11,맘스터치 살사 리코 버거 치즈볼 대유행 치즈볼 본부장 버거킹 고하 다가 중간 사진 찍움 소문 내야 치즈볼 바삭 배달
173,2020-10-09,버거킹 치즈볼 어플 할인 서브웨이 샐러드 가격 로스트치킨 크림 치즈 모짜렐라 치즈 거울 치즈 버거킹 치즈볼 정도 한계 끼함
174,2020-10-09,버거킹 치즈볼 어플 할인 서브웨이 샐러드 가격 로스트치킨 크림 치즈 모짜렐라 치즈 거울 치즈 버거킹 치즈볼 정도 한계 끼함
175,2020-10-09,치즈볼 진심 버거킹 크리미 치킨 치즈볼 바삭 튀김 크리미 이름 치즈 필링 크림 치즈 모짜렐라 달달 크림 치즈
176,2020-10-06,bbq 버거킹 기네스 와퍼 콰트로 치즈 세트 가격 정보 사천 버거킹 크리미 치즈볼 상하 모짜렐라 치즈 크림 치즈 고요 라서
177,2020-10-06,bbq 버거킹 기네스 와퍼 콰트로 치즈 세트 가격 정보 사천 버거킹 크리미 치즈볼 상하 모짜렐라 치즈 크림 치즈 고요 라서
178,2020-10-12,버거킹 치즈볼 크리미 모찌 치킨너겟 꽈배기 인절미 신상 대서 크림 치즈볼 크기
