,date,CJ
123,2020-08-03,cj 크리스 치즈볼 여우 쇼핑 모바일 자사 홍보 게시 별도 구매 문의 감사
124,2020-09-07,bbq kcal cj 후라이드 치킨 칼로리 치킨 한조 칼로리 치즈볼 칼로리 치즈볼 치즈볼 제품 기준 측정 일반 가슴 칼로리 치킨
125,2020-09-11,cj 치즈볼 사이드 바이 에어프라이어 치즈볼 치즈볼 모짜렐라 치즈 프로 첨가 에프 가격 이면 만족
126,2020-09-19,cj cj 사이드바 치즈볼 직접 구매 후기 간식 래서 사이드바 치즈볼 모짜렐라 치즈 크림 치즈 구나 성분 모짜렐라 치즈 어가
127,2020-09-19,cj cj 사이드바 치즈볼 직접 구매 후기 간식 래서 사이드바 치즈볼 모짜렐라 치즈 크림 치즈 구나 성분 모짜렐라 치즈 어가
128,2020-09-08,cj 치즈볼 에어프라이어 해먹 요즘 치즈볼 치즈 아해 항상 치킨 마다 가격 때문 래서
129,2020-09-22,vs cj 냉동 치즈볼 풀무원 모짜렐라 치즈볼 사이드 바이 치즈볼 치즈 어가 치즈볼 가래떡 처럼 찐뜩거렸 만요 외견 통해 예상 처럼 기름
130,2020-09-09,cj 치킨 치즈볼 종류 평가 치킨 치즈볼 처음 구입 한종 구입 레시피 지난번 고추 크런키 스윗 허니 스파 이시스 허니 치즈볼
131,2020-09-29,cj bhc 미국 한인 마트 바삭 치즈볼 다담 떡볶이 소스 통통 소세지 비엔나 소세지 이전 라스베가스 한인 마트 그린랜드 바삭 치즈볼 한국 치즈볼 편의점 찹쌀 치즈스틱
132,2020-10-13,bhc cj bhc cj bhc 냉동 치즈볼 냉동 치즈볼 프레시웨이 어메이징 치즈볼 시리즈 치즈 색상 치즈볼 달라 살짝 당황 두루 프레시웨이 어메이징 블랙치즈볼 오마이갓 오마이갓 치즈볼
133,2020-10-13,bhc cj bhc cj bhc 냉동 치즈볼 냉동 치즈볼 프레시웨이 어메이징 치즈볼 시리즈 치즈 색상 치즈볼 달라 살짝 당황 두루 프레시웨이 어메이징 블랙치즈볼 오마이갓 오마이갓 치즈볼
134,2020-10-07,cj 사이드바 치즈볼 에어프라이어 치즈볼 사이드바 치즈볼 냉동 보관 제품 바삭 쫄깃 고소 모짜렐라 치즈 거기 첨가 사이드
135,2020-10-06,cj bhc cj 사이드바 치즈볼 치즈볼 자꾸 치즈볼 나름 사이드 자고 배달 내기 까운 마침 엄빠 장보 다가
136,2020-10-06,cj bhc cj 사이드바 치즈볼 치즈볼 자꾸 치즈볼 나름 사이드 자고 배달 내기 까운 마침 엄빠 장보 다가
137,2020-10-04,cj 사이드바 치즈볼 후기 이마트 할인 바삭 전혀 냉동 치즈볼 다가 크림 치즈 치즈 연한 결과 찹쌀 부분
138,2020-10-07,cj feat bhc 제품 사이드 바이 치즈볼 치즈볼 비교 제품 어제 아버지 장보 다가 궁금 치즈 타입 사이드 바이 치즈볼 쫄깃
139,2020-10-07,cj 사이드바 치즈볼 가격 아마 신하 에프 더니 이케 소스 치즈볼 전용 소스
140,2020-10-09,cj 하프 피자치즈 탄생 할로윈 분위기 물씬 가구 자취 생도 부담 하프 피자 피자 치즈
