,date,CJ
0,2020-10-13,cj bhc 킹콩 호떡 최고 호떡 의계 호떡 사랑 호떡 믹스 킹콩 호떡 최고 아이스크림 서호 호떡 사랑 도시 뿌링클 치즈볼 일리지 먹스타그램 맛스타그램
1,2020-09-29,cj gourmet worldcuisine 연휴 집콕 대비 먹거리 성하 준비 혼추족 하프 피자 치즈볼 매력 피자 허니 베이컨 체다 피자 인기 사이드 사이드바 치즈볼 조합
2,2020-09-25,day set set set set dreambody cj 하체 운동 이십 오후 운동 하체 공포 하체 운동 하체 마다 이십 한번 레그 프레 와이드 자세 진행 레그 익스 텐션 하프 스쿼트 일어 나기 진행 복근 운동 머신 손잡이 잡고 그레이 진행 미리 코치 오늘이 그날 래서 다리 상태 진행 나중 스쿼트 다리 주저 센터 차안 치즈볼 장하 다애 고마 등살 저리 코치 오전 보더 러시 아직 목표 체중 빠샤 바디 프로필 준비 바디 프로필 준비 헬린 하체 운동 지옥불 치즈볼 동하 여자 내자
3,2020-09-13,bj cj cgv pm bhc pm bj dday 사이드 타락 마지막 선배 님들 선정 지하 고민 시더 평소 선정 달라 평소 궁금헀던 선배 님들 단호 그냥 저건 음식 구나 라며 신경 회로 차단 앤티앤스 아몬드 크림 치즈스틱 해주 셨는데 탄수화물 맛집 회사 영화 볼때 한번 영화 시작 기억 저녁 타락 로제 찜닭 당면 분식 로제 중국 당면 디저트 커스타드 크로칸슈 치즈볼 선배 님들 치즈볼 브랜드 순진 헬창 후배 님들 교육 알볼 제외 선배 님들 은근 타락 음식 짜장면 치킨 피자 아이스크림 햄버거 그냥 치즈볼 마왕 족발 칙촉 아이스크림 아이스박스 엽떡 저녁 마지막 타락 헬창 치즈볼 라이브 방송 특별 게스트 순진 후배 헬창들 타락 타락 헬창 마지막 선배 님들 당면 종류 치즈
4,2020-09-11,cj cj cj 금요일 치킨 고추 크런치 양념치킨 사이드바 치즈볼 치킨 치즈볼 고추 크런치 양념치킨 치즈볼
5,2020-09-11,cj cj cj 금요일 치킨 고추 크런치 양념치킨 사이드바 치즈볼 치킨 치즈볼 고추 크런치 양념치킨 치즈볼
6,2020-09-11,cj cj cj 금요일 치킨 고추 크런치 양념치킨 사이드바 치즈볼 치킨 치즈볼 고추 크런치 양념치킨 치즈볼
7,2020-09-11,hey whats up guys bj pm cj pm 안녕 치즈볼 어제 슈가 쇼크 성적 늦잠 흥미 기사 어보 과거 트레이너 시절 영상 캡쳐 세상 단호 표정 단당류 녀석 팹시 탄수화물 단당류 선배 님들 저녁 타락 지코 양념 소금 탄수화물 맛집 현미 햇반 쌀밥 도전 서브웨이 쿠키 뒷전 해명 라이브 선배 님들 내주 인스타 스토리 뒷전 거좀 선배 님들 처럼 아직 타락 열심 선배 저녁 금요일 지코 먹방 타락 헬창 음식 음식 측정 치즈볼 스쿼트 아이스박스 벤치 프레 미정 데드리프트
8,2020-08-25,shs 라면 점심 중식 한식 오뚜기 진라면 씨제이 비비고 감자 만두
9,2020-08-18,cj gourmet worldcuisine 모짜렐라 치즈 가득 계속 성의 치즈볼 바스 콜라 간식 간식 원픽 미식 여행
10,2020-08-16,lunch cj cook cooking foodporn foodie chicken cheeseball cheesesticks beer beerlover 점심 그냥 휴일 휴가 술술 그냥 한잔 골뱅이 파채 비빔면 파채골빔 완성 파채골빔 치킨 치즈볼 브랜드 치즈스틱 간식 바나나 식단 식단 기록 식단 일기 의식 요리 홈쿡 스타 요리 스타 골빔 치킨 치즈볼 치즈스틱 맥주 맥덕 낮술 스타 맛스타그램 먹스타그램
11,2020-08-08,cj cj hit cafe
12,2020-08-08,cj cj hit cafe
13,2020-08-08,dinner cj cook cooking foodporn foodie meal airfryer chicken cheeseball cj the market 저녁 마켓 쿠폰 냉동식품 마구 마구 구매 크리스 치킨 가지 치즈볼 에어프라이어 라볶이 맥주 술술 어간 크리스 키친 고추 크런치 크리스 치킨 스윗 허니 사이드바 치즈볼 라볶이 단무지 감자 양파 닭고기 이유식 중기 배죽쌀 식단 식단 기록 식단 일기 의식 요리 홈쿡 밥상 스타 요리 스타 밥상 스타 에어프라이어 에어프라이어 요리 치킨 치즈볼 맛스타그램 맛스타 먹스타그램 스타
14,2020-08-08,dinner cj cook cooking foodporn foodie meal airfryer chicken cheeseball cj the market 저녁 마켓 쿠폰 냉동식품 마구 마구 구매 크리스 치킨 가지 치즈볼 에어프라이어 라볶이 맥주 술술 어간 크리스 키친 고추 크런치 크리스 치킨 스윗 허니 사이드바 치즈볼 라볶이 단무지 감자 양파 닭고기 이유식 중기 배죽쌀 식단 식단 기록 식단 일기 의식 요리 홈쿡 밥상 스타 요리 스타 밥상 스타 에어프라이어 에어프라이어 요리 치킨 치즈볼 맛스타그램 맛스타 먹스타그램 스타
15,2020-08-04,cj 요새 요기 이해 서자 품목 장조림 살때 아름 일주일 이면 신랑 휴가 한번 비비고 마켓 고르곤졸라 피자 꼬마 돈카츠 크리스 피치 김말이 치즈볼
16,2020-08-02,bhc cj 불토 토요일 저녁 짜장라면 소화 홈술 배달 음식 뿌링클 치킨 치즈볼 케이준 라이 미니 돈까스 치킨 맥주 소주 참이슬 테라 하이트 하이트진로 테슬라 데일 와이파이
17,2020-07-13,cj hit cafe
18,2020-07-08,kg cj kg kg 치즈볼 치즈스틱 모짜렐라 치즈볼 찹쌀 치즈 스틱 치즈볼 치즈스틱 가공 식품 간식 모짜렐라 치즈 가득 프리미엄 치즈볼 쫀득 찹쌀 고소 모짜렐라 치즈 숑숑 쫄깃 찹쌀 꼬솝 치즈 어울림 실수 치즈볼 치즈스틱 영양 간식 준비 거나 프라이어 정도 조리 치즈볼 치즈스틱 치즈볼 내외 치즈스틱 개중 배송 발송 대한 통운 치즈볼 아이스 배송비 별도 배송 치즈스틱 아이스 배송비 별도 배송
19,2020-07-02,repost bluesky oct cj cj 청주 떡볶이 드뎌 요즘 트롯 신사 임영웅 맛집 유튜브 여러가지 소스 짜장 소스 조만간 갖은 야채 청주 떡볶이 떡볶이 청떡 짜장 소스 간편식 분식 밀당 고수 김말이 치즈볼 메론 수박 그릇 크루 접시 코스 블루 사랑 색감 에어프라이어 냉동식품 머그컵 프릴 자동차 여운 그릇 푸드 픽러블리
20,2020-07-02,repost bluesky oct cj cj 청주 떡볶이 드뎌 요즘 트롯 신사 임영웅 맛집 유튜브 여러가지 소스 짜장 소스 조만간 갖은 야채 청주 떡볶이 떡볶이 청떡 짜장 소스 간편식 분식 밀당 고수 김말이 치즈볼 메론 수박 그릇 크루 접시 코스 블루 사랑 색감 에어프라이어 냉동식품 머그컵 프릴 자동차 여운 그릇 푸드 픽러블리
21,2020-07-01,cj cj 청주 떡볶이 드뎌 요즘 트롯 신사 임영웅 맛집 유튜브 여러가지 소스 짜장 소스 조만간 갖은 야채 청주 떡볶이 떡볶이 청떡 짜장 소스 간편식 분식 밀당 고수 김말이 치즈볼 메론 수박 그릇 크루 접시 코스 블루 사랑 색감 에어프라이어 냉동식품 머그컵 프릴 자동차 여운 그릇 푸드 픽러블리 포크 맛스타그램
22,2020-07-01,cj cj 청주 떡볶이 드뎌 요즘 트롯 신사 임영웅 맛집 유튜브 여러가지 소스 짜장 소스 조만간 갖은 야채 청주 떡볶이 떡볶이 청떡 짜장 소스 간편식 분식 밀당 고수 김말이 치즈볼 메론 수박 그릇 크루 접시 코스 블루 사랑 색감 에어프라이어 냉동식품 머그컵 프릴 자동차 여운 그릇 푸드 픽러블리 포크 맛스타그램
23,2020-06-19,cj cjthemarket cj cj 마켓 할인 쿠폰 왕창 더니 냉동고 가득 가득 남편 벌써 냉동식품 린다 할인 쿠폰 할인 혜택 냉동식품 비비고 비비고 잔치 떡갈비 만두 돈까스 불고기 치킨 치즈볼 핫도그 피자 떡갈비 너겟 불고기 쁘띠첼 스팸 함박스테이크 고등어 시래기 조림
24,2020-06-19,cj cjthemarket cj cj 마켓 할인 쿠폰 왕창 더니 냉동고 가득 가득 남편 벌써 냉동식품 린다 할인 쿠폰 할인 혜택 냉동식품 비비고 비비고 잔치 떡갈비 만두 돈까스 불고기 치킨 치즈볼 핫도그 피자 떡갈비 너겟 불고기 쁘띠첼 스팸 함박스테이크 고등어 시래기 조림
25,2020-06-19,cj cjthemarket cj cj 마켓 할인 쿠폰 왕창 더니 냉동고 가득 가득 남편 벌써 냉동식품 린다 할인 쿠폰 할인 혜택 냉동식품 비비고 비비고 잔치 떡갈비 만두 돈까스 불고기 치킨 치즈볼 핫도그 피자 떡갈비 너겟 불고기 쁘띠첼 스팸 함박스테이크 고등어 시래기 조림
26,2020-06-17,likemefood dosi rak cj cjcheiljedang cjgourmet 서른 도시 치즈 오징어 사이드바 치즈볼 사실 저번 치즈볼 뭔가 래서 고민 치즈볼 문득 냉동 오징어 사실 평소 타코야끼 타코야끼 뚜껑 오징어 그게 치즈 타코야끼 시작 하자 시골 장통 찹쌀 도나 생김새 냄새 조리 위해 준비 간단 치즈볼 오징어 재료 인적 땡초 한번 보시 후기 부탁 드립 조리 방법 매우 간단 치즈볼 뚜껑 치즈 살살 달래 여주 재료 에어프라이어 존맛 사실 타코야끼 기보 옥수수 횟집 반찬 콘치 달달 구니 베이컨 토마토 어간 피자 순간 오징어 땡초 전혀 비리 살짝 태운 타코야끼 기도 세기 천재 한명인 아인슈타인 특별 재능 호기심 호기심 세상 모든 음식 극한 주관 도시 라이 푸드 도시락 메사이드 바이 치즈볼 치즈볼 타코야끼 치즈 타코야끼 타코야끼 만들기 치즈볼 타코야끼 만들기 치즈 오징어 타코야끼 타코야끼 레시피 치즈 문어 찹쌀 모짜렐라 치즈 호기심 괴식 치즈볼 주관 인종 평가
27,2020-02-21,cj 쇼핑몰 마켓 상품 치즈볼 상품 가격 날짜 이미지 더니 올레 치즈볼 치킨
28,2020-02-22,cj 여러 구입 한번 요거트 파우더 취향 딸기 주니 커피숍 용이 치즈볼
29,2020-02-12,cj bhc 에어프라이어 에다가 치즈볼 해먹 치즈볼 롯데 리퀴진꺼 치즈볼 필독 답변 질문 무단
30,2020-02-15,cj 치킨 사이드 간다 치즈볼 에프 마트 다가 다가 이건 달달 치츠볼 거가
31,2020-02-04,cj cj 신제품 대거 출시 식품 백설 제품 쉐프 솔루션 비비고 냉동식품 비비고 냉장 식품 할인 판매 햇반 컵반 비비고 육개장 미역국 사골곰탕 크리스 피함 박피 쁘띠첼 비비고 김치 비비고 왕교 개인 거래 판매 판매 완료 가격 직접 결제 페이 송금 신제품 대거 출시 식품 백설 제품 쉐프 솔루션 비비고 냉동식품 비비고 냉장 식품
32,2020-02-04,cj cj 신제품 대거 출시 식품 백설 제품 쉐프 솔루션 비비고 냉동식품 비비고 냉장 식품 할인 판매 햇반 컵반 비비고 육개장 미역국 사골곰탕 크리스 피함 박피 쁘띠첼 비비고 김치 비비고 왕교 개인 거래 판매 판매 완료 가격 직접 결제 페이 송금 신제품 대거 출시 식품 백설 제품 쉐프 솔루션 비비고 냉동식품 비비고 냉장 식품
33,2020-04-01,cj bhc 저번 구매 작성자 치즈볼 후기 치즈볼 정돈 그냥 찹쌀 도넛 치즈 치즈 치킨 치즈볼 니니
34,2020-03-30,cj hbilxel 마켓 쿠폰 내일 마지막 일반 상품 브라우니 믹스 야채
35,2020-03-09,cj jinheemom jin 마켓 다운로드 가능 쿠폰 지금 물건 장바구니 후기
36,2020-03-27,cj 택배 만두 치즈볼 고기 이도 한동 에어 프라이 아가
37,2020-04-13,cj 치킨 치즈볼 항상 마켓 에어프라이어 노릇 노릇
38,2020-04-14,cj off gx 마켓 핫딜 사이드바 치즈볼 씨제이 마켓 하루 마켓 핫딜
39,2020-04-14,cj off gx 마켓 핫딜 사이드바 치즈볼 씨제이 마켓 하루 마켓 핫딜
40,2020-04-21,cj off gx 마켓 핫딜 사이드바 치즈볼 씨제이 마켓 하루 마켓 핫딜입니
41,2020-04-21,cj off gx 마켓 핫딜 사이드바 치즈볼 씨제이 마켓 하루 마켓 핫딜입니
42,2020-04-23,cj 치즈볼 깜빡 치킨 치즈볼 난대 무비 치킨 공부
43,2020-05-25,cj 치즈볼 치즈볼 몇개 치즈볼 보신 해주
44,2020-05-07,cj one cjwow 짬뽕 핫도그 치즈볼 스팸 양념장 유산균 나름 쿠폰 링크 어간 로그인 필수 입력 할인 쿠폰 쿠폰 할인 쿠폰
45,2020-06-06,cj 마켓 구매 치즈볼 모짜렐라 치즈 돈까스 에프 옥수수 스프 후추 통깨 최근 식물 애플 민트 톡톡
46,2020-06-21,hmr cj 우양 전문 제조 기업 냉동 핫도그 치즈볼 주력 제품 풀무원 롯데 동원 등식 음료 제조 유통 스타벅스 이디야 할리스 대형
47,2020-06-17,cj 비비고 식품 냉동 만두 치즈볼 햇반 제품 살수 온라인 서프라이즈 사전 사전 입장권 발급 중이
48,2020-07-13,cj 기사 공유 라면 농심 상반기 매출 사상 최대 가정 간편식 관련 주요 제품 핫도그 간편 치즈볼 주요 고객 제일제당 풀무원 국내 식품 관련 기업 음료 베이스 사업 매출 비중 차지 냉장 냉동 음료 베이스 공급 주요 제품 시럽 소스 스무디
49,2020-08-31,풀무원 모짜렐라 치즈볼 개성 제주 돼지 감자 만두 비비고 한섬 만두 심야식당 불막창 안주 벌집 껍데기 하림 치킨 너겟 씨제이 물냉면 코스트코 냉동식품 주간 할인
50,2020-08-28,cj 일금 천만 거래 핫도그 치즈볼 제일제당 풀무원 관련 신라 에스 간편식 조류독감 광우병 돼지 열병 수산 관련 사조오양 업체 최초 맛살 제품 국내 도입 조씨 푸드
51,2020-09-14,cj oem hmr 주로 음료 퓨레 제품 스타벅스 이디야 납품 핫도그 치즈볼 제일제당 이나 풀무원 대기업 방식
52,2020-10-05,풀무원 고등어 김치 풀무원 모짜렐라 치즈볼 씨제이 찹쌀 등심 탕수육 하림 매콤 닭강정 동원 돈까스 코스트코 냉동식품 주간 할인 정보 코스트코
53,2020-10-05,풀무원 고등어 김치 풀무원 모짜렐라 치즈볼 씨제이 찹쌀 등심 탕수육 하림 궁금 풀무원 치즈볼
54,2020-10-04,gx gx cj 크리스 핫도그 사이드바 치즈볼 세트 비비고 사이드바 치즈볼 상세 설명 참조 제일제당 크리스 핫도그
55,2020-10-09,sj cj 만두 치즈볼 핫도그 만두 일반 배송 상품 만족도 제품 상세 보기 무료 배송 비비고 만두 비비고
56,2020-01-25,cj 제일제당 사이드 바이 치즈볼 솔직 후기 라서 쭈루룩 모짜렐라 치즈 치즈볼 확실 치킨 매하 치즈볼 치즈 양보 바삭 냉동 보관 다가
57,2020-01-04,bhc cj 사이드바 치즈볼 치즈볼 모짜렐라 완벽 맥주 안주 제일제당 맥주 안주 치즈볼 치즈볼 메사이드 바이 치즈볼
58,2020-02-11,bhc cj 치즈볼 냉동 치즈볼 후기 치즈볼 모짜렐 치즈 치즈볼 믹스 치즈볼 믹스 바삭 쫄깃 치즈 달달
59,2020-02-11,cj 치즈볼 사이드 바이트 치즈볼 워매 장보 다가 별기 치킨 치즈볼 이란 비슷 사실 은지 오래
60,2020-02-23,cj cj 간단 치즈볼 스윗 허니 치즈볼 마트 모짜렐라 치즈 크림 치즈 스윗 허니 치즈볼 조리법 기름 오븐 오븐 조리법 냉동
61,2020-02-23,cj cj 간단 치즈볼 스윗 허니 치즈볼 마트 모짜렐라 치즈 크림 치즈 스윗 허니 치즈볼 조리법 기름 오븐 오븐 조리법 냉동
62,2020-02-18,cj 사이드바 치즈볼 크림 치즈 치즈볼 믹스 달달 라서 치즈볼 단맛 한편 솔직 할인 가격
63,2020-02-28,cj 치즈볼 잘못 만남 치즈볼 엄마 실수 동생 택배 서부 잘못 려고 이나 전자레인지
64,2020-02-04,cj newsarticleviewhtmlidxno 신상 제일제당 견과류 멸치 볶음 오뚜기 철판 뽀끼 풀무원 치즈볼 워홈 치킨
65,2020-02-16,cj 치즈볼 간편식 우유 견과류 고요 홈플러스 입장 전단
66,2020-03-28,cj bhc 치즈볼 배민 마트 유행 치즈볼 사실 치즈볼 한번 정도 찹쌀 도너츠 외피 치즈 치즈 크림 가까운
67,2020-03-22,cj 치즈볼 간식 사이드바 치즈볼 후기 치즈볼 치즈볼 치즈 피자치즈 주얼 치즈볼 그거 치즈 듬뿍 뭔가 쫀득 흐물 거리
68,2020-03-31,cj bhc 제일제당 사이드 바이 치즈볼 크림 치즈 라면 만족 정도 치즈볼 구매 쪼끔 실망
69,2020-03-07,cj 오뚜기 치즈스틱 치즈볼 간편 가성 비갑 포스팅 에어프라이어 에어프라이어 요리 에어프라이어 인스턴트 치즈볼 치즈스틱
70,2020-03-06,cj 에어프라이어 치즈볼 사이드바 치즈볼 후기 살짝 어가 살짝 크림 치즈 전혀 심심 치즈볼 연유
71,2020-03-07,cj 사이드바 치즈볼 에어프라이어 조리 후기 치즈볼 칼로리 쭈욱 모짜렐라 치즈 소하 치즈볼 믹스 바삭 쫄깃하 치즈 달달 어가 조화로움
72,2020-03-27,cj 치즈볼 비교 풀무원 롯데 크림 치즈볼 냉동식품 에어프라이어 조리 빵가루 처럼 치즈볼 표면 기름 가급 이면 고루 발라 조리 치즈볼 치즈
73,2020-03-14,cj 식품 사이드 바이 치즈볼 솔직 후기 풀무원 치즈볼 비교 하자 완성 치즈 치즈볼 젓가락 치즈볼 더니 치즈볼 젓가락 자국 치즈 여주 위해 일부러
74,2020-03-05,cj 모음 스타벅스 슈크림 라떼 베이커리 크로와상 사이드바 치즈볼 치즈 에이치 치즈볼 기대 전혀 단맛 꼬소함 은근 빵피 질깃쫀득 찹쌀 도넛
75,2020-03-09,cj bhc 치즈볼 가격 후기 정리 하자 크림 치즈 찹쌀 도넛 정리 치즈볼 거리 나름 치즈볼 었다
76,2020-03-20,vs vs bbq vs cj cj cj cj bbq 풀무원 치즈볼 페리 카나 치즈볼 치즈볼 치즈볼 치즈볼 비교 육안 치즈볼 치즈 성해 여요 치즈 재형 고요 풀무원 치즈 치즈 유의 쭈욱
77,2020-03-20,vs vs bbq vs cj cj cj cj bbq 풀무원 치즈볼 페리 카나 치즈볼 치즈볼 치즈볼 치즈볼 비교 육안 치즈볼 치즈 성해 여요 치즈 재형 고요 풀무원 치즈 치즈 유의 쭈욱
78,2020-03-20,vs vs bbq vs cj cj cj cj bbq 풀무원 치즈볼 페리 카나 치즈볼 치즈볼 치즈볼 치즈볼 비교 육안 치즈볼 치즈 성해 여요 치즈 재형 고요 풀무원 치즈 치즈 유의 쭈욱
79,2020-03-20,vs vs bbq vs cj cj cj cj bbq 풀무원 치즈볼 페리 카나 치즈볼 치즈볼 치즈볼 치즈볼 비교 육안 치즈볼 치즈 성해 여요 치즈 재형 고요 풀무원 치즈 치즈 유의 쭈욱
80,2020-04-13,cj 돈카츠 치즈볼 래서 치즈볼 옆구리 지고 돈카츠 고기 어가 돈까스 고로케 치즈볼 비쥬 얼잌 후기 찹쌀 도넛
81,2020-04-28,cj 제일제당 사이드 바이 치즈볼 치즈 양은 적당 편도 편도 정도 치즈볼 쫀득쫀득 찹쌀 도넛 식감 맥주 안주 간식 대용
82,2020-04-02,cj 사이드바 간편 간식 맥주 안주 사이드 사이드 바이 치즈볼 온라인 마트 특별 미식 경험 사이드바 치즈볼 어보 았습니 바삭 속은쫄깃 고소 모짜렐라 치즈 달달
83,2020-04-24,vs cj 피티 치즈볼 찹쌀 치즈볼 푸드 치즈볼 솔직 후기 주가 피디 피디 피디 찹쌀 치즈볼 푸드 치즈볼 마트 치즈볼 달달 하니 치즈 적당 고요
84,2020-04-10,bhc cj 치즈볼 마트 치즈볼 풀무원 롯데 마니커 앤지 냄새 불량 크림 치즈 어간 치즈볼 크림 치즈 제품
85,2020-04-12,cj ver 간편 사이드바 치즈볼 후기 치즈볼 보시 치즈 어가 최고 쫀덕쫀덕함 이십 결론 가격 구매
86,2020-04-17,cj 사이드바 치즈볼 후기 찹쌀 치즈볼 찹쌀 도너츠 모짜렐라 치즈 치즈볼
87,2020-04-22,cj vs cj cj 치즈볼 브랜드 치츠볼 치즈 갈리 치즈볼 치즈 음매 치즈 치즈 치즈볼 주신 브랜드
88,2020-04-22,cj vs cj cj 치즈볼 브랜드 치츠볼 치즈 갈리 치즈볼 치즈 음매 치즈 치즈 치즈볼 주신 브랜드
89,2020-04-22,cj vs cj cj 치즈볼 브랜드 치츠볼 치즈 갈리 치즈볼 치즈 음매 치즈 치즈 치즈볼 주신 브랜드
90,2020-05-23,cj 사이드 바이 치즈볼 에어프라이어 조리 메사이드 바이 치즈볼 후기 시리즈 그냥 기본 아주 설명 맹신 주의자 먼저 시도 냉동 상태 치즈볼
91,2020-05-12,cj 사이드바 치즈볼 크리스 피치 아래 치킨 치즈볼 에어프라이어 정도 치즈 나기 조심
92,2020-05-17,cj cj cj cj 씨제이 사이드바 치즈볼 후기 풀무원 치즈볼 비교 쫄깃쫄깃 식감 중요 치즈볼 치즈 이나 풀무원 치즈볼 풀무원 치즈볼 후기 요기 치즈볼 풀무원 씨제이 제일제당
93,2020-05-17,cj cj cj cj 씨제이 사이드바 치즈볼 후기 풀무원 치즈볼 비교 쫄깃쫄깃 식감 중요 치즈볼 치즈 이나 풀무원 치즈볼 풀무원 치즈볼 후기 요기 치즈볼 풀무원 씨제이 제일제당
94,2020-05-17,cj cj cj cj 씨제이 사이드바 치즈볼 후기 풀무원 치즈볼 비교 쫄깃쫄깃 식감 중요 치즈볼 치즈 이나 풀무원 치즈볼 풀무원 치즈볼 후기 요기 치즈볼 풀무원 씨제이 제일제당
95,2020-05-17,cj cj cj cj 씨제이 사이드바 치즈볼 후기 풀무원 치즈볼 비교 쫄깃쫄깃 식감 중요 치즈볼 치즈 이나 풀무원 치즈볼 풀무원 치즈볼 후기 요기 치즈볼 풀무원 씨제이 제일제당
96,2020-05-17,cj cj cj cj 씨제이 사이드바 치즈볼 후기 풀무원 치즈볼 비교 쫄깃쫄깃 식감 중요 치즈볼 치즈 이나 풀무원 치즈볼 풀무원 치즈볼 후기 요기 치즈볼 풀무원 씨제이 제일제당
97,2020-05-17,cj cj cj cj 씨제이 사이드바 치즈볼 후기 풀무원 치즈볼 비교 쫄깃쫄깃 식감 중요 치즈볼 치즈 이나 풀무원 치즈볼 풀무원 치즈볼 후기 요기 치즈볼 풀무원 씨제이 제일제당
98,2020-06-11,cj 제일제당 사이드바 치즈볼 맥주 원래 치즈볼 바삭 찹쌀 쫀뜩함 치즈 핵심
99,2020-06-22,cj 치즈볼 에어프라이어 크림 치즈 정주 안치홍 무조 치즈볼 라미 지중해 문어 샐러드 존맛
100,2020-06-16,cj bhc 사이드바 치즈볼 치즈볼 치킨 마다 무조건 치즈볼 모짜렐라 치즈 가득 마요네즈
101,2020-06-13,cj kcal 치즈볼 냉동 치즈볼 칼로리 개수 치즈볼 봉지 용량 칼로리 기준 봉지 큰일 찹쌀 도넛 모짜렐라 치즈 크림 치즈
102,2020-06-04,cj 치즈볼 우울 고칼로리 간식 텐션 치즈볼 완성 라보 치즈 줄줄 고소 자주 기분 고칼로리 간식 기분 전환
103,2020-06-03,cj 대림 냉동식품 치즈볼 솔직 후기 치킨 집의 치즈볼 었다 바깥 건강 치즈 적당 제일제당
104,2020-06-11,bhc 원조 치즈볼 풀무원 모짜렐라 치즈볼 씨제이 사이드바 치즈볼 솔직 시식 후기 풀무원 모짜렐라 치즈볼 사진 먹음 직스 러운 치즈 모양 보고 망설 임도 카트 담았더랬 모양 얼핏 감자
105,2020-06-10,cj wow 치즈볼 치즈볼 지난 쿠폰 행사 호기심 치즈볼 마음 몹시 부대 오후 맥주 더니 갑자기
106,2020-07-22,cj bhc 사이드바 치즈볼 후기 급식 흡사 블랙치즈볼 흡사 달라 도우 치즈 단맛 아주
107,2020-08-01,cj 치즈볼 치즈볼 사이드바 치즈볼 사이드바 치즈볼 치즈볼 모짜렐라 치즈 보이 겉바 바삭 쫄깃 처음
108,2020-07-25,cj bhc 에어프라이어 메사이드 바이 치즈볼 솔직 후기 이도 쉐프 다지 치즈볼 시나 치즈볼 려고 치즈 찹쌀 두께 찹쌀 도너츠
109,2020-07-14,영롱 치즈 개존맛 문명 특급 아시 씨제이 치즈볼 원래 사고 풀무원 치즈볼 씨제이
110,2020-07-14,영롱 치즈 개존맛 문명 특급 아시 씨제이 치즈볼 원래 사고 풀무원 치즈볼 씨제이
111,2020-07-14,kg kg gx gx cj 치즈스틱 치킨 박스 고추 크런치 사이드바 치즈볼 세트 제일제당 돈카츠
112,2020-08-16,cj 사이드 바이 치즈볼 마트 떡볶이 마켓 구매 치즈볼 사실 치즈볼 아주 예전 뿌링클 기프트 선물 다가 거기 치즈볼 포함 이자
113,2020-08-27,cj cj 제일제당 사이드바 치즈볼 치즈볼 쭈욱 모짜렐라 치즈 소하 치즈볼 믹스 바삭 쫄깃 치즈 달달 첨가 조화 더욱
114,2020-08-27,cj cj 제일제당 사이드바 치즈볼 치즈볼 쭈욱 모짜렐라 치즈 소하 치즈볼 믹스 바삭 쫄깃 치즈 달달 첨가 조화 더욱
115,2020-08-24,cj 사이드바 치즈볼 솔직 후기 사이드 바이 치즈볼 조리 방법 전자레인지 에어프라이어 가능 치즈 모짜렐라 자연 치즈 외국산 고요 치즈
116,2020-08-25,cj 메사이드 바이 치즈볼 후기 치즈 치즈 돌이 항상 치즈 음식 치즈볼 체다 치즈 치즈스틱 치즈 돈까스
117,2020-08-22,cj vs cj cj 사이드 바이 치즈볼 풀무원 모짜렐라 치즈볼 왼쪽 치즈볼 오른쪽 풀무원 치즈볼 사이드 바이 치즈볼 치즈 풀무원 모짜렐라 치즈볼 크기 치즈
118,2020-08-22,cj vs cj cj 사이드 바이 치즈볼 풀무원 모짜렐라 치즈볼 왼쪽 치즈볼 오른쪽 풀무원 치즈볼 사이드 바이 치즈볼 치즈 풀무원 모짜렐라 치즈볼 크기 치즈
119,2020-08-22,cj vs cj cj 사이드 바이 치즈볼 풀무원 모짜렐라 치즈볼 왼쪽 치즈볼 오른쪽 풀무원 치즈볼 사이드 바이 치즈볼 치즈 풀무원 모짜렐라 치즈볼 크기 치즈
120,2020-08-02,cj cj 사이드바 치즈볼 클라우드 클리어 제로 사이드바 치즈볼 제남 치킨 치즈 더니 치즈 제시 조리법
121,2020-08-02,cj cj 사이드바 치즈볼 클라우드 클리어 제로 사이드바 치즈볼 제남 치킨 치즈 더니 치즈 제시 조리법
122,2020-08-06,cgv cgv cj cgv mcgvcokr bogutommys 꿀딜 정보 선데이 치즈볼 카카오 브릭 콤보 선데이 치즈볼 카카오 캠핑카 브릭 콤보 공유 요소 구독
